"Drug","User","Date","Period","Review","Score","Likes","Page"
"Amphetamine","Sludge head","January 8, 2017","Taken for less than 1 month","<b>Adzenys XR-ODT (amphetamine):</b>			 Today was first day of use (15.7 mg), after switching from Adderal 30 mg daily. Could not tell I had taken anything at all. My thinking is no more clear. I have zero energy. Vyvance caused a tazer-like spasm down my spine, when I tried it a few years ago. Adderal has become less effective, but does still help me to focus.",0,10,4
"Amphetamine","sarahisabel98","December 28, 2016","-","<b>Evekeo (amphetamine):</b>			 18 year old college female. I've been medicated for 4 years now and tried concerta (which was hell) and Vyvanse (the devils drug). Evekeo was amazing at first kind of similar to Vyvanse and then it went downhill. Whereas on Vyvanse I just wouldn't eat and was depressed and spacey, this one didn't have side effects like that. But after awhile it made me incredibly mean, and didn't seem to take away the verbal impulse side of the hyperactivity. I'm normally an incredibly happy person but when I'm on this medicine I'm a bitch to whoever over whatever for no reason at all. It did help with the focusing though.",0,18,4
"Amphetamine","Help mom in need","December 18, 2016","Taken for 1 to 6 months","<b>Evekeo (amphetamine):</b>			 My childs grades have suffered more after beginning evekeo and his behavior is so much worse than before. I honestly cannot wait to to see the Dr. again.",0,7,4
"Amphetamine","Able4","November 24, 2016","Taken for 1 to 6 months","<b>Adzenys XR-ODT (amphetamine):</b>			 I may not be the right demographic for this medication but works well and better than lugging around a pill bottle and swallowing a pill with water.  Comes in individual blister packs and easy to transport for ADHD travelling business professionals like myself.",0,8,4
"Amphetamine","MamaBear39","November 24, 2016","-","<b>Dyanavel XR (amphetamine):</b>			 My daughter HATES the flavor! I can't get her to keep it down for more than a couple seconds before it's coming out of her mouth.  I'd rather fight her in getting to swallow a pill than cleaning up the medicine from the floor.  Will be trying something else.",0,3,4
"Amphetamine","Ms. Frustrated","November 12, 2016","Taken for less than 1 month","<b>Adzenys XR-ODT (amphetamine):</b>			 I did not find this medication to be effective. I approximately 3 hours of sustained attention .My energy depletes throughout the day. I do not like the gritted texture nor taste. I will not continue this medication.",0,6,4
"Amphetamine","Calstudent","October 12, 2016","Taken for 1 to 6 months","<b>Evekeo (amphetamine):</b>			 The only ADHD medication I have taken that doesn't have awful side effects. It makes you more alert and productive with out the headaches and and hungover feeling that I get with adderall and focalin. I don't think it effects everyone the same but it has been a real lifesaver for me.",0,22,4
"Amphetamine","TheMrsB","October 5, 2016","Taken for 1 to 6 months","<b>Adzenys XR-ODT (amphetamine):</b>			 I am so thrown off at how many positive reviews I have seen on this stuff, however I must have an insane Ph balance (causes amphetamines to become ineffective), but I do not see how it is possible to take the highest dose they provide and not even feel nothing... like I have not taken anything at all.... The other night I got so tired that I fell asleep without warning!",0,14,4
"Amphetamine","Carterette","September 29, 2016","-","<b>Dyanavel XR (amphetamine):</b>			 My son has tried everything for ADHD. Vyvanse wears off too quickly and Adderall XR made him moody. We tried the dissolvable tablet but he hated the gritty orange flavor. As a last resort to going back to Vyvanse, the pediatrician put him on the new long acting Dyanavel XR. It lasts all day which is great for all the middle school homework he has in the evenings. My favorite thing about Dyanavel is that he still has his appetite and is sleeping well. The copay card made it cheaper than a generic too!",0,32,4
"Amphetamine","GingerBreadMike","September 28, 2016","-","<b>Evekeo (amphetamine):</b>			 I enjoyed Evekeo.  It was great when it came to improving focus.  I also have shift work disorder so for me stimulants are great as they help me overcome the hump I hit every morning when I just want to go to bed and sleep all day.  My wife complained that I was getting really hard to live with compared to normal.  I knew I was more irritable than normal.  Over the 5 months I took it I did feel like the level of irritabilty and arguementativeness was steadily increasing.  Stopped taking when my wife told me I was starting to become unbearable.   I usually get 2 migraines a year but while on evekeo I had 3 in 5 months.",0,14,4
"Amphetamine","Mabel2193","September 26, 2016","-","<b>Adzenys XR-ODT (amphetamine):</b>			 I had been off of medication for a while, recently went to a doctor for ADHD to get meds again -- was given a script for Adzenys XR-ODT, I have had experiences with Adderall in the past while sampling medication with my previous doctor and found success. This medication at the equivalent dosage of 20mg did little to nothing for me for the first few days and eventually, nothing at all.",0,9,4
"Amphetamine","ADHD!","September 3, 2016","-","<b>Dyanavel XR (amphetamine):</b>			 Dyanavel was a great for my son, much better than the Vyvance and it lasted the whole day.  Best part free for two months than $20 dollars there after!",0,17,4
"Amphetamine","Home Mom3","August 24, 2016","Taken for 1 to 6 months","<b>Dyanavel XR (amphetamine):</b>			 It's works but my child doesn't like the bubble gum flavor. Will be trying something else.",0,6,4
"Amphetamine","Sky85","August 19, 2016","-","<b>Evekeo (amphetamine):</b>			 This medicine was horrible for me. I started off at a low dose. It gave me horrible anxiety, mood swings and horrifying negative thoughts. I would never take this medicine again.",0,14,4
"Amphetamine","NotSoHyper","August 7, 2016","Taken for less than 1 month","<b>Evekeo (amphetamine):</b>			 Evekeo made me feel like I had the flu. I felt like I had stayed up until 5am drinking tequila. I had had no alcohol at all. My muscles ached, I was exhausted, I felt like I was going to puke, and I could barely move. I went back to Vyvanse after 2 days. It ends too early for me, but doesn't make me miserable.",0,10,4
"Amphetamine","Kate MM","August 2, 2016","-","<b>Adzenys XR-ODT (amphetamine):</b>			 Adzenys is the first stimulant medicine I've ever tried, I went through a very bad deprrssion from a car accident &amp; working out, eating right &amp; trying every antidepressant just made me even more depressed. Since taking adzenys I'm back to my old happy, energetic self! I don't have add or adhd so I can't comment on that but I do know this has helped me get over most of my depression &amp; helped me to get back to working out &amp; just got me of the couch &amp; out of my rut. The energy was so immense the first week and then I started to get used to it which I've quite enjoyed, I'm not running around like a mad woman but I have the energy &amp; the drive to be my normal self again. At first I had insomnia for a week but Benadryl helped for sure!",0,13,4
"Amphetamine","allthenicknamesareinuse","July 30, 2016","-","<b>Evekeo (amphetamine):</b>			 20 y/o college female. Keeps me alert, focused, awake. I usually wait a little bit after taking it to have caffeine, not necessary just personal preference based on how it makes me feel. Switched to it after taking vyvanse for almost a year, which was great but it eventually made me irritable. so far i have loved this medication. no side effects, but if you take a dose too late in the day it will keep you up at night. i take 5mg in the morning and then another dose when i really need to focus. shorter release so i feel like i need a nap after 4-5 hours. overall would recommend.",0,17,4
"Amphetamine","Hyper Hank","July 26, 2016","Taken for less than 1 month","<b>Adzenys XR-ODT (amphetamine):</b>			 I was a little skeptical to try a new drug but when my Daytrana went on backorder, I listened to my doctor and glad I did.  I HATE to swallow pills and didn't want to carry around any syrup with me so this works perfect for me.  Actually taste like orange! Which as you know most drugs don't actually taste like the flavor they say it should so I was pleasantly surprised.  I got to try it out free for the first month and will be continuing to use in the future!",0,10,4
"Amphetamine","!Charm_87!","July 23, 2016","-","<b>Adzenys XR-ODT (amphetamine):</b>			 I'm on day 2 of adzenys. I like that I take it once.  But the texture is gritty once dissolved. It's a dissolvable pill so what do you expect? I do experience dry mouth and slight decrease in appetite but it's nothing serious. My doctor started me on a pediatric dose of 6.3 milligrams once a day. Another problem I see is that I'm having a hard time falling asleep. It could be because I take the medication around 11 o'clock in the morning but that's the time I get up. So it's honestly too early for me to tell.we will see once I get a routine going and school starts again.",0,14,4
"Amphetamine","JVD333","July 4, 2016","-","I am on Dexamphetamine got diagnosed with ADHD only at age 40. I self medicated with alcohol for 20 years and was on 5 moodstabilisers. I feel like a reborn person detoxed of alcohol and all meds replaced it all with Dexies and WOW I am alive! It took me 4 months to get used to them. They are a real pain in the neck to take every 2 hours. In 1st 4 months it was hell, I became so incredibily depressed, wanted to jump off a bridge. Interval was too big. 4-5 hours.  I pushed it to 40 mg a day every 2 hours. He said You won't sleep if you take them after 5 pm. I sometimes take them at 9 pm and sleep at 11 pm. Sideffect: big ass headaches if I dare to forget my pill after 2 hours.",10,0,4
"Amphetamine","MauraJ","June 23, 2016","-","<b>Evekeo (amphetamine):</b>			 Eh, it's better than adderall but vyvanse is still a lot smoother. Gave me horrible indigestion and heart burn as well as extreme anxiety and chest pain.",0,13,5
"Amphetamine","Holden Caulfield","June 1, 2016","Taken for less than 1 month","<b>Adzenys XR-ODT (amphetamine):</b>			 I have taken Adderall XR for several years and found that long acting amphetamine was the best treatment for my ADHD. However, I frequently had issues remembering to take it in the mornings and would often forget to take my medicine. Adzenys XR-ODT is so convenient in the blister pack I remember to take it, and the orange flavor is great! It lasts all day andI don't get a bad crash at the end of the day like I used to with my Adderall XR. Also, got first month free and pay only $25 per month with co-pay card",0,16,5
"Amphetamine","Kimmy82013","April 27, 2016","-","<b>Evekeo (amphetamine):</b>			 Evekeo has been great for the first Time I am doing a lot better in my school and I understand it better. When it comes off its smooth and I don't stay up all night . I use the discount for my prescription and my insurance card and it is not that expensive. But without all of that it definitely will be",0,15,5
"Amphetamine","IanKov","March 24, 2016","-","<b>Evekeo (amphetamine):</b>			 Much better than vyvanse. A lot smooth and MUCH more consistent.",0,12,5
"Amphetamine","Ghawk","December 18, 2015","Taken for 1 to 6 months","<b>Evekeo (amphetamine):</b>			 I have to say I thought it would be like Adderall but it's really not. I read their study, yeah I'm a dork, but I remembering it saying different mixtures working different. If you are having problems with your current ADHD med talk to you doctor and get a 60 pill free trial.",0,28,5
"Amphetamine","Moke","December 9, 2015","Taken for 1 to 6 months","<b>Evekeo (amphetamine):</b>			 Evekeo works great. It's more mild in regards to excitability in comparison to adderall.  Evekeo is Amphetamine Sulfate and carries 50% dextroamphetamine and 50% levoamphetamine.  Adderall is 75% dextroamphetamine and 25% levoamphetamine, so Evekeo is much smoother and wears off slowly vs adderall's fluctuating tapering.  It is much different than adderall.  Evekeo doesn't make you feel wired like adderall does.  It's a cleaner medicine.  Evekeo is a freebase Amphetamine while adderall has 4 different salts.  I would recommend the makers of Evekeo to make higher milligram tablets.  It's similar to a 10mg adderall IR.  It's just the ratio of ingredients that's the difference. Duration is said by pharmacists to be 12 hr's, buts more like 6.",0,41,5
"Amphetamine","AlphaDog1","November 18, 2015","-","<b>Evekeo (amphetamine):</b>			 Better than Adderall or Vyvanse for side effects.  Works the same but not as long",0,20,5
"Amphetamine","Jenny85","October 29, 2015","Taken for 1 to 6 months","<b>Evekeo (amphetamine):</b>			 So far so good. Helps with ADHD but less side effects .. Gonna keep using it",0,15,5
"Amphetamine","wwwangel","September 21, 2015","Taken for 1 to 6 months","<b>Evekeo (amphetamine):</b>			 My son's doctor gave him this to try. It's pretty much the same as Adderall. I didn't see a big difference in his behavior compared to generic Adderall. There's not much point in paying a premium price (no generic) for the same effectiveness as his usual med.",0,11,5
"Amphetamine","Anonymous","September 19, 2012","Taken for 6 months to 1 year","I have ADD. It helped me study, stay focused. All I know is that I did study more efficiently.",8,18,5
"Amphetamine","Anonymous","October 27, 2011","-","My 5 year old just started this medication and no change in her became evident as its supposed to after about 30 minutes. It actually made her Tourette's worse and made her itch and irritable. Hope you have better luck!",3,9,5
