"Drug","User","Date","Period","Review","Score","Likes","Page"
"Amphetamine","Autumn","August 19, 2018","Taken for less than 1 month","<b>Adzenys XR-ODT (amphetamine):</b>			 I started taking Adzenys about a week ago and so far it hasn't been doing much for me besides me having side effects. I have diarrhea and my heart rate increases/feels like its beating harder. I'm worried about my heart because I have had heart problems in the past. I also feel like I'm not fully there, like I'm kind of in a daze/slow thinking. Also last night I woke up with bad anxiety and then today I feel like I want to cry all of the time. I don't know if the anxiety/crying are side effects but this is not how I usually act. I am going to take it for another week or so and only take half a pill to see if some of the side effects hopefully go away. I really want adzenys to work because it is affordable. If not, I'll probably have to go back to using vyvanse and just deal with the side effects.",0,3,2
"Amphetamine","Catdad82","August 9, 2018","Taken for 1 to 2 years","<b>Adzenys XR-ODT (amphetamine):</b>			 This medication is a million times better than Adderall for my ADHD symptoms--lack of motivation, emotional dysregulation, sensory overload, procrastination, and feeling overwhelmed by even the simplest, most everyday tasks.  Adderall also caused side-effects such as upper gastrointestinal issues, irritability, and the dreaded crash. Adzenys does not for the most part. I also like how the drug is brand-name, I know what I'm getting each month rather than the generic roulette of Adderall, where every generic was different (yet none was as effective as Adzenys).  Finally, I think the orally disintegrating tablet (tastes good, btw) makes the drug more consistent than if it were swallowed and wholly processed via the GI system. No one seems to know about this medication, it's too bad because it is a gem for my ADHD symptoms. I hope it isn't discontinued for this reason.",0,16,2
"Amphetamine","Kracker","July 9, 2018","Taken for less than 1 month","<b>Adzenys XR-ODT (amphetamine):</b>			 I was on Vyvanse 70 mg and switched to Adzenys because I felt the Vyvanse was not working as well.  I take 18.8mg and feel this medication makes me tired and does zero for my ADHD.  I am 51 years old and found out 18.8 is for children that 12mg is the highest adults should be prescribed so I will talk to my doctor but Vyvanse worked much better.",0,4,2
"Amphetamine","JaJo22","July 3, 2018","Taken for 1 to 6 months","<b>Adzenys XR-ODT (amphetamine):</b>			 I went through Adderall IR, Adderall XR and Vyvanse before trying Adzenys, and boy am I glad I did.  Adzenys has a nice gradual come up and keeps me focused all day.  At the end of the day there is absolutely no crash at all.  This was always a major problem for me was the way these medications caused me to crash hard as they were wearing off.  If this is an issue for you, I would suggest you ask your doctor about Adzenys.  I'm glad I finally found a medication that worked so well to control my ADD.",0,6,2
"Amphetamine","Nick","June 20, 2018","Taken for 1 to 6 months","<b>Adzenys XR-ODT (amphetamine):</b>			 At first this medication worked great. Now I noticed a couple of side effects. Soreness in legs, increase urination, but worst of all was the increased agitation and dry mouth. On the plus side the medication work better then other ADHD on the market. It has increased focus and helped level off my energy. I built up a fast tolerance using the 9.3 mg. I Have only taken it for two months helpfully it keeps work!",0,5,2
"Amphetamine","Momof3adhdboys","June 15, 2018","Taken for less than 1 month","<b>Dyanavel XR (amphetamine):</b>			 This is for my 4.5yr old boy. He started after awful side effects coming down from quillivant. Those issues were better than this med. On dyanavel, he calmed down for the first couple hours and then seemed to have little control of his body and words. Extremely difficult, defiant. Not his usual self at all. Going to try something else. I too, was a mom against meds but until you have a child with these challenges you are willing to try anything for a  normal  life.",0,2,2
"Amphetamine","bipolarADD","May 19, 2018","Taken for 1 to 6 months","<b>Adzenys XR-ODT (amphetamine):</b>			 Adzenys XR-ODT gave me great, smooth, long-lasting effects. I’ve had a bit of an increase in physical anxiety/agitation, but that’s largely subsided. Also had some difficulty falling asleep, but I stopped having this effect within 2 weeks. I’m honestly amazed that I have absolutely zero crash with Adzenys, even as I’ve increased my dose a bit. I’ve always experienced crashes with ADD drugs, until I found Adzenys",0,3,2
"Amphetamine","Alice","May 14, 2018","Taken for 1 to 6 months","<b>Adzenys XR-ODT (amphetamine):</b>			 It was a lifesaver at first, but with the new box I'm taking, suddenly, I don't sleep and my leg mucles are always sore. Could this be a bad batch? Did the formula change?  I'm definitely scared.",0,4,2
"Amphetamine","Bhwde","May 13, 2018","Taken for less than 1 month","<b>Dyanavel XR (amphetamine):</b>			 My child was just recently diagnosed with ADHD and first we tried adderall. It seemed to just make him tired but it helped a little bit but not enough. So then we tried dyanavel - this stuff turns my kid into a possessed little ....(mmm what word would be good here?  He definitely wasn't nice!). it started off very good. He was listening and everything was going well, then about 4 hours after he took it, he got in a little trouble for not closing a door.  It was just a simple hey buddy come close this door... and he FLIPPED! He looked at me like he was going to stab me in my sleep and started throwing a little baby tantrum. And ever since then he acts like this every time he gets in trouble. He whines and throws a huge tantrum. He is 7 years old and does not do this without his meds. I know its different for everyone but from my experience, if your child has ADHD and has trouble focusing and listening like mine does, I do not recommend this medicine. We will be trying something else",0,6,2
"Amphetamine","Paloma01","May 1, 2018","Taken for 1 to 6 months","<b>Dyanavel XR (amphetamine):</b>			 It works but why is my daughter so so cranky and whiny after it is wearing off. It only happens with this certain medicine.",0,3,2
"Amphetamine","Concerned mama","April 29, 2018","-","<b>Evekeo (amphetamine):</b>			 We switched from vyvance in the morning and focolin in the afternoon because the cost was getting way to expensive for both and insurance wasn't allowing us to get name brand so we could use a copay card.  After switching to eveko my 11 year old son started having major anger and frustration problems in school.  His teachers said it worked well the first couple days for his focusing but then it was like he wasn't on it at all.  He started becoming extremely defiant in school, hitting himself in the face because he was mad and frustrated.  Calming him down was next to impossible.  We were getting calls on a daily basis.  Not sure how we will do it but we are more than likely going back to his previous medication.",0,9,2
"Amphetamine","Momof02","April 9, 2018","Taken for less than 1 month","<b>Dyanavel XR (amphetamine):</b>			 We just started on this for my son that has ADHD. He is 6 years old and he was on 2.5ml of dyanaval XR it wasn't working so we went up to 4ml and now its working great",0,8,2
"Amphetamine","Senior in High School","April 2, 2018","Taken for 2 to 5 years","<b>Evekeo (amphetamine):</b>			 After Adderal and Ritalin made me incredibly irritable, moody, and anxious I tried evekeo and it is my miracle drug! I've been on it for 2 years now and have no complaints. I recommend this drug if you have failed the more popular stimulants! 11/10 recomend!!",0,22,2
"Amphetamine","Beagles and Bengals","March 28, 2018","Taken for 6 months to 1 year","<b>Adzenys XR-ODT (amphetamine):</b>			 I was very disappointed with varying generics of Adderall XR for my combined ADHD. Brand was better but caused some side effects. Adzenys ODT is a million times better than either. I think my body doesn't respond well to amphetamine salts (Adderall) but does to amphetamine base (Adzenys). Or maybe some of the inactive ingredients that are artificial sweeteners in Adderall (aspartame for example) are reacting badly; I know I can't eat/drink any foods with aspartame or saccharine without getting headaches and low blood sugar, but this would still not explain why the active amphetamine in Adzenys works so much better for me, so I'm going to have to go with the salt vs base hypothesis. Adzenys doesn't make me sleepy like Adderall XR/IR, feels cleaner and smoother, works better for ADHD symptoms like impatience, impulsivity, procrastination, avolition, and task initiation and completion. I just wish there was an Adzenys IR.",0,5,2
"Amphetamine","AriesMoon","March 18, 2018","Taken for less than 1 month","<b>Adzenys XR-ODT (amphetamine):</b>			 I was on 30mg Adderall XR for about a year, which worked well for me except for the crash. It became much less effective at that dose after being on it almost a year, but my doctor has a cap on the Adderall dosage she will prescribe. Just switched to Adzenys 12.5mg at my last appointment. I've been taking it for almost a week. I'm completely unfocused and back to having trouble getting to sleep. Not that it does nothing at all...mostly I just feel like I'm in another world. My thoughts are definitely slowed down, but more distracting from reality. I'm definitely feeling really chill overall. It does last longer than Adderall, if you want to feel like you're in an other worldly state for 12 hours or more. Things effect people differently and I'm sure this is very helpful to a lot of people, but I tried to Google similar experiences and found none, so I wanted to write a review in case anyone else might be experiencing the same.",0,9,3
"Amphetamine","blah","March 13, 2018","Taken for less than 1 month","<b>Adzenys XR-ODT (amphetamine):</b>			 I have been on Adderall 20 mg 3x/day for a couple years. My doctor switched me to this med because I was experiencing increased anxiety. I have a lot of issues at home, which I think is the cause of the increase in anxiety. My doctor, however, thinks Adderall might be the cause. I know my body and this new medication just is NOT working for me. I wanted to switch back, but she wants me to try 18.8 mg instead of 12.5. I don't have much hope because it didn't do a thing for my focus or attention and my energy is completely depleted. I feel like I have been given a placebo.",0,5,3
"Amphetamine","Amanda_0407","February 3, 2018","Taken for 1 to 6 months","<b>Dyanavel XR (amphetamine):</b>			 I was that mom... the mom that was 100% against medicating my child. I fought it for years until I could no longer handle his behavior so I agreed to give something a try. He has dx of anxiety, sensory processing disorder, ODD &amp; ADHD. Our ped started him on 2.5 mL increasing to 3.5 mL throughout the  month. This medication has been life changing for him &amp; everyone else in our household. He is back to being my sweet, loving, respectful little boy &amp; is doing much better academically too! He has had zero negative side effects except a little weight loss but overall his appetite doesn’t seem to have decreased any, he sleeps well &amp; I haven’t noticed it  wearing off  later in the day. I started getting positive reports from his teachers almost immediately. I am so thankful his doctor put him on this medication, my only regret was not starting it sooner!",0,22,3
"Amphetamine","Truth76","January 28, 2018","-","<b>Evekeo (amphetamine):</b>			 Had bad experience. Very bad anxiety and depression side effects don’t try!",0,5,3
"Amphetamine","Leah2222","December 15, 2017","-","<b>Adzenys XR-ODT (amphetamine):</b>			 I had tried everything and didn't like how all of the other stimulants made me feel. My doctor mentioned this and that is was new and it blew my expectations out of the water. It incredibly useful but you don’t feel like you’re on medicine you don’t feel the highs and lows that even adderal or others cause. It’s extremely smooth and it got me back to normal.",0,6,3
"Amphetamine","AlexWood","December 4, 2017","-","<b>Dyanavel XR (amphetamine):</b>			 This is the only medication we've tried so far for my 11 year old son, but it works. His school work has done a 180 degree turn since we started on Dyanavel.  The only downside is the flavor, which he hates, but he's motivated do he takes it anyway. We haven't had any negative side effects other than reduced appetite I'm the first few months taking the medication.  He's back to raiding the fridge 24/7 now though.",0,13,3
"Amphetamine","Anonymous","November 22, 2017","Taken for 1 to 6 months","<b>Evekeo (amphetamine):</b>			 Tried all these different medicines and found vyvanse XR worked perfect Until insurance didn’t cover it anymore so I took Concerta and that basically made my heart rate go up to 170 BPM and it was ridiculous so I tried a newer medication evekeo and it’s good but causes a hell of a withdrawal including anger  diarrhea dizziness nausea loss of appetite but for the most part it’s good",0,9,3
"Amphetamine","Really 678","November 20, 2017","Taken for less than 1 month","<b>Adzenys XR-ODT (amphetamine):</b>			 I never knew I had ADD until my daughter was diagnosed. During her interview I realized I had all the same symptoms. I tried the 3.1mg for three days and felt a lot better. I also noticed I slept really well. I have had insomnia my entire life and the last 6 years I have been seeing a sleep specialist/researcher. We have tried so many different sleep meds and my primary had me on Xanax for a couple of years. Nothing truly worked until I found this med. Now I take 6.3mg feel great all day with no side affects and the best thing is a sleep with no aides and I don't take Xanax anymore. I feel great and my sleep specialist was able to get me three years, yup that’s right three years for free!! I have two insurances and neither were going to pay!!",0,4,3
"Amphetamine","Faikey","October 24, 2017","-","<b>Adzenys XR-ODT (amphetamine):</b>			 I've been on ADHD medication for a very long time. My body had built a pretty strong tolerance stimulants. I combine normally IR Adderall, Vyvanse, and XR Adderall, and now I combine Zenzedi (great, btw), IR Adderall, and this medication and the only thing I noticed is no increase in focus at all but some weird increase in insomnia which is unusual because it's not like an anxiety insomnia but a strange almost increased ADHD insomnia I had growing up. Normally after taking my ADHD medications I can sleep without issue but this one causes me to just stay awake without jitters, focus, anxiety, or anything. I don't care for it.",0,4,3
"Amphetamine","Concerened Mom","October 10, 2017","Taken for less than 1 month","<b>Evekeo (amphetamine):</b>			 My child has been on this almost a week and it has made her worse in school and hyper, I am looking forward to seeing the Doctor this week, the dose was cut in half after being on it 1 day and no change in behaviour, still not able to focus and refuses all school work and became more defiant.",0,11,3
"Amphetamine","Anonymous","September 27, 2017","-","<b>Dyanavel XR (amphetamine):</b>			 Do not take this! It caused my 8 yrs old grave mental issues!",0,3,3
"Amphetamine","birdgirl1234","August 25, 2017","Taken for 1 to 2 years","<b>Adzenys XR-ODT (amphetamine):</b>			 This medication works so well for me and my family.  Easy to take, easy to transport and little to no side effects.  A little dry mouth initially but after a week or so that cleared up.  For only $25 it can't be beat.",0,5,3
"Amphetamine","KellyDoc","July 20, 2017","Taken for 1 to 6 months","<b>Dyanavel XR (amphetamine):</b>			 My 5 1/2 year old son was given this in the past month. We switches from Quillivant XR. This is much better for him. He thinks much more clearly, can focus,  have a conversation.  He doesn't have the anxiety that Quillivant was causing or the emotional crash when the medicine wore off. It's very expensive even with insurance since its so new, but the doctor gave us a discount card to make it very affordable and another problem is all pharmacies don't carry it. Overall much better for his ADHD and less side effects.  His school even noticed an immediate difference.",0,31,3
"Amphetamine","Monkeybutt03","July 12, 2017","Taken for 1 to 6 months","<b>Adzenys XR-ODT (amphetamine):</b>			 This medicine works great for my niece!",0,2,3
"Amphetamine","ShannonV","June 13, 2017","Taken for 1 to 6 months","<b>Adzenys XR-ODT (amphetamine):</b>			 I was taking 2 of the 20 mg Adderall a day and they wore off quick. Doctor had tried my son on this new medicine and worked for him. So I asked our doctor to switch me also, only draw back was that no one in our town carries it. I could either drive an hour to a Walgreens that carried or wait a week for the Walgreens in our town to get it in. Said they won't just order this medicine to keep on hand  until we have filled 4 prescriptions which I thought made no sense. Luckily our local CVS has it on hand and the $25 coupon our doctor gave us has been wonderful. With our insurance it would cost $89 but was able to get the first prescription FREE!!  And then each one after for $25..",0,12,3
"Amphetamine","Anonymous","June 13, 2017","Taken for less than 1 month","<b>Adzenys XR-ODT (amphetamine):</b>			 I just started this medication and I like it for the hyperactivity side of my ADHD. I have tried almost every ADHD medication but most recently was on vyvanse, with the vyvanse I had great concentration but the hyperactivity was not controlled well so she had me try Adzenys I've only been on it about a week and the taste is not that bad for being a dissolvable medication but I will say that I can't take it immediately and then go to work because I become almost spaced out. I know I probably need to adjust to it and it's great once the first hour has passed. I'm still unsure whether I will stay on adzenys or switch back to vyvanse but so far so good.",0,10,3
"Amphetamine","Junkie Jack","June 6, 2017","Taken for less than 1 month","<b>Evekeo (amphetamine):</b>			 Love this med to help me stay awake to study.",0,6,3
"Amphetamine","humour412","April 25, 2017","Taken for 1 to 6 months","<b>Adzenys XR-ODT (amphetamine):</b>			 Have been taking for few months. Switched from adderall and it's been good. Can concentrate more at work and when driving. Overall satisfied and will keep continue taking it.",0,10,3
"Amphetamine","Bubdrum","March 22, 2017","Taken for 1 to 6 months","<b>Adzenys XR-ODT (amphetamine):</b>			 Been on this for about 3 months now.  At first it was great in keeping me focused on tasks at work and at home but it is starting to not be as effective I feel.  My dr. prescribed me the 18.8mg variety based on my weight and also because I am a gastric bypass patient as I digest and absorb things differently which is why we didn't go the more known route of adderall.  As I've taken this medication, especially over the last month I've noticed I have more anxiety, and I'm not my normal happy go lucky self.  I have a follow up in April with my doc and will address these issues then to see what other game plan we can come up with.  I've heard from a friend that also had gastric bypass that she takes vyvanse",0,7,3
"Amphetamine","Lucy106","March 22, 2017","Taken for 6 months to 1 year","<b>Adzenys XR-ODT (amphetamine):</b>			 Simply the best. The only side effect of this med is increased concentration and dry mouth :). It doesn't make me feel like my heart is racing or that my blood pressure is up. I'm really happy with this med. I had a hard time sticky with Concerta and other off brands, and I didn't like any of the adderall products. Since starting this, I haven't missed a single dose.",0,13,3
"Amphetamine","Anonymous","March 15, 2017","Taken for less than 1 month","<b>Dyanavel XR (amphetamine):</b>			 This medicine made me feel so tired and sluggish.",0,12,3
"Amphetamine","Adult with ADHD","February 16, 2017","Taken for 1 to 6 months","<b>Adzenys XR-ODT (amphetamine):</b>			 Been on Adzenys since September 2016. Works great.  I have been more focused at work and I'm other less stimulating situations. No side effects. Flavor is good for a ODT. Easy to take and remember",0,12,3
"Amphetamine","carjulie","February 14, 2017","Taken for 6 months to 1 year","<b>Dyanavel XR (amphetamine):</b>			 Now my 10 years old son is on 5.5mg liquid of Dyanavel xr and it last 5 hours.",0,7,3
"Amphetamine","thtaylor4088","February 6, 2017","Taken for less than 1 month","<b>Dyanavel XR (amphetamine):</b>			 My 7 year old daughter is severe ADHD.  Prior to Dyanavel XR, our best experience was with 30 mg of adderall XR.  But that had a profound effect on her appetite and ability to interact with other people.  We tried concerta which left her very defiant, Focalin and Vyvance were completely ineffective.  We tried Dyanavel for the first time one months ago.  I can't believe the difference.  She has an appetite, she socializes, she has a personality, she stays in her seat at school and actually works in her assignments.  After 4 days on this medication, her teacher called me and asked what had changed because she couldn't believe the difference. The only downfall is nighttime.  She consistently wakes up around 4-5 am with dreams.",0,32,3
"Amphetamine","Lulu1988","February 4, 2017","-","<b>Evekeo (amphetamine):</b>			 I have bipolar I disorder with psychotic and depressive features and a diagnosis of ADHD. I take meds for all three conditions. I take Vyvanse 50mg in the AM. When that wares off, I take Evekeo 10 mg twice every 4-5 hours, PM. I also take my stimulants with Ativan as I also have anxiety too. Evekeo is perfect for me. It doesn't make me feel hyper nor does it give me that 'high' feeling. It normalizes me and I can actually be driven and calm at the same time. Since I take two stimulants, you're probably wondering how in the world. All I can say is that Vyvanse doesn't last all day long for me, so I supplement with Evekeo. I take Evekeo once Vyvanse wares out. I'm happy with them both.",0,25,3
"Amphetamine","adultadhd","January 30, 2017","-","<b>Adzenys XR-ODT (amphetamine):</b>			 Adderall XR became less effective so dr wanted me to try Adzenys XR 15.7 I do not like it. Terrible headaches right after I take it then I get nauseated. Even though the Adderall xr has become less effective at least it gives me somewhat concentration without side effects. Also I hate the blister pack it comes in and it tastes terrible with a gritty bad after taste.",0,10,4
"Amphetamine","MzDisorderedSyndrome","January 28, 2017","Taken for less than 1 month","<b>Adzenys XR-ODT (amphetamine):</b>			 This medication didn't come close to helping me the way my regular Adderall does. That being said I am going to stick with what I KNOW works but that's just me. Now I've heard others swear by Adzenys &amp; wonder where its been all of their lives which I think is great. Just like any other drug what works for one may be rubbish 4 another. Adzenys is a fairly new drug on the market so of course Drs everywhere are going 2 B pushing it right now. I've worked in the medical field &amp; I've seen Drs promote meds that they weren't even crazy about.. It  just depended on what the drug rep looked like for that particular med &amp; how they themselves were going to benefit by writing the drug. I'm not saying Adzenys is bad I'm just saying 4 me it didn't work.",0,12,4
"Amphetamine","adult adhd","January 27, 2017","Taken for less than 1 month","<b>Adzenys XR-ODT (amphetamine):</b>			 I have taken Adderall 30 mg XR for a little over a year along with a 10 mg boost needed after lunch to get my attention and motivation going. Since it only helps a little to calm my thoughts down and only jump from starting 3 tasks instead of 5 and slowed my thoughts down a little bit the Dr thought to try this new medication Adzenys XR 15.7 mg. Started it 6 days ago and it does nothing for me. I have zero motivation to many thoughts are swimming around. also have a constant headache for the majority of the morning and dull one later and then a crash at midday. at least with Adderall my motivation was great, I thought about a few things at the same time instead of being bombarded and no crash.",0,9,4
"Amphetamine","ADHD mom","January 24, 2017","Taken for 1 to 6 months","<b>Adzenys XR-ODT (amphetamine):</b>			 My daughter was diagnosed with ADHD a few years ago (she's 13 now) and was on Adderall XR 25 mg for a few years. She was never hungry and had a hard time sleeping. We switched her to Adzenys XR 12.5 (lower than her Adderall dose equivalent). It doesn't seem to last as long -- but then again it's not as strong. The good thing is her appetite is back and she doesn't have trouble sleeping. She also doesn't complain about not feeling like herself (she is usually a pretty happy kid, but complained the Adderall made her withdrawn). She's doing fairly good in school, though she has some learning challenges in some areas. Although she's only been on it a few months, I am relatively happy with the results.",0,12,4
"Amphetamine","Adhd girl","January 8, 2017","Taken for 1 to 6 months","<b>Adzenys XR-ODT (amphetamine):</b>			 This product  is terrible !!! Took it for 1month . Nothing at all . My doctor is writing me a new product  this week . The taste is terrible . May be  my chemistry  but no good.",0,7,4
