"Drug","User","Date","Period","Review","Score","Likes","Page"
"Focalin XR","Human","May 5, 2020","-","Took a break then started again and on day 3 I was nausea tired",4,1,1
"Focalin XR","CollegeGirl","February 26, 2020","-","I am 19 year old female in college, and an athlete with extreme ADHD. I usually take Adderall Xr 20-30mg and it has helped me so much in college, I used to drink 6 cups of coffee a day just so I could focus enough to remember where I left my keys and sit down to take a test, but now adderall does that for me. FOCALIN however,  was possibly the worst experience of my life. Focalin took every bit of anxiety and sadness and threw me into several panic attacks. I am a very happy and energetic person, I have never experienced depression or anxiety like this. I didn’t sleep all night and I spent most of the night sobbing uncontrollably. My heart was beating out of my chest and I couldn’t think about anything but how sad and stressful everything was. I suggest to NEVER take this medication, the side effects FAR outweighed the purpose of the medication. I never felt focused or honed in.",1,3,1
"Focalin XR","MT","February 17, 2020","Taken for 2 to 5 years","I've tried almost every single ADHD pill from Adderall to Daytrana to Ritalin to Vyanese to Concerta...Focalin is BY FAR the best for me. I am on the 10mg dose. Was originally on 30mg but my heart was beating way too fast on it. The other meds made me very angry, but this keeps me at bay, yet focused. Only con I have with this is about an hour after I take it, I have a bowel movement. I'm also the same way with coffee. I don't take it everyday and on the days where I don't I can definitely tell, but I don't have cravings.",10,5,1
"Focalin XR","Frankl","January 11, 2020","Taken for 10 years or more","I was on  focalin XR when I was age 5 I think it is a good medication learning wise, but at the same time it drains you it takes your happiness and joy away it’s like you are completely numb to joy, when I’m off of it I can’t focus but I am always so joyous and happy, when I’m on it I focus perfectly but I am very zombied out and it is a horrible feeling",2,9,1
"Focalin XR","ashton","January 7, 2020","Taken for less than 1 month","Today was my first day on Focalin. I took 10 milligrams and it did absolutely nothing. I feel zero difference. The only difference I feel is the fact that I have a headache and sore throat.",1,3,1
"Focalin XR","Better life","November 15, 2019","Taken for 6 months to 1 year","Our son was diagnosed with ADHD and Focalin XR has changed his life for the better.  He is able to focus at school now and he's performance, grades and happiness have all evolved.  It was with heavy hearts we finally relinquished using meds because of the fear of what it might do long term and seeing zombied-out kids who no longer have personalities.  Focalin didn't do this at all.  Our son is still very much himself but without the stress of struggling so hard to focus. It has changed our lives. Teachers, coaches and family have all noticed wonderful outcome.",10,20,1
"Focalin XR","Ev","October 16, 2019","Taken for 6 months to 1 year","I’ve had ADHD for a very long time and didn’t start taking Focalin until (11th grade) I tried other stimulants in middle school but gave up because disliked the way they made me feel. Focalin does its job. It helps me focus and get work done, however, I do get shaky and anxious while on the drug. My appetite is also effected. You just have to decide if the side-effects are worth the outcome.",5,9,1
"Focalin XR","Anonymous","August 29, 2019","Taken for 5 to 10 years","I've taken it on and off since I was in highschool (I'm 26 now). Generally 5-10mg has worked best for me. It helps me a lot when there are tasks I need extra focus on, and a lower dose can help in social situations. I found it to be helpful for school, and more recently at work. The worst side affect for me is a loss of appetite. I find that I have to totally guess how hungry I am and force it down so I don't get brain fog. It relieves anxiety in that I can finally do what I need to, but it raises anxiety in general. I try to take it as little as possible, and haven't experienced any issues taking it sporadically. Just keep the dose low.",8,11,1
"Focalin XR","Wouldn’t you like to know","August 23, 2019","Taken for less than 1 month","The first day I took Focalin XR, it worked fantastic and I had so much energy and confidence was really feeling like myself again. 2nd day of taking it, it was ok wasn’t as good as the first day. Then the third day I felt no difference at all. Made me feel probably worse than when I was off of it. Was extremely exhausted had no effects at all. So I called my doc and he told me to start taking 2 (20mg each) and it did ok I felt the energy but literally no focus at all. Wouldn’t recommend this to anyone may work ok for some but it’s a good chance it won’t.",1,3,1
"Focalin XR","AQ","August 15, 2019","-","Focalin does the trick in getting you less scatter-brained and it helps with focus, but be sure you are only ADHD and  aren't also autistic and/or have motor tics/nervous tics because it is an amphetamine stimulant drug. There it might make you more fidgety if you fidget or have nervous tics out of anxiety and over-stimulation. I'm on the spectrum and this drug makes my repetitive motor movements worse.",7,10,1
"Focalin XR","Max","July 28, 2019","Taken for 1 to 6 months","Long story short I was previously on Vyvanse 40mg a day, and I decided I wanted to try Focalin XR. Before that I was on Concerta and absolutely hated it, when I was a kid I apparently did very well on it, but not anymore. So I decided to give Focalin XR a try, and it works very well! The only 2 issues I have is the questionable quality of the release beads among certain generic manufacturer, and the severity of the crash.",7,5,1
"Focalin XR","Mo","July 22, 2019","Taken for 5 to 10 years","I’ve never commented on a drug before, but I feel compelled to here due the number of negative reviews. Focalin has completely given me a life... I went from not being able to function to a person who is optimistic, looks forward to taking on the day, carries out tasks to completion and enjoys doing so. It has given me the ability to be a much better man, husband and father. Will it do the same for you? Maybe... maybe not. But if it does, the result is priceless.",10,25,1
"Focalin XR","Johnsmith2359","July 13, 2019","-","Whenever I take this medication I feel bored of everything. I will just sit and do nothing instead of doing things I normally enjoy. I am not hungry and become unsociable. Sometimes get shaky. Grades seemed to improve slightly. Not worth it at all.",2,5,1
"Focalin XR","Mom","July 7, 2019","Taken for 2 to 5 years","My daughter with ADHD been taking  Focalin XR 30mg and she has less attitude. Her teachers say it helps her control her self. Without it she has an attitude to her sister she is good when she is on it but when it  but when it wears off her attitude is back and she’s hyper.  Her grades are better though.",8,6,1
"Focalin XR","Lindsey","June 10, 2019","-","My 14 yr old son took Focalin for 2 yrs. He ended his own life while on this med. We were never told that suicidal ideation is a possible side effect. It is now recently listed as a side effect. I would have never given this to my child had I known. Children can not always express themselves and don’t connect dark feelings with a medication they are taking. Please be aware with children on these types of drugs! Heartbroken mom",0,60,1
"Focalin XR","Hi","May 19, 2019","-","My son with ADHD used to run around and be so loud and excited but now on the Fovalin XR he is calm quite and it feels like he is not here. He is in his room looking at the wall at the store he just sits in his seat silent and on the week end he lets me watch news and sleeps almost all the time and he is a total different person without it when I watch my TV he stares and don't care and he is horror without it",10,5,1
"Focalin XR","Anonymous","May 11, 2019","Taken for less than 1 month","Our son is able to concentrate on his school work and is not constantly being redirected now that he is on Focalin for his ADHD. He feels better about himself.",8,10,1
"Focalin XR","Jane Doe","April 26, 2019","Taken for less than 1 month","I was prescribed this as my first treatment for ADHD when I was (finally) diagnosed at age 18. It helped me calm down a little, I could go to work and not feel the urgent need to go home. But then I would start crying at work, in public. I would cry to my parents until they couldn’t handle me anymore. The comedown from when it wears off was HORRIBLE for me. I have GAD, but the anxiety I experienced was nothing like that. It was acute fear and dread that came rushing in for the next 4-6 hours after the meds wore off. Also I should mention I lost feeling in my hands and feet. I tried taking it for about a month but it wasn’t worth it. Four years later I still haven’t found something that works.",2,6,1
"Focalin XR","17 year old","April 19, 2019","Taken for 1 to 6 months","I see a lot of negative reviews, however Focalin XR is doing very well for me and my ADHD! I have been taking medications since I was in the first grade, and I can definitely tell the difference when I’m on this medication. I think my dose still needs to be messed with a little, but I feel a lot better. The only problem is that I’m losing a little bit of weight. Not a bad thing, but something to keep an eye on.",8,8,1
"Focalin XR","Rather Not Say","April 16, 2019","Taken for 6 months to 1 year","I took this medicine it made me have suicidal thoughts. It is awful. It made me irritable and I could not get sleep. This medicine tore up my stomach every time I eat I would throw-up. I just got tired of this medication. I wouldn't take this medication.",1,5,1
"Focalin XR","CJ","April 4, 2019","Taken for 5 to 10 years","These other comments are crazy and not relative to this drug vs others.  I have taken almost every type of ADD med and this is the best by far.  Methylphenidate has left and right branch isomers.  The right branch helps with ADD and the left branch causes stimulant jittery side effects.  Focalin/dexmethylphenidate is just the right branch.  Once you get your dosing right (I take 25mg XR in morning and 10mg IR in afternoon) then it is the best.  It is like a cure for ADD as opposed to taking a stimulant.  By far the lightest side effects.  It is less hard on the cardiovascular system than regular methylphenidate, and does not create neurotoxins like many of the amphetamine family drugs i.e. Adderall.  As long as you make yourself eat on it, then it is not noticeable.",10,25,1
"Focalin XR","Real deal","September 8, 2018","Taken for 1 to 2 years","My wife and I adopted. At the the time of birth doctors told us he was born addicted to crack cocaine also might not learn or express himself in a standard way. Our son is now 8yrs old in third grade omega prodigy program. He started taking Focalin and guanfacine at 6yrs old helped tremendously. 2 months to start working over summer. It's not a miracle drug it just helps keep him focused. I have not seen any side affects and no we are not rich or private school boot camp people. We just have him read 45min a day and let him be a kid. Good luck",0,16,1
"Focalin XR","Mom411","August 18, 2018","Taken for 2 to 5 years","I hate giving my child medicine. Absolutely hate it. My son was doing so poorly in school though without it. With it his grades are so much better. I tried stopping it for two months and had to give it to him again because grades and behavior took a nose dive.",9,15,1
"Focalin XR","Cool Guy","August 16, 2018","-","I've always had ADD but didn't start trying to get help with it until I was about to start college. I tried Adderall for 2 weeks and became unable to eat and felt constantly awful. It was obvious Adderall wasn't working for me, so my doctor recommend Focalin XR, and I really can't recommend it enough. About a week after taking Focalin (10mg twice daily) I went from that to being able to work without distraction for at least 4 hours. I could focus on all the things I enjoyed for longer periods. I was no longer asking my friends and others I'm sorry could you repeat that? like I was before constantly. It has also helped me with my depression, I feel so much more motivated and I'm able to finally organize things without it feeling like a chore. Sadly it's quite expensive, unless you have very good insurance. My previous insurance covered it until I turned 19 at about $5, but with my current insurance it's $170/month with a discount coupon.",10,9,1
"Focalin XR","Captain America","August 3, 2018","Taken for 1 to 6 months","I didn’t get diagnosed till I was 30. I’m 31 now.  I was taking adderall XR 25mg. I just didn’t feel it working like it should. So my Dr. switched me to focalin xr 30mg. I read the starting dose is 10mg for adults, I guess since I took a higher dose of adderall my dr felt it was best to get me going on a higher dose of focalin. My job is working on the phones I have to call about 300 people a day. There is no way I would be able to perform my job well if I wasn’t taking this medication. I’m focused and not bored, I’m not day dreaming all day, I’m staying in my seat, I don’t have a messy desk. This stuff works.",10,12,1
"Focalin XR","Sam","June 13, 2018","Taken for less than 1 month","Has helped so much with my focus at work that I am amazed.  Only side Effect I notice is I clench my jaws sometimes to tight.  I can live with that.",0,5,2
"Focalin XR","Drew","March 22, 2018","Taken for less than 1 month","18 y/o daughter, 100 pds, prescribed starting dose of 20 mg daily by primary care dr.  She went nearly out of her mind and out of control immediately. Anger, crying uncontrollably, inability to process, absolutely like she was on crack. Previously on another ADHD med without these effects. 4 days in we took her off and she returned to sanity.  This scared   both her and us.  It appears she was prescribed 4x the starting dose considering her size...and it is capsules that cannot be split. I Epic fail.",0,3,2
"Focalin XR","Nunya beeswax","January 29, 2018","-","I was placed on this medication after taking a 5 question survey on a piece of paper.  That DOES NOT determine whether or not you have ADHD.  I was on this medication and lost 40 lbs.  I also lost several jobs, became very emotionally erratic, and nearly died after arriving to a hospital with a 260 BPM heartbeat.  After finding out that I have Mitral Valve Prolapse with regurgitation, I obviously was weened off this medication.  I ended up following up with a neurosurgeon completing a CAT scan from a previous Traumatic Brain Injury as a teen and then also completed neuro-psychological testing which proved that I, in fact, do NOT have ADHD even though I was diagnosed with it twice in my life.",1,8,2
"Focalin XR","MomOf3_V","September 24, 2017","-","Ok I have been reading up on the side affects and reviews of this medication my 6 year old had tried 2 or 3 other ADHD medications from a clinic he stayed in for about a month he is on XR 20mg and it to me has honestly done wonders my son is able to focus, learn, sit still and get his school work done. He is so much happier that he is learning and can focus on one subject at a time rather than racing through his brain. I like it and only concerns is he can hold better conversations but his answers to question are very short How was your day? Good....You have to ask him more questions to get more answers. Then you have to repeat or either give him one instruction at a time for him to complete. I'm concerned about the long term side affects",8,19,2
"Focalin XR","TheRealAnise","April 28, 2017","Taken for 10 years or more","I have tried every ADHD drug medication available, both brand and generic (Ritalin XR, Ritalin IR, Adderall XR and IR, generic mixed amphetamine salts, Daytrana, Vyvanse, Strattera, some I can't even remember, if it exists, I've almost certainly tried it. ) Focalin XR is the only one that works. Naturally, that also means that insurance companies don't want to cover it. If you're trying to get it covered and they're dragging their feet, don't give up! You have to jump through a lot of hoops and you have to fight every step of the way. Get your doctor to help you and talk to them. Do NOT give up. Insurance companies love to make it as difficult as possible for people to get effective meds. Don't let them do it.",10,35,2
"Focalin XR","AmandaLAllen17","February 23, 2017","-","Works Well",10,5,2
"Focalin XR","Anonymous112","December 10, 2016","-","Hi! I am 18 years old . I was diagnosed with ADHD just a couple months after starting kindergarten. I was having trouble paying attention, got in trouble everyday; seeing the principal was 2-3 times every 2 weeks was normal. I started taking focalin at 5. My grades improved, my conduct improved, and I could focus. I took it  every weekday I was in school. It killed my appetite, I became dehydrated a lot and I didn't get all the nutrients I needed to Grow properly ( 16, 124lbs).  I stopped taking in 7th grade at my discretion and my grades dropped instantly, my conduct went back. 11th- I started back and instantly my grades improved. Only drawback is I have to force myself to eat.",9,40,2
"Focalin XR","Neary","December 8, 2016","-","My son takes Focalin XR for his adhd. I like the medicine but my only complaint is a side effect that is not listed anywhere when I research Focalin. The side effect my son experiences is digging in the ear or the sensation of something in his ear that he needs to get out. The higher the dosage the worse the digging is. I have talked to the doctors, had his ears checked and put on allergey medicines, he still digs in his ears. He does really well with the medicine in school and activities out side of school. I have not seen any other side effect for this medication.",9,15,2
"Focalin XR","John's mom","August 12, 2016","Taken for 5 to 10 years","My son has been on this for 8 years and it is a huge help. Takes 1st thing in morning and lasts all day. No problem eating dinner and has kept a healthy weight. With the coupon we pay zero out of pocket....",10,27,2
"Focalin XR","mom of 3 sweet souls","July 19, 2016","Taken for 1 to 2 years","I have an 8 year old with ADHD, ODD &amp; anxiety and a 7 year old with ADHD.  We tried everything before going to meds - healthy diet (no sugar/dyes), exercise, consistent schedule.  Both boys have taken Focalin XR for a year (started with low dosages and increased as they grew) and it's been life changing!  The meds have drastically improved their grades, behaviors and relationships.  Both boys take a small dose of Focalin with lunch to get through the afternoon and a small dose of Clonidine in the evening to slow things down for bedtime.  Focalin XR has been our saving grace - now instead of CONSTANT redirection, we can actually go do things and have fun.  The only side effects are suppressed appetite, but they are both a healthy weight.",10,41,2
"Focalin XR","Ameliabidelia","July 4, 2016","Taken for 2 to 5 years","I've been taking 20mg of Focalin XR for the past 2 years and have experienced great improvement in mental function and all around health. Focalin has allowed me to focus and be aware of a situation. I have been more efficient at work, more aware of my health and wellbeing, and able to process situations more appropriately. My biggest complaint has been with sleep patterns. Some nights I can sleep 6 hours or I can sleep for 14 and I CAN NOT fall asleep right away. My FitBit has mixed reports, but they are questionable. This is something I have tried to tweak with my doctor, but we have not had any success. My second complaint is nausea, but that we have been able to tweak with food consumption and timing.",9,17,2
"Focalin XR","Unknown Unknown","July 3, 2016","-","Worst 10 year experience of my life! It gave me bi-polar disorder OCD and even worse ADHD!! It made me get very very very bad anxiety and it felt like I was gonna have a heart explode!",1,11,2
"Focalin XR","Drake235","June 22, 2016","-","It's amazing but don't take 5 or 6 or 7 you will feel sick and stay up and not eat for a day or 2 but if you want a fun focus high go small like 2 or 3 then work your way up if you want to buy its not fun with a lot you start hearing thing and seeing things and you get scared easy but fun at the end did my college homework project and easays and other things I had to do for college got all done in that 24 hour period still up and feel hyper and awake but I know I'm going to crash very soon but the drug does it job 100% for me when I do 1 10mg or 2 10mg I do 2 for test the next day soo I know I'm up and ready for it",10,10,2
"Focalin XR","GabrielPCA","May 13, 2016","Taken for 5 to 10 years","I was diagnosed with ADHD at the age of 5. My parents stopped medication a few years later. I was re-evaluated at as 25 and given Focalin XR. I have been on it for 8 years and have nothing but great things to say about it. I feel focused and in control when on it. When I'm off it, time drags by and I can't seem to finish anything. I haven't experienced many side effects. Periodically have less of an appetite and occasionally clinch my teeth but other than that, all is well.",10,35,2
"Focalin XR","Terrified mom","April 21, 2016","-","My son has been diagnosed by 2 psychiatrists with ADHD. His issue started when he was 4. I thought he would out grow it, but it hasn't happened. He's 7 now. I've tried everything and going to start Focalin XR next week. I'm terrified!!  mostly of all the side effects. I'm also afraid it's not going to work..am I doing the right thing...",0,20,2
"Focalin XR","Focalin for president","March 8, 2016","-","My son started haveing behavior problems in pre school. We had some teachers put up with it while the next year another wouldn't. They'de go out of their way to displine him,cause face it their human and just didn't like him. He still got straight a's and b's.  We decided hey he's just hyped he has good grades we re not gonna dope our kid up. We'll we moved he went to a new school where teachers didn't know him and they started letting him fall behind. In principles office everday. Then we found foclin it was night and day.They put him in special classe last three months of year. By the end of three months they had already decided he didn't need the classes and for three years now a lilltle babytalk no incidents or trips to office.",10,16,2
"Focalin XR","extremely happy mom","December 25, 2015","Taken for 5 to 10 years","My son was diagnosed at 4 and has been through almost all the drugs for ADHD which would typically fail because of side effects ie zombie out or hypersensitivity and the simplest things would make him cry.  He has been diagnosed by two of the biggest and best known hospitals for children (2 separate occassions) with the 0.001% extreme ADHD and let me tell you Focalin has been a God sent.  He is 10 now, on Focalin xr 25mg, his grades are up, left and right compliments from teachers that usually had complaints, no reported behavioural issues yet. Only small downside is appetite suppression. Big healthy meal before the med, small high cal snacks after school and dinner, big healthy dinner and you're set. While on meds can't even tell he has ADHD!",10,45,2
"Focalin XR","BrandonH6","December 10, 2015","-","I never had ADD or problems focusing and staying motivated before I had chemotherapy for Ewing's Sarcoma at 16-17 years old. I'm now 24 and started being treated for those symptoms with Focalin XR earlier this year. It was night and day difference for me. I had energy, yes the first week I was shakey but that stops, I lost weight gained from conituning to eat like a weight lifting football player but had very little movement at all. I felt great, I can get things done now. Motivation is now just lacking from my lack of trying but when I get on something I blaze through it. Negative effects I have experienced are occasional moodiness, especially if I am focused on something and then get interrupted. Caffeine is a no no.",8,24,2
"Focalin XR","9yr old daughter","November 24, 2015","Taken for 1 to 6 months","We had no results on this medication.  Granted we only took the 5mg but her emotions were so heightened she would start crying for no reason.  The teachers didn't see a difference and her grades started going down.  The side effects were to intense for her on 5mg, there was no way I going to go up and have it worse.  We are now going to try Vyvanse 10mg.  We will see if this change helps.",1,13,2
"Focalin XR","Anonymous","November 22, 2015","Taken for 2 to 5 years","My Son was diagnosed with ADHD when he was 4 years old he Is now 7 before finding Focalin his doctor started him on Ritalin he was only on it for 3 days because it made him zombified and depressive with many mood swings then he started Vyvanse for a few weeks but it gave him some kind of allergic reaction in his throat.  Finally  he was put on Focalin 10ml and for the last 3 years it has been doing him great. He does awesome in school and also at home he can focus and he is happy. The only bad part is he has absolutely no appetite from 10 min after he takes the pill- 6hrs later. He  drinks cyproheptad syrup 2mg to help boost his appetite while on the Focalin.",8,20,2
