"Drug","User","Date","Period","Review","Score","Likes","Page"
"Focalin XR","Anonymous","September 8, 2015","Taken for 2 to 5 years","I was diagnosed with ADHD Inattentive Type at age 20, in my junior year of college (about 2.5 years ago). I started on Focalin XR 10mg, and while it took me a to get used to how to work around the meds (I had to change from doing schoolwork late at night to early in the morning), but it has done nothing but help me. The only thing I found was that when I interned and now that I've been working for a year, it doesn't help me (I'm on the phone a lot and it makes me have some issues bouncing around a conversation - too focused on one thing).  Cons: absolutely no appetite from about half an hour after taking it-, 6/7 hrs later, really stiff neck, crazy distracted/hungry/drained when it wears off",9,25,2
"Focalin XR","Mac daddy25","August 19, 2015","-","My son was diagnosed with ADHD about 6 months ago,he is 7 years old, this medicine Works great. He's not zombified. Helps him to really focus and helps with school. Only side effect I noticed is he doesn't have a appetite and it wears off about 4pm and he eats like crazy then. No mood swings. Very satisfied with this medication.",8,35,2
"Focalin XR","Blastman123","August 6, 2015","Taken for 10 years or more","I was diagnosed with ADHD when i was about 5 and my experience over all has been amazing ive been on it for 12 years now i take 40mg once in the morning and in the afternoon and by like 6pm it wears off(btw im 6 feet tall and weigh 225 lb thanks to this medication).  The only bad parts or symptoms im having are that Caffeine has no effect on me anymore( probably built up a tolerance thanks to the focalin) , I dont always sleep to well, and ever since i tuned like 14 my appetite went from non-existent to out of control (dont know why...) im 17 now and am an A- Student where as i was an F student before, I definitely recommend this but i should warn you all its not for everyone there are alternatives.",9,34,2
"Focalin XR","Anonymous","July 28, 2015","-","My daughter was 6 when she started it and her school work has improved dramatically. The only side effect is that she is not hungry, and we have to force her to eat. At 5:30pm when it wears off, she is hungry and distracted.",10,24,2
"Focalin XR","Son name Shawn.","May 15, 2015","-","My son was diagnosed at six years old. (ADHD).  He's been on Focalin EX 30 mg for four years.  Works amazing he's able to concentrate and focus in school.",10,28,2
"Focalin XR","Joshua_","April 9, 2015","-","I'm 17 now. Been taking the medicine for maybe 3-4 years now. Honestly, it's fantastic in what it does. Better concentration, less impulsive, able to actually sit down and work, more control over my mood/emotions and its worth repeating Less Impulsive. But please know that because of this I also weigh 129lbs. I'm 6 feet tall. This completly kills my appetite. I've gone full 24 days without any real meal and hate it. I hate feeling my stomach in pain and feeling weak because I have nothing to fuel me but still my mouth stays dry and eating food becomes so non-instinctive that I have to force myself to go through the motions of chewing and swallowing. When off it, appetite is fine. Great medicine, please be aware of the effects possible.",8,53,3
"Focalin XR","math-man","December 6, 2014","-","I'm an adult who has taken this off and on for 4 years.  I've always had trouble concentrating and Focalin is an effective fix.   I do think there are minor side-effects though.  It makes me feel much more focused and less worried/panicked about what I need to do.  Unlike other though I would not say it calms me down I feel like it actually stresses me out more.  When I take this I'm more serious and easily annoyed and I can't relax.  I have also found that my appetite drops off and that I don't sleep very deeply. Overall a great medicine but for me and many ADHD people our symptoms are brought out due to simply a lack of strenuous physical exercise (1hr) every day.  When on a regular exercise and sleep schedule I do not need it.",8,38,3
"Focalin XR","Down-the-line~","April 9, 2014","Taken for less than 1 month","I was properly diagnosed with ADHD after knowing all my life, I'm special. And different from the rest of my coworkers and people I meet and met. I recently lost my job due to a rightful blowup at the my Boss's deputy, which led to all the way to a final write up. Two month later, it was discovered that I wasn't doing the daily logs, that everyone can do, but I couldn't do it easily. This behavior led to a Doctor and conclusion, I have ADHD. At first I was on Vyvanse 20 then 40, this left me speedy and jittery, almost unable to cope in public. So I changed to Concerta XR 36. Mild and cool enough, but I don't see the difference with my ADHD. So I moved to Focalin XR 25. It's been an hour since my taking it at 3pm. I feel it.",8,28,3
"Focalin XR","Brandy30","March 27, 2014","-","My son is 13 and was put on Focalin for his ADHD when he was about 7 years old. It did not make him a zombie at all. My ex=husband was very concerned that it would do what Ritalin did to him. Focalin for my son just calmed him down enough to do his class work . He was first just taking one in the mornings and then as he got older and got more class work to do we realized that it was not lasting him so he got put on a low does for in the afternoon. He grades improved so much and yet he still had a lot of energy to blow through.",10,85,3
"Focalin XR","Lltcat","February 1, 2014","-","I have two children currently taking Focalin XR. My 12-year-old daughter has been on it for three years and my nine-year-old son has been on it for one year. We have seen fantastic results with both of them. We have seen as many others have said that the medicine seems to wear off about the time they get home from school.  What we do is they have a small snack and take a small afternoon dose of 5 to 10 mg of regular Focalin to help them get to their homework and evening activities. If it is a no homework day or no activity day we opt to not take this medicine in the evening and we do not take the evening dose on the weekends. We do take the morning dose every day of the week.  We've not had any major side effects.  The only thing we have noticed is a slight decrease in my sons appetite not my daughters. We have also had to adjust medication as they have grown. But we have had wonderful success with both children on the medication.",9,108,3
"Focalin XR","Anonymous","January 23, 2014","Taken for 2 to 5 years","I was diagnosed with ADD when I was seven, I think. I had behavior issues in my second grade class and I drove my teacher nuts with my constant distractions and my lack of focus. Little things like small talk and excessive noises triggered my symptoms and I was put on Ritalin LA when I was eight. Ritalin was awful for me. I didn't sleep very well at all. I had periods of insomnia and when I would sleep it was very prolonged in hours of sleep I was getting. Finally, after a couple of years suffering with this Ritalin I talked with my doctor about trying a new medicine called Focalin XR when I was 13 and I am almost 18 now. Focalin XR has been really wonderful for me. My focus is better. It does cause diarrhea, and mood swings.",8,51,3
"Focalin XR","Mr P","January 10, 2014","Taken for 6 months to 1 year","Let me explain what can go wrong here and what you may want to speak with your Dr about. Focalin XRs effect is much , much, much stronger than Concerta or Ritalin. This is very important to understand, so if you are thinking of switching to Focalin XR from another medication do not go to a similar strength. I was on Concerta 54mg and went to  Focalin XR 40mg. This was a scary experience I got dizzy almost passed out and couldn't tell you what 1 1 was. It was horrible  to say the least. I discontinued the Focalin and tried Adderal. That made me grumpy and sick. I did research and found out about Focalins potency. I am now on Focalin XR 15mg and doing awesome.",9,59,3
"Focalin XR","Momma Tiph","December 21, 2013","Taken for less than 1 month","I gave my 4 year old his first dose at 7 am on a Friday- by 3pm he was running, hitting back flips off the bed and could not stay asleep. I called the doctor she said discontinue. His heart was beating out his chest- I was so scared I sat and watched him all night and his heart beat like that through the next day. No more stimulants for him.",5,24,3
"Focalin XR","Cameron's mom","November 17, 2013","Taken for 1 to 6 months","Our son has been on focalin xr for about 3 months. He was on regular focalin for 2 months previous to the xr, but because the medication would wear off so quickly, it was like he was on an emotional roller coaster. The xr has been better for those reasons. I still struggle with having my son on medication and the fact that his appetite is so little while on the medicine. But I'm happy to report he's doing well in school and cooperating. I don't like that he seems so serious when he's on the medicine because I don't want a little robot. But I can't have my son be so impulsive and unsafe. I also don't like that the medication wears off right around the time he gets home and he tantrums and acts terrible and all I do is correct behavior.",8,64,3
"Focalin XR","neandrathal","September 18, 2013","-","Helpful.",8,10,3
"Focalin XR","lmschmitz3","July 11, 2013","-","My fifteen year old son has had behavioral problems since he was a toddler, he was diagnosed with ADHD at the age of five through very specific testing by a psychologist who specialized in ADHD. I was not going to put my son on medication because his teachers thought he was hyper, there is a difference. He has been on every ADHD medication on earth with different side effects. None of them were as effective as finding Focalin XR. If a medication is not working or causing negative side effects on your child, do not give up! Sometimes you need to try a different combination of medications. My son did not start doing emotionally better and stabilized on his medication until he was twelve. I would not give up. Help is out there!",10,85,3
"Focalin XR","BobbiAnn0405","February 19, 2013","-","I am loving all these comments about this medication, and I thought I was the only one in the world who had these same issues. My 1lb 13 oz daughter had to have a tracheotomy in for 4 yrs got it removed and immediately began acting out, led to ODD and ADHD, went through all the medicines, I am a Nurse by the way. I found this and I am sticking to it, it does have appetite suppression effect, and only last 6 hours peak time. After 3pm after school it wears off and let me tell you its on until I give her clonidine 0.1mg tab at night(helps to sleep). I don't know where to go from here. Luck and God bless you all.",8,45,3
"Focalin XR","Papa del Toro","February 8, 2013","Taken for 1 to 6 months","Our Facts:  Son was getting into trouble at school every day. He was a terror around the house. His diet was exceptional, eating vegetables, fish, fruit, rice, and no sugary drinks or high fructose corn syrup.  Lots of love and discipline at home. Got in trouble all the time at home and school because he's uncontrollable. With Focalin he immediately improved and is doing great in school.  He is actually happier and feeling better now.  While his appetite is down while on the medicine (about 7 hours), he eats a huge breakfast and a huge dinner to compensate.  Even his tick has gone away.   We are very relieved. Only downside is that it only lasts about 7 hours.  So when he gets home, he starts amping up again.",9,69,3
"Focalin XR","chrissy37","January 21, 2013","-","My son just started this 2.5 weeks ago. He is 9 with ADHD and odd. The medication works fine for symptoms. Yet I'm concerned because he has developed a tic where he constantly taps his legs and sometimes hits them with his fists pretty hard and twitches his eyes. We are going back to the doctor for management.",4,29,3
"Focalin XR","Jonathan age 12","January 18, 2013","-","I got diagnosed with ADHD and this is my first medicine. It helps me focus but the side effects make me miserable. I'm starving right now but I don't want to eat and my throat is dry. I can't sleep and this side effect makes it worse because I have asthma and severe allergies so I can't sleep and I have twitches bad. I twitch my left shoulder blade a lot now and sometimes it wont stop.",4,35,3
"Focalin XR","KRANKY","December 28, 2012","Taken for 1 to 6 months","I am a 60 year old male with ADHD, who would have ever thought it? I started using Focalin IR 5mg after cutting it into four(4) pieces. I would take one quarter piece every three hours. It took me from being nonproductive to productive again with very few side effects. I am now taking Focalin XR, 10 mg in the morning and a 5 mg 6 hours later in the afternoon. I think my ideal dose will end up at 15 mg am and 10 mg afternoon to reach the optimal dose. The only side effect has been heartburn, a slight headache and being a little jittery with a occasional outburst of anger. I can handle the side effects which have subsided somewhat, to get the wonderful effects of this medication! ALIVE AGAIN AT 60 yrs old!",9,64,3
"Focalin XR","chandler1166","September 25, 2012","Taken for 2 to 5 years","It makes me feel full and a bit depressed...but I do enjoy doing all my work and making good grades.",7,22,3
"Focalin XR","Anonymous","September 2, 2012","Taken for 2 to 5 years","My son has been on Focalin XR for a few years and we started at 15mg once a day and he seemed to do fine for a while and then teachers noticed some problems with attention.  We have never had behavior problems and he has always seemed happy in school and at home.  We increased to 20mg a day about 6-9 months ago and he just now told me that he is having suicidal thoughts and has been for a while, so will be talking to his doctor about cutting it back to 15mg a day and see if this helps.",0,30,3
"Focalin XR","Dsfg2111","August 21, 2012","-","My son started Focalin 5mg when he was first diagnosed with ADHD. He was six at that time. While he did seem to be a bit more focused, the mood swings were VERY significant. He became volatile, reacting with violent outbursts and temper tantrums at the slightest provocation. After a while, his attention span declined, but his mood swings did not. His teacher noted that, even on medication, he was still having problems staying focused and on task. Upping the dosage would only have made his withdrawal worse, according to his pediatrician. I have known other children on Focalin who have had similar experiences with the medication. After six months (giving his body time to adjust to the medication) we took him off. Trying Concerta.",2,48,3
"Focalin XR","HLS","March 19, 2012","-","Overall this medication has been absolutely wonderful.  Our 12 year old son was diagnosed at age 7 with ADHD. We did try another medicine, but it stopped working after about 2 years. We have been on the Focalin XR since.  Our son takes 25 mg, 2 times daily about 6 hours apart. It has helped a ton. He does have the appetite issue, but we are sustaining it, and when it wears off at nite, he eats great. The mornings are the worst part before the medicine kicks in.  Our son has improved so much in school and in his extra curricular activities.  He is a total joy when the medication is working. We do try and give him drug vacations on the weekends and during the summer which helps maintain his weight.",8,46,3
"Focalin XR","Anonymous","December 10, 2011","-","I was diagnosed with ADHD at the age of 7. I started with Concerta to treat it but as time went on the side effects and the dosage being 135mg was getting annoying. I have noticed that Focalin XR has fewer side effects than Concerta. Also, I eat a good deal more and I can sleep when taking it. I also read in the comments that the maximum dosage is 20mg? I take 35mg and will probably up my dose. Other than that it is a very good medication.",8,27,3
"Focalin XR","Anonymous","December 3, 2011","-","This has been a God send. I have Executive Functioning issues with possible undiagnosed ADD and I have tried many, many different prescriptions (Adderall, Concerta, Meditate, Vyvanse) and none have worked nearly as well as Focalin. The ones listed above put a lot of load/pressure on my brain. It's hard to explain but it was not pleasant. On Focalin I am much more attentive and there's no body load. Others also cut my appetite significantly and kept me awake at night. While Focalin still cuts my appetite some, I am able to go to sleep when I need too. 10/10 but remember just because it worked for me doesn't mean it's going to for you. I suggest trying them all and seeing which one has the best synergy with your body.",10,62,3
"Focalin XR","hmawhor","November 18, 2011","-","We started our 10 year old daughter on this medication last year and had terrific results. She doesn't have any behavioral issues at school and never had but did by the time she got home, was so worn out from trying to focus and be good that she was having emotional break downs. We started last year on 5 and after 8 months 10. She is saying she doesn't notice a difference between taking in and not recently so increase to 15. She has been emotional again somedays, but not sure whether that is because she is an 11 year old girl, medication related, or not enough medicine. She has had a problem falling asleep since she was born and last year seemed better after being on medicines, but has come back this year.  We give her melatonin occasionally.",8,18,3
"Focalin XR","Anonymous","November 5, 2011","-","My daughter started taking Focalin XR 15mg in the morning and 10mg in the afternoon. This medicine does not seem to be helping at all and her behavior is worse than ever to the point that we cannot handle her and she almost had to be hospitalized for the second time within a 2 week span.",2,16,3
"Focalin XR","Anonymous","June 25, 2011","-","Our 11 year old son is diagnosed with ADHD inattentive type and has been on this medicine for 14 months now. It made a big difference for him. He is on 15mg Focalin RX. If he doesn't take it for a day, the teacher can really tell the difference. He can focus now and became a part of the class, contributes to the conversation and also has an easier time with his social life. He doesn't hate school anymore. We don't see any behavioral issues at home when it wears off. He has appetite loss, so he eats a big breakfast before he takes the medication. He also got used to eat a sandwiches at school even if he is not hungry. It became a part of his routine.",9,51,3
"Focalin XR","mother of a wild man","May 14, 2011","-","My 6 yr old son started showing signs of ADHD a year ago. He is in kindergarten and he has 3 types of days green- good, yellow-not the best, red-bad day. Every week he was coming home with 2 yellow days a week for calling out and being disruptive for the last 7 months. He started taking Focalin XR 10mg and has a green day everyday since he started the medication. His teachers say how much better he has been at school and he doesn't run a muck through the house anymore. I'm so happy we found Focalin.",8,37,4
"Focalin XR","Anonymous","November 3, 2010","-","I am a adult, recently diagnosed with ADD.  Probably had it my whole life, but now I am doing something about it.  My doctor prescribed this medication, and at first, I was so focused and improving my error ratio's at work.  The only thing even after increasing my dose, it wears off.  By 1:00pm, I am tired and can go to sleep.  I think I am going to ask my doctor to give me the non extended so I can take it in the am, and pm.  Other than that, it is a great medicine, and I don't have the non-appetite side effect, in fact, it makes me want to eat more.",6,31,4
"Focalin XR","Anonymous","September 18, 2010","-","My son has been on Focalin XR for 3 years now.  We have had nothing but success.  He will not go to school without it.  He went from a failing student that stayed in trouble to a GT student that LOVES school and a very successful competative swimmer.  Yes we do have behavor problems in the evening but its nothing that we can't handle..",9,39,4
"Focalin XR","Kahleia","September 16, 2010","-","My daughter has been on this drug for a month and she has been focusing a lot better on homework and her behavior has improved. I am currently trying to figure out what to do because it helps her a lot but also causes diarrhea sometimes.",7,15,4
"Focalin XR","Anonymous","June 4, 2010","-","My son started taking this at 6, he was violent with family members, and would not pay attention in class, refusing to do homework, sometimes hitting other kids. He had never been  on any other behavior modification medication before. We noticed a big difference when he started taking Focalin XR. His teacher started sending home good notes. He was doing well in school, but by the time he got home the medication had worn off, and we were dealing with the same problems. Now he has been on it for 2 months, it seems as though his body has just gotten used to the medicine and his former behavior had taken over. Now we are consulting his Doctor to see if the medication needs to be increased, or where to go from here.",7,27,4
"Focalin XR","Anonymous","January 27, 2010","-","My child has been taking this for a few months now. We tried Concerta and after only the second dose he was having severe tics. Focalin has less side effects but his behavior is WORSE when he misses a dose than it ever was before he started taking this medicine.",3,20,4
"Focalin XR","Anonymous","April 12, 2009","-","My daughter started this medication about 3 months ago. Her grades and reading levels have soared and we don't have as much trouble getting her to concentrate on homework but when it comes time for bed, she's a handful and irritable still when confronted with certain tasks to be done like chores. I am not going to consider another medication on top of this but will instead consider a behavior intervention.",9,29,4
"Focalin XR","Mom of a 13 yr old","September 17, 2008","-","My son is 13 and he has tried several different prescriptions for ADHD. This one does seem to be the best so far.  I have read about the max of dose being 20 ml and that is what he is on. Once the medicine wears off he can be very difficult to manage with his attitude and behavior.  It is ends up being a very stressful situation when he gets this way.",8,33,4
"Focalin XR","Anonymous","June 10, 2008","-","My daughter has been on this medication for a little over a year. She is doing wonderfully on it, besides her attitude and behavior when it wears off.  I do however, give her an additional pill in the afternoon if we have something to do in the evening. The only side effect that she gets is not wanting to eat. She has been on several other medicines and this one is the best.",9,43,4
"Focalin XR","25withADHD","May 3, 2008","-","I had a lot of success with Focalin.  I felt like my brain got turned off, which was a good thing! I could sit through my classes and actually get stuff done.  I stopped losing things and I got things done faster and with ease.  I lost weight, which was pretty cool.  I didn't have too many side effects that I can recall, except for the lack of appetite.",9,63,4
"Focalin XR","tasha79","March 17, 2008","-","My daughter has been taking this for about 2 months and it seems to be working besides she has been really disrespectful to everyone witch we have not seen with her before with her other meds.",8,32,4
"Focalin XR","MamaZgirl","March 10, 2008","-","My daughter has been taking this for 7 months with almost no side affects.  Her reading level increased from 3.1 to 4.5 in 6 months and her grades overall increased to A's.  Our only problem is that we are having behavior problems with her at home as the medication is wearing off, and prior to taking it in the morning.  We are currently adding another drug to see if it helps with this issue.  Her behavior at school has not changed.",8,42,4
"Focalin XR","Anonymous","March 10, 2008","-","Patient has had diarrhea at times since beginning this medicine nearly a year ago.",6,17,4
