"Drug","User","Date","Period","Review","Score","Likes","Page"
"Methylphenidate","lauren","March 6, 2018","Taken for 1 to 6 months","<b>Cotempla XR-ODT (methylphenidate):</b>			 Used this medicine in replacement for quillivant XR when it was on back order. The pills don't dissolve as fast as I expected them to. They still dissolve pretty fast and taste good. Works good with concentration and doesn't suppress your appetite as much.",0,7,6
"Methylphenidate","Viv","March 6, 2018","Taken for 1 to 6 months","<b>Concerta (methylphenidate):</b>			 It did help me to calm my brain, but it gave me a very fast heart rate, anxiety, and caused me to loose weight. My normal weight is about 140 and at my lowest on concerta I weighed 123. It did help with the ADD, but didn't work completely, so I stopped taking it because the side effects outweighed the help.",0,11,6
"Methylphenidate","P. Greene","March 2, 2018","Taken for 10 years or more","<b>Metadate CD (methylphenidate):</b>			 Yes its the only thing that works for me, and now my insurance will not cover it. I've tried everything else for ADHD. I wish there was a way that the maker would help in lowering the price of this drug . I'm disabled from stage 4 cancer. I've been in remission for 12 yrs and 2 months 2 days. It helps me to complete all the everyday tasks. I'd really appreciate if their was some kind of help",0,8,6
"Methylphenidate","KaitlynnLouden","February 20, 2018","-","<b>Concerta (methylphenidate):</b>			 I was seven years old when I was diagnosed with ADHD and prescribed Concerta.  I took this medication for three years and there were definitely a lot of changes. Yes, I was able to focus in school I remember that. I remember while on the medication I always wanted to try and do my best. But I was never hungry, never tired, never wanted friends, never wanted to talk. I was like a zombie. I remember being bullied by other students because they thought I was weird.  I remember crying all the time because I was always sad. Once I stopped taking the medication I finally gained weight and started talking; as well as paying attention in class.  Concerta may have helped me focus more, but it took away three years of my childhood that I can hardly remember now. I will never be the same.",0,21,7
"Methylphenidate","Anonymous","February 16, 2018","Taken for 6 months to 1 year","<b>Concerta (methylphenidate):</b>			 Like many others this has definitely changed my life also.  I can function and do things I never thought possible.",0,14,7
"Methylphenidate","avery48","February 13, 2018","-","<b>Concerta (methylphenidate):</b>			 I have both ADHD and mild/moderate narcolepsy. I have been on concerta for 9 months. I had not taken any medication til I was a teenager (my parents were very against it) so I took Wellbutrin for a while to help with depression and my ADHD and narcolepsy however it was not strong enough, so I switched to concerta and am taking 36 MG. It changed my life. For years I could not go a day without taking a nap, could not focus at all in class. I just started college a few months ago and got a 4.0 my first semester which seemed impossible for me years ago. I can finally focus and stay awake, I cried a lot at first because I was so not used to this!! The only negative parts are insomnia, anxiety, and irritability. I recommend having the same bedtime every night and having something like melatonin on hand to combat this.   Also take your concerta at least 12 hours before you plan on going to bed. These side effects aren't horrible though, the good by far outweighs the bad!",0,17,7
"Methylphenidate","Carlosdielol","February 13, 2018","-","<b>Ritalin (methylphenidate):</b>			 I've been ritalin for a little over a week now and I have noticed that the mornings in first period are much easier to get through, but throughout the day when I'm on it I'll experience these low points of depression where I'm literaly just sitting at my desk and not be able to do anything. It works for calming me and I'm a lot less restless but once it wears off it feels like a wave of ADHD  hits me and I start running around out of control doing things like yelling and jumping.",0,9,7
"Methylphenidate","Pacercop","January 29, 2018","Taken for 5 to 10 years","<b>Concerta (methylphenidate):</b>			 I have a love-hate relationship with Concerta. The pros of the drug are that I can put two and two together, stick with mundane tasks (and look forward to them), read long, boring documents and catch errors, etc. The cons are the side effects- no sex drive, (sometimes) anxiety, a weird aura or buzz that lasts for awhile and depression. Lately I've been using natural treatments that are effective. Overall, though, Concerta did help me.",0,14,7
"Methylphenidate","Omki","January 15, 2018","-","<b>Ritalin LA (methylphenidate):</b>			 I  have tried it for 2 months one day I took it I couldn't feel anything (like helping me concentrate) all of what I just felt was the side effects",0,0,7
"Methylphenidate","Kattyh","January 4, 2018","Taken for 1 to 6 months","<b>Concerta (methylphenidate):</b>			 This medication was literally life changing for my son with ADHD (impulsive and hyperactive). He had impulsive, hyoeractive and aggressive behavior and they tried other meds like antipsychotics which made him worse! He started concerta (after I demanded a stimulant) and he is a different child - able to focus, not as impulsive and hyperactive and the aggression is gone!",0,17,7
"Methylphenidate","zzara","December 20, 2017","-","<b>Ritalin (methylphenidate):</b>			 I'm 18 years old &amp; just got prescribed ritalin for ADD. The first day I was studying for 5 hours and then felt completley drained mentally. In general I can do a lot more then before but I feel like its losing effect very quickly, as I can't feel it anymore so I don't take it when I don't have to study(so i don't get too high of a tolerance) I started on 10mg once a day and after a week I upped to 10mg 3x a day. I drink a lot of coffee, guarana and stuff so the effect are better. If I finish high school it will  because of ritalin",0,11,7
"Methylphenidate","ali78","December 19, 2017","Taken for 1 to 6 months","<b>Ritalin (methylphenidate):</b>			 I started taking Ritalin recently and it has already dramatically changed my life. I was diagnosed with nervous depression last year and prescribed Zoloft, which significantly drew me out of my depression. But Ritalin made me understand what it is like to be highly functioning. I cried after the first day I took it out of pure elation. I was able to stay awake at school the whole day (a huge personal rarity for me) and I stayed on topic and could hold conversations way easier after the first week. I stopped being so scatter brained. My only complaint would be slight nausea and insomnia. I just wish it helped with my hyperspaces, as i am still jittery, but I am on a low dose.",0,9,7
"Methylphenidate","Mojo90","December 12, 2017","Taken for 1 to 6 months","<b>Ritalin LA (methylphenidate):</b>			 The first 1 month on LA 20mg were horrible. Anxiety and way too focused. I nearly quit taking it but decided to persist. I am very glad I did.  I now feel fantastic and not so anxious. I would definitely recommend. I have tried all types of Ritalin and concerta and so far this is the one that works for me the best. It also works great with my Anti-depressant. Double Win :)",0,8,7
"Methylphenidate","Paintlady","December 11, 2017","Taken for 1 to 2 years","<b>Concerta (methylphenidate):</b>			 My son, 11, had been on Concerta for two years. We took him off of this med because he was getting very aggressive, with me and his siblings, and also kept saying he was going to kill himself.",0,7,7
"Methylphenidate","Anonymous","November 30, 2017","Taken for 2 to 5 years","<b>Ritalin (methylphenidate):</b>			 I’m a 19 year old athletic kid, and when I was prescribed this 3 years ago it did wonders. It was my junior year of high school and I was prescribed 10mg twice a day, once in the morning and once at lunch, with an optional one in the afternoon if I had a lot of homework or studying. My grades were much better and it didn’t have any side effects. Now, 3 years later I have a bad tolerance and I had to up my dosage to 20mg three times a day. I now take it to even make it to class and if I don’t take it I can barely stay awake. Like many people said it makes you feel extremely sluggish like a zombie, and it’s an absolutely awful feeling. I lose emotions, have mood swings and even my sex drive with my girlfriend is completely destroyed.",0,7,7
"Methylphenidate","Akurian","November 15, 2017","Taken for 6 months to 1 year","<b>Concerta (methylphenidate):</b>			 ? am a 28 year old female with ADD and mild form of narcolepsy. Before Concerta, ? was tired and sleepy ALL the time and distracted. It’s gotten to the point where ?t was affecting my work. ? thought enough was enough and went to my doctor. Concerta was the first medication he prescribed and it’s the best. But we experimented with Adderral (good pill but knocked me out at 7:00pm after ?t wore off, so ?t didn’t address narcolepsy) and Ritalin (heart rate was just insane) and Vyvanse (gave me anxiety that I never had). With Concerta ? have 0 side effects, ? am never sleepy anymore (but sleep well at night) and distraction levels have decreased significantly. Giving ?t a 9 because ? am not at 100% with focus. ? wish it were slightly stronger.",0,27,7
"Methylphenidate","Sophmobile","November 14, 2017","-","<b>Concerta (methylphenidate):</b>			 For a while it was good, I was doing okay in school and focusing more, but the more I increased my dose the worse the quality of life became, my social anxiety went through the roof. The worst part about it for me was that when my dose was 72 mg the cutoff or withdrawal was horrible, as soon as it wore off my face would get a big red rash and would pulsate, and my pores would get huge, this would happen everyday, and it was irritating and made me self conscious, so I took myself off the medication and noticed it stopped. I haven’t been on it since and I would like to start a new medication with less side effects.",0,8,7
"Methylphenidate","Woolly Jumper","November 14, 2017","Taken for 10 years or more","<b>Concerta (methylphenidate):</b>			 This medication worked fantastically for me! When I started taking it I was at the bottom of my class, struggling at school, and within 2 years I'd moved to the top. It totally transformed how I was able to concentrate.  I always felt like this allowed me to 'be the real me' because it gave me the focus and patience to do the things I wanted to do. It helped me socially because I was able think and communicate better (more tactfully!) In terms of side effects I can't take it too late in the day or else I wouldn't sleep at night, but nothing else. I know some people have described many more side effects but I didn't get anything like that. The only downside is that after 19 years on the drug, I don't find it as effective anymore.",0,17,7
"Methylphenidate","Mustafa2827","October 29, 2017","-","<b>Concerta (methylphenidate):</b>			 Concerta makes you focused and and concentrated. If you wanna get stuff done you can get it done in a breeze. You won’t notice that your enjoying what your doing, what I mean by that is like u know how homework is boring and especially if you have ADHD you have impulse problems, when you take concerta it’s like when your doing it, time passes by a lot and you won’t notice. Like you look at the time and for example it’s 2:30 while your doing your homework like I said the time will be 4:00 when you look back at your phone",0,24,7
"Methylphenidate","Cachito","October 20, 2017","Taken for less than 1 month","I'm 49 years old and recently diagnosed with ADHD.  My doctor put me on this medication 18mg about a month ago, I feel somewhat better not quite totally better still have trouble staying focused my anxiety is all but gone so thats great.  I've stopped biting my nails and clenching my teeth, but I always heard that you lose weight on this medicine, but I feel like I'm gaining weight - actually I am, and I don't stop eating not big meals but I'm constantly eating something! even after a meal.  Is that normal? I can't find anywhere where it says that you can gain weight...",0,2,7
"Methylphenidate","Anonymous","October 9, 2017","-","<b>Concerta (methylphenidate):</b>			 I am a 20 y/o girl. I was on 54 mg of Concerta once a day. This drug was the worst thing thats ever happened to me. It did help my grades but I felt most of it was placebo and the fact that the side effects were so horrible I wanted to focus on work to distract myself. It made my anxiety unbearable and constant. My heart beat in my head. My whole left arm and pinky would feel numb and prickly. I knew I was hungry but could not eat and was disgusted by food. I fell into a horrible depression and felt just overwhelming darkness. The pros was that it made sitting in long classes and retaining information much easier. I felt excited about learning and getting work done. Overall it helped with school but the side effects are not worth it.",0,32,7
"Methylphenidate","Stl_84","September 19, 2017","Taken for 1 to 2 years","<b>Aptensio XR (methylphenidate):</b>			 Both my daughters are on aptensio my 12 year old is on 50mg and 9 year old 20 mg. My 12 year old is 4'11 , 80 pounds. She eats and eats and eats all day. She's constantly hungry and still having problems in school! Also notice she has mood swings and gets mad more easily! I feel helps hyper part , but not fully helping focusing, she been on it over a year now! My 9 year old eats I would say normal! Helps her with focus and hyper. So I would say definitely helps her.",0,9,7
"Methylphenidate","EJCALI","September 14, 2017","-","<b>Concerta (methylphenidate):</b>			 It's amazing how much more focused my 16 year old son is, since he started his daily 36mg Concerta.  His work effort and work quality is improved dramatically.  Yes, managing his food consumption has been a bit of work.  His appetite is definitely not what it used to be, but we're working on it.  Although it's only been 3 weeks, we are all thrilled with his response.  Good luck to all!",0,18,7
"Methylphenidate","blakers","September 13, 2017","-","<b>Ritalin (methylphenidate):</b>			 It's bad for kids with ADHD because when I was 5 they gave it to me it kept me up for 72 hours and I took it every 4 days.",0,7,7
"Methylphenidate","Mumreese","September 5, 2017","Taken for 2 to 5 years","<b>Daytrana (methylphenidate):</b>			 When my son couldn't swallow, the patch was the perfect alternative for his ADD. He never did have the hyperactivity. We used it for years but he developed a nasty allergic skin reaction to it and we had to stop using it. We miss the ease of it and the simplicity of the 8am-6pm use of it. By bedtime he was ready to sleep. With Concerta he has to take Benadryl to help him sleep. If only they could have fixed that problem",0,8,7
"Methylphenidate","Ells Bells","August 30, 2017","Taken for 1 to 6 months","<b>Ritalin LA (methylphenidate):</b>			 Thinking that there has been a misdiagnosis as Ritalin had the opposite to that promised.  Violence, aggressive tendencies and amplified mood swings, far worse than before.  When not screetching, behaviour was loopy, super-happy and still unfocused.  Ceased 4 weeks into a 6 week trial - by necessity.",0,5,7
"Methylphenidate","mikeyinto","August 30, 2017","Taken for 1 to 6 months","<b>Concerta (methylphenidate):</b>			 My son has severe ADHD and Autism.  My son was graduated to 36 mg time release Concerta.  His behaviour did improve very slightly, however, he lost nearly 10% of his body weight in a short 3 months.  We  could hardly get him eat.  We started to supplement him on an immediate release 10mg Ritalin tablet before school and it was an absolute miracle. We removed the concerta and then increased his Ritalin to 10mg three times a day and its like a new child.  While its the same drug, the delivery system is completely different.  I firmly believe that the digestive system needs to be looked at for each individual taking Concerta.  For my son, the delivery system of the Concerta did nothing positive",0,18,7
"Methylphenidate","caduhunterbr","August 17, 2017","Taken for less than 1 month","<b>Ritalin (methylphenidate):</b>			 I was prescribed the 10mg IR Ritalin, to be taken three times a day a few weeks ago. To say the least, I have developed a tolerance to the drug. It has a bad comedown 2-3 hours after I take the drug. But it has done wonders for my depression and ADHD symptoms. The only downside I found is that it makes me feel like a zombie, too focused, much nervous and has a nasty after-effects. But so far it has been a revolutionary step in my life. I will try switching to the LA version though.",0,13,7
"Methylphenidate","SANAVA","August 12, 2017","-","<b>Concerta (methylphenidate):</b>			 Terrible experience. My son is affected with ASD and ADHD. We gave him Concerta for one day by prescription. All symptoms have worsen dramatically, He became extremely nervous and did not sleep a half of night.",0,8,8
"Methylphenidate","Ritalinimmediaterelease","August 4, 2017","-","Methylphenidate (Ritalin), which is always understood to denote IMMEDIATE-RELEASE, is a miracle medication w/practically zero side effects.I mean true Schedule 2 stimulant narcotic methylphenidate ..not Adderall, not Dexedine,not dextroamphetamine, not atomoxetine. My weight, brain, overall health, wellness, &amp; relationships are healthier on rigorous doses of methylphenidate (Immediate-Release plus Ritalin LA or Immediate-Release plus Concerta); however, pharmacies have to understand that  the generic must be the true actual commercially available exact product in every aspect as brand.",10,4,8
"Methylphenidate","Anonymous","August 3, 2017","Taken for less than 1 month","<b>Ritalin (methylphenidate):</b>			 I have only been on ritalin for a couple days now and the results are great. My concentration and focus has improved, I can get more things done and I feel more motivated and self assured. My social life is better and can keep a conversation going. The downsides for me where fast heart rate which made me feel anxious, a bad headache when I first took it and a decreased in appetite. Overall this is working for me so far and I would say to not abuse this drug, combine it with alcohol or anything else and to eat well before taking medicine. hope this helps",0,10,8
"Methylphenidate","John94","July 14, 2017","Taken for less than 1 month","<b>Concerta (methylphenidate):</b>			 I was prescribed this by my doctor and it was terrible. I stopped taking it after 5 days because my doctor told me to. It made me angry all the time. It did not help my concentration. Also, 3 days after taking it I still have shortness of breathe, my heart is still beating hard, and the left part of my chest has immense pressure on it. I'm never taking this stuff again. Trust me, nobody needs it.",0,21,8
"Methylphenidate","Chuck-e","July 12, 2017","-","My internist gave me methylphenidate (the active ingredient in Ritalin) for an ADHD disorder that I didn't even know I had. My God! My world finally made sense, and I was able to finally concentrate on a single task without having something pull me away for no earthly reason. And on top of that, the peripheral neuropathy in my feet, courtesy of a few early drugs in the HIV era, disappeared... totally. I didn't even need my methadone until I began to develop a tolerance for the methylphenidate. I'm the only person my pharmacist has heard of who experienced this effect, but I am sure not complaining. This is truly a miracle drug for me, but since I went to a larger insurance company, with it's own doctors, it's been refused  it to me.",10,6,8
"Methylphenidate","To tired to make name Bla bla","June 30, 2017","-","<b>Daytrana (methylphenidate):</b>			 I was trying to fall asleep for 20 minutes then I said ohh crap I forgot to take it off. So now I will be awake for 3 more hours. It is very bad if you are a busy person like me. Uggg so tired but can't sleep.",0,5,8
"Methylphenidate","KaylaL","June 13, 2017","-","After three years of constant downs with behavior, my son was finally diagnosed with ADHD at six. We’ve tried 10 mg ($60), 20mg ($99) and 30mg ($104)- all of which has worked for about a 1- 1.5 months and then stops. Our pros (when it is working): concentration improved (could actually sit down and read a chapter book), hyperactivity calmed down, but not enough to make him sluggish and school attitude improved. Cons: didn’t last long during the day as well as it stopped working after a month of taking every day as well as loss of appetite (lost 5 lbs over the last 5 months). Since we keep plateauing his doctor has switched him to Vyvanse.",5,3,8
"Methylphenidate","Carojak","June 13, 2017","Taken for less than 1 month","<b>Concerta (methylphenidate):</b>			 I have a nine year old son who was diagnosed with ADHD at the age of six. We tried Focalin first and it made him extremely weepy. A month later we tried Vyvanse and had a good experience with it for three years. There was a major rebound effect but we felt lucky to have some relief from symptoms for the hours that we did and dealt with the negatives. We moved from CA to a high altitude state and his meds went haywire. We tried Strattera for two months and he had a stable mood but zero focus. We started Concerta two weeks ago and are extremely happy. We aren't dealing with an afternoon rebound!!!! He is pleasant. He can focus. We are hopeful that the good will continue. I suggest trying this drug or another one if you aren't 100% satisfied.",0,24,8
"Methylphenidate","Anonymous","June 3, 2017","Taken for 6 months to 1 year","<b>Ritalin (methylphenidate):</b>			 There are some things I love about this medicine, like my ability to focus and get things done. But I really hate the side effect of having no appetite because I'm skinny to begin with. It also increases my heart rate which can make my feel anxious. It also gives me diarrhea which my doctor said does happen to some people. It's super effective, but I wish I could get rid of those side effects. may be better for people who do not need to focus 12 hours a day like I do because I require 3 doses a day.",0,16,8
"Methylphenidate","trouble61","May 29, 2017","Taken for 1 to 6 months","<b>Ritalin LA (methylphenidate):</b>			 At 55 years of age I am diagnosed with ADHD.  It was something I always knew about myself (have Bsc Psych).  However, historic issues of sexual abuse at school caused issues / depression / PTSD.  I was first given Citalopram and diazepam.  I cannot say with certainty it helped a lot.  However, once diagnosed with adult ADHD I was prescribed Ritalin LA. It has been nothing short of a miracle for me. Up early, happier, and getting on with life as best I can. Some minor side effects went away as I continued. Also changed to a decent DE-CAFF coffee.  Caffinated make me anxious and cancels the positives. Was easy to do. I see Ritalin LA as a positive for my depression.",0,14,8
"Methylphenidate","28F","May 22, 2017","Taken for 2 to 5 years","<b>Concerta (methylphenidate):</b>			 In early elementary school I was diagnosed with ADHD. It's not common for females to have it. I started on ritalin. It helped, but I stopped taking it in high school because I was worried about the stigma. In University I took it off and on. After graduating, I took it only during major changes because it helped me cope, but I never wanted to rely on it. Now I'm trying to get my career going in the field I want to be in and I'm stressed out of my mind. I have anxiety and my family doc is concerned I'm going through depression. I'm back on Concerta and have been for a few days. It is the 18mg dosage, but while I feel a bit more focused, sadly I feel more focused on my emotions. Hopefully when I move up to 27mg I will be less forgetful and anxious.",0,21,8
"Methylphenidate","Reis grand","May 20, 2017","Taken for 1 to 2 years","<b>Concerta (methylphenidate):</b>			 This drug has cause way to many side effects on my 12 year old grandchild. Has cause her body to over develop very fast.",0,14,8
"Methylphenidate","female 11 years old","May 19, 2017","Taken for 1 to 6 months","<b>Aptensio XR (methylphenidate):</b>			 My daughter has been taking Aptensio for 3 months now. She takes 50mg once a day. She has taken just about every drug on the market. The longest lasting about 8 months. She takes the Aptensio at 7am and by 3:00 when she comes home she is a total train wreck! The come down for her is fast and has her acting worse than before medicated. She says she isn't really finding her focus to be much better when at school. However, in the past 3 months she has put on 5 lbs. She is always hungry which is a total change from any other stimulant med she has tried. I take the same med and have put on 13lbs. in three months. We know of two other children that have gained as well and love the med. So if your child is under weight from stimulants try this one",0,7,8
