"Drug","User","Date","Period","Review","Score","Likes","Page"
"Methylphenidate","Mom=)","January 25, 2013","-","<b>Concerta (methylphenidate):</b>			 My son is 6 AND has been diagnosed with ADHD. Concerta is one of the medications we have tried. It does wonders for him during the day, he has GONE from being the class clown to top student. He always had it in him just lacked the ability to stay focused long enough to show it. However, during the evening is when we started noticing the difference it made in our child. He doesn't eat, he whispers even when everyone else was being loud, he became very emotional, and he would sit with a coloring books and color for hours... or sit at the computer playing games, he never slept . This was very unlike our son... he was usually climbing walls like spiderman... running around... jumping... happy go lucky! He became very withdrawn. We took him off it.",0,42,19
"Methylphenidate","Alindsay330","January 20, 2013","-","<b>Daytrana (methylphenidate):</b>			 We had tried the patch when our son was 5 1/2 yrs old.  We have tried many stimulant medications which do not last the amount of time it states it should so we tried Daytrana.  This was not for us.  My son was out of control, increased aggression, impulsivity, and couldn't sit still to save his life.  My son does deal with other mental Health disorders such as SPD, ODD, ADHD, GAD, and a mood disorder.  We are currently on Focalin XR 15mg in the morning and 10Mg XR about 12pm.  Focalin has been the best we found but still I think causes his other diagnosis to shine through a bit more.",0,10,19
"Methylphenidate","A worried mom","January 16, 2013","Taken for 1 to 6 months","<b>Concerta (methylphenidate):</b>			 My daughter has A.D.D. so we tried Concerta. At first it was fine I thought there was hope for my daughter but after two months my daughter started to get angry and really bad mood swings Super emotional. She told me when shes at school she wanted to to scream and yell. She wanted to throw things. SHE didn't. MY daughter is very quiet and shy and keeps to her self, I am so happy I took her off of it.",0,36,19
"Methylphenidate","jg99999","January 9, 2013","-","<b>Concerta (methylphenidate):</b>			 I am 18 and I've been on Concerta for just over a year now, and I took an extra year of high school to catch up, I went from a 60 in math to a 90, I felt like I had a whole new brain. Like others, I was a funny, outgoing, active person but I now find myself completely content with being alone, infact I prefer it. I easily become irritated by spending time with others. I've also experienced uncontrollable mood swings, and I spend a lot of time crying. Lately, I've been losing focus though regardless and my dosage is already at 54mg. I'm so happy with my grades, and in the beginning I was myself, but in the past few months I've become a machine, and all I think about is how much work I need to do.",0,28,19
"Methylphenidate","Dennis22","January 8, 2013","-","<b>Concerta (methylphenidate):</b>			 On it for 5 months now, and all I have to say is WOW. I have battled nervousness, anxiety and a very, very low stress threshold for all my life (I'm 32 now). It all changed when I started taking Concerta. Started with 16 mg., and felt a lot more relaxed, but also started to develop a foggy kind of feeling in my head. After 2 weeks the dose was upped to 36, and the foggy feeling subsided a bit. Then on 54mg. 2 weeks later, it was like I could see things more clearly. My memory improved, I'm 'sharper', actually feel smarter. All of my anxiety, nervousness etc. is gone. cons: had a persistent fungal infection for a while (on my foot) allergic reaction (redness), &amp; slight tinnitus, but all in all very, very satisfied. A life saver for me!",0,44,19
"Methylphenidate","Crit","December 13, 2012","-","<b>Ritalin (methylphenidate):</b>			 I have been on Ritalin for 5 months now and it works great for my ADHD. I wish I would have been on it when I was in high school maybe I would have finished high school. I am 25 yrs old and I'm going for my G.E.D so I can go to College. I am so happy now I can concentrate and do things that I was never able to do. The only con is that it is not lasting as long as it did when I first got on it. I really believe Ritalin saved my life.",0,71,20
"Methylphenidate","Anonymous","December 6, 2012","Taken for less than 1 month","<b>Metadate CD (methylphenidate):</b>			 My 5 year old has been on this medication for about 2 weeks now we switched him from Adderall to this because Adderall had to many side effects but other than the side effects he did really well at first. So we switched to Medadate we had high hopes that we found the right medicine for him but we saw no response at all his behavior on the medicine was as if he was not on it. We moved his dose up to 20 yesterday I hope this will help or else we have to try something else.",0,19,20
"Methylphenidate","Anonymous","November 14, 2012","-","<b>Concerta (methylphenidate):</b>			 I have been taking Concerta for (ADHD) about 3 months now.  The effects have been both positive and negative.  I started off with 36 mg and my grades were increasing rapidly, and I was more focused, but I started to become more antisocial, angry, I didn't have an appetite, I had sleeping problems and depression.  Then about two weeks ago I switched to 54 mg due to lack of focus, and my stomach has been troubling me. I'm having twitching problems, and I am hearing voices.",0,22,20
"Methylphenidate","Anonymous","November 9, 2012","Taken for 1 to 6 months","<b>Ritalin (methylphenidate):</b>			 I'm 28 yrs old and just started taking this 2 months ago. I abused med's in my teens &amp; for the past 6 yrs have turned down prescriptions for fear of addiction &amp; losing my personality and control. I gave Ritalin a shot at 10mg 2/day, 5 day/week none on weekends. I wish my parents would have taken me to a doctor to get checked out about 20 years ago. In 2 months I have been able to focus and concentrate on things like never before. I went from being an average student and poor test taker to above average and testing well. I don't snap at people as much as I did prior to taking. And still feel in control of who I am. The down side is I had to cut back on my coffee consumption. Its a good cause!",0,64,20
"Methylphenidate","Sean P","October 29, 2012","Taken for 1 to 6 months","<b>Ritalin (methylphenidate):</b>			 I'm currently going through nursing school at a university near me and from the start of this past semester I had a real tough time staying focused and doing my homework. Went to see a nurse APR N and she gave me a script for Ritalin, 10mg 2x a day. This medicine has been a God send for me, I always complete my assignments on time and have been getting A's and B's on all my test. It lets me sit down and study for 6 hours at a time but if I hadn't taken the Ritalin I wouldn't have half the work done that needed to be done. Plus I've not had a single issue with it such as withdrawals or anxiety.",0,41,20
"Methylphenidate","Anonymous","October 5, 2012","-","<b>Daytrana (methylphenidate):</b>			 My son was diagnosed with ADHD. He was having problems at school such as focusing, following directions, sitting still.. etc. We decided to use the Daytrana patch since he isn't able to take pills. This so far is working wonders. He is on his first week and is already showing signs of improvement! I recommend this product.",0,38,20
"Methylphenidate","Anonymous","September 1, 2012","Taken for 6 months to 1 year","<b>Concerta (methylphenidate):</b>			 I am a college student and I have to say this is by far the best ADHD medication I have taken. I was taking Adderall XR prior and was having major anxiety attacks/mood swings and just never really adjusted to it, so my doctor switched me to Concerta. It has helped me tremendously, I am finding it so much easier to focus and complete tasks, I have gone from C's to the deans list over the last year. I feel no side effects, I take the extended release medication early in the morning so it lasts all day but does not interfere with my sleep patterns. I would recommend this medication, it has worked wonders for me!",0,42,20
"Methylphenidate","Numbhole","August 29, 2012","Taken for 1 to 6 months","<b>Concerta (methylphenidate):</b>			 My 10 year old Son got from Below Expected to Expected in Maths due to amazing Concerta. Although sometimes it makes him be a bit depressed and finds it hard to smile. But this has really improved his Grades. His Cousin also takes it and they all now are very good in school. Use Concerta! It actually works! Thanks Jassen-Cliag for this great Medication for my Son's ADHD.",0,17,20
"Methylphenidate","Anonymous","June 21, 2012","-","<b>Concerta (methylphenidate):</b>			 My 9 yr old son started taking Concerta 3 weeks ago after years of struggling with ADHD. We've done therapy (CBT), educational assistance, behavioral plans. His issue is related to impulsive reactions, emotional liability - rather than hyperactivity - while he had always been able to do his work well and finish tasks - he was often tantrumy, would lash out at peers if he didn't get his way or become so overwhelmed emotionally that he would not be able to process the situation rationally.  ALL of the behavioral issues have ceased.",0,38,20
"Methylphenidate","pittsburgh7","June 18, 2012","Taken for less than 1 month","<b>Ritalin-SR (methylphenidate):</b>			 Our son is 11 yrs old. He is ADHD/non-specific mood disorder. He has been on numerous medication. The last 2 years we have had him on only Abilify and Tenex. We decided at the end of the school year that we would remove all medicines and start fresh because we felt that the medicines were NOT working any longer and puberty was showing it's ugly face. We started Ritalin SR 3 weeks after he stopped getting other medicines. Within 24 hours he had a face tic, 36 hours he could not sit for long periods of time. 48 hours we knew he needed to be removed. We could barely understand him talking, he made us crazy because he could NOT stop moving. He did not feel it, he does not understand that the things he was doing was not normal for him.",0,14,20
"Methylphenidate","orange county","June 6, 2012","Taken for 1 to 6 months","<b>Concerta (methylphenidate):</b>			 I've tried several of the common ADD medications, and Concerta works the best for me. I was on it for two years a few years ago. When I am on this, I produce better work in school and in my job. When I am not on it, my mind has significant difficulty compartmentalizing information, storing it and accessing it when I need it. Often I wouldn't even hear what was being said. This creates major anxiety when I can't think clear enough to get more challenging tasks done. What Concerta also does is makes me hyper- focus on small things like constructing a simple email to send to one person - it'll take me 15 minutes to write the 30 second email because I'm overly focused on my every word.",0,20,20
"Methylphenidate","arhctr","May 29, 2012","Taken for less than 1 month","<b>Concerta (methylphenidate):</b>			 I am a nineteen year old woman taking Concerta for ADD. It really helps me. I can focus a lot better and I feel a lot more relaxed. My boyfriend and I went from fighting every single day to not fighting at all. It has absolutely worked wonders for me. The only side effects I have had is no appetite and I have lost six pounds in less than a week which I am not complaining about since I am five foot three and weighed 155 pounds beforehand. I have also experienced a terribly dry mouth but my doctor said it should go away when I start my second dose. Overall, I love it and I would recommend it to anyone!",0,23,20
"Methylphenidate","Anonymous","May 7, 2012","-","<b>Concerta (methylphenidate):</b>			 After the first day of taking Concerta I feel like: Oh , this is how normal people feel like. The medicine did not get me hyper but instead it made me feel a lot more alive. Exactly fit my expectation. Thank you.",0,43,20
"Methylphenidate","Anonymous","May 3, 2012","Taken for 10 years or more","<b>Concerta (methylphenidate):</b>			 I'm 18 and I've been on Concerta for years. All the bad side effects I have so I tried other medications but nothing worked, so I went back to Concerta. I love it. It makes me focus and not annoy people but it makes me have mood swings and go into phases where I'll just not talk, not eat, just watch movies all day (not depression).",0,23,20
"Methylphenidate","sty","May 2, 2012","Taken for 5 to 10 years","<b>Concerta (methylphenidate):</b>			 This is the only medication that has worked for me, with limited side effects. I love this and would highly recommend it if your insurance will cover it (though not all will).",0,16,20
"Methylphenidate","melzey","April 29, 2012","-","<b>Concerta (methylphenidate):</b>			 I been on this ADHD medication, but never was on it for more then 3 months. I am always switched due to the weight lose. When I first took it I was about 135lbs, after 2 months I was 98lbs. I lost over 35 pounds. This was in 2010. I stopped taking it because it wasn't helping me. Within those months my doctor kept putting me on different medicines, none worked. I started school with no medicines, I was on the high honor all, my mom wanted me to take it because I couldn't focus I was so HYPER. So my doctor put me on Concerta again. I have been on and off, but I have been consistent for 1-2 weeks. I have noticed my face is very itchy and blotchy and I want to hide and cry. Well I'm getting good grades but lost 10lbs in a week.",0,13,20
"Methylphenidate","Anonymous","April 3, 2012","-","<b>Daytrana (methylphenidate):</b>			 My husband and I didn't believe in ADD. My child's doctor said that he would only medicate if my child's grades were suffering.  We postponed medication until my son was in the 5th grade and grades started plummeting. He is not hyper or misbehaved but has difficulty focusing, completing tasks and becoming overwhelmed.  We tried other medicines, but Daytrana was for us.  No fuss to take medicines.  No sudden drop in mood. No depression.  The only drawback was itchy skin, but he overcame this and difficulty removing the backing, but overtime this becomes easier. I would recommend this. Do not give up on your child.  ADD is real!",0,89,20
"Methylphenidate","Bobjo","April 1, 2012","-","<b>Daytrana (methylphenidate):</b>			 My 18 year old daughter has been on Daytrana patches for more than 5 years.  She needs a 40 mg dose, and 30 mg is the strongest patch. Benefits are MANY.  Though 9 hours is the recommended time for wearing the patch, my daughter routinely wears them for 14 hours daily to get school work and homework done.  She wears them 16 or more hours if she has a date, or there is a school function that lasts late e.g. PROM.  This has allowed her to avoid those horrible impulse control issues most ADD kids experience.  Daytrana has allowed her to avoid the highs and lows that occur with other medications.  We love Daytrana.",0,68,20
"Methylphenidate","Relieved Mom","March 6, 2012","-","<b>Methylin ER (methylphenidate):</b>			 My son (9yrs old) has been taking this for about 3 weeks now for ADD. I was apprehensive about resorting to medicating him, but as his grades and progress were suffering, we felt we had to take the next step and try medication.  We have noticed a dramatic difference.  On the 2nd day his teachers sent me notes about how much he had already improved with focusing on his school work and having to spend much less time getting him to pay attention.  He is more focused and hasn't brought work home not completed in class since he started it. Only one dizzy spell on the 2nd day of treatment and a little trouble getting to sleep the first 3 nights, but now he seems adjusted to the meds and is doing quite well.",0,29,20
"Methylphenidate","Anonymous","March 4, 2012","-","<b>Concerta (methylphenidate):</b>			 My 7 year old was diagnosed with ADHD this past summer. My husband and I tried 6 months of alternative treatments (tutoring, organic foods, tonsillectomy for sleep apnea) but nothing was helping. Finally had a neurologist prescribe 27 mg of Concerta, and it is AMAZING. Her reading scores went from 50-60% to 95-100%. The same with math. She can tie her shoes for the first time and get dressed without an argument. I'm 38 and was also diagnosed (recommended by her Dr). Started the same dose and I have to admit, I feel calmer than ever, explains a lot about problems I've had in the past. It's worth a try....glad I finally gave it a chance.",0,37,20
"Methylphenidate","Anice.","March 3, 2012","-","<b>Concerta (methylphenidate):</b>			 I have been taking this medicine for over 6 years now. I was diagnosed with ADHD at the age of nine (now 24) and have taken numerous other ADHD meds. I feel out of all of them Concerta has been the most successful. I do however feel it makes me zone out and am quiet at times. Most think something is wrong with me but I feel it's the medication. I am typically chatty and friendly most times. It tends to happen when I'm one on one with people rather than a group setting.",0,22,20
"Methylphenidate","Anonymous","February 12, 2012","-","<b>Concerta (methylphenidate):</b>			 I have been taking Concerta 54mg for 10 years now. In early 2002, I was put on Adderall 10mg. The first day of the 10mg, I came home from school and said, I'm never taking this again. Twice I tried to pick a fight with my classmates. Concerta was like a miracle. I could focus on my work (instead of splitting my attention between my work and drawings or books or video games), and I didn't feel any major side effects. A couple years after starting it, the difference, minor at first, was remarkable between the days I would and would not take it. I've had increasing depression for the past 5 years, though, and I'm wondering if it's because of the Concerta...",0,18,20
"Methylphenidate","Yesdnilw","February 7, 2012","-","<b>Concerta (methylphenidate):</b>			 Some of these experiences are quite alarming! I never experienced the really harsh side effects such as depression, suicidal thoughts and any other bad side effects. I've been taking Concerta ever since I was 8. I was taken off of Concerta when I was 21 and I actually went down hill after that. I lost a lot of my friends and I can't control my thoughts, day dreams and mood swings and my performance at my job declined rapidly to the point where I almost lost it. I am 23 now and just got back on Concerta and am super happy with how it has organized my mind! .",0,46,20
"Methylphenidate","chrisizzle","January 27, 2012","-","<b>Concerta (methylphenidate):</b>			 I am taking 54mg for inattentive ADD its only been a month of taking Concerta without breaks, but I feel I have the general feeling down. I can focus with minimal distraction. After 3 weeks I am feeling the loss of appetite, lost 6lbs in one week and there is only a period of about 5 hours I can feel it work, during that time I love the motivation I get and am more social. All in all it does what it's supposed to but for only around 5-6 hours, after the working period I am easily aggravated and my ADD is worse than ever. My anxiety was high at first but after a month I feel like it is less of a problem for me.",0,20,20
"Methylphenidate","Anonymous","January 25, 2012","-","<b>Concerta (methylphenidate):</b>			 I am taking this medicine for ADD. Very positive, this medication has changed my life. I am much more productive. Only side effects are loss of appetite and increased anxiety.",0,18,20
"Methylphenidate","littlelimabean","January 22, 2012","-","<b>Ritalin (methylphenidate):</b>			 This medicine made me feel zombie like. I had hopes of focus and alertness and I know achieving the level of focus intended for the medicine does take a couple of weeks to take effect. But I do not think I can tolerate the restlessness feeling to achieve the intended effect. Just my opinion.",0,31,21
"Methylphenidate","LivesinIowa","January 20, 2012","-","<b>Concerta (methylphenidate):</b>			 I am 15 years old and was diagnosed with ADHD when I was 6. I feel Concerta is like a mental steroid. I focus 50% more and understand the things I'm taught better. Honestly, I really do not like Concerta. I have muscle twitches, nervousness, agitation, a complete lose of appetite, (which gets to the point where I almost pass out due to suppressed hunger pains) tiredness, mellowness, confusion, mood swings quite frequently, irritation of the eyes which is one of the things I absolutely hate, and more. I am not autistic but sometimes I feel like I am during school. My social life is completely impaired. When I take Concerta I am a very dull person. I am constantly paranoid, always worried about what others think of me.",0,39,21
"Methylphenidate","Anonymous","January 9, 2012","-","<b>Ritalin (methylphenidate):</b>			 Before Ritalin I was constantly snapping at my husband and I was never able to concentrate at work.  After taking it I have turned into a new person!  I am able to relax and for once feel calm.   My husband said that since I started taking it I haven't been as moody.  I am also able to complete my work projects in a timely manner.",0,45,21
"Methylphenidate","Anonymous","January 8, 2012","-","<b>Concerta (methylphenidate):</b>			 I'm 16, and have been taking Concerta for about a year now. It works well and really helps me focus, but I do have a lack of appetite and trouble sleeping. Neither of those are really bad though. My 2 biggest complaints are first that I feel less creative while I'm on it and second, when I don't take it now my concentration is horrible, and I get less done than before I started taking it.",0,13,21
"Methylphenidate","Anonymous","January 3, 2012","-","<b>Daytrana (methylphenidate):</b>			 My 5 year old son has severe ADHD and started on this patch 4 months ago. Although it really does what it says, it leaves him with severe rashes, and muscle tenderness. I am looking into alternatives now.",0,24,21
"Methylphenidate","gorgeousgab","December 22, 2011","-","After years of being treated for the secondary effects of ADHD (depression, anxiety), the primary disorder and everything else has disappeared. I am a better me. Able to concentrate, to carry a conversation, to complete responsibilities, to maintain relationships (control my tourettes, so to speak)...and I  have yet to lose my personality. I'm on the lowest amount (mg) possible to make a difference. Maybe that makes a difference in the blunting of the personality. I read a lot of complaints of it killing ones personality and I do not experience that at all. I have no side effects. No problem with sleep, or weight. Everything has been an improvement.",9,4,21
"Methylphenidate","Anonymous","December 16, 2011","-","<b>Ritalin (methylphenidate):</b>			 I am a 20 year old man, going to university and had or still have troubles concentrating with my ADHD, mostly staying on one subject. Started taking Dexedrine, first it made me restless and gave lots of anxiety. Could not hold up a normal conversation or sit still, it made me feel uncomfortable. Then tried Concerta it was effective somewhat but did not help as much as I had hoped, could not notice much of a effect. Ritalin gives me the concentration when I need it most.",0,23,21
"Methylphenidate","Finally focused","December 14, 2011","-","<b>Ritalin (methylphenidate):</b>			 I was 31 years old before I began taking Ritalin. I take a small dose, 10mg in the morning and 10mg early afternoon. I wish I had been prescribed this medicine years ago. I drive a truck for a living but I also do a lot of self study (audio and printed books) and Ritalin has greatly increased my productivity with the latter and safety with the former. I experience VERY few side effects. My mind used to wander quite often, I just thought I had an active imagination, but it was a problem. I have not lost my ability to imagine or abstract yet I have lost of tendency to wander aimlessly into unrelated thought. I have also lost my ability to get lost so often while driving!",0,43,21
"Methylphenidate","Anonymous","December 13, 2011","-","<b>Concerta (methylphenidate):</b>			 Yes, this medicine does work very well for paying attention. It also can be used when you need it and can stop and start use (you can just take it on schooldays even just important school days if you want). It's good that you don't have to ruin your weekend with the bad side effects. If you just take one like I have for five years you'll focus but by noon you'll be a zombie that hates the sound of people trying to make pointless conversation.",0,15,21
"Methylphenidate","Anonymous","December 9, 2011","-","<b>Concerta (methylphenidate):</b>			 I am a college student and found that for the first two months, Concerta worked wonders. It improved my mood, attention, and energy. It even helped with headaches. However, as I write this at 3 am, the side effect of sleep disruption has become unbearable. I either don't sleep for days or sleep for 20 hours a day for a week. Don't write it off, though. It is definitely effective and adjusting the dose may do the trick.",0,14,21
"Methylphenidate","Anonymous","December 7, 2011","-","<b>Concerta (methylphenidate):</b>			 I started to take Concerta in 2010. I see a difference about my school behavior. My teachers think that I have improved at school.",0,5,21
