"Drug","User","Date","Period","Review","Score","Likes","Page"
"Methylphenidate","Julie247","December 20, 2015","-","<b>Concerta (methylphenidate):</b>			 I am in grade 12 and I have been on concerta since grade 3. I have noticed I am underweight and I have trouble sleeping at night. But concerta has helped me focus in school, but I just wish it didn't come with some of the side effects.",0,23,13
"Methylphenidate","Anonymous","December 14, 2015","Taken for less than 1 month","<b>Concerta (methylphenidate):</b>			 I don't feel right,  I can't focus, I don't want to workout which I love to do, I don't want to drum which i love doing too. I felt great on biphentin despite the anger I tried concerta for a day and hated it",0,17,13
"Methylphenidate","Renightsa","December 14, 2015","Taken for 1 to 6 months","I've had ADD my whole life and just started take this year I'm 19.  Pros- You take it in about 30mins it kicks in Your heart starts pounding you feel a high and then you can focus on something for about 2-3 hour Cons- It makes you focus on one thing so if you want to do anything else you can't It gets rid of your hunger Give you horrible headaches Makes you mad at anything when it wears off  Makes you want to take more and more to feel that high again  I really don't recommend it.",2,7,13
"Methylphenidate","Anonymous","December 13, 2015","Taken for 1 to 6 months","<b>Quillivant XR (methylphenidate):</b>			 My son was prescribed this at the age of five. It work well on his ADHD, the bad thing about it was that it made his see things that weren't there. He would hallucinate very badly. So we had him taken off and was put on a new medicine.",0,20,13
"Methylphenidate","bror95","December 10, 2015","Taken for 5 to 10 years","<b>Ritalin LA (methylphenidate):</b>			 I have been using Ritalin for 5 years, at first it helped me in social situations. Now I use it to concentrate. The 40mg capsule with release holds for 7 hours, only downside is that I loose my appetite for those 7 hours. I went from being an almost dropout in elementary to a high achiever in high school. Now I am in university and ritalin definitely helped me.",0,14,13
"Methylphenidate","Anonymous","December 7, 2015","Taken for 10 years or more","<b>Concerta (methylphenidate):</b>			 The only reason I gave Concerta a 2 and not a 0, was because when I didn't take it for two days I could feel myself going through a withdrawal. I would begin to feel tired, annoyed and angered easily, some headaches, and so on. I have been on Concerta for about 13 years and even with it in my system I still struggled in school. At first they had me on smaller doses, but they had to be increased. I've been taking 108mg each morning and the only thing that I have noticed a difference in is the withdrawal I go through, which can be helped by drinking coffee. By the way, I'm currently on the drug right now and I'm supposed to be studying for my spanish exam that I have this afternoon. So if that doesn't tell you something then idk what will.",0,18,13
"Methylphenidate","DeeDoubt","November 25, 2015","-","<b>Ritalin (methylphenidate):</b>			 I've been on and off this medication for a few years now. I have mixed feelings towards it. The first 30 minutes to an hour of taking it , I feel a rush and a feeling of I can do anything. That rush motivates me to go to the gym actually. After the rush is gone I feel more focused and alert. After the alerteness has warn off I feel moody and irritable. I'm very aware it's the medication making me on edge and try to control it.  I get a bit headachy sometimes and it bothers my stomach from time to time. Always hungry? Not on this medication. Appetite gone, at least for a while until the next pill. Make sure to eat! I would say this medication is addictive and would not recommend it to anyone that has an addiction problem.",0,35,13
"Methylphenidate","Anonymous","November 21, 2015","-","<b>Concerta (methylphenidate):</b>			 Doctor started me on 27 took that for 3 weeks for severe ADHD and it lost its effect so I was put up to 54 mg and amazing changes I get work done fast and I am motivated only problem is Crash is pretty awful for me, I get really sick to the stomach and drowsy. For the sick stomach I just use ginger but drowsyness can't do anything",0,20,13
"Methylphenidate","db19","November 21, 2015","Taken for 1 to 2 years","<b>Ritalin LA (methylphenidate):</b>			 Was put on this drug roughly a year ago started at 20mg  it litterarally turned my life around It gave me great symptom relief all day with little to no side effects unfortunately after 6 months this medication slowly lost  it's effectiveness I am now on 80mg a day and only get roughly 2-3 hour symptom relief which is dissapointing but expected due to tolerance so I will be changing medication soon. But I have to say while it worked ritalin la was the best medication i have been on yet with very little side effects..",0,14,13
"Methylphenidate","Anonymous","November 19, 2015","Taken for less than 1 month","I love this medication so much! It helps me so much with my impulsive behavior! Don't listen to all of those reviews that say that it makes you have a new personality. It is very rare. If you use it you will be sure to thank me!",10,3,13
"Methylphenidate","Walker40","November 14, 2015","-","<b>Concerta (methylphenidate):</b>			 My daughter see and hear things that are not there.  She has been taking concerta 36mg for over a year.  But all of a sudden, she is so scared of everything.",0,31,13
"Methylphenidate","Thankful Mom","October 23, 2015","Taken for 5 to 10 years","<b>Daytrana (methylphenidate):</b>			 My daughter has ADHD and has tried every medication out there. Most did nothing but once we tried Daytrana Patches that was exactly what she needed.  Her grades improved as well as her concentration and her attitude. I am so thankful that we found the patch. She has used Daytrana for the last eight years. Even though she is 22 now, it is still a very important tool to help her focus in her last year of college. Organization, planning, study habits and everything else that goes out the window with ADHD is a new way of life and much more pleasant all the way around. Daytrana helps my daughter reach her potential and stay focused. She does have some redness from the patch but she would forget to take a pill everyday.",0,27,13
"Methylphenidate","Anonymous","October 22, 2015","-","<b>Concerta (methylphenidate):</b>			 ADD/ADHD has always been an issue, sure - grades sucked, concentration lacked, motivation gone. But, when the doctor prescribed Concerta, that all changed. I felt a change and saw my grades and concentration get better and better. The appetite loss was a minor issue. I've always been a big eater with a super fast metabolism. When I was told I was a few pounds overweight, I was happy. The solution to the problem is to force yourself to eat. It's not a bad sacrifice if you see a positive difference in your performance. I'm 65', 17 years old, and 210 pounds. I'm skinny, sure, but I'm willing to sacrifice quite a bit so I can do better in school. :)",0,47,13
"Methylphenidate","HomeBaking","October 9, 2015","Taken for 1 to 2 years","<b>Concerta (methylphenidate):</b>			 At the age of 10, my son's ADHD was needing medical help. He was put on Concerta18mg and was a little unwell for two weeks, with sick stomach, lack of appetite, and slightly listless. Made sure he ate breakfast before taking his tablet. He did look a little thin after about 1 year. We persevered with Concerta and life quickly improved until almost all ADHD problems had disappeared. Did not increase the initial drug dose. But after 18 months, he was becoming quiet and withdrawn. Decided to stop Concerta. Mild withdrawal symptoms for a week or so. We have never looked back. He is now 14, not on any medications and is a tall, healthy, teenager. Wow, recommend this tablet. He may need it again some day.",0,44,13
"Methylphenidate","Lily J","September 23, 2015","-","<b>Concerta (methylphenidate):</b>			 I first started taking Concerta about 2 years ago. I'm almost 13. It works okay but I have been losing my appetite far too much. I'm already really underweight and this drug makes it worse. I've also run into sleep paralysis once or twice.",0,26,13
"Methylphenidate","Dan the duck","September 22, 2015","-","<b>Concerta (methylphenidate):</b>			 I've been taking concerta for close to 15 years now since I was diagnosed at age 3. Around 8th grade I had started getting pain in my chest which was similar to costo condritis. The pain got increasingly worse up through highschool and the beginning of college around age 18 when it stopped affecting me as much. Now I'm 21 years old (as of the 12th this month) and for the past years I've been noticing that I've been getting increasingly anxious and worrying more than usual. In the past 5years on a daily 63 mg dose I've been dealing with depression, anxiety, nightmares, insomnia, loss of appetite, and I've lost 30lbs due to that. It's effective, but at a price, sometimes one you can't afford.",0,30,13
"Methylphenidate","Hesteroonie","September 21, 2015","Taken for 2 to 5 years","Through testing, I was determined to have Adult Attention Deficit Disorder (AADD). I had gotten to the point where I could not read, and reading has been the love of my life since age 6. I'm 70 now. I found it hard to get anything done, hard to remember what I was doing. It's hard to say how much of this was caused by five year abusive relationship, finally ended in Jan 2015. I am now reading like I used to: novels, studies for school, keeping on on world affairs, etc. What a gift! My psychiatrist wants me to continue Ritalin. Past history shows I snowballed into depression without it. I do take her advice, but it makes me so hyper! I have to take xanax to calm down. Taking one drug that requires taking another is not a good thing in my book, but what can I do?",5,5,13
"Methylphenidate","InfiniteBravery","September 16, 2015","Taken for 1 to 6 months","<b>Ritalin (methylphenidate):</b>			 Taking 20mg of Ritalin three times per day for my ADHD symptoms was less effective than taking regular caffeine.",0,20,14
"Methylphenidate","Anonymous","September 15, 2015","-","<b>Concerta (methylphenidate):</b>			 I was diagnosed with ADD about ten years ago. I was prescribed Concerta by my doctor and it wasn't an easy transition. I got tons of work done and all, but it killed my apetite during lunch hours and as a result I lost weight. As time went on I got more used to the medication and I've since regained my weight (for the most part, I've still got a high metabolism and as a result gaining any kind of weight is difficult for me) and can still focus on my schoolwork. Part of this can be attributed to getting older and all, but I think the medication has certainly helped. For reference, I'm a 6 ft tall guy who weighs around 125 lbs.",0,25,14
"Methylphenidate","AMA76","September 14, 2015","-","<b>Daytrana (methylphenidate):</b>			 My son has has great results with this patch. He is 7, and on the 10 mg. He definitely has loss of appetite during the day, and it's hard to get him to sleep at a reasonable time, but he has had a complete turnaround at school. Since I know all ADHD meds have the same side effects I stated, my only real complaint is how it irritates his skin. He has taken it off several times due to itchiness (which does seem to go away after a couple hours). As for getting the backing off, I warm it between my palms for a minute or two, and peel from the pointed part of the backing. Works perfectly.",0,20,14
"Methylphenidate","Ford73","September 13, 2015","Taken for 2 to 5 years","<b>Concerta (methylphenidate):</b>			 Well it started in 2014 when I was diagnosed with adhd.... And I could not focus for more than 5 minutes before doing something else and this has helped me greatly focus and calm me down.  We also own a farm and I drive a skid steer loader and drive a tractor, also doing fieldwork takes a good deal of focus and now I can easily do 5 hours of bale loading and not get distracted which is a lifesaver. One downside is that I lose my appetite but not a big deal to me.",0,29,14
"Methylphenidate","BrinFish613","September 8, 2015","-","<b>Concerta (methylphenidate):</b>			 I was diagnosed with ADHD a little less than a year ago at the age of 12. At first, I loved it because it helped me get so much work done and I stopped getting in trouble and annoying people. After about one month I started realizing that I wasn't eating because the medicine was destroying my appetite, and I liked it. I started using the drug more for weight loss than anything and I went from a happy, bubbly 115 lbs to a lifeless 95 lbs. at 5ft8in, that's severely underweight and unhealthy. I kept taking the medicine but I became increasingly more depressed and anxious. I was an outcast but I was too obsessed with losing weight to care. After the school year finished, I took a break from the medicine and I am now a happy, healthy 13yr old.",0,31,14
"Methylphenidate","Oaktree1987","September 8, 2015","-","<b>Daytrana (methylphenidate):</b>			 Im actually an adult on the patch. I am 28. female. I've been trying to find the right stimulant with bearable side effects since I was in high school. Please excuse the lengthy review I just know the search can be tough and long. I have Depression, ADD, GA &amp; SA, and OCD skin(cuticle) picking tendencies. It's been very hard finding a stimulant that didn't worsen my anxiety related symptoms. I could tolerate 5mg adderrall XR but my body burned through both the XR and IR in about 3 hours. Then I would crash for the rest of the day (depressed, irritable, anxious).  Vyvanse gave me zero motivation and made me calm but in a weird way. For example, I didn't care or worry about anything... I didn't even want to talk to people. I would just want to sit there alone and stare at a wall or something. It was nice to be that relax but too weird. But the real problem was the crash! It was the most extreme of all the stimulants I've tried by far! I took it only twice and threw it out. I almost didn't try Daytrana patch because Ritalin was actually the first stimulant I tried, which was over 10 years ago and I remember similar symptoms to that I had on adderrall. I ended up giving it a try with the logic that it might be smoother since its was for children and I was also desperate since I'm working and study for the GRE. I'm so happy I gave Daytrana a shot!! I'm telling you if you suffer from anxiety, can't tolerate the crashes, and metabolize the other stimulant too fast you have got to try this one!! I've only been on it for a week but I can't believe it! I leave it in for the whole 9 hours and I never crash. In comparison to Adderall is still the best stimulant for getting you motivated, I have to motivate myself a little but unlike adderall I can stay focused ALL day with Daytrana. Im also less likely to do something stimulanty like start reorganizing my closet for no reason but I do get the necessary cleaning, errands, bills etc done effortlessly. And the best part is that it doubles as an anti-depressant since, what I assume is the increased dopamine stays in my system pretty much all day and night. The happiness doesn't feel like a high it feels more like an absence of depression. I don't have anymore of the repetitive negative thoughts. The constant emotions of hopelessness, guilt, embarrassment, you name it, just aren't there anymore. There is still a mild degree of sadness I carry with me but I have major depression so I feel like it's only normal and I can handle that :)!! As far as the negative side effects: Like all the stimulants I've been on I still have the insomnia, loss of appetite, and increase urge to pick at my cuticles at night when it's wearing off. But there is not a crash. no evenings being completely drained of energy, fits of irritation, major anxiety or depression.  Also, the patch is applied to your hip and I'm experiencing some muscle tension in my legs which I think might be slowly subsiding. Im drinking a lot of water and taking vitamins in precaution of cramps.  Advice on taking the patch off- It's easier for me to take it off when it's wet. I do it in the shower/bath or rub it off with a warm wash cloth.  Good luck!",0,98,14
"Methylphenidate","Pressley","August 28, 2015","Taken for 5 to 10 years","<b>Concerta (methylphenidate):</b>			 I've been taking Concerta for nearly five years now and just recently it hasn't been working as well as it used to. I was diagnosed with ADD in 6th grade and was then prescribed this medication. I've been taking it ever since. But back in May, I started to notice that I was having a much harder time focusing. It was almost like I hadn't taken it at all. This was very unfortunate since at that time I was having my end of year exams. I've also seen that others have been having the same problem. I'm looking forward to having this sorted out because my ADD is very bad and makes it very hard just to function in everyday life.",0,23,14
"Methylphenidate","Laurn","August 21, 2015","-","<b>Concerta (methylphenidate):</b>			 I first started with 27 mg or concerta when it was giving me no effect my doctor increased to 54 mg. At first I loved it. So great...motivation, energy, concentration etc. But then I realized how bad my anxiety was getting and that my prozac was no longer controlling my anxiety and depression. Concerta caused me to have very severe migraines which cause nausea and dizziness. I would have a migraine in the morning and the only thing that would take it away was the concerta and as soon as it wore off around 5-6pm there came the migraine again!  &amp; I obviously couldn't take the concerta or I'd be up all night. I am not switched to vyvanse but haven't tried it yet. If concerta did not cause migraines and anxiety then I would really recommend it.",0,19,14
"Methylphenidate","Loonchild","August 17, 2015","Taken for 1 to 6 months","<b>Concerta (methylphenidate):</b>			 34 years old diagnosed back in Oct 14 started meds at 18mg fine 1st day then no real benefit after that  I hoped the increase would help did for a while. Now on 54mg and I'm not in a great place and emotionally feel low  and feel desperate. My relationship has broken down I'm hoping tomorrow I can change meds",0,12,14
"Methylphenidate","crayolatips","August 12, 2015","Taken for 1 to 2 years","<b>Concerta (methylphenidate):</b>			 i started taking this medicine at age 10 for about 1 year. i took it and it made me feel really like as if i was depressed and it made me feel no hunger.i never ate until the medicine would where out by the end of the day that shen i would start binging on foods at night time. the medicine was useless. and btw i still have adhd and it doesnt affect anyone or myself.",0,14,14
"Methylphenidate","Sumomof3","August 11, 2015","-","<b>Quillivant XR (methylphenidate):</b>			 This has been the best medication for my 10-yr old son, both in how it works and the fact that it's a liquid. He has severe ADHD. He can't swallow pills and the patch gave him a rash. He had tried a few capsule meds opened up &amp; the extended release bead mixed in pudding. As soon as this came out, we switched him to Quillivant and he's had great success in managing his ADHD during the day. He starts having trouble at school around 1pm, so it does wear off somewhat, but overall we have been impressed with this medication. I will second the other reviewer's comment that you should get the Copay card from your prescriber that is given to them by the manufacturer so it only costs $20/month. You can get a new one each calendar year.",0,15,14
"Methylphenidate","Jonahs Mom","August 11, 2015","-","<b>Metadate CD (methylphenidate):</b>			 My son has been on this medication for 4 years. He's now on 40 MG and it has been a Godsend! He went from Ds and Fs to As and Bs.  It wears off after school but as long as he makes it through school that's all that matters to me!!! I would recommend this medication to any parent. It truly has helped our son and brings out the best in him!",0,78,14
"Methylphenidate","Shshs","August 4, 2015","Taken for less than 1 month","<b>Concerta (methylphenidate):</b>			 Love this. I was first prescribed 27 mg and seen no changes but with the 54 it is perfect. I am able to focus and do things and not get irritated with background noise.",0,24,14
"Methylphenidate","PeterAnthony54","July 18, 2015","Taken for 10 years or more","<b>Concerta (methylphenidate):</b>			 I was initially diagnosed with ADHD-combined hyperactive and implulsive when I was 16. Up until that point, I struggled with my attention issues and excessive energy and it became increasingly difficult to cope with the symptoms as I got older. My doctor prescribed me Concerta 54 Mg once a day. I immediately noticed significant improvements. I was able to think more clearly and communicate coherently. At the same time I noticed that I had a better ability to control my attention and remain focused over a more prolonged period of time. My grades improved and my relationship with friends and family became much better. I'm now 26 and still taking the medication. The therapeutic effects are still evident.",0,59,14
"Methylphenidate","arhlpn","July 17, 2015","Taken for 2 to 5 years","<b>Concerta (methylphenidate):</b>			 I absolutely love this medication for my ADHD and as a mood stabilizer. It works wonders with little to no side effects. Coming down from it in the evenings is another story .. My coming down period sucks as I just get consumed with rage.",0,32,14
"Methylphenidate","Eddie024","July 11, 2015","-","<b>Ritalin (methylphenidate):</b>			 Helped me a lot. Been using it for 8 months and now I'm on a 20 mg 2 times a day. I never had the power to just sit still and stay on one task. Now I'm able to actually sit down and focus on one task. I'm 16 and was diagnosed at 15. Ritalin doesn't last long enough though which is the only down side. Only lasts for 3 hours but it's good because you could get your appetite back. No side effects just a little nervous at times and head aches which are rare. Also suppressed appetite the first hour you take it.",0,25,14
"Methylphenidate","RebelRebel","July 7, 2015","-","<b>Concerta (methylphenidate):</b>			 I'm 50. I was in school before ADD and ADHD were a thing. Those of us that couldn't pay attention or behave got C's and D's, and we liked it that way. I'm kidding, we didn't like it that way and neither did our parents. I muddled through high school and even got a college degree, but I really struggled. I remember when I first heard of ADD and meds that treat it, and it was a revelation. I've tried many of these medications and Concerta is my favorite. To me, it's the smoothest.  The short acting drugs hit too strongly and then quickly crash. Hard. I had been taking Metidate CD until an insurance change made Concerta cheaper. Concerta is smoother than Metidate.",0,38,14
"Methylphenidate","Sharbear7487","June 23, 2015","-","<b>Concerta (methylphenidate):</b>			 I was first diagnosed with ADD when I was 6 years old, I'm almost 28 now,and have been on Ritilan and Adderall for most of my life. I went off medication a few times in my life and although I was functional, I found myself spacing out a lot, and unable to focus. Recently I had been under so much stress that I was experiencing more frequent zoning out especially at work. So I talked to my doctor about it, and he originally prescribed Strattera but my insurance company wouldn't cover it so he put me on 20 mg dose once a day. This is only my second day on it, but overall I've had little negative side effects. Just a minor loss of appetite and some dry mouth. I am definitely feeling a lot more focused and can still sleep. So far so good.",0,24,14
"Methylphenidate","law1234567890","June 16, 2015","Taken for 2 to 5 years","<b>Ritalin (methylphenidate):</b>			 Ritalin has changed my life for the better. Family and friends could see how happy I was. I was able to finish what I started instead of 20 progject. A fill in Dr said he would not prescribed me my Ritalin because I was 61years old that I was too old. My regular dr is out of town. I am withdrawing and very tired and depressed and I want to die or I will if. These thoughts of after life will be painless live alone and no one will find me for days",0,29,14
"Methylphenidate","Cornelis","June 10, 2015","-","<b>Concerta (methylphenidate):</b>			 Ok this is where i am after two weeks. I'm turning 54 one of these days, Managing Director of my company and self diagnosed with ADHD about a month ago. I matched ALL the criteria. Went to see a doctor and he confirmed my suspicions. I relayed my struggles with studies at University and he referred to me attaining two degrees a 'miracle, I cannot begin to explain how difficult studying was not to mention having to sit through hours of lectures. There was no - and I stress - NO filter between my brain.mind and my mouth. Anger,profanity and impulse behavior was only curbed by my life-long ability to be able to fall asleep anywhere, anytime. Imagine an alien being in charge for 53 years. It's all gone. Why did no one help me with this before?",0,76,14
