"Drug","User","Date","Period","Review","Score","Likes","Page"
"Mydayis","Dee","July 16, 2018","Taken for less than 1 month","I’ve been on Mydayis 37.5mg for a week after taking two and a half 20 mg Adderall for four years. I feel slightly more focused for a few hours longer than my first dose of 20 mg Adderall but much, much more tired. I find myself looking for sugar or caffeine to keep focused at work after five or six hours. I don’t know if the dose is too low or it’s just not for me. Hopefully, at my next appointment after trying it for 30 days; my PCP will have some answers or suggestions! I don’t want to gain weight!!",5,8,2
"Mydayis","John","July 7, 2018","Taken for 6 months to 1 year","This is my first time going on anything. At 45 I have finally admitted I have an issue focusing. I am the person with a million ideas that starts everything and never finishes anything. My therapist prescribed my mydayis 50 mg. Started 25 then upped to 50. It immediately changed my life. I am so focused and get so much done. Not just at work but around the house. I can work until 10 and go to sleep or work until 3am if I choose. It’s been wonderful for the 6 months I’ve been on it. I have never tried anything else but last time I visited my therapist a few days ago she asked me if it made me moody and irritable and I said no it puts me in a good mood and works all day. She said she was going to switch from adderal to mydayis lol. I hope everyone finds the right combination or dosage because this has completely changed my life and my marriage and my respect from peers at the office.",10,19,2
"Mydayis","Bongo","July 6, 2018","-","Worst side effects ever. I switched to mydayis 37.5mgs once a day after several years of taking Adderall XR 30mgs twice a day. The first week I felt disoriented and every time I went to bed all my muscles felt VERY sore, especially my legs. It felt like I had run 20 miles and every time I moved the soreness woke me up. Then, one night when trying to fall asleep I heard voices, it was the sound of many people talking, like if I was at a very crowded restaurant. After that, I stopped taking this medication for my own safety.  I’ve never had side effects with adderall other than feeling some anxiety when I forget to eat.",2,13,2
"Mydayis","Marcia","July 3, 2018","Taken for less than 1 month","I like Mydayis! I've tried Vyvanse and Straterra and those didn't do much in the area of focusing but the Mydayis is like the perfect drug. It is released three times a day which is a release after taking it, during mid day, and afternoon and you basically stay focused all day. ADHD medicine is an individual thing because Mydayis works for me but someone else might not like it. Like people rave about Vyvanse but it didn't do much for me. Mydayis is basically adderall but it's released different and you don't have to take an instant release capsule after the extend release wears off. With  Mydayis you take one pill and you set for the rest of the day",10,10,2
"Mydayis","AngryLogic","June 25, 2018","Taken for 6 months to 1 year","To all the people saying this is rubbish and to use adderall XR instead, this IS adderall XR. It's literally made by the same company and contains the same ingredients. It's just a triple layer release whereas adderall XR is double layer. If you do not feel the effects of mydayis but do feel adderall XR, it's because of your own negative expectations and placebo. That's is all.",10,42,2
"Mydayis","spemat","May 28, 2018","-","It worked for like 2-3 hours more than a 6 hour Adderall XR dose but I am a Dexedrine Spansule and Zenzedi guy.    Vyvanse and Desoxyn didn‘t calm me at all.  And I liked Daytrana oddly but Ritalin is less effective.   The doses are off.  I figured it would range from 7.5 mg to 90 mg dosing.",3,2,2
"Mydayis","Frass","May 21, 2018","Taken for 6 months to 1 year","Mydayis causes me to have way to much anxiety, only reason I take it is due to the long half life.",3,7,2
"Mydayis","Mac","May 16, 2018","Taken for less than 1 month","I was on Adderall XR 20mg for years! I was told to try Mydayis 25mg and 3 hours after I took it my heart rate was at 150. It was weird because it dipped fast between 150 all the way down to 50 with in seconds! It was awful! My anxiety is still super high by the experience I’ve had today!",1,10,2
"Mydayis","Geez","May 16, 2018","-","Taking 37.5mg for a few months. Previously on 70mg  Vyvanse + afternoon boost  Good: Slows down my racing thoughts Focused for a few hours  Low appetite- def can lose a few :) Not Good: (v=same as Vyvanse) I think my eyesight is affected - v Dizziness periodically - v Increased BP - v Nail biting  Jaw clenching - v Sweating  This med is going to be like all the others out there.  Good for some people and not good for others.  With any med if the side affects overshadow the benefits then it isn’t for you. Mydayis works like Vyvanse but initially didn’t need the boost. When I take it at 6am, I have to get right up and move around or I’ll go into a deep sleep and wake up 1-2 hrs late for everything!  I still can’t figure out if caffeine helps or hinders it. I’m going to give it a few more months to see if I need to increase or go back to Vyvanse + boost.  All of these meds should be accessible. No one should have to change just because of cost  IMO",8,15,2
"Mydayis","Heather164","May 10, 2018","Taken for 1 to 6 months","I’ve been using this for 30 days, and really find it to be more effective than anything I’ve previously tried. It took a few days to get used to the idea that I have to drink a ton of water. I was getting really bad headaches for the first week, towards the end of the day. Once I started making sure my water intake was sufficient, the headaches went away. I think this triple time release is perfect for someone who has a long day, but would hesitate to give it to a teen, or someone who requires more sleep and rest. It is essential that you take it upon waking if you want to get to sleep on time at night.",9,17,2
"Mydayis","Diagnosed at 36","May 6, 2018","Taken for less than 1 month","It's helping with talking too much, binge eating, organization, memory, motivation, prioritizing tasks, memory, breaking hyper-focus, listening, conveying thoughts, studying, homeschooling my preschooler, staying awake ALL day, sleeping ALL night, and my organization is creating more structure for my kids-I have everything ready before they wake so we're not fighting before school. The best part is I'm feeling more energy so I'm walking the dog, actually wanting to play with my kids outside, and my libido came back! lol Unfortunately it didn't take away my anxiety and irritability as much as Vyvanse did. Only side effects I've noticed: I need to up my fiber intake and I have dry mouth (water bottle in purse, gum, and a floride mouth wash to keep my teeth healthy - these things seem to work great.) The first 2 days at night I felt so cold, it took me awhile to fall asleep, and I couldn't stop scratching my scalp- so weird! Other than that it's working great!",8,17,2
"Mydayis","Mjd331","May 4, 2018","Taken for 1 to 6 months","I went from taking Adderall XR 20mg twice a day + Adderall IR 20mg once a day, to Mydayis 50mg. This hasn’t been effective at all.  Not motivated.  Not focused.  I rather just have Adderall XR plus my IR booster rather than the  convenience  of taking 1 capsule a day.  Waste of my time.",1,8,3
"Mydayis","MADJake","May 3, 2018","Taken for less than 1 month","Switched from vyvanse. Insurance wouldn't cover and $300+ a month was unsustainable.  $3 was much nicer, but with the side effects I'm having it's not worth it. I was under the impression that this was the same/similar to vyvanse with a different release method, but I'm not feeling more productive at all, if anything less. What really sucks is a low constant headache and random body/joint aches. After reading other reviews I'll be requesting to swap to something else.  Ty other person with same reactions, it made me feel better that it wasn't just me.",1,10,3
"Mydayis","Shannon","April 21, 2018","Taken for 1 to 6 months","Starting taking Mydayis after Vyvance got to be really expensive. For the first month I was on a 37.5 mg. It didn’t seem to help my focus and worse yet by 7PM I was ridiculously irritable. Dr decided to increase my dose to 50 mg during month 2. The first few days I felt pretty good. But by 5 days in I felt awful again. This time I felt like a zombie, had zero focus and still felt mad at the world. This stuff is awful. I would never recommend taking this stuff. Time to go back to vyvance.",3,7,3
"Mydayis","MudBug","April 20, 2018","Taken for less than 1 month","This caused me to have major shortness of breath and nausea. Much prefer Vyvanse.",2,6,3
"Mydayis","Escahm","April 7, 2018","Taken for less than 1 month","Started Mydayis 37.5mg on Wednesday + it's now Saturday. I feel nothing, no change whatsoever.",1,3,3
"Mydayis","CaylaM98","April 7, 2018","Taken for 1 to 6 months","I am a nursing student and a pharmacy technician so I see all the new drugs that hit the market like when this one did. I am up long hours since I have classes in the mornings until the afternoon, then I go to work for at least 7 hours per day after that. I have always had issues with school and ADHD. I finally decided to try medications when I was a freshman in college. I thought this medication would be perfect since it lasts so long. I hated having to take Adderall so many times a day and I would forget to take them all the time. Once I spoke to my psychiatrist and started the Mydayis I was sweating on my face so much and I had some heart palpitations which triggered my asthma constantly. I didn't even feel a big difference in my focus. I was already on the highest strength so there was nowhere else to go. We decided to go with Vyvanse and it's working great. I felt more awake on the medication, but not focused. I still felt squirrely and anxious.",3,5,3
"Mydayis","Anonymous","April 6, 2018","-","I was on 70mg Vyvanse for several years, but was constantly complaining that it stopped working by 2pm every day. So when Mydayis came out, my doctor suggested I try it. It DOES last longer, but that also means constantly being on from the time you take your pill to the time you fall asleep. This led to a non-stop feeling of being overwhelmed and worsened anxiety. I was stuck in a state of exhaustion but never able to rest. I started at 32.5mg and didn't feel it was helping me concentrate, so I went up to 50mg and still didn't feel like I was concentrating well.  The worst issue I had is a much higher diastolic blood pressure - I'm talking after 4 months on Mydayis, I was 15 points higher than before I started it. Additionally, I started grinding my teeth and clenching my jaw leading my dentist to comment on some chipping of my teeth from grinding. I'm switching back to Vyvanse. Mydayis is not worth it - be careful what you wish for, I guess!",3,8,3
"Mydayis","Pukydoo","March 31, 2018","-","Quite possibly the worst medication available. To everyone whose lives it changed, try adderall or adderall xr. It will change it even better. I'm 32 and have been on 50mg of adderall xr for many years. Before that vyvnse but found I was picking at my skin. adderall xr was cutting out early in the day and my dr said try mydayis. (She also wrote me a script for adderall, probably bc she knew mydayis sucks). First day. 4 hours after taking mydayis 50 not working.  10 hours, still nothing.I had wasted my day being not productive.  Whoever thought 4 hours before a medication might help you with ADHD was nuts.  Or just shire trying to get a new med out there bc adderall is generic. The end of my day was when I had a complete breakdown over dinner. Sobbed for hours and felt so depressed.  I tapered down my adderall to 25 mg and figured I'd give mydayis 50 another try. Nope. By 3pm complete sobfest and a in really dark place.  Yeah mydayis is $3 a fill with their marketing pack...not worth it.",1,12,3
"Mydayis","chanchan126","March 26, 2018","-","I'm eighteen years old and was taking Concerta (54mgs). I decided to try this (50mgs) and wow. First night, absolutely no sleep tossing and turning constantly. Second night I was able to get in about 5 hours even though I took the medication at 6am and tried to go to sleep at 12am. Third day was actually good, very focused and felt decent. But that night all hell broke loose. Tossing and turning again, and started thinking I did things that I really didn't do. Needless to say not a fun time.",3,5,3
"Mydayis","Anonymous","March 21, 2018","Taken for 1 to 6 months","Whats throwing me off is seeing  many experiences saying they couldn’t feel Mydayis working for 4+ hours. it starts off with a small instant release so I do feel mine working right away. Side effects are different for everyone, but for comparison purposes: Adderrall XR 30 mg worked 6-7 hours, then sleepiness &amp; a hard coming down/depressed feeling, loss of appetite, calming effect - helped rationalize my emotions effectively. Mydayis: 12 hrs, still feel working within first 30-60 mins like adderrall, my appetite came BACK with this, no coming down feeling, but the overall effectiveness of helping with focusing sometimes isn’t as much. I’ve thought about increasing but I’d like to see about therapy for self management or at least a low dose. The doc also said if this dose doesn’t work as well that we’d switch to Vyvanse, which is one I haven’t tried so I’m afraid to switch. Overall this one has worked best for me, but I am looking at healthier avenues in the near future.",8,12,3
"Mydayis","Anonymous","March 20, 2018","Taken for less than 1 month","It's helped, but these side effects are a bit much. Whenever I take it, I often feel depressed. I'm not entirely sure if that's the best way to describe it, but I end up kinda hating myself and not wanting to do anything because I'm a piece of rubbish. This is a common side effect, but I've also been having vision problems and they've only been happening after I started taking the medication. It could just be a coincidence, but this new farsightedness is definitely out of the ordinary. My parents also needed glasses, but I'm pretty sure neither of them were specifically farsighted.",6,8,3
"Mydayis","AZ1106","March 19, 2018","Taken for less than 1 month","Switched to this because Vyvanse 70mg was wearing off too soon (I take my meds around 6am and it would wear off by 1-2pm). It's been about 2 weeks now and I'm depressed, grouchy, and accomplish nothing in the morning until about 10am when I am almost overly focused. I feel moody, more overwhelmed than normal, and it does not have the calming effect on me like Vyvanse did. I'm going back to Vyvanse for sure and going to ask about an afternoon pill to get me through those last couple of hours of work.",2,14,3
"Mydayis","Dee","March 16, 2018","Taken for less than 1 month","Highly disappointed. Didn't control or help ADHD symptoms. Went back to Adderral XR30",3,5,3
"Mydayis","Hilly26","March 15, 2018","-","Hey all- I can relate. I'm 27 and have been on adderall since I’ve been 13. I've tried Ritalin, focalin, adderall (obviously), vyvance, Ritalin .. and now I’m on mydayis being prescribed 50 mg with 20 mg IR to be divided in half taking each one separately. Mydayis kicks in literally 3 hours later, therefore, I need to take the half of 20mg IR first thing when I get up. Truthfully, vyvnance has been the most helpful to me.. I’m just always open to try something that could help me the best.",8,5,3
"Mydayis","Grace M.","March 11, 2018","-","I was prescribed Adderall IR 10mg 2x daily last summer but the dips between dosages were awful. My doctor prescribed Mydayis 12.5 mg to see if the XR would help even out the lows.  Mydayis took several hours to kick in. I had to wake up 2 hours earlier than normal just to be productive by an acceptable time. The overall productivity effects were minimal. I became horribly irritable. I could not be in the same room as others and noise made me fighty. (I typically have a very quiet, sweet disposition) I slept far more than average and noticed significant gaps in my memory. I was very nauseous and I began violently vomiting after each pill. Overall, it was an awful experience. I am back on Adderall IR and realize, as a college student, XR is not best for me. I need to be in control the effective period. IR gives me flexibility that Mydayis and pills like it can't provide.",2,6,3
"Mydayis","marcus","March 9, 2018","-","The first day, I was so ill it was inconceivable. Plain and simple. The second: gave me such an intense deep sleep it was still hard to grasp. Yes, I took the RIGHT prescribed pill. Obviously, way too many PERSONAL variables to go slamming a new med, (some people report very positive reactions) but after MY experience I really question the mad scientists behind  this stuff. Stick to the basic Adderall.",1,6,3
"Mydayis","Anne","March 4, 2018","Taken for 1 to 6 months","This makes me very nauseous if I don’t eat enough food when I take it. It seems to me like it takes longer to start working, compared to adderall. It does not seem as effective as adderall in my opinion but I guess it lasts longer throughout the day. I am currently using a Rx coupon so I pay $15/month. Dosage 37.5mg.  Compared to adderall (which I was on for years), Mydayis causes less of a lack of appetite and less of that  pounding heart  feeling. I also feel that I am able to sleep better on this. The lowest dose did nothing at all for me besides nausea. 37.5 mg is better but I would probably be fine increasing to 50mg",5,5,3
"Mydayis","Amber","February 27, 2018","Taken for 1 to 6 months","I have been on Mydayis for a few months now. It has changed my life. Initially, I was on 25mg, but I have Bipolar Disorder as well, so it made me manic when I would take it. I am now on the 12.5 mg and I am finally productive at college and it's even helped some of my anxiety. All other ADD/ADHD medicine before this has always made my anxiety worse and the side effects outweighed the benefits, but I am so glad my doctor put me on this. Without it, my brain fog is intense and I cannot function normally.",9,11,3
"Mydayis","Dale19","February 17, 2018","-","Over the last 5 years I’ve tried Adderall XR, adderall In tablet form, vyvanse and Ritalin in just about every dosage and I think Mydayis is the most effective of them all.   Both Adderall XR and vyvanse would wear off early and I would need multiple adderall tablet pick me ups to get through the day, and even took more than prescribed which would leave me out of medicine early.  Mydayis 50 mg in the morning gets me through the entire day, no additional afternoon pick me ups needed.  It doesn’t make me feel like my heart is beating out of my chest as adderall did but still works very clean and effectively.   I don’t quite understand all the other negative reviews, and would recommend.",0,11,3
"Mydayis","C5011","February 13, 2018","-","Pretty bad.  In fact, this is the worst ADHD med I have taken since Ritalin.  It lasts longer?  Well it takes like 3 hrs for it to kick in, and when it does, the effect isn't that strong.  That same effect lasts for about 6-8 hrs,  then it drops hard.  Side effects are hilarious.  I get the shakes, tingles, drowsiness (even right after I take it), itchiness, inability to sleep.  That sounds like a crack head.  Pros are that my appetite has been decent, I'm more social.  Its almost like I didn't even take anything. Take vyvanse if you want to focus.   Its smoother and stronger. This is a dirty drug for me.",2,8,3
"Mydayis","Tan the man","February 11, 2018","-","Switched to this from Vyvanse. Totally regret it. Now it does stay in the system longer, but it does not hit as hard. I want help focusing and this barely does any aid for that.  The downsides are overwhelming. My heart is beating faster than it ever has. I need to take sleep aids at night. This stuff is nasty.  I'm calling to change back tomorrow for sure.",2,10,3
"Mydayis","Smack Talker","February 10, 2018","Taken for less than 1 month","You need to go off the drug for awhile like me. If you have been taking continuous for more than 3 months, you will have to increase dosage to follow tolerance. A safer method is to go off for a month, on for 2 months. Another is to only take it when you absolutely need it. Don't just take it because it's there. How in the hell do they feel right prescribing 60mg?",6,2,3
"Mydayis","Startup Girl","January 21, 2018","Taken for less than 1 month","Previously I was on 25mg of adderall XR and 20mg of adderall IR since I would lose coverage so quickly. Mydayis takes longer to kick in but lasts me waaaaaasy longer (10 hours instead of 6). I started my own company so focus is super important for me. I’m currently on day 3 of 50mg of Mydayis and feel less speedy than when I had to take extra diesel of adderall IR. I have noticed a slight increase in my depression but hoping it will pass it a couple weeks as others have said. I also just switched from Prozac to Zoloft so that could be part of it too.",8,8,3
"Mydayis","mind wandering","January 20, 2018","Taken for less than 1 month","I just starting taking Mydayis. I, as well, am having problems with it  (as I did with Adderall)  taking too long to kick in. 4-5 hours. Felt totally scatter brained until the med would kick in. Decided to take it at bedtime. WOW! I was able to get up right away and get my day going, getting to work and able to focus better. The thing with Adderall is that it didn't last long enough. So I was switched to Mydayis  but think I need to take it at bedtime as well. With it suppose to be longer acting (14-16 hours), I'm hoping I can sleep good, get up in the AM, focus and get going without the fatigue and not able to focus AND have it will last all day at work. Worth a try.",3,5,3
"Mydayis","Bee movie best movie","January 19, 2018","Taken for 1 to 6 months","I switched from adderall XR 20mg (3 Years) to Mydais 25mg (1 month), but felt no positive or negative effects (like taking nothing), so upped the dose to 37.5mg (~2 weeks). I’ve personally never had worse side effects from any drug. Most bothersome were strong headaches with sensitivity to light, dizziness, unusual motion sickness/nausea, achey muscles, restlessness, racing heart/palpitations, and fatigue and irritability.... plus other common adderall-ish side effects. But, yeah, takes a few hours to take effect, and not covered by insurance ($100+/30-day supply), so will not continue.  Hope this helps. Best of luck to you.",1,10,3
"Mydayis","DRPETEHALL","January 16, 2018","Taken for 1 to 6 months","I've been diagnosed with ADD for several years as an adult. I tried every med in the books without sufficient relief without significant side effects. I am currently on month 2 of Mydayis at the lowest dose, 25mg. I think I need to go up a dose, which I will discuss with my physician. However, even at the lowest dose I am experiencing relief without side effects. I am very grateful for this product - no highs, no lows, no crashes, and I can sleep at night. Best of all, there is currently a coupon that makes this drug affordable although it is not currently covered by my insurance.",0,6,4
"Mydayis","Texas NP","January 8, 2018","-","Mydayis is a long acting medication, class: amphetamine, with 3 doses combined to be released about every 4 hours. Thank God for the Chemists' who intricately designed the pharmacokinetics and pharmacodynamics in relation to Mydayis! I've had ADHD for 37 years and suffered many hardships due to the scrutiny of taking medication for my ADHD. I'm able to focus on one task at a time and am not distracted! I wake up at 6am: take Mydayis 37.5 mg. It kicks in by 0800. At 1pm, the 2nd dose is released and definitely can feel the effects without any crashes. 3rd dose is released by about 5pm steadily. I now have the ability to stay on task without any crashes. I fall asleep easily, the best aspect!",8,10,4
"Mydayis","Booboo555","January 6, 2018","Taken for 1 to 6 months","Mydayis has been a game changer for me. I was on 60mg of Adderoll XR for years, and I’d lose focus in the mid afternoon so I’d take another one. At the end of the month, I’d run short, get irritable, and sleep until I got my script filled again. Vicious cycle.  Mydayis 50 mg keeps me level and on a smooth, even keel all day. I usually take it a few hours before waking up since it does take awhile to kick in. After a week of taking 37.5mg , I did experience some depression but it passed.  I’m very grateful that I started Mydayis. My quality of life has improved greatly.",9,12,4
"Mydayis","JulieAnne5555","January 4, 2018","Taken for 1 to 6 months","I started on  Mydayis 37.5mg  12/09/2017.  Previously, I took Adderoll X-R 60mg daily. Adderoll was working fine except the big drawback was I’d crash and have no focus after three o’clock in the afternoon. This would lead me into a vicious cycle of wanting another Adderoll just to be productive. At the end of the month, I’d run short of my Adderoll and go  in a tank .  This infuriated my husband because he didn’t understand what I was going through. Since I was tired of this cycle month after month (my FNP would not increase my dose) , I did some research and found out about Mydayis. I am taking 50mg now and it’s been a game changer. No more crashes! I did feel depressed the 2nd week but it passed. I’m really happy I found this medication.",9,13,4
