"Drug","User","Date","Period","Review","Score","Likes","Page"
"Aripiprazole","Sunguppy","March 27, 2018","Taken for 6 months to 1 year","<b>Abilify (aripiprazole):</b>			 I was on abilify for a diagnosis of mixed bipolar disorder and generalized anxiety disorder  following a hospitalization. I was on it for about a year . I found it helpful, and easily tolerated at first - it helped reduce hallucinations and paranoia while improving my fluctuating mood. However, even at its highest dose, it wasn’t strong enough or potent enough for me I suppose - it just didn’t match up. I continued to have some paranoia and whenever I was more upset than usual, I’d have breakthrough hallucinations. What made the docs take me off of it was the oral twitching I developed and bizarre tongue movements, which are signs of tardive dyskinesia, a rare side effect. Newer antipsychotics have less instances of this condition, but it’s still possible. Anyway, I was taken off of it and placed on another antipsychotic. Still have tongue movements though... An overall okay drug, it works for a lot of people, but not everyone!",0,7,4
"Aripiprazole","jimbojim","February 17, 2018","-","Taken for one month now at 2mg. In morning along with my venlafaxine 50mg morning, 25 mg venlafaxine, around 8pm and I take  50 mg seroquel at bedtime. My conditions are Bipolar 2, anxiety, and severe depression. 54 year old male. I'm finally feeling stable and happy. Hope things keep working well, last year was the worst of my life. Hope you all find a doctor that eases you up on your medications so you can adjust and not be overwhelmed with all the side effects.",8,2,4
"Aripiprazole","lil eskimo","January 31, 2018","Taken for 1 to 6 months","<b>Abilify (aripiprazole):</b>			 I have been on abilify since Sept 2017. I haven't gained weight, no side effects so far and no anxiety. This drugs helps me to focus and concentrate. It also keeps my moods stable. I take this with lithium 1200mg and seroquel 100mg for sleep. Hopefully it keeps on working.",0,11,4
"Aripiprazole","Jengar","January 31, 2018","-","<b>Abilify (aripiprazole):</b>			 I've suffered from Bipolar 2 and GAD and ADD for 15 yrs now. I take Lamictal, Effexor XR, Abilify and Adderall.  Not until I started Abilify 3 weeks ago have I had any improvement with energy levels and depression. I have treatment resistant depression and my anxiety causes me to not be able to work and I barely want to leave the house. But since starting Abilify, I feel almost fantastic. I wake up early ready to start my day. And I've never been a morning person. I'm more positive about my life and I am even thinking about getting a job. I haven't worked in 6 years. But I do have problems staying asleep . I mean, its 3:06am and I am wide awake writing this. So yeah, restless sleep. And the sexual side effects aren't good. Total lack of interest which is difficult when you're in a relationship. But I'm not willing to stop this medication.The good far outweighs the bad in so so many ways. Good luck to all and give this med a try",0,16,4
"Aripiprazole","sammymaguire","January 19, 2018","Taken for 6 months to 1 year","<b>Abilify Maintena (aripiprazole):</b>			 This is my story. 20 years ago I developed clinical depression possibly bipolar. That was bad enough but the change in brain chemistry plunged me into immediate/overnight alcoholism.  Nothing worked for 20 years. This drug cured my alcoholism. I am a normal drinker now.  I have no idea why this drug cured my alcoholism but it did.",0,9,4
"Aripiprazole","Youdontknowmebut","January 18, 2018","-","<b>Abilify (aripiprazole):</b>			 One day and done. I've never experienced side effects like this before. I took it before bed and then was up every few hours, restless, mind racing. Finally I shot up at 4am and NEEDED to shower. While in there my head was so heavy, I couldn't stand any more. I had to rest my head. Then I got so nauseated I started to dry heave. Now I'm heavy headed, blurry, dizzy, restless, &amp; afraid to stand up or drive. I will never take this drug again.",0,15,4
"Aripiprazole","vinnyofvinny","January 8, 2018","-","<b>Abilify Maintena (aripiprazole):</b>			 It's not for me 6 weeks on and cannot wait till it's out my system. Makes me feel  like I can't  stay in one place too long. It has ruined my sleep and has made me unsocial. I am not saying it's a bad drug just not for me......",0,10,4
"Aripiprazole","Tzwashere","December 30, 2017","Taken for less than 1 month","<b>Abilify (aripiprazole):</b>			 I took it once which made a horrible experience for myself. I woke up from a nap and I had double vision, nausea, vomiting and fainted because of Abilify.",0,8,4
"Aripiprazole","Boaneldhaoel","December 2, 2017","-","<b>Abilify (aripiprazole):</b>			 I'm not sure what mental issues I have exactly, they've told me this and that over the past 15 years. I got people talking going on and seeing them. I also have anger outbursts and take things out on myself, but doesn't happen when I hear and see the people. So anyway, I tried Risperdal before from my doc and it helped me to be able to read and understand what I read, but with Abilify it's not as good, although Risperdal made me have gynecomastia big time, and Abilify doesn't cause as much prolactin. I think it's a decent medication, but the voices and seeing people are still strong and break through the veil, even the mask of the medication, so I'm not cured. But it's better than nothing I guess. But one day I may go off of it.",0,4,4
"Aripiprazole","Josh1447","November 27, 2017","Taken for 1 to 2 years","<b>Abilify (aripiprazole):</b>			 This drug has been a lifesaver to me. It's helped provide me with mood stability with an antidepressant effect, whereas lithium only controlled the mania part of my mood. I use this in combination with other drugs  and so far there hasn't been any side effects. I tried decreasing the dosage, and within 2 days I noticed a difference in my mood. I would definitely recommend this drug. This has made a difference in my mood, the way I think, and my overall perspective. This improved my motivation to get work done, since I wouldn't be just sitting around reminiscing in a negative thought loop. It gives me mental freedom and allows me to escape brain fog that has imprisoned my thoughts. Seriously, don't be afraid to try this drug",0,25,4
"Aripiprazole","Bipolardance","October 23, 2017","Taken for less than 1 month","<b>Abilify (aripiprazole):</b>			 Was put on Abilify to control hypomania. I'm very, very sensitive to pretty much every medication. Initial I had a stomach ache that only lasted one night and some tiredness the first two days. However... After this I had severe hypomania and restlessness that just didn't go away. It wasn't akasteisia though. Unfortunately I can't reach the mood stabilizing effect - being at least 10 mg - since I can't go any higher than 1.25 mg without having side effects such as emotional numbness, numbness of my face, twitching, increased eye blinking - which of course scares me since there is a risk of Tardive Dyskinesia. It's definitely a very powerfull drug. BUT it really did help my depression and anxiety, just didn't help control my hypomania. LOL",0,9,4
"Aripiprazole","DDPKS","October 20, 2017","-","<b>Abilify (aripiprazole):</b>			 The medication, at first, did was it was supposed to do. I was a shut in with some paranoia thrown in and hadn't left my house in over a year, except to go to doctors appointments and get groceries in the house. At first I found the medication got me out and about and got me back into the real world. I signed up for college, got in contact with friends I hadn't talked with in ages, and started living again. For that, this drug was fine. Then the side effects started kicking in. Keep in mind I was on 2mg of this drug and even then the side effects were bad enough to knock me OUT of college and suffer something called Depersonalization through Disassociation. One of the scariest experiences I think I've ever had. I don't recommend it.",0,15,4
"Aripiprazole","OWER","September 30, 2017","Taken for 1 to 6 months","<b>Abilify (aripiprazole):</b>			 This medication was the worst experience of my life and I've been through a lot of rubbish. I experienced insomnia depression anxiety and pesudo ME on abilify. I was on it for 3 months and I spent my time feeling lobotomised and wanting to give up on life. It took me 3 months to fully get back to my old self. Going between depressed and manic. I found a medication that works for me with out professional help afterwards.",0,10,4
"Aripiprazole","Anonymous","September 30, 2017","Taken for 1 to 2 years","<b>Abilify (aripiprazole):</b>			 When I first starting taking abilify, I was about 14 and a half and 130 pounds, and it worked great. My mood was great, side effects were minimal. However, over the course of about a year I have gained almost 60 pounds, and that was while playing two varsity sports and a club sport that whole time, so I was active majority of that time. When I came off it recently, I lost about 10 pounds over two weeks, but I was much worse than I was before I went on it, (which I find weird), so I was put back on. It is impossible to get the weight to go away.",0,8,4
"Aripiprazole","Anouniemous","September 19, 2017","Taken for less than 1 month","<b>Abilify (aripiprazole):</b>			 I got extreme manic symptom after I used Abilify for one month. I feel very anxious and scared about everything. I have an illusion energy which leads me push up double times more than no medication usage, but I feel very weak and extreme anxiety in the next few days. It increases my distance between up and down emotion very far away, but the distance between up and down emotion should be neutral. After I withdraw all of them carefully with herbal sleeping pills for alternative, my distant emotion becomes shorter which changes to be neutral condition. When my emotion and mood become neutral, my excessive emotional reaction no longer appear anymore.",0,5,4
"Aripiprazole","TJLEONG","August 30, 2017","Taken for 1 to 6 months","<b>Abilify (aripiprazole):</b>			 I was given this medicine by a regular medical doctor in tandem with Prozac and Ambien.  What a horrible combo!!!!  After being on Abilify for several weeks every nerve ending in my body felt like they were on fire.  I was hyper and couldn't stay seated.  I found out that this medicine was burning my brain and causing Akathisia.   I called my doctor and told him what was going on and he wanted to double the milligram.  I said....ohhhhhhhh no your not!!!!!  Because of this medicine combo things got so bad I tried suicide back in February of 2015.  I took 13 sleeping pills. The hospital doctor in the psych ward said the combination I was on was wrong and he was surprised I wasn't in the hospital earlier !!!",0,10,4
"Aripiprazole","asklady75","August 17, 2017","Taken for 1 to 6 months","<b>Abilify (aripiprazole):</b>			 I give Abilify the highest rating. I'm a 42 year old female with PTSD, Bipolar Depression, ADHD. I have tried every anti-depressant out there, from Amoxapine to Zyprexa, in which I experienced some extremely negative side effects from.  So, needless to say, I am rather reluctant when having to start taking a medication that I've never tried before.  (I've been taking 60mg of Prozac (fluoxetine) daily for the past several years). As of late, I've been experiencing increased symptoms in my bipolar depression.  My doctor prescribed Abilify 5mg about 2 months ago.  I have noticed such a positive change in myself. After only about 5-7 days of taking Abilify did I start to notice a change in my mood, attitude, outlook on life. It's been great!",0,16,5
"Aripiprazole","Michael Shmakyl","August 4, 2017","-","<b>Abilify (aripiprazole):</b>			 It's just silence in my head, its hard to think. I don't have schizophrenia. I just can't really think clearly. All night I stayed up dizzy and nauseous but I'm gonna continue the medicine in hopes that it loosens up and keeps me mellow headed. After the initial nausea I felt pretty chill.  (If it gets better I will keep you guys updated.)",0,7,5
"Aripiprazole","bipolarbunny","August 2, 2017","Taken for less than 1 month","<b>Abilify (aripiprazole):</b>			 I had a bad time with this drug. It worked on my mood, but whenever I stood up, I got dizzy. I fell down the stairs once. Plus even with insurance, it's really expensive.",0,6,5
"Aripiprazole","Patient2","July 11, 2017","-","<b>Abilify (aripiprazole):</b>			 I like this medication, but it causes my prolactin levels to go up. Which in turn cause my breast to leak milky fluid. Dr said he thinks it is from Invega injection. I just cannot take this side effect",0,4,5
"Aripiprazole","charge It Up","June 26, 2017","Taken for less than 1 month","<b>Abilify (aripiprazole):</b>			 I have been on this for three days. The first day was horrific and I was definitively going to quit. I felt more trapped and traumatized by the 'problem things' I am dealing with than ever. The weird thing is I  liked my psychiatrist but I felt the drug was killing me. I was horrified by some of the things I am dealing with but now three days later I feel it is starting to balance things out and put me in a humored mood from my 'problems' rather than a traumatized one. I swore off of all psychiatric pills for the past fourteen years, but decided to give it another shot. In the big picture, I think it is the right decision, but it is making me worrisomely hungry.",0,7,5
"Aripiprazole","Anonymous","June 26, 2017","-","<b>Abilify (aripiprazole):</b>			 I didn't notice a big difference on Ablify. I feel more level headed but also I feel more indecisive, dizzy and restlessness. I was on 10 mg for 3 months and the restlessness was so bad I couldn't sit still.",0,11,5
"Aripiprazole","Anonymous","June 19, 2017","-","<b>Abilify (aripiprazole):</b>			 I've been prescribed ability and loxapac for a manic episode on May 19th for slightly more than three weeks. It worked well but early June I started to feel unable to sit  still at some places. Around June 10th I had terrible anxiety and panic attacks, it was pure torture, so back to the institution. Had to wait two days until a doctor showed up , gave me something that stopped it all and removed the two drugs. It might be loxapac. Fact is, since then, there is another torture. Akathisia in the form of wanting to walk all the time. It's been one week now and thanks god it stops at night. I want to live (I'm not even 20)  I pray it stops fast  l've suffered enough. I really hate Abilify or Loxapac",0,2,5
"Aripiprazole","Abilify ruined my life","June 15, 2017","-","<b>Abilify (aripiprazole):</b>			 Started taking Abilify in August of 2016. The day after I wanted to drink. I'm a recovering alcoholic, called my physciatrist and she switched seroquel to Thorazine. And I got over the next couple of days. I just received an inheritance somehow I ended up with 191 Groupons, online shopping I couldn't have controlled so much in an amnesia state. Wouldn't have known this was happening. Went to Dr and hospitals 8 or 9 times with different things of Abilify! I had an suicide attempt in March. I stayed awake for 4 days afterwards. I've wrecked my car 4 times. I have TD and Akatasia now. I've never had a drug complicate me as much!   I was also severely anorexic.",0,3,5
"Aripiprazole","TWG74","June 9, 2017","Taken for 6 months to 1 year","I'm a 42 year old female with bipolar II.  I took this in combination with Paxil for about six months.  I started off at a low dose and gradually increased to 20 mg.  I put on 20+ pounds in the months since the last increase, but I know the Paxil was causing weight gain so I'm not sure that's Abilify's fault.  Also I started smoking and craving sweets all the time.  It was like I was never full!  I will admit in the beginning the Abilify made me hypomanic.  That finally settled down (took about two months) and now I'm functioning normally.  My psychiatrist and I switched me from Paxil to Wellbutrin XL and I'm starting to lose weight and I quit smoking.  All in all it was a rough start with Abilify, but now I'm glad I'm on it.",7,2,5
"Aripiprazole","Qel","May 24, 2017","Taken for less than 1 month","Had to go off this drug, because it gave me severe neck pain along with headaches and nausea. I was on 10 mg",1,0,5
"Aripiprazole","Cptnken","May 15, 2017","-","<b>Abilify (aripiprazole):</b>			 I have bipolar II, cycle up in spring and major depressive in the fall. I have tried lamictal, great drug but got the rash, geodon, ok but felt like I was drunk, latuda, got the jaw pain whitch was awful. Ability seems to help with the overwhelming agitation I get in the spring time. I hope it is as good in the fall for my depression phase.",0,10,5
"Aripiprazole","wer3","May 14, 2017","Taken for less than 1 month","Cannot tolerate restlessness",1,0,5
"Aripiprazole","Anonymous","May 12, 2017","Taken for 1 to 6 months","<b>Abilify (aripiprazole):</b>			 I've been on abilify for almost a month the only side effect I have is waking up in the middle of the night a few times I have actually lost 12 pounds I am eating good and drinking plenty of water so I'm sure that helps I'm also on Zoloft and topamax all in all it's a much better drug than my previous geodon I would recommend it",0,12,5
"Aripiprazole","ksaskowski","May 3, 2017","Taken for 1 to 6 months","I began taking this after I was diagnosed with bipolar 2 ultra rapid cycling. I started at 2 mg and went up to 10mg gradually over the course of two months, but with no change whatsoever. If anything, my mood was even less stable while taking it. In addition to its ineffectiveness, it kept me from sleeping in its entirety. it might work for others, but it did nothing for me.",1,0,5
"Aripiprazole","Charlotte9459","April 28, 2017","Taken for 1 to 6 months","<b>Abilify (aripiprazole):</b>			 After taking anti-psychotic medications for 9 years and trying just about every single one of  them, I have finally found one that is working for me, at this point in my life. I started this medication  (Abilify) nearly 4 months ago and the positive changes I’ve seen in my life make me so happy. I have  lost almost 30 pounds within these last several months, I have been more active with my children, and I  actually get off the couch and walk and enjoy life. I’ve been involved with my  FitBit  challenges which I  would’ve never attempted to even think about doing before. My manic episodes are very rare and less  erratic. Before when I would be on a anti-psychotic  medication I would feel like I was in a  zombie mode  barely functioning day by day. The only downfall I have with this medication (Abilify), which is a side effect, is if I get up to  quickly I get dizzy and just collapse. Now I’m at a plateau with my weight, but I’m not gaining weight  either. I give this Anti-Psychotic Medication a 9 out of 10.",0,32,5
"Aripiprazole","Blueszz","April 17, 2017","Taken for 1 to 2 years","<b>Abilify (aripiprazole):</b>			 Excellent. Depression lifted fast. Stabilizes my mood very well, as a bonus I spontaneously los 55 lbs! All that weight came from Seroquel and Zyprexa. Con, has a negative effect on sleep, I need melatonin to be able to sleep. Also my blood pressure is suddenly a lot lower, 102/63 causing some light headedness during the day. It's however the first med that is able to stabilize my mood very well with very acceptable side effects.",0,24,5
"Aripiprazole","Noekster","April 4, 2017","Taken for 1 to 6 months","<b>Abilify (aripiprazole):</b>			 I'm not an easy patient, unsatisfied with the weight gain from the typical atypicals, lacking an 'oomph' from lithium, allergic to lamotrgine and anti-depressants give me a one way ticket to the manic rollercoaster.  I started Abilify and within 3 days I was hypermanic and nauseous to boot. No sleep, spending $400 on some bed sheets seemed like a marvellous idea, thrill seeking etc and throwing up every 3 hours.  However my psychiatrist guided me through it with sleep meds and something to settle the stomach and I'm so glad I pushed through.  Yeah, the restlessness is an issue but I'd like to consider myself an 'experience and going out' person now. Anything better than the listlessness of depression or meds that are supposed to cure it.",0,18,5
"Aripiprazole","veee","March 27, 2017","-","<b>Abilify (aripiprazole):</b>			 I have rapid-cycling bipolar and have been on Abilify for a little over 7-8 months. At first, I was on the Abilify by its self and I experienced worsened anxiety and depression. I was thinking about switching drugs after a few weeks of these negative feelings not going away, so my Pdoc added Zoloft to my mix. This combination was a life saver for me. I would definitely recommend using Abilify as an add-on. My mania is manifested as rage, impulsiveness, and rapid negative thoughts in my head and Abilify stopped that for me. The only negative side effect I have now is weight gain. I've only gained 8 pounds, but I have to ignore my food cravings.",0,13,5
"Aripiprazole","Lpapa","March 26, 2017","-","<b>Abilify (aripiprazole):</b>			 I took this med for 2 weeks.   Within 3 days I was in full thrown into full a total manic state.  I was awake every night by 3am because I couldn't sleep.  I spent quite a significant amount of money in a short amount of time!  I also put 4 pounds on in this time.  The only positive thing I can say is that it gave me energy.  The reason my pdoc tried me on it was depression and lack of energy.  I also have bipolar and have been on Lithium for 3 years and have been steady until I took Abilify. Needless to say I have stopped taking this med.",0,7,5
"Aripiprazole","Angel 23","March 24, 2017","-","<b>Abilify (aripiprazole):</b>			 I have been on abilify for 6 weeks now and am still experiencing anxiety, agitation, constipation. I also feel sedated although I feel like I can't sit still.",0,14,5
"Aripiprazole","Merry Xmas","March 23, 2017","Taken for 1 to 6 months","<b>Abilify (aripiprazole):</b>			 I started Abilify because my bipolar disorder drug cocktail became less effective. Abilify was new on the market. It lifted my mood considerably, I felt great. And without any bad side effects. I thought.  After about 6 weeks I developed hand tremor. It got worse. My psychopharmacologist sent me to a neurologist who began treating me for a kind of tremor that's inherited. He did not believe it was due to Abilify- which now has a side effect listed as muscle movements that could become permanent. Naturally I stopped taking Abilify. So either the neurologist is right, and Abilify activated the tremor or I developed the permanent muscle movement side effect. Either way, I now have to take an anti-tremor drug.",0,10,5
"Aripiprazole","Crackedpot","March 2, 2017","Taken for less than 1 month","I started taking abilify generic about a month ago. I didn't realize how depressed physically and mentally I was. I have more mental and physical  to do things. I take 30 mgs along with 800 tegreol, 300 Wellbutrin, 60 cymbalta. I'm still having mild mood swings but most of my depression and hypo mania is gone. No side effects. Hope I can take this for a long time. Good luck to you all.",10,2,5
"Aripiprazole","Mlf77","February 12, 2017","-","Abilify works great for me to stablilize my  mood . I take it to stable my moods and for anger issues. It has been a life saver. It mellows me out and helps me manage my anger/irritability. When I first started taking it, it made me sleepy and I didn't feel like doing anything. After a couple of weeks, that passed and I had more energy and motivation to get things done.",10,4,5
"Aripiprazole","Manic now","January 13, 2017","-","<b>Abilify (aripiprazole):</b>			 Total Mania, could not sleep, monitored sleep showed never in REM sleep at all over an 8 hour period.  Anxious, increased Resp Rate, wide awake, no hunger, racking thoughts.   Unable to finally function at job related to no sleep.  This drug is horrid!",0,13,5
"Aripiprazole","28","January 7, 2017","-","This drug I was given trying to reduce tremors which my medical team they believe it is due to Lithium taken for 30 years.  I have been taking Aripirazole 2 mg for 17 days.  The tremors have not really reduced ... but the positive effects are more energy, feeling more upbeat, sleeping same.  Some of this I think is I had to reduce the Lithium so it may be an offset .  I am monitoring the Manic side of my disorder though ... I want to be careful.  I am easily distracted, get headaches, lightheaded, off balance, blurred vision at night, heartburn, body pain, constipation.  I am going to stay on this med at least until I see my Therapist on the 17th unless I have more side effects which then I would find out how to wean off.",4,0,5
"Aripiprazole","Anonymous","December 26, 2016","Taken for less than 1 month","Only able to tolerate abilify for about 10 days. Although almost immediate improvement in my mood, motivation, etc, the side effects were more than I could bear. After about 4 days I started developing internalized restlesness (akathsia). It became unbearable. I had to stop. Has anyone experienced this akathsia with Abilify and been able to break through these  side effects?? The mental benefits were quite amazing",0,6,6
"Aripiprazole","Edward Hanley","December 23, 2016","-","<b>Abilify (aripiprazole):</b>			 Diabetes, thoughts of self-destruction , compulsive behavior,no energy, etc",0,12,6
