"Drug","User","Date","Period","Review","Score","Likes","Page"
"Aripiprazole","Zoowie","September 19, 2015","-","<b>Abilify (aripiprazole):</b>			 My doc put me on Abilify 15mg after extreme weight gain on Seroquel.  I have never been affected by a medication like Abilify.  My first tablet made me very very ill.  I was constantly vomiting, I was weak and felt like my body was burning up from inside. I was sweating profusely and I was weak.  I contacted my doctor and was immediately taken off Abilify.  It works for some and for others not. It definitely did not work for me.  I have now been put onto Lamictin 25mg so tomorrow I take my first tablet.",0,9,7
"Aripiprazole","Waguespack","August 27, 2015","Taken for 2 to 5 years","<b>Abilify (aripiprazole):</b>			 I think it works really good for an add on. And its a cute little pink pill.",0,8,7
"Aripiprazole","lintu","August 25, 2015","Taken for 1 to 6 months","<b>Abilify (aripiprazole):</b>			 I am on 30 mg of Abilify plus Trazodone and Wellbutrin and have to say this combination seems to be what works best for me. I don't feel drugged up but able to function day to day at work and with my family. I experience no side effects with Abilify except possibly some hair loss (but it looks like most if not all those type of drugs do that). Other than that I am grateful this helps.",0,19,8
"Aripiprazole","Caley69","August 20, 2015","Taken for less than 1 month","<b>Abilify (aripiprazole):</b>			 I started abilify recently and it makes me restless like my mind is awake but my body is asleep but for the bipolar I feel so much better and like a new person. Besides the restlessness I love this pill.",0,15,8
"Aripiprazole","Woahthere","August 14, 2015","Taken for less than 1 month","<b>Abilify (aripiprazole):</b>			 After having to pay a but load out of pocket for this i slowly found out it was not for me. It put me in a hyper-manic state. Had to constantly be moving. Would wake up every morning at 7 am, when the sunlight started peaking in my room, regardless of what time I was finally able to pass out. And worst of all, it caused me to have problems using the restroom. No matter how hard I tried or what I did it made me not able to urinate. Some meds don't work on some people as they should.",0,10,8
"Aripiprazole","Anonymous","August 6, 2015","Taken for less than 1 month","<b>Abilify (aripiprazole):</b>			 I have noticed since I have been on this medication I have become more happy and able to deal with my depression that I was suffering for a few days. I have noticed differences in my sleep pattern. I go back to bed earlier and I wake up early which can be a problem for me at times because I need lots of energy during the day to keep me going because I will get tired and depressed. My mood starts to slip after 3:00 which can be annoying.",0,17,8
"Aripiprazole","Miaaaaa","July 29, 2015","-","<b>Abilify (aripiprazole):</b>			 I'm a 22 year old female, recently diagnosed with bipolar, I took this medication for a month and it was pure hell, made me an emotional wreck (never was emotional) crying out of nowhere, made my anxiety even worse, made me extremely tired, made me paranoid to the point where I thought I was going to die. Over all I have no positive notes to tell. Didn't work for me but hey everyone is different.",0,13,8
"Aripiprazole","Anonymous","July 27, 2015","Taken for 5 to 10 years","<b>Abilify (aripiprazole):</b>			 I am on a much higher dose than most others here, 10 mg. I do have bipolar illness, perhaps that is why my cocktail also includes 400 mg lamictal and 25 mcg cytomel. I am stable after eight years with this combo. I still have manic episodes, but much more manageable, thank god! What is also nice is that the abilify is available as a generic drug. Beforehand it was $80/ month, even with excellent insurance. Worth a try!",0,9,8
"Aripiprazole","Pakbesar","July 18, 2015","Taken for 1 to 6 months","<b>Abilify (aripiprazole):</b>			 I've been 4 months on this drug and it wiped out my depression. It started to work after 1 week of usage. I gained 14 Kgs and a little bit manic (but supressed by depakote). I love this abilify it saved my life",0,21,8
"Aripiprazole","Amazing Finally SO HAPPY","July 16, 2015","-","<b>Abilify (aripiprazole):</b>			 I was VERY hesitant on taking this medication, and like most of you reading these reviews, I too was scared of what it might or might not do. All I can say, in 3 days (2mg dose) there was a huge difference in my attitude, calmness and overall presence in me and my thoughts.  Amazing!!!!  I have so much energy and love doing things again.  It has been one week, and for those of you who are affraid to gain weight; you must know, I am losing weight.  It has actually decreased my apitite, however that might be because I am cautious of it and find other ways to curb cravings.   One side effect I am having is NOT sleeping, although we are going through a bit of a heat wave and even air conditioning is not helping.  Good Luck!",0,32,8
"Aripiprazole","ser8508","May 28, 2015","Taken for 1 to 6 months","<b>Abilify (aripiprazole):</b>			 I took Abilify for a month and it was not for me. It first made me happy, but it made me too happy! I became manic again and couldn't settle myself down. I would be up at 2 am working out or cleaning. Also, the side effects were awful! My hands never stopped shaking and people began to think I had a drinking problem due to the way they were shaking. It also made me gain 5 lbs within a week. Not a fan.",0,19,8
"Aripiprazole","tmoscoe","May 23, 2015","Taken for less than 1 month","<b>Abilify (aripiprazole):</b>			 Within 1 hr of taking - starting shaking uncontrollably, threw up and couldn't sleep",0,14,8
"Aripiprazole","ChrisGH","May 19, 2015","-","<b>Abilify (aripiprazole):</b>			 Since Abilify was added to my bipolar cocktail, I have had only minor manic episodes.  I have been on it now for 4-5 years.  I would highly recommend it to anyone!  Thanks for giving my a much more stable life Abilify!",0,19,8
"Aripiprazole","chrisbce","April 30, 2015","Taken for 5 to 10 years","<b>Abilify (aripiprazole):</b>			 I've been taking Abilify 30mg per day for 8 years. I have not had a major episode since and no hospitalization. Great for maintenance of mania and rapid cycling.",0,28,8
"Aripiprazole","SMSSKS","April 13, 2015","Taken for 1 to 6 months","<b>Abilify (aripiprazole):</b>			 After five months in 11-12 year old male, no noticeable side effects and works very well at reducing mania. (7.5mg)",0,12,8
"Aripiprazole","Loco Miguelito","April 11, 2015","Taken for 10 years or more","<b>Abilify (aripiprazole):</b>			 I am 40. I was diagnosed bipolar 15 years ago. My mania manifests itself as aggression/rage. My rage has been a problem since I was young. My violent outbursts consisted of me punching myself, bashing my head against walls and other horrifically embarrassing and dangerous actions. I was extremely verbally abusive to anyone unfortunate enough to be near me during my rages. I have been on many meds throughout my life. Every benzo. Mellaril. Thorazine. Every SSRI. Depakote. Lithium. NOTHING curbed my rage. In fact - SSRI meds INTENSIFIED my rage. 10 years ago, my psychiatrist put me on 20mg of Abilify. Within 4 days - I felt like I could finally breathe. My rage literally disappeared. But I don't feel zombie-ish like with other meds.",0,70,8
"Aripiprazole","Stunnerxxx","April 7, 2015","Taken for less than 1 month","<b>Abilify (aripiprazole):</b>			 Love it!",0,14,8
"Aripiprazole","BAEEEEEEE","March 30, 2015","Taken for less than 1 month","<b>Abilify (aripiprazole):</b>			 I have bipolar 1 and started this medication to help with breakthrough symptoms while on a mood stabilizer.  Within the first few hours I knew this wasn't the right medication for me.  I was so anxious inside, I felt as if my blood was crawling around beneath my skin. After two days of taking it I knew that if I stayed on it, I would be at risk of suicide to stop that horrible feeling.  Taking it made me stay awake for two days, fretting with anxiety.  I spoke to my doctor the first chance I got and she immediately took me off of it.  I'm on other medications now and very stable for years.",0,22,8
"Aripiprazole","kyloo","March 17, 2015","Taken for 1 to 6 months","<b>Abilify (aripiprazole):</b>			 I'm on Abilify in conjunction with Lamictal. In ten years this combination is the only one that has worked. While it took some tweaking it is well worth it. Two side effects, constipation and eye rolling.",0,24,8
"Aripiprazole","crjuarez","March 14, 2015","-","<b>Abilify (aripiprazole):</b>			 Abilify changed my life. There is hope. I was on Zoloft and Clonidine when I first started Abilify at the age of 15.. Zoloft for depression and Clondine to manage my complete rage. My moods were out of control. I was depressed and hopeless one second and then mean, irrational, and full of rage the next. My Dr. prescribed me 2mg of Abilify and from that point on I feel like I have been cured though I know I'm not.. Bi-polar disorder is a constant battle. I know Abilify works for me because I have tried to get off it and lost complete control over my emotions. Went back on it and I was golden again.  I am on 5mg 2x daily. I am now 21 and better than I have ever been in the past. Only side effect is I like to eat a lot.",0,33,8
"Aripiprazole","Jessj1234","March 12, 2015","-","<b>Abilify (aripiprazole):</b>			 Day one: TERRIBLE!  Very tired, had to stay home from work Day two: Getting better.  Very tired in morning but the day improved Day three: Wonderful!  I am not sure what normal is, but if this is it, I am in heaven.  Awake, focused, appropriate amount of energy, easy going mood, less irritable and lower anxiety (could be the xanax on the last one). I am just beginning the medication but typically meds have a quick affect on me and stick.  I have not noticed any unusual appetite increases but I am certainly going to keep an eye on it because I noticed a large percentage experiences weight gain.  As my fiance says- mental health is more important than gaining a few pounds anyway.",0,45,8
"Aripiprazole","Izzy Tempe","March 7, 2015","Taken for 1 to 2 years","<b>Abilify (aripiprazole):</b>			 Desperately trying to get back on Abilify, but insurance is awful. My suicidal thoughts are back. The Abilify balanced me out and I could sleep while on it. (It's almost 5am, and I haven't slept yet.)",0,27,8
"Aripiprazole","Chels27","January 15, 2015","Taken for 1 to 6 months","<b>Abilify (aripiprazole):</b>			 I am a 28 year old female diagnosed with Bipolar 1, Generalized Anxiety Disoder, Panic disorder and Agoraphobia. A little over a week of taking this medication in conjunction with Lamictal and a benzo (Xanax, Klonopin, or Valium depending upon doc's decision) I felt like a million bucks. I could leave the house. I had a normal sleep schedule. I had energy for the first time in a long time. It was a miracle for me. Stopped taking it and downward I went again. Restarting now and I couldn't be more excited. I will say it made me feel restless and that includes Restless Leg Syndrome types of feelings. But, I would rather be restless and functioning. You have to weigh the pros and cons --for me it is a PRO!",0,75,8
"Aripiprazole","Just Plain Nuts","November 19, 2014","Taken for 5 to 10 years","<b>Abilify (aripiprazole):</b>			 Abilify worked pretty good for five years with Prozac.  But then I became morbidly obese, with elevated bad lipids and prediabetes.  Also, I was constantly in fear of tardive dyskinesia.  I no longer take it.",0,25,8
"Aripiprazole","Nocture_Melody","November 12, 2014","-","<b>Abilify (aripiprazole):</b>			 I'm a 21 year old female and just diagnosed with Bipolar I. It's been a roller coaster ride especially after gaining 10 pounds in the hospital while taking risperidone and Depakote. I'm still on the Depakote, though I hope to discontinue it as soon as my psychiatrist allows, but I just switched to Abilify. I've got to say, so far I have no complaints. With risperidone I had no lid to my hunger. It was endless, and that was quite disappointing. There were many other side effects, but the weight gain has added to my self loathing. Though the painful heart dysrhythmias are a close second. I'm hoping that Abilify makes it possible for me to curb my appetite back to what it used to be as I exercise the 30 pounds I don't need away.",0,31,8
"Aripiprazole","Anonymous","October 24, 2014","Taken for less than 1 month","<b>Abilify (aripiprazole):</b>			 This has helped extremely with my bad mood swings and irritability but am having nightmares and waking up multiple time during the night feeling restless.",0,39,8
"Aripiprazole","Valkyrie66","October 15, 2014","-","<b>Abilify (aripiprazole):</b>			 Have been on Abilify for two weeks and my personality has changed drastically. I went from being chilled out and quite okay on Seroquel and Effexor but wanted to try Abilify to combat weight gain. In the two weeks I've been on it I've swung from hypomanic to aggressive and downright selfish. I did things I wouldn't normally do that has hurt my relationship with my partner and I've also been spending like crazy. Probably should stop but will consult psychiatrist first to see what she says.",0,36,8
"Aripiprazole","Dont'StandCloseToMe","September 15, 2014","Taken for 1 to 6 months","<b>Abilify (aripiprazole):</b>			 No effect after 3 months on it.",0,13,9
"Aripiprazole","David Lawliet","August 14, 2014","-","<b>Abilify (aripiprazole):</b>			 I've been taking Abilify for eight months now. Although it made me gain 15-20kg (something like 33-40 lbs I believe?), my experience is quite positive. The sadness from my major depressive episode, as well as my suicidal thoughts, have been almost annihilated. The reason why I rated it as a six is because it didn't help ease the great fatigue I have. But it helped a lot, that is for sure.",0,37,9
"Aripiprazole","MJude","August 12, 2014","Taken for 1 to 2 years","<b>Abilify (aripiprazole):</b>			 So many negative side effects. This interacts HORRIBLY with THC, especially as the THC wears off, and exponentially exacerbates the intensity and length of any depressive come-down effects. In my experience it  interacts with alcohol in about the same way. Also it can make women in-orgasmic.",0,20,9
"Aripiprazole",":):)","August 10, 2014","-","<b>Abilify (aripiprazole):</b>			 I was ready to walk out on my husband because of his hateful stressful presence. I sent him to the doctor and he was diagnosed with bipolar disorder and started on Abilify. It was a lifesaver for our marriage and family. He is happy, fun, and hopeful again. I thank God my prayers were answered.",0,89,9
"Aripiprazole","Attracta54","July 30, 2014","Taken for 6 months to 1 year","<b>Abilify (aripiprazole):</b>			 Gained 60 lbs in under 9 months while taking this.",0,15,9
"Aripiprazole","graysonnnnn","July 29, 2014","-","<b>Abilify (aripiprazole):</b>			 I took Abilify for one month. I had restlessness, a feeling that I needed to do something. It was a good thing in a way. At first I was more irritable but that subsided substantially after a few days. It made me feel a lot more calmer and in control of my emotions without making me feel like I was suppressing them. This is the first pharmaceutical medicine I have tried to treat my condition and it definitely worked better than the natural remedies such as St John's Wort, same, and passion flower. It even helped more than meditation. I have just switched to Latuda because Abilify gave me chest pains. If the pain was anywhere else I would of definitely stayed on the medicine because it worked. It helped me gain 10 lb which is good for me.",0,25,9
"Aripiprazole","bigger boy","June 1, 2014","Taken for 6 months to 1 year","<b>Abilify (aripiprazole):</b>			 I like Abilify a lot because I used to be extremely irritable. I also couldn't ride my bicycle when I was manic because I would not focus on my safety. Luckily, I now only get hypomanic episodes thanks to Abilify. I feel like I am free to get off of my emotional roller coaster and explore the world outside. The only few problems it gave me were akasthesia and weight gain. I'm 14 years old, and I don't know whether I gained 40 lbs from growing, the medicine, or both.",0,26,9
"Aripiprazole","Golf Queen","May 23, 2014","Taken for 1 to 2 years","<b>Abilify (aripiprazole):</b>			 Started on Abilify in addition to Effexor and Lamictal.  Immediately had tremors in hands, lips and speech.  Gained weight and was anxious.  Stopped taking when I ran out; tremors stopped, lost weight and no noticeable negative consequences.  Don't know why it was prescribed but it caused more problems than it helped.  Side effects were terrible.",0,36,9
"Aripiprazole","ceecee44","April 16, 2014","Taken for 5 to 10 years","<b>Abilify (aripiprazole):</b>			 I am diagnosed bi-polar and I have tried Lamictal, Lithium, Latuda and I don't even know how many other combinations. Abilify was the only one that has shown results for me. Yes, it tends to make me tired about 4-5 hours after taking it. And it makes me eat like a piggy sometimes, which has caused some weight gain. But nothing to severe. I take 5mg in the morning and 5mg at night, perfect dose for me. It keeps my moods perfectly balanced but I have been taking Abilify since I was 15 and I am now 20 and do not plan on stopping it anytime soon. I have tried that and it did not end well.",0,52,9
"Aripiprazole","ky girl","March 4, 2014","Taken for 1 to 6 months","<b>Abilify (aripiprazole):</b>			 I have tried many bipolar, mania medicines with none being the right one, however when my doctor prescribed Abilify it helped majorly in my life. I am on a combination of Abilify, Divalproex and Trazadone. All of which work in my favor. It is very comforting to know there is a medicine out there that understands bipolar patients.",0,36,9
"Aripiprazole","AliPaige","January 10, 2014","Taken for less than 1 month","<b>Abilify (aripiprazole):</b>			 This medicine did not work for me.  I suffer from Bipolar with mood swings and panic disorder.  I went up to 10mg and It seemed to help my mood but it pushed my anxiety off the charts. I was a shaky mess while taking it and also unable to focus and complete tasks.  Went off within 4 weeks.",0,30,9
"Aripiprazole","Bipolar Bear","December 27, 2013","Taken for less than 1 month","<b>Abilify (aripiprazole):</b>			 This medicine made me nervous all the time, I was a wreck, I could never sit still. It took away the mania and psychosis but left me suicidal and depressed so my psychiatrist stopped it.",0,20,9
"Aripiprazole","MrRowland","December 6, 2013","-","<b>Abilify (aripiprazole):</b>			 Abilify is not for everyone. I experienced severe personality change within a month. The story:  I have had bipolar disorder since I was 13 and have been in treatment for 9 years. When Abilify came out, we tried Abilify to bridge getting me off atypical antipsychotics and onto a mood stabilizer.  The 20 day experience was horrible. My personality changed radically. I didn't know myself anymore. Friends, my lover, my boss, all begged me to stop. I felt weird on it, not better. Severe personality changes are possible with Abilify. I called my psych, we stopped the medicine and moved onward. Those 20 days were destructive, but my friends &amp; job were kind and life returned to normal.",0,46,9
"Aripiprazole","samnm","November 17, 2013","-","<b>Abilify (aripiprazole):</b>			 I feel the Abilify working on my depression. I am singing and happier then I have been in a while. I was taking Invega before and that did not help me at all. I am diagnosed with Bipolar 1. This medicine has lessened my mania but has not vanished it completely. I do not see any side effects with this medicine!",0,40,9
"Aripiprazole","samanthamora09","November 15, 2013","-","<b>Abilify (aripiprazole):</b>			 Today is my first day taking the medication and within two hours I am ready to pass out. I feel so sleepy and its not really regulating my moods. In fact, I'm more aggravated than usual and going off on everybody. I also feel slightly nauseous and dizzy.",0,35,9
"Aripiprazole","queen bee22","October 24, 2013","-","<b>Abilify (aripiprazole):</b>			 I was diagnosed as bipolar type II and my nurse practitioner in WA prescribed me abilify and I gained 30lb within a month of taking it. I blew up like a balloon and he said he doesn't have that side effect. I looked online and it says that it clearly does. He said to take it a few more weeks and see how I did. I gained ten more pounds and my mother insisted I stop taking it. I went from 148 to 188lb. It may have started helped with my symptoms but I was to concerned about my weight gain so he finally put me on Topamax.",0,30,9
"Aripiprazole","escape1978","October 22, 2013","-","I was on Abilify for a year and a half. In that time I gained 30lbs. It also made me very forgetful. I felt like there was a fog in my brain that just wouldn't go away. The med did work but I can't stand feeling like I'm starving every second of the day. I quit cold turkey six days ago and already lost 4 lbs. I feel great...I have more energy, the fog is lifting and I'm not as hungry! Good luck to you.",5,2,9
"Aripiprazole","tabby cat","August 23, 2013","-","<b>Abilify (aripiprazole):</b>			 I feel really good using this medicine for bipolar and depression.",0,38,9
"Aripiprazole","Anonymous","August 22, 2013","Taken for 1 to 6 months","<b>Abilify (aripiprazole):</b>			 Abilify was fine at first, but it slowly increased my anxiety to the point where I felt like I was stuck in one long, never ending panic attack. I stopped Abilify two days ago and feel so much better.",0,37,9
"Aripiprazole","mona lucynski","August 13, 2013","-","<b>Abilify (aripiprazole):</b>			 I started taking and was fine for a few weeks. Then I started gaining weight slowly. Before I knew it I had gained 40 pounds in 6 months.",0,40,9
"Aripiprazole","Juan doe","August 4, 2013","Taken for less than 1 month","<b>Abilify (aripiprazole):</b>			 I found out I was bipolar about a month ago. The first pill my PCP gave me was Abilify. Starting on 2mg for the first 2 weeks. I didn't notice anything until maybe the third day. However the rest of that week and the following I have been on a roller coaster. I just started taking 5mg of Abilify and I notice the next day. I had the feeling of being normal again. Only side effect I've notice was when I was depressed I was depressed. Since upping the dose I feel way better.",0,31,9
"Aripiprazole","AAB","July 19, 2013","-","<b>Abilify (aripiprazole):</b>			 This medicine has been a game changer for me. I stopped stress eating and lost weight, my mood stabilized and I have been incredibly productive and achieved great things on it. It does wonders for my anxiety. I have been on it for a year and could not be happier with the product. It is expensive but WORTH it! Highly recommend.",0,74,9
"Aripiprazole","Bunkswife","July 11, 2013","-","<b>Abilify (aripiprazole):</b>			 This is what I've always needed. My mood is lifted, I have energy I never had before, I don't feel sad and helpless anymore, my anxiety has lessened and I'm easier to get along with. This may just save my failing marriage. I was afraid of all the side effect warnings but I only experienced mild nausea for about a week, and for the first few days I woke up intermittently during the night, but could easily fall asleep again almost immediately.  Feeling so much better!",0,62,9
"Aripiprazole","AlieC","July 4, 2013","Taken for less than 1 month","<b>Abilify (aripiprazole):</b>			 I have only been taking Abilify (along with my Prozac) for 2 days. So far I have had many ups and downs. I wake up feeling shaky and out of sorts. I have trouble breathing and black out a lot. (I black out anyways, but it has increased). Then I go through a period of anxiety and sweating. A little while later I go through severe nausea and then extreme fatigue. Between each phase I feel pretty great, but it's short lived. I'm going to give it more time, but that's the initial reaction for me.",0,16,9
"Aripiprazole","stuckonperc","July 3, 2013","Taken for 5 to 10 years","<b>Abilify (aripiprazole):</b>			 I've used several bipolar medications.  This has the least side effects.",0,41,9
"Aripiprazole","Anonymous","June 30, 2013","Taken for 2 to 5 years","<b>Abilify (aripiprazole):</b>			 Got put on 15mg of Abilify in the hospital and it has been the best antipsychotic I've taken! My anxiety is pretty much gone and there was a big difference in my mood swings.",0,40,10
"Aripiprazole","Anonymous","June 23, 2013","-","<b>Abilify (aripiprazole):</b>			 It works well for me.",0,21,10
"Aripiprazole","Kitty2489","June 12, 2013","Taken for less than 1 month","<b>Abilify (aripiprazole):</b>			 I was recently diagnosed at age 24 with Bipolar disorder (some paranoid features) co-morbid with Asperger's disorder. I have woken up in the morning all my life in an absolute rage, and my Bipolar has affected my life in more ways than I care to mention. I wish I would've known about my mental illness sooner- I thought everyone felt like I did. I have been on this medicine for a week, and for once in my life I wake up in a good mood, I stay in a good mood during the day, and am generally happy. I am extremely productive instead of either too manic or too depressed to function. The only bad thing is the akathesia, but worth it.",0,58,10
"Aripiprazole","Lilli in Waiting","May 28, 2013","Taken for 5 to 10 years","<b>Abilify (aripiprazole):</b>			 It's not for everyone, but I do well on it. It's a great antidepressant, and it helped me lose a lot of weight, I believe. Only downside- insomnia! But it does go away, eventually (the insomnia).",0,32,10
