"Drug","User","Date","Period","Review","Score","Likes","Page"
"Aripiprazole","Jay P","June 9, 2020","Taken for less than 1 month","<b>Abilify (aripiprazole):</b>			 I just started this Abilify at a 5mg dose and am going up to 10 mg today. Side effects were - nausea briefly -  restlessness that might keep waking you up at night. Both of these went away. I was told by my psych that I might feel shaky but that should pass. Positives so far are less rumination and constant thinking. Less daydreaming. It doesn’t affect my actual ability to think. I haven’t gone manic on this yet. My temperament seems to be even and my energy level is good. I'll check back in in a month with the 10mg review. Thanks all.",0,9,1
"Aripiprazole","ailik","May 28, 2020","Taken for 1 to 6 months","<b>Abilify (aripiprazole):</b>			 I took this medication for about two months I'd say. The highest I ever went to was 5mg. While it did work on the depression, it made the mania a lot worse to the point where I went psychotic and ended up in the hospital. The biggest issue I had was that the doctor was very intent on keeping me on this drug despite the fact it was not working.",0,4,1
"Aripiprazole","pay123","May 4, 2020","Taken for less than 1 month","I was diagnosed with Bipolar 1, and this medicine was unfortunately a nightmare for me. Within the first night of taking it, I was up with vomiting and diarrhea to the point I was glued to the toilet. I was so weak I could not even stand up without getting dizzy, chills, and nauseated. I would nearly pass out anytime I even moved. I was stuck in bed for a whole week and had to miss work. I did not notice any good effects, but since I was so sick I wasn't particularly paying attention to my mental status. I only took the meds for 3 days before I had to stop because I literally could not function. I hope this was not a common occurrence and others are able to get relief from this medication- but for me it brought on very very bad side effects.",1,2,1
"Aripiprazole","gs","April 26, 2020","Taken for 6 months to 1 year","aripiprazole is the worst antipsychotic I ever took. It managed mania and psychosis well but I barely had thoughts or motivation and it did nothing for my depression.  Then I got horrible akathisia so I refused to take it anymore.",3,1,1
"Aripiprazole","Cookie","March 7, 2020","Taken for 1 to 6 months","<b>Abilify (aripiprazole):</b>			 Abilify and zoloft work well for my bipolar depression. My mood was never been so controlled, I feel like a new and normal person. It kills my sex drive so I also take a supplement for women which helps a lot.",0,14,1
"Aripiprazole","Fernando Wong","February 17, 2020","Taken for 1 to 6 months","<b>Abilify (aripiprazole):</b>			 Abilify helped with my manic episodes, but gained 15 pounds after a month and spiralled into a horrible depression that saw me in bed for weeks after I tried to come off the drug. Felt near completely disabled. Not for me.",0,17,1
"Aripiprazole","Dunker","February 15, 2020","Taken for 2 to 5 years","I have been on Zyprexa, Aripiprazole and both at the same time. Zyprexa was awful. I gained weight, lost my libido, and had ED. Coming off Zyprexa was the hardest thing on earth. Now that I am on the Aripiprazole 10 mg I am doing so much better and have lost 60lbs. My mania rarely bothers me and my depression is less of an issue too. I have major depressive disorder as well as being bipolar. I also take lamotrigine. I'm actually starting to enjoy life again.",10,9,1
"Aripiprazole","Hellokittie","February 6, 2020","Taken for 6 months to 1 year","<b>Abilify (aripiprazole):</b>			 This medication has ruined my self esteem and essentially my life. I have gained 50 lbs from this medication. That wasn’t a typo 50 freaking lbs!!! I’ve recently stopped taking it but no weight has come off yet. I’m beside myself. I don’t know what to do. I hate the way I look now.",0,24,1
"Aripiprazole","Bill","February 2, 2020","Taken for 1 to 2 years","<b>Abilify (aripiprazole):</b>			 Be careful, Abilify caused a massive compulsive gambling addiction where I lost tens of thousands over time. I mentioned it to the doctor early on but she ignored it, didn't note it or change the meds. Guess I was hooked on the buzz. Stopped taking Abilify.  Stopped gambling recklessly. Compulsive gambling addiction is a mental health disorder itself.  Who'd have thought that the NHS would prescribe this dangerous drug that can cause it? Sounds ridiculous but true.  There was a guy with Parkinsons prescribed it in England, went full on the National Lottery online games and scratch cards etc ... but won his case for not being advised properly of the potential side effects and got most of the losses back. They don't care for my complaint.   A class action lawsuit is underway in the United States because it wasn't on the label.  Suing a big Japanese pharmaceutical company seems okay. Lost all interest in work and drifted for 18 months.",0,12,1
"Aripiprazole","Parliament625","January 25, 2020","Taken for 10 years or more","<b>Abilify (aripiprazole):</b>			 I am diagnosed with Bipolar 1 and in my 20s suffered through 3 major manic psychotic episodes which led to at least month long hospitalizations each time. After the first episode, I was put on zyprexa in which I felt zombified and depressed on which led me to go off of it entirely. Less than a year later I was hospitalized again and at that point I was introduced to Abilify. Three years passed during which I was stable. I then went off of it which led to my third and final hospitalization. Ever since then I took the 20mg tablets religiously and would soon combine it with Lamictal. This combo has worked wonders for me. Years ago a doctor told me that I’m on the Rolls Royce of bipolar medication and I firmly agree. About a year ago I started taking the 400mg injection which helped me lose at least 30 pounds. I find the injection the most effective method of taking Abilify. It has been a life saver for me!",0,25,1
"Aripiprazole","Nick","January 19, 2020","Taken for 1 to 6 months","<b>Abilify (aripiprazole):</b>			 Have been on Abilify (Generic) for about a month now. My lows are higher and my highs are nonexistent. I’m mostly flat emotionally, lacking interest in everything, including people. Good for my irritability and delusions, but the side effects are tough.",0,18,1
"Aripiprazole","Subject17","January 17, 2020","Taken for 1 to 6 months","<b>Abilify (aripiprazole):</b>			 I am a 24 year old male with Bipolar II. Depression is what I struggle with 98% of the time. I have been taking this med  Abilify for about a month now, so long enough. I switched to this from Zyprexa, and that switch was rough. My anxiety came back worse than before on this med and the restlessness was too much for me. I took 5mg and I would get an hour or two of sleep per day and not be able to sit still during the day. I will say that it cured my depression completely, so for that I am grateful. As far as my anxiety, sleep, and overall mood it has not improved. Moving up in dosage caused more restlessness and moving down to 2.5mg or less made me tired and didn't do much for my mood. This med didn't work for me but its not the worst med, give it a shot. I'm switching to Latuda, wish me luck.",0,16,1
"Aripiprazole","Kay M.","January 8, 2020","-","<b>Abilify (aripiprazole):</b>			 I am 31, female with bipolar 1 along with depression (obviously lol), extreme social anxiety and PTDS.  I was on abilify, all the way up to 20mgs at the last year or so.  I truly thought it wasn't working or doing ANYTHING for me anymore, so switched to Latuda.  Well the pharmacy was out of stock of Latuda and I had just finished my taper off of Abilify,  so I was about 4-5 days off of any mood stabilizer.  And now I can say that although it may not have been as effective as when I first went on it, it definitely made a difference!  Since the second week of my taper (down to 5 mg, then 2) I applied for some more credit cards and thought nothing of it.  In the past 2 days, I have maxed out all those credit cards.  It wasn't until last night I put the connection to me not being on anything.  I gained a little weight on it, but at the same time,  I allowed myself to eat what I wanted and didn't exercise.  During the taper, I tried seroquel and abilify is nothing as bad as that weight wise.",0,19,1
"Aripiprazole","Air","December 26, 2019","Taken for less than 1 month","Only giving it a 3 because I had no mood swings while taking this but had every side effect imaginable.",3,3,1
"Aripiprazole","RidinHi","December 18, 2019","-","<b>Abilify (aripiprazole):</b>			 Ability was the first medication prescribed following my bipolar diagnosis, I was told it had a side effect of weight gain. When I first started it, for 14 days, I was MISERABLE...I couldn't eat, sleep, use the restroom, lay down without fidgeting, focus or stop thinking super fast. But on day 15, all those awful effects disappeared. I never experienced anything bad other that weigh gain.  I had the same side effects weaning off it. (That was 300+ pounds ago. I didn't change my eating or exercising habits) In 2017 my new psychiatrist changed medications and I dropped 41 pounds in two years the Abilify slowed my metabolism.  I mainly noticed how it gave me a sense of controlled well being.  In the 15 years I took it, I only missed two doses. I figured if I did my part, medication and stayed actively involved in my own therapy then life would be best it could.",0,26,1
"Aripiprazole","Ben","December 14, 2019","Taken for less than 1 month","<b>Abilify (aripiprazole):</b>			 Been on every BiPolar med known.  Finally tried Abilify (generic)  and this  for me, is the VERY BEST bipolar medication in the world.  No highs, no lows, NO bipolar  symptoms at all.  I’ve never known in my 45 years that a bipolar drug could make me feel so  normal .  Truly happy, level headed and carefree.  Sleep is normal for the first time ever.  I’d rate it an  11  if I could!  CHANGED MY LIFE FOR THE BETTER, literally!  I TAKE aripiprazole 10mg once daily, Prozac as well.",0,35,1
"Aripiprazole","Anonymous","December 9, 2019","-","<b>Abilify (aripiprazole):</b>			 Up until recently, I was taking just 1 mg of Abilify along with 300 mg of Lamictal.  My doctor had me on 2, but I felt like it made me feel apathetic and kind of dissociated, so I began cutting the pill in half.  I did notice that I felt less depressed, could focus better, and did not experience such strong mood episodes.   However, within a month I was experiencing this extremely intense paranoia that I never had before.  I had chest pains and headaches regularly.  I couldn't eat and often felt sick because of how anxious I was.  So yes, Abilify did benefit me alongside this weird side effect.  My doctor had me convinced the medication wasn't causing the paranoia, it was just me, but as soon as I stopped taking it the headaches, chest pains, and bursts of anxiety have stopped.  I do feel more depressed and my mood swings have come back harder.  I'm getting a new doctor soon to hopefully put me on another type of antipsychotic",0,13,1
"Aripiprazole","Joe","December 5, 2019","Taken for 1 to 6 months","<b>Abilify (aripiprazole):</b>			 I had so many horrible experiences with  meds for my bipolar. It scared me to try one more but I'm now on 2mg of abilify once daily and found my old self again after a very long time living an unbearable life. The only side effect is slight insomnia and I'm losing the ton of weight that I gained while on seroquel. Abilify saved my life.",0,26,1
"Aripiprazole","Duckdodger","December 4, 2019","-","<b>Abilify (aripiprazole):</b>			 This made me feel absolutely horrible. It gave me worse derealization, anxiety, and anhedonia, worse than I have ever had. I do NOT recommend ever trying this stay away from it!!!",0,12,1
"Aripiprazole","virgosag","November 25, 2019","-","One month taking Aripiprazole: Apathy, weight gain, no creativity, extreme fatigue, and no interest in anything. I feel that I am not myself while taking this medicine. I have had so much trouble with antidepressants in general, none of them seem to help, the side effects are so much bigger than the benefits. I am a runner of 5k daily and I can't run even 1km while taking this medicine, I feel extremely tired. Im gonna quit taking it.",1,5,1
"Aripiprazole","Whaddup","November 23, 2019","Taken for 1 to 6 months","<b>Abilify (aripiprazole):</b>			 I was prescribed Abilify after experiencing a 3-4 month long hypomanic episode. I was on Lamictal 100mg but that wasn’t helping alone so my psychiatrist decided to add in Abilify. She also said it would help with the mild paranoid thoughts I was having. This was a horrible medication for me personally. It may work for other people, but it wasn’t for me. It made me flat and I didn’t care about anything anymore. I wasn’t depressed on it, I just didn’t care about anything. Even the people around me commented on how apathetic I had become. It made my fears of psychiatric medications come true. I lost my personality, passion, and energy. I am off of it now, and feel way better. I think it served its purpose of getting me out of my hypomanic episode, which is why I gave it a 4-star rating, but I couldn’t see being on this medication long-term.",0,13,1
"Aripiprazole","K from M","November 15, 2019","Taken for 1 to 2 years","Abilify stole a year and a half my life....I regret going on it much less staying on it. It gave me EXTREME fatigue. I'd go unconscious randomly....I fell asleep during conversations...a few of them with my boss (who was a very understanding guy). The memory loss was also horrific, I left a dough ball in the mixer once and put the mixer away. I'm pretty sure I also ended up with excessive body hair due to this med and to add insult to injury I did gain a little weight also. I got off it in July and it is November and I still don't feel 100%. This was on 5,10 and 15mg...it was all awful.",1,4,1
"Aripiprazole","Edd","November 13, 2019","Taken for 1 to 2 years","<b>Abilify Maintena (aripiprazole):</b>			 I’ve been given this drug 300mg by depot every month &amp; am on a community treatment order, which means if I refuse I get taken straight into hospital. It stops psychosis in bipolar but comes at a price, no emotions, extreme tiredness sleeping 12-14 hrs a night so hard to work. I’ve lost my creative side, my sex drive, even my ability to cook. I just sit in a chair most of the time, gaining weight, I feel so sorry for my family, I’ve completely lost myself and the psychiatrist doesn’t seem to care..",0,7,1
"Aripiprazole","WelcomeToDetox","October 30, 2019","Taken for 1 to 6 months","<b>Abilify (aripiprazole):</b>			 On Abilify for Bipolar and it is the first time in my entire life that I have felt stable. I have no side effects from this medication. I take it at night and it makes me a bit sleepy which is good for my sleep anyways. I have tried a few other mood stabilizers without success and finally tried Abilify and it works fantastically for me.",0,32,1
"Aripiprazole","Amy","October 19, 2019","Taken for 1 to 6 months","<b>Abilify (aripiprazole):</b>			 I HATE this drug! I have the more depressive side of bipolar disorder and for some reason got put on this antipsychotic instead of antidepressants. I have had irritability followed by flat affect. All of my creativity is gone as is my sex drive. I'm starting to get more and more depressed. My medicines provider keeps saying to wait or cancelling appointments! I'm probably going to taper myself off if things don't get changed soon.",0,13,1
"Aripiprazole","Anonymous","October 18, 2019","Taken for 1 to 6 months","<b>Abilify (aripiprazole):</b>			 I feel like a new woman on Abilify! I have Bi-Polar II, anxiety, depression, and PTSD. I have tried Lithium (gained too much weight and my thyroid went wacky), Lamictal (skin rash) and Topamax (which I currently take 50 mg at night to counteract the possible side effect of weight gain with Abilify). I have NOT gained any weight on Abilify! I was hesitant to take it, and now I’m kicking myself for not starting it sooner because I feel amazing! I have energy, depression and anxiety are GONE, and my bi-polar symptoms have vanished. This is a miracle drug for me! Give it a try if you are questioning it, because I wish I would have tried it sooner! I’m 46 years old and I am 5’10  and weigh 165 pounds with a BMI of 24 (Average).",0,48,2
"Aripiprazole","LadyLoveYou","October 16, 2019","Taken for 2 to 5 years","I have a hard time starting medications. I’m severely sensitive to them. I experienced extremely high anxiety after the first dosage of 10mg. However, if you give it time it really, really does work. It take about a month to be fully effective. But it has helped my intrusive thoughts and anxiety so much after that’s months period. I have gained a severe amount of weight. However, I really believe my mental health is what’s important right now. I’ve tried coming back and the thoughts always come rushing back. I still get thoughts every now and again but I can rationalize them like a  normal  person. I hope all of you find which medication works for you and it lasts a life time. Much love.",10,2,2
"Aripiprazole","Anonymous","October 16, 2019","Taken for 1 to 6 months","<b>Abilify (aripiprazole):</b>			 This medication  Abilify almost killed me. I started it in January  for bipolar and felt flat and slightly suicidal (as I had before starting it) for about two months on it. Experienced some weight gain. After the two months, I began to have obsessive suicidal thoughts to the point I couldn't concentrate. Oddly enough, I didn't feel depressed just non-stop suicidal thoughts. I got off of it and switched to lithium, haven't had a suicidal thought in months!",0,15,2
"Aripiprazole","Nickname","October 14, 2019","Taken for 10 years or more","I have co-morbid Bipolar II and ADHD. I have been on Abilify since 2004. I started at 15mg/day and found it flattened my personality too much, so after two years I (with the help of my psychiatrist) reduced my dosage gradually to 7.5 mg/day. This therapy reduced my anxiety, hypomania and depression considerably, though ADHD symptoms persist. I have been fortunate to have NO side effects. However, when the generic was introduced and insurance company mandated it, I tried the aripiprazole from Teva Pharmaceuticals (instead of brand name Abilify from Otsuka Pharma), and found it to be MUCH LESS effective. I switched back to brand name Abilify.",8,3,2
"Aripiprazole","Cloud","October 13, 2019","Taken for 2 to 5 years","<b>Abilify Maintena (aripiprazole):</b>			 Abilify 400mg injection at first made me so anxious and felt suicidal. My Dr's said it wasn't the drug it was my depression and anxiety. They persisted with it, as I'm not compliant with tablets. I have bipolar 1 with psychosis. It has helped with psychosis but the side affects are destroying me. Extreme lethargy and total numbness, physically, mentally and emotionally. It has made me gain weight also despite daily exercise. I have no libido whatsoever anymore.  When I complain to the psychiatrist  they just say it's not supposed to do that, there must be another reason for these things. I also feel like I have no memory but have  impulses to gamble and spend money. I have no energy to fight anymore, it's so sad and disgusting that my quality of life is not a factor to these people. Dr's etc.  As long as I'm not in the ward is all that matters to them.",0,6,2
"Aripiprazole","Ness","October 11, 2019","Taken for 1 to 6 months","<b>Abilify (aripiprazole):</b>			 I tried to give Abilify a chance three times. I find no interest in activities, not suicidal but don’t feel inspired or a purpose to anything, I just want to be in bed all day and I easily get emotionally hurt or offended. I felt everyone would stare and judge me and so my Doctor kept saying that I would get better after a couple of weeks. The first few days I felt very high and happy, I also had high levels of energy but I couldn’t finish one thing before starting another. I also began to feel extreme panic, I had constant panic attacks, flushing sensation and once I began to lessen the dose to come off I experienced vertigo. I had not felt this before and I was in a panic thinking I had some tumor or had something haywire my nervous system and would never be the same. I stopped in July and it’s now October I still have vertigo but not as intense, I was just prescribed Wellbutrin and I’m really hoping it helps me. Everyone is different but this was my personal experience",0,10,2
"Aripiprazole","Star08","October 9, 2019","Taken for 2 to 5 years","<b>Abilify Maintena (aripiprazole):</b>			 Major weigh gain. I feeling tired all the time, but on the other hand my moods have been completely stable. Except for focus which I was prescribed concerta for. It seems to be working :)",0,2,2
"Aripiprazole","Kelizabeth","October 4, 2019","Taken for 5 to 10 years","<b>Abilify (aripiprazole):</b>			 I took abilify for over 6 years and at first it worked very well. Year 2 I started having face twitching, shakiness and stuttering speech. 3rd year I started with tardive dyskinesia. 4-6 ish years I had all the aforementioned and added falling at least 6 times a day, I was so shaky I could barely walk, plus my memory was shot. I couldn't remember my  phone number or email address I had had for 10 years. New psych took me off and within 2 months almost all of the symptoms were gone. I think some of the shakiness and memory loss are permanent but I have a new lease on life. Poison. Pure poison. I wish I could have those 6 years back.",0,22,2
"Aripiprazole","Suzy","October 4, 2019","-","Started on the injection 2 years ago 880 my every 6 weeks, at first it made everything wonderful. Increased to 1064 every 8 weeks and my mouth chewing is horrible, I gaining weight rapidly and I have been obsessed with shopping. Also wake up every hour on the hour. Going to request having the dose lowered.",8,2,2
"Aripiprazole","Caregiver","October 2, 2019","Taken for less than 1 month","<b>Abilify (aripiprazole):</b>			 Thank you all so much for your candid feedback!! I needed this for support and better understanding. I sobbed reading every comment, because I can relate.  My 18 year old son has psychosis and mania. Meds just changed. Lithium dropped due to  out of range  high toxicity.  Antipsychotic med. Risperidone, no longer affective after a year. He has been on Abilify for 1 week. After 1 day, I could tell his psychosis was disappearing.  He realized date on the calendar, acted as if he had missed a month of his life. Then immediately jumped back in the game! He showered with soap! His obsessive, fixated thoughts and actions stopped, and he quickly  reprioritized his responsibilities.  Side affects- nausea, sick, no appetite for days.  (Zofran) is helping.  Slightly more aggravated at times, pesters family, a little removed, impulsive and quick to snap. It’s only been a week, so hoping these symptoms stop, and mood levels out. Thank you again for sharing! Love and wellness to all",0,17,2
"Aripiprazole","inmmsh","September 24, 2019","Taken for 1 to 2 years","<b>Abilify (aripiprazole):</b>			 Worked well for 2 years but has been less effective lately.",0,12,2
"Aripiprazole","Megan","September 22, 2019","Taken for less than 1 month","I’ve just been diagnosed with bipolar disorder. Abilify 2mg is the first thing my doctor prescribed to me. Taking one pill each evening. For the past week I’ve noticed every time I take the medication before bed, the whole night I am tossing and turning, constantly feeling like I need to be on the go, and my dreams have been very weird and giving me anxiety in my sleep. Someone told me to try taking the med in the morning instead of at night should I try that? Or try a new medication?",5,2,2
"Aripiprazole","Malz","September 16, 2019","Taken for less than 1 month","I’ve been on Abilify for four days, and I’m unbelievably impressed. Other meds: buspirone, lamictal, propranolol, clonazepam. While technically using it for treatment-resistant bipolar depression, my doctor also recommended it for obsessive/intrusive thoughts and social paranoia. It felt like the drug acted immediately. I still have pretty bad sleepiness and dizziness, especially upon standing, but they should subside over time—and the symptom reduction is worth it",9,3,2
"Aripiprazole","Joey","September 5, 2019","Taken for less than 1 month","Give aripiprazole some time to kick in. It really works for my bipolar",10,3,2
"Aripiprazole","LaSkipit","September 1, 2019","-","<b>Abilify (aripiprazole):</b>			 Wow. I took it and many of the reviews here could have been me. Was on it for 3 weeks couldn’t take the side effects. My tongue was  swollen 2x it’s size uncontrollable salivating. Anger outbursts that were uncharacteristic of me, impulsivity, akasthasia horrible kicking legs as I tried to go to sleep. Doc was kind enough to pull me off it as I gained 20 pounds in this month. Ridiculous. It was not a  live saver  for me either.",0,11,2
"Aripiprazole","Clobber8","August 28, 2019","Taken for 2 to 5 years","<b>Abilify (aripiprazole):</b>			 This drug destroyed my life. My sexual urges became insatiable and my drug use went supersonic. After the dust settled my marriage was destroyed,  I’m broke and my credit rating went 750 to 400. I’ve lost all credibility with my family and friends. I started going sideways almost immediately after I started taking Abilify. I had trembling hands   I cut myself and was very irritable.  I became a different person",0,9,2
