"Drug","User","Date","Period","Review","Score","Likes","Page"
"Saphris","BAEEEE","March 30, 2015","Taken for less than 1 month","Wonderdrug. I have never, ever had a period of more than two days without irritability without hypomania. Within 2 days of taking this medication, my irritability was nil.  I was able to sit in a busy, loud restaurant without getting angry or distracted.  I have no sedation during the day, and this medication helps me sleep at night, immediately and deeply.  I'm sleeping about 9-10 hours every night, which is why I'm giving it 8 of 10 stars, because that amount of sleep is a little much for me.  I still feel a normal range of emotion on this medication, my sex drive is normal, I have no side effects.  The taste is not so bad, but tongue does get numb every time I take it, but this wears  off by the time I wake up.",8,46,4
"Saphris","bipolar12345","March 10, 2015","-","I take a low dose of Saphris (5 mg). My experience with this medicine is simply incredible. It makes me feel so zen and happy, it's a feeling difficult to describe. I used to take clonazepam, but it never made me feel that great.  Another good point is that it helps going to sleep, but waking up is easy (not like Seroquel and Zyprexa!!)",9,71,4
"Saphris","Seanie","March 2, 2015","Taken for less than 1 month","I have been taking Seroquel for 7 years and was initially happy with the effects, but the medication hasn't been working as well lately and I have gained 40kgs in those 7 years. So I was put on Saphris 3 weeks ago. The benefits have been amazing, with increased energy, memory and positive thoughts. Unfortunately, I had a severe allergic reaction to Saphris a few days ago and I've had to stop taking it. I hope to find something just as good. I suppose the good news is that now I know that there are other Atypical Antipsychotics that could help me.",7,23,4
"Saphris","Seanie","February 28, 2015","Taken for less than 1 month","I was on Seroquel for 7 years when I had to start trialling something else due to weight gain. I was taking Saphris 3 weeks and I had a severe allergic reaction. Saphris was changing my life for the better and so I'm sad that I can't take it anymore. I had motivation, great memory &amp; concentration, positive thoughts, ability to plan &amp; function highly and loads of energy. I can't take the tablets anymore, but i'm going to miss how good they made me feel. Now I'm looking into Zeldox or Latuda. I definitely need an antipsychotic for my Bipolar.",8,23,4
"Saphris","Andrew The Great","February 19, 2015","Taken for 6 months to 1 year","Been on Saphris for almost a year.  Have tried almost all of the others except for Latuda.  My experience is that I have had the best dreams and put on the least amount of weight on this medicine.  Also, not nearly as drowsy.",10,53,4
"Saphris","HiSpRiNcEsS","February 7, 2015","Taken for less than 1 month","Diagnosed ADHD, Bipolar, Major Depression, GAD, Panic disorder. Have been on Saphris 5 mg at night for 1 week. After the first dose I could tell a huge difference in my mood. For the first time in months I woke up in a great mood. After a few days, I knew I was no longer in mania. Which I've been in for at least 4 mths. My thinking is back to normal. The only problem I'm having is keeping my mood stabilized. When I take it at night it puts me to sleep in 15 min. No longer using sleeping meds. For one week of use I think it's a great medicine.",9,35,4
"Saphris","Anonymous","December 11, 2014","-","Took this drug because my antidepressant was causing horrible mood swings. It works well and quickly, and side effects are not awful. Only problem was I would have really intense episodes of heavy breathing/heartbeat, with twitching and then I would barely be able to move for a while. Hopefully as I get used to it, this should go away. But great medication, really helped my mood and mental clarity!",7,16,4
"Saphris","LJ Arizona","November 13, 2014","Taken for 6 months to 1 year","I have been on Saphris for nine months. I am taking 20 mg at night.  I find the medication puts me to sleep 10-15 minutes after taking my dosage.  If I wake up in the middle of the night to go to the bathroom, I stumble around in a daze. After sleeping 9-10 hours, I wake up feeling refreshed. I also take Lamotrigine and Sertraline. To manage anxiety, I take Lorazepam as needed. It took me several months to see the full benefits. Today, I am under control.  No suicidal thoughts. No aggressive behavior. I am no longer having the delusions that people are out to get me and/or I am being followed.  Best of all the medication did not throw me into depression.  I still have problems when I become overwhelmed or in a busy environment.",10,81,4
"Saphris","Scorpionis","October 1, 2014","Taken for 2 to 5 years","I started Saphris after experiencing some episodes of violent anger as a result of mixed episodes of my bipolar disorder. There was an almost immediate lessening of symptoms, making me feel calmer right away. I have experienced almost no side effects from the medicine other than occasional sleepiness, but nothing debilitating. I had little or no weight gain, which made me very happy. It also has a lower incidence of causing cholesterol and blood sugar issues than many other AAPs. I find Saphris very helpful for both the immediate treatment of a breakthrough mixed/manic episode as well as for daily maintenance.",9,80,4
"Saphris","Horrible drug","September 24, 2014","Taken for less than 1 month","I developed tardive dyskinesia of the toes, constant akathesia and inability to sit still. I stopped the medicine weeks ago and I still am moving.",1,39,4
"Saphris","that1hippiechick","September 8, 2014","Taken for 1 to 6 months","I have bipolar1, general &amp; social anxiety, post traumatic stress disorder and borderline personality disorder. I've been on pretty much everything over the last 14 years. Seroquel worked well for over a year but the weight gain was awful. Regular exercise and healthy eating. Lithium and Lamictal replaced the Seroquel and seemed efficient, couldn't handle the nausea anymore after 2 yrs. 5 weeks ago I decided I wanted try Saphris. Psych agreed, decided to start low and slow as I tend to have allergic or increased anxiety with most medicines. Started on 2.5mg for a week. I literally felt better the next morning. I had increased energy and felt happy for the first time in over 10yrs. I'm up to 5mg pm, 2.5mg am. Anxiety decreased, and down to 1.5mg of Klonopin daily from 3mg. This is a miracle for me!",9,97,4
"Saphris","Anonymous","September 4, 2014","Taken for 1 to 6 months","I take 3/4 of a 5mg Saphris and 200mg Epilim which helps to take the edge off of my anxiety and depression. I felt a difference within days of taking my first dose, like I could breathe again and didn't have the weight of the world on my shoulders. What I will say though is that medication is never the complete answer. My medicines have allowed me to get to a stable enough place where I am able to deal with the underlying issues causing my depression and anxiety. Does help me feel more comfortable in my own skin.",9,60,4
"Saphris","lake forest oconnor","August 23, 2014","-","I took 1  5 mg a few nights ago. My body had unbearable muscle thrashing.  I woke up every 2 minutes spasming out of control it was very painful as well and couldn't get sleep.",2,32,4
"Saphris","BradwickMD","August 10, 2014","Taken for less than 1 month","I was prescribed Saphris for bipolar disorder. The morning after my first bedtime dose I had a number of side effects. I experienced confusion, dizziness, hallucinations and acute short term memory loss.  As a result of the confusion and acute short term memory loss, I unintentionally overdosed on my morning medications resulting in extreme doses of medications. The most concerning was a 900mg dose of Wellbutrin (bupropion) which in doses of 300mg or more can cause seizures.",1,24,4
"Saphris","Twightman91","July 23, 2014","Taken for 1 to 2 years","I had been taking Saphris 10mg at bedtime for well over a year and then suddenly stopped taking it for a month to see how I would feel. In this month I was a wreck and had racing thoughts and couldn't fall asleep until 2am and would be up 6 hours later. I also found myself fantasizing about stuff and being unrealistic about things. I started taking it again close to a month ago and I really see how much it helps me. The only downside is that I sleep over 11 hours now and I get into such a deep sleep without waking up once.",8,61,4
"Saphris","djeck","June 29, 2014","Taken for 6 months to 1 year","Bipolar with mixed episodes, ADHD and severe anxiety. Saphris was a miracle for me also. I've been on disability for 10 years and this is the first medicine I've taken that has made me functional.  Absolutely can't take it the morning; it makes me incoherent for about 3 hours and I eat everything in sight.  So I take all 20 mgs at night and am doing fine.  Have mouth sores, though. My doctor said to alternate between taking it sublingually, supra lingually and but ally and it's helping.",9,41,4
"Saphris","Reeena","May 10, 2014","-","I have been on Saphris for about 3 months now.  I take 15mgs at night.  I'm able to sleep now without the help of any other medicine.  I get restless from time to time but subdue it with Vistaril.  Sometimes I get boosts of energy which can be good.  My moods are more balanced than ever before.  I can laugh things off instead of getting angry.  The reason I gave Saphris a 9 is because it affects my libido.  I recently started taking Wellbutrin to combat this.  I hope it works!",9,34,5
"Saphris","Life is Great!","April 9, 2014","Taken for 6 months to 1 year","I started out with 20 mg of Saphris but stayed groggy.  Went down to 10 mg and have been on it for 6 months. I also take a sleep aid at night and now I sleep 6-7 hrs compared to 3-4. No running thoughts in my head. The longest time I have ever stayed out of the hospital in 12 years. I feel wonderful, when I start getting anxious, I take a 5 mg with my Xanax and I am good to go. Downside: Gained 50 pds and cholesterol is through the roof, even though I do not eat red meat. Always have the munchies though. Had to start on a statin medicine. Blood sugar is higher than usual but within range.  Keeping an eye out on this too.  But this is the only medicine that has worked for me without being a zombie or continued mixed episodes.",9,42,5
"Saphris","Todd B.","March 18, 2014","Taken for 1 to 6 months","I believe I have found the answer I have been looking for! Been on it about two months. I sleep throught the night with a lot less interruption and I fall asleep more quickly.  My thought pattern is far less anxious and muddled; I am able to concentrate.  My mood is far less out of whack and I am generally happy.  The only downside for me is it gives me the munchies and I have diabetes, so I have gained some weight a bit rapidly.  However, with a lot of effort, I have eliminated foods out of my diet that are carbs. I am starting to level out and I have a lot of hope for the future with this medicine. It is expensive, but I have good insurance.",10,49,5
"Saphris","Review gal","February 11, 2014","-","Been bipolar for seventeen years, Saphris for two months, started out eating right after I took it and I was very sleepy.  The eating eventually subsided but within ten days I started having jaw muscle tension.  At first I had energy and the racing thoughts and paranoia went away.  The sublingual dosing and taste seemed to be minor in the hopes that it would help symptoms.  I would take it at night only, after getting everything done for the evening because it really made me sleep deeply, within fifteen minutes, when I really didn't have a sleeping problem before taking it.  It did make me more alert during the day, which almost led to panic on several occasions.  It was addressing psychosis symptoms but I continued a low level of depression",6,36,5
"Saphris","Anon434343","February 9, 2014","-","Saphris is the best bi-polar medication I have taken. I sleep the best I ever had on Saphris and do not experience manic out bursts. Other bi-polar medications made me gain weight. On other medications I have gained 30 lbs in a short time frame. On Saphris, I haven't gained any weight and weigh a few pounds less than I did before I started to take Saphris.",8,64,5
"Saphris","Anonymous88888","December 20, 2013","-","I have Bipolar Disorder I, with rapid cycling and mixed states. I tried Saphris when I was recovering from a hospitalization which was very unpleasant and ended very badly. So I was a bit manic and terribly anxious going on it. I took it for 6 days. It seemed to work almost right away. I was shakey and anxious throughout the 6 days. Extremely sleepy and dizzy after my 5mg at bedtime. But that wore off after 4 days. Mood-wise, it seemed to completely stall my cycling. Miracle! And I was much calmer and less reactive, but definitely awake during the days. Then after my 6th dose I noticed my lips were puffy, and my tongue was fatter, then my throat got tight = allergic reaction. Worked great until that!",9,45,5
"Saphris","Anonymous","October 20, 2013","Taken for 1 to 6 months","I have been taking this for about 4 months now. While I admit I am awful at being consistent with new meds, I am blown away by how well Saphris has consistently toned down my impulsivity, irritation, edginess, suicidal ideations, and cycling depression.  Unlike antipsychotics such as lithium, this stuff did not turn me into a walking zombie. I am still able to feel elated, just not so much so that I lose control of myself.  Also it helps me have a regular sleeping pattern! I do not know how anyone can taking this in the morning as it knocks me out harder than ambien. The downside of it is that I am experiencing secondary nocturnal enuresis :S  It is something I have always struggled with and I would not expect others to experience this.",9,53,5
"Saphris","KristiR","August 17, 2013","Taken for 6 months to 1 year","I am currently taking 1/4 of a 5 mg tablet (but started out on a 1/2 tablet) of Saphris at night.  I am also on Lexapro, 10 mg for depression and anxiety.  The combo works great.  I have horrible insomnia/waking in the night on just Lexapro (or other SSRI's I've tried) but with Saphris I sleep great and wake up refreshed!  Only downside is that I've put on 10-15 pounds in the last 6 months, but not sure if it is due to the Lexapro or Saphris or both.  I eat very healthy (just too much) and exercise regularly....but find myself always feeling hungry.  Oh well...at least I'm happy!",9,44,5
"Saphris","mcadams","August 11, 2013","-","Saphris has helped me more than any other medication (which were many, many over 12 years). I was blown away by the benefit and bewildered that it took so long for someone to prescribe it. I still don't have the strength and energy that I need but I am functioning at 80% to 90%. Before it was barely hanging on with suicidal periods. Savella was another good medication for me but not quite this good. The racing thoughts, paranoia, and insomnia are gone. I usually fall asleep within 15 minutes of lying down. Although I am having some nights of waking up after 3 hours. Just getting to sleep earlier and getting the required sleep I need has made a tremendous difference in how I function and cope. My side effect has been arthritis and weight gain.",9,48,5
"Saphris","Maryjane543","August 5, 2013","-","This medicine is a lifesaver without a doubt",10,35,5
"Saphris","Kissa miau","August 2, 2013","Taken for less than 1 month","I will give this a 2, simply because of the ease of use.  The tabs dissolve under your tongue so you can take them anywhere.  You cannot eat or drink for 10-15 min afterwards, which is really not a big deal. I am bipolar I with occasional mixed episodes and was prescribed this medicine (5 mg 2x daily) in the middle of a mixed episode while in the hospital.  It propelled me into full-blown mania. As with all medicines and this disease, its very personal.  This medicine might be more appropriate for someone less prone to mania than myself.  I am on Topamax 150 mg (50 mg 3x daily) and Seroquel 100 mg nightly, now.  I am not cured by a long shot, but I am certainly a lot better now, a month later, than I was on the Saphris.",2,23,5
"Saphris","Maya K","July 2, 2013","-","I have tried so many medications for my numerous manic episodes and nothing even came close to the benefits I have experienced with Saphris. It reduced my anxiety and agitation profoundly. I have not had another episode after being on Saphris for over six months. I have an overall sense of well being and much more functional. I've lost 50lbs after being on Zyprexa. Saphris is a wonderful medicine and has given me hope and I am slowly rebuilding my life. It might taste really bad but it is all worth it.",10,82,5
"Saphris","Gary Hava","June 17, 2013","-","You have to be aware of the positives and negatives of any medicine you take. Even Tylenol. I have found that Saphris has worked pretty well despite a few side effects that I've learned to live with. My doc tried me on Latuda first because I was a bit concerned with taking something sublingually. I should have tried Saphris first. Latuda had me wanting to jump out of my skin and made me want to eat all of the time. I gained 50 pounds in the six months I was on Latuda and have lost all but 7lbs on Saphris.  I don't mind the numb tongue because it goes away. I am even used to the taste now. Overall Saphris gave me my life back.",10,81,5
"Saphris","Anonymous","June 2, 2013","Taken for less than 1 month","I am Bipolar Type I and was switched to Saphris from Seroquel by my psychiatrist.  One dose and I began having suicidal ideation that I hadn't experienced in years. I had the presence of mind to call my psych doc immediately (it was a weekend) but she didn't call back.  I am a nurse and should have known better, but I took it the next day.  After the second dose, I was frightened I would act on the impulse.  Luckily I have a very supportive and observant husband.  I called doc again and she said to stop immediately, of course, as I should have after the first dose.  I saw her on Monday and went back to Seroquel.  Less severe side effects included numbness of my entire tongue and sick-feeling somnolence.",1,28,5
"Saphris","MYA May","May 27, 2013","Taken for less than 1 month","I have had some success in using Saphris, however, the side effects are somewhat mixed.  I don't like feeling groggy or fussy the morning after taking the medicines.  I also don't like having short term memory loss.  I like the stabilizing mental moods and the reduced depression and manic episodes.  The medicine numbs my tongue and makes me hungry all the time, so am I hoping after time this stops.  I have been taking this medication since the May, 20mg.",0,28,5
"Saphris","gypsygirl39","May 26, 2013","Taken for 1 to 2 years","I love Saphris.  Best thing that ever happened to me.  No other medicine compares.  Down side, it's so expensive.  I get samples from my psychiatrist, but I will be moving out of state soon and I am so afraid I won't be able to afford Saphris.  It's the only medicine that gave me the least amount of side effects and lets me lead a normal life.",10,57,5
"Saphris","CattyAK","May 4, 2013","-","I've been on Saphris 20mg nightly for 2 months. I have Bipolar Rapid Cyclical with ADHD. This medication is the best. I fall asleep within 10-15 minutes. The horrible taste is a small price to pay. My mood is the most stable it's been in a long time. I'm happy about life, feeling very positive- a huge change for me!",10,58,5
"Saphris","cpas","April 27, 2013","-","I was diagnosed with Bipolar Disorder almost five years ago and have tried just about every medication without success.  I have recently started taking Saphris and it is my miracle. My mood swings have gone and I'm no longer angry or depressed.  I have plenty of energy (minus the mania) and feel a complete sense of well being. The dissolvable wafers have a very bitter taste however this is a very small price to pay considering how awesome I feel.",9,61,5
"Saphris","Anonymous","April 22, 2013","Taken for 1 to 6 months","Saphris has slowed my thoughts down a lot! I have the black cherry flavor. I do feel suicidal, but I felt that way before the meds. The only problem I have is the weight gain. I've been on Saphris for almost 2 months and have gained 20lbs. I find it hard to shed the weight.",8,33,5
"Saphris","peace mama 75","April 10, 2013","-","I just replaced my 75mg nightly Seroquel with 5mg (will probably go to 10) of Saphris.  I was very scared to change.  I am a successful and happy trauma nurse, mom, partner, etc., even though I do struggle with bipolar disorder and anxiety.  My life has been going REALLY well for several years with low doses of Seroquel, Zoloft, and Lamictal, so when my annual spring crazies kind of snuck up on me worse than normal, I was very hesitant to rock the boat. So far this compares VERY FAVORABLY with my Seroquel.  I am sleeping well and the morning fog is getting better as my body adjusts.  My thinking is clearer and quieter WITHOUT feeling dumb or sad. And I don't seem to be quite as ravenously hungry as on Seroquel.  Hope it lasts!",9,62,5
"Saphris","Rey1222","April 9, 2013","Taken for 1 to 6 months","Saphris is the best. 10/10. For those of you who had bad experience starting out, I suggest trying it out again from a low dose. The key is to get the medicine in your system until it builds up in a few week. When all else failed Saphris was the one that had saved my life and improved it like it has reversed the chemical imbalances associated with my bipolar. My mind and sense of attention has been brought back from the severe depressed and mixed episode. And severe agitation. When I first started Saphris with 5mg it too gave me severe akathesia (restlessness). Thank fully after finding out that my other medication mirtazapine (Remeron) reduced restlessness. I can now sleep well after taking the Saphris with the Remeron without any insomnia.",10,36,5
"Saphris","Debmas","January 25, 2013","Taken for 6 months to 1 year","I have Bipolar I with some psychotic episodes in the past. I used to be on Abilify, but I had weight gain and shaking of my hands. Saphris has been wonderful for me. I used to take Ambien because I couldn't sleep, but with Saphris I fall asleep within 10-15 minutes. I only take 5mg at night. I don't take it in the morning because of how sleepy it makes me. I've also tried 10mg at night and that worked well too. As for the flavor, I have to have the black cherry. I couldn't stand the original, mint, I think it was. I feel great and would definitely recommend it.",10,70,5
"Saphris","sadmd","January 20, 2013","Taken for 6 months to 1 year","I love this medicine. I have Bipolar 2 and post traumatic stress disorder. I have been on this medicine for 9 months. It puts me to sleep about 15 mins after taking it. I have lost 35 pounds (I had gained 50 pounds on Lamictal and Abilify) I am off the Lamictal. I have been able to stay out of the hospital. I feel better overall. I am trying taking 1 course in college and may even try to work again.",10,71,5
"Saphris","saphrisuser","January 19, 2013","Taken for less than 1 month","Taking for Bipolar Disoder II and Post Traumatic Stress Disorder. Works nearly immediately and works wonders. Never had a quieter head or felt better. The horrible taste is worth it.",10,53,5
"Saphris","Sammi1985","November 24, 2012","-","I was very hopeful when starting Saphris, but it didn't take long for my family and I to see this was NOT the medication for me. I asked doctors to take me of this but I kept on being told to give it more time. I would sleep over 12 hours a day and if I could SOMEHOW manage to stay up with the use of coffee and energy drinks, I was a shell. I would sit there confused, unable to really talk or take care of myself. I took it twice a day once in the morning and once before bed, and rather than give me my life it was robbing me of what little I had. It also didn't help with my delusions or paranoid thinking. I even still saw shadows and things of that nature from time to time.",2,37,5
"Saphris","Anonymous","October 25, 2012","Taken for 6 months to 1 year","I responded well to this medicine but I gained 50 pounds and was tortured by unending hunger. Eventually I had to get off of it and that wasn't easy. It took about a month to get over the withdrawal symptoms.",0,29,6
"Saphris","Boxerjod","October 25, 2012","Taken for less than 1 month","I have been taking Saphris for 10 days. I went cold turkey off Seroquel 600mg/day. I have had terrible insomnia. My psych said this should improve over next few weeks, I hope so. Agreed that it tastes awful and numbness under tongue only lasts approx half an hour. My mood improved the next day after my first 5mg dose. I feel so happy and enthusiastic about life, which is amazing. The Seroquel fog has lifted and I have lost 3.5kgs in 7 days (Seroquel munchies are gone).",9,43,6
