"Drug","User","Date","Period","Review","Score","Likes","Page"
"Saphris","Lunabee77","December 2, 2016","Taken for 1 to 2 years","Have been on and off Saphris several times. For me, being on Saphris is like turning a light switch on. I go from being manic/depressed to functioning like a normal human. But.... the side effects have made me quit several times - irregular heartbeat, fainting, nausea, etc. Now back on at a low dose with Lamictal and clonezepam for panic disorder. Feel pretty good. Hope it will last. Without Saphris, I am non-functional - so doing my best to manage the side effects while getting the benefits of this medication. Best of luck to all.",8,27,2
"Saphris","831","November 30, 2016","-","I have been taking this med for years and I feel trapped. I don't think it really does anything for me. The problem is that I tried to stop taking it and I became completely useless, tired, irritable, and full of anxiety.  Right now I have not taken it for two days because I forgot it before I went out of town. I am tired, got insomnia and I feel like I am hung over and nauseous. The withdrawals from taking this medication is awful. So I think anyone that wants to start this med should seriously consider this when making a decision to ingest this. I am not the only one who has experienced this. There is a lot about withdrawing from this med on the net.",4,17,2
"Saphris","cookie 1234","November 17, 2016","-","Bad experience causes extreme restless leg syndrome and back aches, taste horrible also , only been on 20 mgs a day for 3 weeks so hopefully not much withdrawals I'm stopping cold turkey as I need my sleep gonna dry bendryl as I think its a allergic reaction.  Would never take again.",1,8,2
"Saphris","Aerh","November 12, 2016","Taken for 2 to 5 years","Helpful BUT it tastes TERRIBLE I absolutely hate the taste I would rather receive it through an injection than how I have to take it but my psychiatrist told me that it is okay to swallow it with a drink instead of the manufacturer directions also it is kind of like false advertising because it says that it tastes like black cherry but it does NOT at all when I was 5 I accidentally ate a small amount of poop and from what I remember it tastes almost exactly the same.",2,17,2
"Saphris","Pratt93","November 1, 2016","Taken for 6 months to 1 year","I'm currently on Saphris, I just starting working for the first time in 3 years.  Ive been on Saphris about 10 months.  2 days ago I woke up and had white canker sores in my mouth, tingling lips.  This drug is so great,  can take it and wake up 6 hours later and not feel tired all day.",9,23,2
"Saphris","Gizmo298","October 10, 2016","-","A side effect of this medication for me was tardive dyskinesia.",1,13,2
"Saphris","Jisduit","October 6, 2016","-","I am the mother of an adult son that has been taking this medicine for over 2 years.  It has done wonders !!!  He has remained stable on this medicine.  He takes 2 10 mg doses at night with trazadone, lamictle, welbutrin and valium.  Right after taking his meds he does get the munchies and right after he is asleep - He functions very well during the day - is attending college full time going for his bachlors - Because he has done so well he was determined no longer disabled and lost his health insurance - the cost of this out of pocket her in VA is 1300.00.  He has applied for the assistance program and we are hoping - he doctor did give him samples and he is good for at least 2 months - if not maybe I will check into a Canadian pharmacy",10,23,2
"Saphris","Andrea the cutter","September 21, 2016","-","I have Bipolar II and I couldn't sleep and was suffering from mania and cutting. It helped with all of that. I could fall asleep in 10 minutes which was a god send. I went through the pharmacutic patient assistance program to get it free because it cost me $200 a month. After taking it for a while I noticed it was causing neurological problems in the form of foot drop. I constantly tripped and fell and had to wear a bulky brace on my foot. I came of of saphris during a manic episode and noticed that my foot healed. Saphris is good in some was but bad in others.",2,10,2
"Saphris","Lovajule","September 14, 2016","Taken for 1 to 6 months","I had tried many medications to level out my bipolar disorder and relieve my GAD and it seemed that when I would get one symptom straight one of the others would reappear. Years it took, eventually my doc decided to try something new when the depression hit and nothing seemed to be helping. So I started trileptal, which helped noticeably but I wasn't sleeping so he recommended saphris to help me sleep, I was a little apprehensive but desired to feel better so I agreed to try it. I am beyond satisfied with it. I feel better than I have been in as long as I remember. I am back in school full time and working full time without the edginess if mania. I feel like myself again. My friends and family have commented on how well I seem to be.",8,31,3
"Saphris","48 yr old male","August 29, 2016","Taken for 2 to 5 years","Have been on Saphris, Trileptal, and Effexor for about 3 years now for Bi-Polar disorder and depression.  I take 5mg of Saphris before bed and I can only sleep about 2 hours if I miss a dose of Saphris.  Otherwise, I sleep about 9 hours of deep and restful sleep.  I do not function well.  Not sure which drug is responsible, but I have issues with focusing and memory that I never had before.  I still have thoughts of suicide almost daily, but this is the best I've functioned on any drug and I've been on them all except Lithium.",6,16,3
"Saphris","BrizeVegasGal","August 15, 2016","Taken for less than 1 month","This drug was an experience in itself. The 1st night I got the restless legs syndrome and kept getting out of bed to go to the bathroom because I had this urge to urinate but... when I got there, couldn't. Then, the next day in the morning I felt whacked. Stoned. Then, I'd pick up after breakfast and my mind would race. I'd become manic. Which was enjoyable. Like an uber high. That bit was good. But kinda defeats the purpose ... so goodbye Saphris.",2,8,3
"Saphris","JMSS","July 18, 2016","-","Taken by teen with schizoaffective disorder. 5mg didn't work so well, gradually increased to 15mg and then medication worked wonders. Happy, stable mood, very little side effects after three months. Diminished irritability and aggression. More friendly and overall happier.",10,17,3
"Saphris","Bipolar penguin","June 28, 2016","Taken for less than 1 month","I was put on 2.5 mg every night of saphris, about 2 weeks ago. It has been utter hell for me. Not only Did it make my tactile hallucinations worse, it caused more problems than before. I've had to go to the ER. I'm more agitated than before. I'm bipolar. Isn't this a bipolar med? I'm not schizophrenic. And what's worse is that even though I'm on the lowest possible dose and only taking once a day, after stopping it IM STILL GETTING WITHDRAWAL SYMPTOMS! And not small ones. Like I said before I had to go to the ER. I'm drinking a lot of water but I still had a extremely low amount of electrolytes. I ended up using two full bags of fluid. This drug is not safe. It does more harm than good.",1,17,3
"Saphris","D Jones","June 2, 2016","Taken for 1 to 6 months","Used it for six weeks. Cluster headaches, Not able to sleep. Foggy all day from lack of sleep. Mind raced 1000 miles per hour. bm several times a day. muscle cramps in feet dosage 5 mg to start 2 days 10 mg 2 days 15 mg on day 5 at night.this went on for 6 weeks doctor saying it would get better. it didn't. finely stopped and went back to depakote. I can live with the small tremors. back to being able to sleep no headache",1,8,3
"Saphris","Deep Hein","May 31, 2016","-","Bipolar II with severe anxiety. Saphris is doesn't work for most people but for the ones it does work for, it can be a life changing miracle drug.  That's been my experience. I spent 10 years either so depressed or anxious that I could barely get out of bed.  I took my first dose at bedtime and when I woke up the next mrning the anxiety was gone. It gave me my life back. I take the whole daily dose at night.  It knocks me out cold for at least 3 hours and I can't function at alI if take it in the morning. I had horrible mouth sores.Finally figured out that it was from the dry mouth caused by my other meds. Now I take a sip of water first and after it dissolves, I suck on a caramel or a couple of pieces of candy.",10,24,3
"Saphris","HSog","May 31, 2016","-","Bad drug I wonder If all the good reviews  on the internet was written by the Company behind it ...first i took 5mg X2  The morning dose made me sleepy at the point that I can't stay awake for 5 minutes...Now I take 10mg at night It makes me sleep for 12 hours (Can't wake up) &amp; gave me Flat affect- totally impaired Thinking- Loss Of hope in life - Suicidal thoughts -Problems in tongue &amp; Talking ( bec. Its sublingual) ...Horrible Drug &amp; Don't Believe All the good reviews you read !",1,17,3
"Saphris","Lovepeguin","May 2, 2016","-","I was diagnosed  with bipolar in 2007 PTSD borderline personality disorder,panic attack  anxiety I was taking abilify,carbamazepine my doctor took me off those and put me on olanzapine but than my legs &amp; ankles started swelling so they took off that than my doctor wanted me to try Seroquel I really didn't want to try that because you become a zombie well I never got that drug instead I got saphtis but I'm having side-effects my legs,feet,ankles feels like my whole body swelling ankles,I'm itchy as well I don't know what the rash looks like is welts like mosquito bites or just hives? I'm not sure if I should stop taking it that will be sad if I have stop taking it because it really works for me other than I have insomnia and the swelling.",0,8,3
"Saphris","40 yrs old female","April 17, 2016","Taken for 1 to 6 months","Love it! This medication can have a tough adjustment period. But I took 1tsp of Benadryl with it at night and that helped me adjust. As long as you don't have symptoms of allergic reaction then my advice is hang in there. Saphris is by far the best medicine! I now take 5mg in the morning and 5mg at night with zero side effects. This med has made all my anxiety and paranoia associated with mania dissappear! I have been using free samples so far but the cost will be worth my health and sanity!",10,20,3
"Saphris","jay wins","April 9, 2016","-","Just took for my first time and instantly made my head, throat ,chest and stomach hurt my chest still hurt and it's Been over the ten minutes and my tongue is still numb I wish I could get my depikote back all these other meds are going to kill me",0,6,3
"Saphris","Yveron","March 28, 2016","-","I've been on Seroquel for 6 yrs and have had nightmares the whole time.  I switched to Saphris 4 days ago, 5 mg morning and night plus 112.5 mg Effexor.  I'm amazed at waking up early in the morning after 8 hrs sleep on Saphris where I've been sleeping 12 hrs a night previously on Seroquel then still a zombie for the next 3 hrs.  The morning dose sedated me so I'm changing to 10mg at night and also adding lamotrigine this week.  I haven't felt this good in many years, but I'm not elevated  I have BP 1 and live in Australia.  As I'm on disability, all of my medications only cost $6.20 each as its subsidised by the govt. I feel very sad for everyone in the USA with chronic illnesses.  It's just not fair.",8,28,3
"Saphris","Mrspickle","March 26, 2016","Taken for 1 to 6 months","Started on Saphris 2 months ago for sleep and bi-polar. I started at 5 mg---total nightmare! Couldn't sleep, picked arguments with my husband and was generally very hyped and energetic ( in a good but bad way!). I never saw a manic episode coming at me--but I saw this one!  After 5 days I called the doctor and was advised to go up to 10mg. WOW!! Immediate turn around that night (I only take it at night) and my sleep was fantastic! My attitude was amazing and my husband was delighted with his loving and easy going wife! I felt great--not drugged just happy and content. Work with it--it's turned my life around!",10,36,3
"Saphris","Anonymous","March 22, 2016","Taken for 6 months to 1 year","I am taking Saphris 10mg for bipolar disorder with manic episodes that turn into schizophrenia. I have been taking Saphris for 8 months. It has been the most effective medication so far for my symptoms. I take the dissolvable tablet you put under your tongue at night. After I take it I can fall asleep within 20 minutes which has been a godsend. During the day I have no drowsiness and sleepiness. I have to stop taking Saphris though because of what it is doing to my tongue and under my tongue. Four months ago I started getting white soars and skin peeling under my tongue where I put the Saphris. Woke up a month ago with white sores all along my tongue. Hasn't fully healed. Plus deformation of my tongue. Very sad bc now I have to go off it.",8,26,3
"Saphris","Heidi-was-here","February 18, 2016","-","I took Saphris and was given 10 mg samples from my Dr.  I felt great!  After a few weeks of samples- I went to fill my prescription.....After insurance it was $400.00!  I couldn't afford to get it filled.  It really stinks that a medication that made such a difference for mental health could be so costly.  I can only imagine this is why so many go without medication for mental illness.",0,36,3
"Saphris","RPO","February 11, 2016","-","My experience was very negative. I felt light headed and dizzy immediately and within two weeks I started falling asleep at random times, even while driving on the freeway. I had violent nightmares. I threw up constantly and according to my family started to lose my memory. I couldn't sleep more than a few hours at a time without waking up and having a panic attack. Sleeping medication did nothing to help that. The side effects became so debilitating that I had to stop it and move to something else.",1,12,3
"Saphris","MistyC","February 3, 2016","Taken for less than 1 month","I have found Saphris to be very effective, especially for my bipolar depression. I felt happy for the first time in 4 months and its only 2/3 days to work! I was taking lithium and lamotrigine, but the lamotrigine didn't bring my mood up and the lithium didn't either. Needless to say, I was feeling pretty down. Saphris made me feel clear thinking, motivated and reduced my anxiety. And it has only been a week and a day since starting it. I am very pleased. I still have a ways to go in terms of my over all experience with this medication. All the best.",9,25,3
"Saphris","AnneGeminiRose","January 24, 2016","-","Hi - I am reviewing the drug Saphris.  I've been depressed and have a sugar addiction all of my life am now 60.  First I was diagnosed with Dysththmic Disorder, then PTSD, Major Recurrent Depression, Anxiety, BiPolar 2.  I currently take Wellbutrin, Cymbalta, and half mg Klonipin for sleep at bedtime. I have a binge eating disorder.  Currently I've been in a long episode of depression and anxiety. I have anger and rage issues - After WLS - weight loss surgery in 2013 the anger and rage came forward - this is very distressing for me. I rarely have a rage incident but since the WLS I feel on edge, irritable most of the time and lash out easily. I've heard wonderful things about Saphris and wonder if it might help me.",1,6,3
"Saphris","P J A","January 14, 2016","Taken for less than 1 month","I've been actively seeking a remedy for my 'weirdness' for 40 years. I've tried counselling, antidepressants, and bipolar meds. While all of these have helped, none of them could do what I really needed for them to do to reach my ultimate goal; To fit in with society. I went to a shrink for GAD, and was prescribed Saphris. The effects were virtually immediate. The list of improvements in my life is 26 items and counting.       The drug is over $200/month in the states WITH good insurance. I found online pharmacies in Canada that sell it for $90 for a 3-month supply. It is shipped from India, which scares lots of folks because of their legendary lack of gov't regulations. I'm not made of money, so, to me, the risk is worth it!",10,22,3
"Saphris","Inky1969","January 10, 2016","Taken for 2 to 5 years","I have been on saphris for three years. I loved how calm and focused I was. But I have gained 60 lbs.  I told my Dr. A million times but she says it doesn't cause weight gain. Well I am very depressed. I exercise I eat very little and I can't lose a pound. Well now I am morbidly obese. And all the stuff I can't do because I'm so big has really got me down. I am weaning my self down and getting off saphris as much as I hate the side effects I am scared to see what my life will look like with out it. Oh my daughter was on it for two months and she gained 18lbs. Why can't we have both sanity and without gaining 50 freaking pounds. Grrr",7,28,3
"Saphris","Angela 478377","January 8, 2016","-","This was my second time trying saphris. Throughout my first experience,  it worked great for my severe depression,  but caused me to gain 20  pounds in a very short time frame. This increase in weight wasn't acceptable, as I battle with bulimia as well. The second time around,  a few years later,  I had high hopes for this medication,  as it had virtually wiped out my depression while on it in the past, and I was taking the precautionary measure of adding Effexor to my medication regimen to help counteract the side effect of increased hunger and weight gain. The Effexor did help with decreasing my appetite;  however the antidepressant effect was not nearly as strong for some reason.  It may have even worsened my depressive symptoms.",7,10,3
"Saphris","bipolarII","December 19, 2015","-","I was diagnosed with Bipolar II (with very few manifestations of depression) so mostly problems with mania. I started on 5mg at night for a week then went up to morning and night doses of 5mg. I did that for 2 days as the day time doses made me feel restless, uncomfortable, edgy, weird and sedated. I couldn't stand it and would count down the time before it would wear off. Then I tried taking 10mg at night but then I couldn't sleep. I would wake up exhausted for the 4th time in a night. Went back to just 5mg at night and this had little to no effect. I worried about weight gain but I lost weight- helped that I was extra cautious about what I ate. If 'increased appetite' is listed I take extra measures with exercise and diet to stay healthy.",7,10,3
"Saphris","Kenis","December 18, 2015","Taken for less than 1 month","I have been on Saphris now for 1 month. I have not been this happy in 35 years!  I am working out ever day now at the local health club. Last night I swam for over 40 minutes straight.  The only side-effect of this med is excellent REM sleep and a good night's rest.  Heaven help you if you don't have insurance....Very Pricey $$$$$",10,31,3
"Saphris","soulgr4ffiti4rtist","November 26, 2015","-","I was diagnosed with Schizoaffective disorder a month ago, previously Bipolar 1 with mixed episodes. Saphris changed my life for the better in so many ways. It helped cut down the agitation and anger associated with the mixed episodes almost right away. The paranoia still bites me every once in a while but it has been majorly decreased as well as the hallucinations and delusions that were plaguing me continuously. I sleep so well and don't have the medication hang over that risperidone was giving me at the dose I required. I started at 5mg and am now at 20mg at bedtime and it's working great. Hope the best to all who are trying to get the right med combo!",10,24,3
"Saphris","Concerned Hubby","November 12, 2015","Taken for less than 1 month","My wife had a severe reaction to this med after just 2 days. She could not swallow, she could not speak. She was catatonic for 3 days until I could get the doctor to understand if she can't swallow, she can't take her meds which meant catatonia and severe withdrawal from benzos. I got the doctor to giver her ativan IV and she was back in 4 to 8 hours",1,14,3
"Saphris","Any girl","November 8, 2015","Taken for 1 to 6 months","I have been on various antidepressants since i was 18, with some relief at times.  I've been very functional all along but never happy.  I've used other illicit substances to self medicate.  I saw a psychiatrist when I finally got sick and tired of spinning my wheels. She diagnosed me with bipolar 2 and put me on saphris. For the first month,  I felt AMAZING. I was getting things done at home, at work,  and even nurturing a social life again.  The med still works weekly for my mood but I've gained 20 lbs in just 2months.  This is really starting to get me down.  The med had changed my life,  but I'm not sure how much longer I can deal with the weight gain.  If it weren't for the weight,  I would've given it a10.",8,36,4
"Saphris","Just need some advice","October 20, 2015","Taken for 1 to 6 months","I like saphris but have experienced the nasty side effect of weight gain.  I had tried 4 other anti psychotics and all of them made me put on weight without relieving me of my bi polar symptoms.  I am staying on saphris because for the first time I feel normal. No more high highs or low lows.  However the increased appetite drives me nuts.  I literally obsess about food all day. I recently cut out all processed sugar to see if this helps. If anyone has any advice I'd love to hear it.",7,31,4
"Saphris","Zeusa","October 19, 2015","-","Overall ok, makes me sleepy and I take it 30 mins b4 bed to get me to sleep. I did find it put some weight on me and makes my eyes a little jumpy. That's  the extent of my side effects really. Overall I'm happy with it, it controls my mania and inability to sleep.",0,20,4
"Saphris","coaff1395","September 23, 2015","-","Words can not describe it.  The medication has turned my life around.  I still can not believe what it has done for me.  My mind has slowed down so much without taking away my ability to think sharply.  I am truly happy.  Anger, irritation, racing thoughts are almost completely gone.  I am Bi Polar 1 with GAD and depression.  I too am a mixed episode/rapid cycle guy.  This med has givin me my life back.  I have been shedding anxiety and sleep meds left and right.  If you can't afford it, please look to Canada.  You can get generic Saphris (asenapine) very, very reasonable.  It could well be worth going through a reputable Canadian pharmacy.",10,46,4
"Saphris","Kateannmarie23","September 16, 2015","-","I do not deal with fits of rage anymore nor do I go to extreme lows of sadness and the world is ending. Side effects I had were initially insomnia grogginess after taking the medication and a little bit more hungry. I eat a well-balanced diet with lots of vegetables some fruit high protein and I notice having a snack before taking it helps for hunger pains. I make sure to get regular low impact exercise such as walking. I am now able to be a better mother keep my jobs and feel much much much better mentally. Give it a try at least a month. It has been 3 weeks and I do not have insomnia at night anymore and have dropped 14 pounds. Stay positive don't let side effects get you down!",10,42,4
"Saphris","Bipolar Bob","August 16, 2015","Taken for 1 to 2 years","I'm Bipolar 1 Rapid Cycling &amp; also have ADD; this medication saved my life. I have been on it for a year now (along with a cocktail of others, I am BP 1, let's be realistic) titrating from 5 mg to 30 mg all at night. I was in constant mixed states, I couldn't control my impulses, my anxiety and paranoia were through the roof and I was unemployed - leaving the house, let alone working wasn't an option. I work fulltime now in a professional environment, back on my career track. My mood is stable, and for once in my 15 year diagnosis I can say I'm stable.  Side effects take time to pass, and some never go away, for me, its AM daily muscle pain for 90 mins. I haven't been able to touch a drop of liquor, not even a sip of beer; I prefer sanity.",10,47,4
"Saphris","Nick83","June 8, 2015","Taken for 1 to 6 months","I suffer from ADHD, Bipolar Disorder, and PTSD.  Saphris has helped take the edge off the bipolar symptoms.  I would have to leave the office whether to walk around the building or to go to the bathroom to splash water on my face, but now I can stay at my desk the entire day most days and am good with only leaving for bathroom breaks or to go get water.  I went from having PTSD nightmares 1 - 6 nights a week and waking up myself and my fiancée from moaning, growling, or yelling to having the nightmares about once a week on average or sometimes even going a week without any.  I take it at bedtime and within 10 - 15 minutes, I am really drowsy and falling asleep, which has also helped me.  As a result of these last two, I am now more rested",10,34,4
"Saphris","Bbrenda","May 24, 2015","-","Within two days dose I had edema in my calves knees and ankles 3 days it just got worse. Also the Saphris headache that would not go away. Did not continue with fourth dose. Great wonders if you have zero side effects",2,18,4
"Saphris","Kelcie","May 20, 2015","-","I suffer from Bipolar 1 Mixed Rapid Cycling, I started taking Saphris to replace geodon about a month and a half ago to reduce my Manic Episodes and I do feel better but I am gaining weight at an alarming rate!!! I have tried so many medications throughout the years for the manic episodes and am going to stick with this as it really does helps tremendously and I haven't suffered any other side effects.",8,21,4
