"Drug","User","Date","Period","Review","Score","Likes","Page"
"Brexpiprazole","Lilly","June 9, 2020","Taken for less than 1 month","<b>Rexulti (brexpiprazole):</b>			 I struggled with anxiety and depression for 17 years since age 6.  I tried every other medicine without success.  Finally, with the help of the almighty, I have greatly improved on Rexulti.  A real miracle!!",0,8,1
"Brexpiprazole","Melfell","June 1, 2020","Taken for 6 months to 1 year","<b>Rexulti (brexpiprazole):</b>			 Rexulti has been a MIRACLE for my anxiety/depression. I’ve tried pretty much every antidepressant on the market and had awful side effects with every one. I take lamictal for depression and adding this on top of it, it absolutely changed my life for the better. I have no side effects other than gaining a couple pounds, which I needed",0,5,1
"Brexpiprazole","Anonymous","May 27, 2020","Taken for 1 to 6 months","<b>Rexulti (brexpiprazole):</b>			 I started on Rexulti at the low dose of 0.5 mg. It was really helping with my break through depression. I have been taking Wellbutrin for about 2 years and I needed a little boost. Well 2 months later and I gained 10 POUNDS. Super disappointed. The medication works, but be ready to be depressed about how much weight you've gained from it. Won't recommend.",0,5,1
"Brexpiprazole","GradStudent048","May 25, 2020","Taken for 1 to 2 years","<b>Rexulti (brexpiprazole):</b>			 I’m back! I posted nearly 2 years ago on July 5, 2018 when I had been on Rexulti for a month. This drug helped me a lot the first few months, and then things just started going downhill. I gained 40 pounds in a matter of about 9 months, and I’m finally at a place now where my psychiatrist and I agree that I don’t need this medication anymore. The weight gain has just been really detrimental for my mental health because body image and eating disorders were part of my triggers. I hope that this medication can help other people and they don’t have to suffer with it fizzling out and causing unprecedented weight gain like it did for me.",0,5,1
"Brexpiprazole","Rivera085","May 2, 2020","Taken for 1 to 6 months","<b>Rexulti (brexpiprazole):</b>			 I have been on rexulti 4mg with wellbutrinxl 300mg, zoloft 200mg and adderall 90mg a day. Rexulti is for my depression. Yes I have gained so weight but I feel better on 4mg of rexulti. I need to figure out how to loose weight with this drug. But I also have other thryoid issues that messes with my weight constantly. I would rather be happy and gain a little weight than be miserable. I have come to the conclusion the medications are what you make it. I feel lots of relief from my depression. For years I felt like, even with 2 antidepressants I need something to stabilize me more. This rexulti is the only medication that doesn't change my personality or change who I am as a person.",0,8,1
"Brexpiprazole","Kells90","May 1, 2020","Taken for 2 to 5 years","<b>Rexulti (brexpiprazole):</b>			 Ok, so I've on on Rexulti for a few years now for depression. This is the best advise I can give someone thinking about taking this Medication. Currently I am on 2mg, I take it for major depression. My Dr started me off on 1mg. It seems like I had side efforts from the drug in the beginning. Dry mouth, weight gain, irritable and fatigue. So I started taking it at night. After about 2 weeks I then switched to morning again. Side efforts went away except for me eating :(. Overall its a good drug if it helps. I would recommend it. DOWNSIDE: do not just stop taking the drug! You most taper down on the medication. You will have effects if you just stop taking it. For example MOODY as heck. Then it takes a few days to build the medicine back up in your body for it to go away.",0,4,1
"Brexpiprazole","Anonymous","April 30, 2020","-","<b>Rexulti (brexpiprazole):</b>			 Took one sample and had a terrible reaction four hours later. Hot/cold flashes, sweating, flashing lights in eyes. Had to run to the bathroom to vomit. Had a similar reaction to abilify",0,2,1
"Brexpiprazole","Brando","April 16, 2020","Taken for less than 1 month","<b>Rexulti (brexpiprazole):</b>			 I’ve been taking the 14 day trial pack of REXULTI woman’s on the 9th night, I had the worst most vivid nightmare I’ve had in years. I also was unable to stay asleep for more than 1 hour at a time. I also felt several other side effects that are inconvenient. I do not recommend this if you have severe anxiety as it only works for a short period of time before stopping.",0,4,1
"Brexpiprazole","Ag","March 27, 2020","Taken for 1 to 6 months","<b>Rexulti (brexpiprazole):</b>			 This medication saved my life. My anxiety was so bad I couldn't take an effective dose of SSRI. Rexulti calmed my anxiety enough I was able to start upping my SSRI and my depression is getting better and better every day. My anxiety is almost nonexistent! I have gained a few pounds but nothing significant and I would rather gain 10 pounds and be happy than be miserable.",0,15,1
"Brexpiprazole","Madalena","February 28, 2020","-","<b>Rexulti (brexpiprazole):</b>			 I am a 22 year old female &amp; have been diagnosed with MDD &amp; anxiety. I was prescribed 0.5mgs Rexulti as an add-on to my 20mgs Prozac to alleviate lingering symptoms of depression, lack of motivation/energy,&amp; anxiety. I felt relief from said symptoms the morning after the 3rd dose! Now, I'm excited to wake up in the morning &amp; just live life. I have the perfect balance of happy energy &amp; calmness that makes going to school, doing daily life things, hygiene &amp; self-care tasks, &amp; social activities enjoyable and fulfilling. My social anxiety is gone, I am bubbly &amp; eager to engage with others, I am excited &amp; motivated to do school work, &amp; I quit having negative/self-betraying thoughts &amp; behaviors. The only side affect experienced was an increased appetite for the first week of the medication, but that symptom subsided within a week. I know there are plenty of negative reviews on here, but I HIGHLY recommend giving it a try. I feel like I have my life/personality back.",0,43,1
"Brexpiprazole","Pepper1981","February 20, 2020","Taken for 6 months to 1 year","<b>Rexulti (brexpiprazole):</b>			 I was given Rexulti for add on for depression. At the time I was constantly in a dark place. Lots of thinking of death. Not suicidal. It helped overnight. However, I had some bad side effects. Tardive dyskinesia of the mouth. Although not in the way this condition is talked about. I was unable to chew. It was as if I lost that automatical chewing. I lost weight as I was unable to really eat anything except fluids. I was then put on yet another medication (can't recall the name.) This helped a little but did not help the way I had hoped. I decided to go off the Rexulti cold turkey. And I felt as though I was my body was failing me. Felt worse than the flu. I gave it 2 weeks before I had to start taking it again. Now I am slowly tapering to lower doses. Please listen when I say DO NOT go off cold turkey. I was on 3 mgs. I am now on 2mg and hope to change dose to 1mg next.",0,13,1
"Brexpiprazole","Melancholia","February 19, 2020","-","<b>Rexulti (brexpiprazole):</b>			 I have been on Rexulti for approximately a month now, starting at the 0.5mg dose and now am titrating up to 1mg, I’m an 8 day cycle of alternating between the .5mg to 1mg respectively. This medication was prescribed to me as an add on to Persistent Depressive Disorder ( Dysthymia) by my psychiatrist. I am also prescribed Wellbutrin XL 300mg and Cipralex 20mg ... this cocktail seems to help me enough to get up for work and continue my duties in the home life as a husband and father without considering killing myself . Before I was given Rexulti I was semi suicidal daily so I guess it is helping . It is supposed to mood stabilize and give me an extra boost to get going however I do feel somewhat sedated while on this drug especially the days I take 1mg, which to me is not a bad think I would rather feel ok and sedated vs sad but energetic.",0,9,1
"Brexpiprazole","FortMac","February 4, 2020","Taken for 1 to 6 months","<b>Rexulti (brexpiprazole):</b>			 Was on 0.5 mg Rexulti for 3 months as an add-on to Mirtazapine for depression. It massively increased my anxiety and caused tremendous restlessness - I couldn’t sit still or concentrate. Have tapered off over a 30 day period and am finally feeling calmer. This medication was just released in the past few years, I feel like it hadn’t been evaluated sufficiently prior.",0,13,1
"Brexpiprazole","McLovin","January 24, 2020","Taken for less than 1 month","<b>Rexulti (brexpiprazole):</b>			 Absolutely horrible experience. My psychiatrist gave me a free two-week sample of 0.5mg Rexulti pills. Since I began taking them I have been EXTREMELY irritable, stressed, and unable to calm down. I’m throwing the rest of them in the trash, hopefully these symptoms will go away soon.",0,14,1
"Brexpiprazole","Chrissy","January 19, 2020","Taken for 1 to 6 months","My experience is a bit different to others I had bipolar disorder. I’ve been on this for a month and I’ve lost 9kgs which is great. My mood is a lot better overall. The only issue I have is drowsiness about four hours after I take it to the point I feel exhausted and need a nap, I’m not working at the moment so that’s not an issue but it will be when I’m working. I also have this feeling in the late afternoon of restlessness and sometimes anxiety comes with it, I can’t sit or lie still. I believe this may be an acute experience of akathesia and will be talking to my doctor when I consider renewing the script. My mood is more tolerable and my outlook on life is a lot better.",6,2,1
"Brexpiprazole","Not myName","January 10, 2020","-","<b>Rexulti (brexpiprazole):</b>			 I was on this for Depressive Episode / Delusions. The side effects doctors won’t tell you about that happened to me: high blood sugar, high blood pressure, fast weight gain, lethargy, heart palpitations, constant panic attacks, insomnia, migraines, stomach and digestive issues, and much much more that ruined my entire summer.  BTW: it only  works  for two weeks to a month then it stops completely as shown by literally half of the reviews on this. Disgusting. Put in more research before shoving in experimental antipsychotics into peoples mouths whenever they even feel a tad bit sad.",0,24,1
"Brexpiprazole","Doc","November 29, 2019","Taken for 6 months to 1 year","I have been on Rexulti for about 8 months now and it is time to get off of it.  It worked a while and then the depression started getting worse and was having cramps all of the time.  I got to where I hardly wanted to drink anything and was experiencing dehydration.  I quit taking it 3 days ago and have not had any adverse side effects.  I take seroquel for sleeping and I think this being another antipsychotic, it is keeping me from having any withdrawal symptoms so far.  If I start having any withdrawal symptoms, I will take one every 3 days then go off for good.  I really do not think I a going to have too many adverse effects being that it has been 72 hours so far.  I am going to try to eventually wean myself off of seroquel once I am completely off of Rexulti. I appreciate all prayers for sure and will say a prayer for all who have posted on this site. Godspeed, Doc",0,0,1
"Brexpiprazole","Shawn","October 30, 2019","Taken for less than 1 month","<b>Rexulti (brexpiprazole):</b>			 For those that like this med Rexulti  but stop because they gain weight, I'm on the keto (low carb) diet and you will not gain weight. You have to stick to it.",0,50,1
"Brexpiprazole","Emma","August 24, 2019","Taken for less than 1 month","<b>Rexulti (brexpiprazole):</b>			 Been on it for a month, and I don’t think I can continue this medication. it must be too strong for me because it makes me feel like I’m dreaming, and makes my body feel so so strange and numb. Kind of like when your legs fall asleep, but all over and for hours and hours! I think it’s helped my anxiety, but I can’t stand feeling numb!! Also makes my head so foggy I felt like I was drugged all day today.",0,24,1
"Brexpiprazole","Margo","August 20, 2019","Taken for less than 1 month","<b>Rexulti (brexpiprazole):</b>			 I was diagnosed with panic disorder about 5 years ago. Under that umbrella includes agoraphobia, anxiety and depression, GAD and PTSD. I am a forensic pathologist and realize these come with the job. I started out on Zoloft and the absolutely awful Xanax (2.0 mg qd). After 3.5 yrs of self-prescribing with my family doctor I began seeing a psychiatrist. Over a year later I have been on Pristiq (100 mg) and Xanax (0.5 mg). I wasn’t feeling any better during this time and was given Buspar, Wellbutrin and Seroquel, none of which I took for more than a couple of days. I was zonked out from this mix. I began Rexulti one week ago and have seen incredible improvement in mood and energy. I’m only on the first baby step and am hoping this will help me wean off Xanax. I have not had any bad side effects so far and have actually lost weight. I’m already on a low sugar diet and gym at least three days a week. Keeping fingers crossed",0,52,1
"Brexpiprazole","lrivera1902","August 9, 2019","-","<b>Rexulti (brexpiprazole):</b>			 This is my 3rd time trying Rexulti. Honestly, the first 2 times I took this medication my other psychiatrist only gave me 2mg. It did not work for me. But, I switched psychiatrist and they gave me 4mg for my depression. What a major difference. I am on weight watchers freestyle and I actually lost 3lbs on this medication while doing this program. Yes, it can cause weight gain. But, as soon as I started taking this medication I immediately went on weight watchers freestyle. The only thing is my sugar was high when I got blood work.  You really need to watch your sugar when on this medication and eat a healthy diet. People say this medication causes weight gain so you have to be really careful and watch what you eat.",0,30,1
"Brexpiprazole","closet smile","August 4, 2019","Taken for 2 to 5 years","<b>Rexulti (brexpiprazole):</b>			 The commercials are making me worse.  I'm sick of seeing the happy face being shoved down my throat.",0,21,1
"Brexpiprazole","Deco","July 17, 2019","Taken for 1 to 6 months","<b>Rexulti (brexpiprazole):</b>			 Glad it helps some people but not for me. Gained almost ten pounds in three weeks- made eating feel like a compulsion that was never satisfied. Tried one more week to see if any positive results with it would show up, but never noticed any.",0,17,1
"Brexpiprazole","Genesis11","June 17, 2019","Taken for 2 to 5 years","<b>Rexulti (brexpiprazole):</b>			 I was prescribed Rexulti as an add on medication to several other antidepressants that I had been taking for several years. The other medications worked wonderfully for about 4 years but then I began to experience some relapse of depression and anxiety symptoms. and that is when my doc recommended I start on Rexulti. She started me on a low dose of .25mg/day and slowly worked up to the target dose of 2mg/day. It worked quickly (within 7 days) and I started to feel much better. It wiped out the depression and anxiety and I felt so normal and able to handle life. No side effects for me. I can still experience a normal range of emotions too.",0,95,1
"Brexpiprazole","kris","May 17, 2019","-","<b>Rexulti (brexpiprazole):</b>			 Hello! I am and 18 year old girl and I have a hell of a story.  I was put on zoloft for a long time - maybe 3 years, so I started when I was 15 years old which  was when I was diagnosed with depression. 3 years went by and I started getting worse and worse. They misdiagnosed me - I really had bipolar disorder so they then took me off the Zoloft cold turkey. Then they put me on Latuda and Lamictal. Latuda made me throw up 30 minutes after taking it, plus it didn't work. The lamictal did help my mood though,  so they took me off Latuda. I felt so hopeless. That was until about a month and a half ago, when I was put on Rexulti and within a day of taking it, I felt so much better. No joke, this Rexulti is a miracle drug, everything has been so much better. It helps me feel balanced and I don't have severe episodes. It really calmed me down and made me happier. My only complaint is that I had a big appetite within the first two days of taking it. To those searching for a prescription that works- PLEASE at least TRY rexulti.",0,59,1
"Brexpiprazole","Beloved","May 10, 2019","Taken for less than 1 month","<b>Rexulti (brexpiprazole):</b>			 This medicine is hard to rate. While  taking it, I  had never felt better.  Seriously,  my depression was gone, I felt like getting out again.  I felt like I had my life back, BUT I  began having cravings like I had never had before.  I was eating uncontrollably.  I  was getting up in the middle of the night to eat. I  have never had this behavior before and I'm in my 40's. In the past, if I began gaining weight,  I  immediately talked to the doctor and had my medication  switched.  However,  this time,  I was conflicted.  The way I felt taking Rexulti felt like a miracle and I hated the idea of quitting,  until.....I gained  70lbs!! I even gained  20 lbs in 3 days. I finally felt I had no choice but to stop Rexulti. I've been miserable for almost two years now.  I've recently lost 23 lbs, but it has been so difficult.  If I could go back, I would have switched after the first 10 lbs!! Sometimes,  it feels like a no win situation.  I'm committed to losing weight.  I've got to do this!",0,53,2
"Brexpiprazole","B","May 2, 2019","Taken for 1 to 2 years","<b>Rexulti (brexpiprazole):</b>			 Rexulti works if you are in a rough spot, but I have gained 80 lbs using this. My brain works, but the weight gain is not healthy for me. My doctor and I have agreed to discontinue this medication and are looking into alternatives. I lost 15 pounds the first week I lowered my dosage in half. I will continue to reduce dosage until it is out of my system. Anyone that uses this I would recommend keeping tabs and seeing what effect it has on your body during the first few months.",0,32,2
"Brexpiprazole","Brittany","May 2, 2019","Taken for 1 to 6 months","<b>Rexulti (brexpiprazole):</b>			 My problems are Bi-Polar disorder, anxiety, depression. I was switched from Latuda 80mg to Rexulti (which my doctor pushed on me and had samples). I also take Adderall, Prozac. I started having tremors, and the biggest panic attack in my life that I ended up in the hospital. I didn’t know what was wrong with me so I switched to an NP there. We both thought it was the Adderall making me tremor, this morning NO TREMORS. I went back to Ability 10mg at night with my other usual meds! This med is NOT for people with non-polar disorder, it will make you worse. I’m sure it will help with depression but they have no proven facts stating that Rexulti is for non-polar. Studies actually made it clear it made bi-polar worse.",0,16,2
"Brexpiprazole","Matt","April 25, 2019","Taken for 1 to 6 months","<b>Rexulti (brexpiprazole):</b>			 I was on Lexapro for many years, 20 mg/day.  It helped with anxiety but not really for my depression.  Began Rexulti and is started working within 2 days.  I started at 0.5 mg and worked myself up to 2 mg/day.  I have significantly increased energy and went from sleeping 8 hours to 6 hours a night.  Mood has been better and activities seem doable and world is bright again.  I seem to have less dread about life activities and feel happier, more energetic, and ready to tackle the world.  No spasms, or other strange side effects.",0,75,2
"Brexpiprazole","Rocklinrobin","April 11, 2019","Taken for 1 to 2 years","<b>Rexulti (brexpiprazole):</b>			 I am presently trying to recover my mind after feeling depressed for about 6 months. I have been taking Pristique for years, and my doc added Rexulti  a week ago.  I must admit it is SLOW going, writing this is exhausting. I see a psychiatrist that I like and admire, I have severe depression on both sides of the family. I've had episodes of depression in the  past, neither this intense nor long and I'm scared. I have vowed not to harm myself, to my husband and children, who top  my gratitude list, but I'm dancing as fast as I can.",0,22,2
"Brexpiprazole","KAK","April 2, 2019","Taken for less than 1 month","<b>Rexulti (brexpiprazole):</b>			 Wow! It's only my first day on rexulti and the difference is amazing. I have lots of energy and am so happy!!!",0,26,2
"Brexpiprazole","T","March 15, 2019","-","<b>Rexulti (brexpiprazole):</b>			 I’ve been on every Depression medication imaginable, none that worked totally. I was in a deep dark hole, fatigue, depression, paranoid. With being prescribed Rexulti in just a few days, I have my life back, I have all my energy back, depression is now hardly zero and my paranoia has diminished! No side effects for me! I recommend trying this to anyone suffering like I was!!",0,69,2
"Brexpiprazole","Anonymous","January 29, 2019","Taken for 1 to 6 months","<b>Rexulti (brexpiprazole):</b>			 I was put on .25 mg of rexulti to help the effect of my Lexapro. After increasing the rexulti to .50 I had my first major seizure. I was taken to the hospital and they said it was probably a non epileptic seizure. I called my doctor who said it could not be caused by the rexulti and increase the dosage to 1mg. After that my seizures increased to three or four times a week. I weaned myself off rexulti and now I am seizure free. Please be careful with this drug.",0,34,2
"Brexpiprazole","Kn","January 9, 2019","Taken for 1 to 6 months","<b>Rexulti (brexpiprazole):</b>			 I never write reviews? But I feel this is totally necessary to tell how amazingly well this drug worked for me. I have had a horrible year. I’ve been on Prozac for 15 years and all of a sudden it stopped working. I switched to Zoloft and had relief for 5 months and that stopped working. My doctor prescribed rexulti and I’ve been on it for a month. I feel like I have my life back. I feel better than I have felt before even on Prozac. I started feeling better after 2 days and felt like myself again at 4 days. Zero side effects on this medication for me. It’s beyond worth a try.",0,66,2
"Brexpiprazole","tkmetal","December 13, 2018","Taken for 1 to 6 months","<b>Rexulti (brexpiprazole):</b>			 Took Latuda did nothing for me so Psych started me on Rexulti in mid-September. Took me off for a week in November because side effects were severe, shaking leg, irritable, restlessness. Been back on it almost 6 weeks going from 0.5mg to 2mg now feel a little ok but still have lack of interest in things I enjoyed, I still have sadness, I'm functional but not really present. Read that some of these meds can take up to 6- 8 weeks before I feel full affect. I'm on Pristiq 100 mg and 2 Clonzapem a day. Hopefully will feel full effects shortly.",0,18,2
"Brexpiprazole","Justagirl","December 11, 2018","Taken for 1 to 6 months","<b>Rexulti (brexpiprazole):</b>			 I've been on Rexulti for about 5 months now. I told myself I would write a review because I know there are people out there looking for hope and good reviews. This drug definitely took me out of a dark hole. It took 3 days for it to work. I remember waking up feeling normal again. I take it as an add on to my anti-depressant Mirtazapine. I gained weight at the beginning but I was able to shed it off shortly after. I have some extrapyramidal effects but nothing weird. I just feel a weird twitch in a muscle every now and then. I keep an eye on it though. Other than that, no other bad side effects. I would give it a chance if your anti-depressant isn't doing enough. I take 1mg.",0,44,2
"Brexpiprazole","Natalie","October 19, 2018","Taken for 1 to 6 months","<b>Rexulti (brexpiprazole):</b>			 I was put on this medication to help with the fatigue I’ve been experiencing for close to 2 years. I was taking it in conjunction with Cipralex (20 mg) which I’ve been on for 8 years. I was taking 0.5 mg of Rexulti for the past 3 months and my energy levels were great. Unfortunately it made me gain 20 pounds in that time. My appetite was out of control... seriously, I was eating out like 4-5 times per week and binging at night. Insane. I just went off of it close to 2 weeks ago and after 2 days my appetite went back to normal. I just can’t be on antipsychotics.",0,18,2
"Brexpiprazole","crazydude81","October 18, 2018","Taken for 1 to 6 months","<b>Rexulti (brexpiprazole):</b>			 Dear God, save me from this drug.I took this for 2-3 months, violently sick 2 my stomach daily. My doc tried a variety of antidiarrea pills to no avail; I lived in the bathroom. I worked to d/c thru a slow taper, causing the worst drug w/d I've ever encountered. Going from 2mg to 1mg I threw up IN my car TWICE, &amp; walked around w/intense nausea. I had to taper at a 1/4 mg after that, sick throughout. I eventually got off-a near wk ago, &amp; bc of its lovely 91 hr 1/2 life I'm still stuck in the bathroom. I wake up nightly, rushing to the bathroom. It's lightening-up but better has never been such a relative word. I guess a decrease from 20+ trips without warning to 7-8 times with a manageable 15 minute daytime warning is an improvement, but it's not quality of life. No prior major stomach issues, just this nasty pill that's caused a complete life interruption. At the very start of a stomach issue I'd advise tapering off, there is no drug known to man that can control Rexulti's effects on your GI track.",0,21,2
