"Drug","User","Date","Period","Review","Score","Likes","Page"
"Tramadol","apricot","May 23, 2019","Taken for 1 to 2 years","I have always suffered with depression and was using antidepressants which helped somewhat then I ended up with back pain and was prescribed tramadol which has helped me a lot. Lost my husband last year and at times just cannot be bothered with life but if I take tramadol it improves my mood and I get on with my life. It has made a big difference. I want to give it up because I get constipated which I think is a side effect but there are things I can take like fruit and high fibre to get rid of that problem. Every time I try to give it up I get so down that I have decided at the age of 72 why not continue taking it and enjoy life the best I can. I take 50mg in the morning and evening and half at lunch time every day. I still take an antidepressant with it. My dr told me if the pills work thats what it is all about feeling better.",10,41,2
"Tramadol","Alice","May 7, 2019","Taken for 10 years or more","I have had the same experience as so many in here. Took tramadol for pain originally then found it gave me quality of life and got rid of depression. My problem is getting a doctor to prescribe it.",10,33,2
"Tramadol","Michael hal","March 27, 2019","-","I have depression  my doctor  gave me antidepressants , It didn’t work  Got sick of it , Went to my cupboard to get panadeine (paracetamol with codeine) forte to knock a headache  out so I can rest , Depression was getting to me , While looking for it, I saw an old carton of tramadol , It was for my sister in-law for her tooth pain 2 years back , So I took that instead , And guess what , I felt like never before, Even when I never had depression , I wasn’t sure it was from tramadol  I remember walking and saying to myself , the depression is  going  I was happy  Then later I started feeling the depression back it was thesame , Strange , I was curious-  was it tramadol? , Mmmmm  So I took another 50 mg  Wow  Felt great  Slow release  It took around and hour to feel it  But went full day  It works  Control is key  I want to live happy  Regardless what I read  It worked for me  Better addicted and happy  Than not addicted and miserable  Words I told the doctor  I’m still no more than 50 mg sometimes 25 mg low dose  4 times a Week",0,31,2
"Tramadol","Klams","March 16, 2019","Taken for 2 to 5 years","Tramadol is life changing for me, all of my depression, and social anxiety vanishes and I want to talk to people, get out of bed, do things and enjoy life.   I am 300 lb. I take 50 mg just to stop the worst feelings, 100 mg to be active and totally free of anxiety and depression. The effects last for a full day, and sometimes into the next day.  I never take more than a dose a week, so I am often sleepy the next day, but I can get through that easily with caffeine.  I don’t know how to get it prescribed. Doctors just don’t care that it has been transformative. It doesn’t seem fair.  I have a small supply obtained illegally. I take them only when I absolutely can’t face life as myself any more.  I avoid feeling the effects while working. (Even though effects are mild, I don’t want anything to affect my job performance), so I only allow myself relief one day a week or less.  Other SSRIs have not helped me much. They just make me not care about anything.",0,43,2
"Tramadol","forrin","March 7, 2019","Taken for 1 to 6 months","Doesnt do a thing for me ,",1,3,2
"Tramadol","Wifeofpie","December 9, 2018","Taken for 1 to 6 months","My family has a history of depression. I also have back issues. I took my first dose of 50 mg tramadol tablets. I was so shocked to realize it did little for my back pain but my mood was altered for the better. It helped my depressive issues almost immediately. I was shocked to say the least but also very relieved to fine my spirits lifted without feeling sedated at all. It is amazing.",10,49,2
"Tramadol","Pix3L","November 18, 2018","Taken for less than 1 month","I have been on Suboxone for 2 1/2yrs. I've always had issues with Depression/Anxiety. However, the Suboxone has made my Depression/Anxiety 1000x worse and I have been put on different kinds of SSRI/SNRI medications, nothing has worked. I did some research on Suboxone combined with Tramadol and let me tell you, I was my bubbly self again. I felt amazing for the first time in a long time. The opiate side of Tramadol gets blocked by Suboxone so its Tramadol's anti-depressant component that is working its magic on me.  The DR will not prescribe this to me since I am on addiction treatment, he won't even prescribe me an anti-depressant that matches Tramadols. I have made my situation even worse now since I got to experience Tramadol's anti-depressant magic knowing I cant get that medication prescribed. Imagine every waking day in mental misery and someone hands you something that makes it all go away but to be told you will never get it.",10,37,2
"Tramadol","Julz77","October 29, 2018","Taken for 2 to 5 years","I LOVE Tramadol. I'm a stay at home mom and I'm over weight, big chest, and my back hurts all the time. Chasing toddlers around and doing house work can be aggravating at times. I've found tramadol to help with quite a few things. Mood, Motivation, pain, depression. I no longer take valium and effexor for my anxiety and depression because tramadol helps everything in my case! It's a wonder pill for me. I usually take 50mg when I get up, 1 later on in the day, then 1 at night. Sometimes I might take 2 in the morning and then 1 later that evening. But regardless tramadol makes me feel normal and able to do my everyday duties without being in a slump. Shame it's a narcotic now bc doctors are hesitant to prescribe and you don't get refills so u have to go every month to your doctor to get it. Hope this helps someone in pain and or depression as I've found it to be of help in both areas!!!",10,65,2
"Tramadol","Taximanlondon","October 11, 2018","Taken for 2 to 5 years","I've had depression since I was very young. I never accepted SSRI and just carried on regardless. My diabetes eventually gave me peripheral neuropathy and my feet hurt. Tramadol was prescribed for the pain. Since taking the tramadol my depression has been virtually non existent. I have not told my GP as he will probably stop the prescription .I do not have euphoria or anything like that, I am though functioning as a real human being with energy and purpose . My life is not perfect but its much much better , it can't just be a coincidence. John Lennon said  Whatever gets you through the night, It's Alright I wish all you fellow suffers the very best luck x",10,54,2
"Tramadol","Maynard","October 11, 2018","Taken for 1 to 6 months","I have been taking 100mg at once during the morning about every 3 to 4 days and I’m amazed how it calms me down. Unfortunately not taking it for 3 to 4 days makes me a little more depressed. Would love to take it once a day everyday but am afraid to.",9,23,2
"Tramadol","BJ","September 30, 2018","Taken for 5 to 10 years","I was at work some years ago I was a welder, and started getting to where I got tired real easy and I couldn't figure it out. And one of my co-workers gave me a Tramadol and it was like wow !! I can make it through the day now. I take one 50 mg a day . If I don't I start to feel run down and tired. I don't know if I had some kind of mild depression or not but that's the way it helps me.",8,29,3
"Tramadol","Moonflower","September 4, 2018","Taken for 5 to 10 years","The last SSRI I tried put me into a manic episode.  After 30 years I discovered Tramadol, the only medication to date that helps with my depression. Then, Tramadol was re-classified and now my psychiatrist wants me to get off the drug.  I tried twice in the past to taper back from the 150 mg that I take in divided doses every day.  Used the slowest taper schedule I could find online.  The withdrawal is bad,  I couldn't take the shaking and suicidal thoughts, so continued to take it.  I came to peace with taking tramadol, especially after reading about the difference between addiction and dependence.  I am dependent on this medication to keep me alive, literally.  I don't crave it and I have no desire to increase my dose, both of which are signs of addiction.   Am so grateful to read about other people's positive experiences with Tramadol in treating depression.  There wasn't much info out there when I started to look into it several years ago.",8,54,3
"Tramadol","Tess","August 23, 2018","Taken for 6 months to 1 year","I was given Tramadol for foot pain by my orthopedist. I didn’t particularly notice that it helped my pain, but it certainly improved my mood.  And fast.  I’m not saying I was hugely depressed and have never been treated for depression,  but my improved mood was a surprise.  It doesn’t make me feel high or anything like that, and I’m not an overly anxious person, but it just makes me happier and not so grumpy!  The only thing is, my doctor hasn’t given me much - guess it’s very controlled. So I got more elsewhere. It only takes about 50 mg a day for me.  I did go several months without any and didn’t feel any withdrawal side effects other than some sweating and a return to my normal mood.  I certainly would not want to take more than 100mg a day.  I have never taken much medication in my life.  I have friends on anti-depressants etc., and have mentioned this effect with tramadol.  Interesting reading other people comment on this.",9,28,3
"Tramadol","Soso","August 15, 2018","Taken for 1 to 2 years","This medication was initially prescribed for back pain. As an unexpected side effect it dealt with my MDD perfectly. Unfortunately I am medication sensitive and started to have negative side effects so had to slowly get off this medication. For some reason the withdrawal was horrible. Everybody responds differently and even though this medication worked with the pain and depression it's side effects made it impossible for me to remain on it and the withdrawal was the worst part for me.",1,14,3
"Tramadol","Sad Sally","June 24, 2018","Taken for 6 months to 1 year","I have chronic depression and PTSD.  I have tried all the SSRIs and SNRIs. I've tried combinations of supplements,  and checked into magnetic brain stimulation treatments.  Nothing worked. I was in a car accident and hurt my back. I was prescribed Tramadol and noticed within a couple of day that I  felt normal, happy, not anxious.   So I talked to my doctor who is willing to continue prescribing it for me.    I still have my negative thoughts but they don't dominate my day,  nor disrupt my life.  I keep up on my magnesium L-threonate, magnesium glycate and L-theanine which make a big difference.   Everyone's body chemistry is different.  This drug works for my chemistry.  I understand that I will have to take a medication for the test of my life, but it's a small price to pay. There are days I almost didn't make it through. And I'm fortunate to have found something that works for me.",9,48,3
"Tramadol","Shellbell","May 7, 2018","-","I was reading some of these past comments and I have to say some of you I am very disappointed. Every single drug you take on this planet has side effects and it has withdraw symptoms I don't care what medicine you take! Every drug you take long enough has a dependency issue. I mean come on even coffee people have withdrawals to that. I have taken tramadol for back pain ovarian cyst, and then my psychiatrist told me he wanted me to continue on this medicine because it's been proven effective in treating depression, and I have been on every anti depressant they have ever made and horrible health and side effects and I was not having a good quality of life. The good out weighs the bad. And my life is finally getting better. Now shame on you adults that are bashing people for taking tramadol for depression. My life is good.",10,82,3
"Tramadol","Anonymous","March 3, 2018","Taken for 1 to 6 months","Honestly the best option I've found for treating my depression. Very limited side effects compared to standard anti depressants. Only thing that has bothered me are heat flashes at night, but that is manageable. Would recommend taking days apart to help not  build dependency.",8,34,3
"Tramadol","Egghead99","January 7, 2018","-","The comments resonate with me regards Tramadol. I was diagnosed it for back pain which it relieved and gave me a surge of energy and wellbeing which later disappeared with use, but it is still useful for relieving my dire morning depression, if taken 2 hours before rising I can face getting out of bed.",7,25,3
"Tramadol","davetrindle","January 2, 2018","Taken for 5 to 10 years","My Pdoc tried this after so many SSRIs had little effect. Tramadol worked much better right away. I wouldn't suggest taking more than 100mg, as this drug is very difficult to taper down from. When you taper off, reduce by 12.5mg per month to avoid withdrawals and give your body time to adjust. I have since tried Niacin and found it equally effective for Depression and Anxiety.",10,27,3
"Tramadol","Iljc1225himg","November 28, 2017","Taken for 2 to 5 years","I am a 65 year old Male and suffer from depression. My Psychiatrist prescribed Tramadol 50mg daily.  I have been taking it for three years and it works terrific.  I have tried SSRIs in the past but did not have any success. I have heard horror stories about the withdrawal symptoms of Tramadol so I have taken some days off or decreased my dosage to test and experiment the withdrawal effects -- but I am not sure I want to go through the rest of my days bummed out and unproductive.  I have heard all the stories about working out, proper diet, self-talk etc...  I am very disciplined in adhering to these principles -- but it does not help my depression. Just my two cents.  Jerry",8,51,3
"Tramadol","rndthewheel","October 23, 2017","Taken for 2 to 5 years","without going into a long story, I feel much better on tramadol even if only 1/2 to 1 tablet a day, w/out it, I feel pretty shitty at times, similiar to flu symptoms, depression, anxiety.  I'm hesitant whether to tell this to a psychiatrist, how likely would they go along with it or encourage getting off of it, it's been very hard to get off even this low dose",0,25,3
"Tramadol","HealthIsEverything","August 29, 2017","Taken for 1 to 2 years","I was put on Tramadol for pain and a funny thing happened.   I noticed I felt more energy and overall well being.   I had felt a bit depressed over the years and they tried a few meds but none seemed to work.   I had surgery and was given tramadol.   Once the pain was gone - I stopped it and noticed I fell back into my old slump.   I was in therapy and tried everything.  Years later  I went to Mexico for business and saw Tramdol in the pharmacy.  I bought one bottle of 50mg capsules and said let's try this. 50mg twice a day.  Within 2 weeks people were commenting I seemed like I was happier.   It does not give me a high like hydrocodone and other opiate meds.   They need to explore this and stop shooting it down as an antidepressant.",10,86,3
"Tramadol","Myriam zapata","August 27, 2017","-","Using for over 5 yrs.  great for depression and feeling energetic.",10,50,3
"Tramadol","Beckums","July 30, 2017","Taken for 2 to 5 years","Tramadol is NOT an opiate.  It does act on the same pain receptors as opiates, but it does not have the same addictive quality as opiates and does not have the same risk of abuse as opiates.  You can become dependent on Tramadol, just as you can be dependent on SSRI's.  You can't cold turkey quit an SSRI without some really gnarly withdrawal symptoms and the same goes for Tramadol and opiates and tons of other drugs.   I've been taking Tramadol for 4 years for general pain in my body due to end stage renal disease and osteodystrophy.  Since I've been taking Tramadol I have not needed antidepressants and I find that I function at a higher level with Tramadol than with any SSRI I have ever taken.  There are no negative side effects for me.",7,64,3
"Tramadol","BlueMoon34","July 3, 2017","-","I originally took Tramadol for pain.  I previously had bouts with depression, which totally consumed me.  I tried Tramadol (50mg noon time and one at bedtime.  ) It pulled me out of the depression before it took me over.  Works great.",9,54,3
"Tramadol","Dallas Mike","June 9, 2017","Taken for less than 1 month","I have treatment resistant Major Depression and as a result, I've taken so many drugs over the years that I can't list them all. I got kidney stones a while back and got tramadol to help me with the pain. It didn't help much for that, but it sure helped treat my depression. I talked with my primary care doctor about this and she's reluctant to prescribe it if it isn't for pain. As the result, I'm going to find a new doctor... One who knows a bit more about psychiatry.",10,48,3
"Tramadol","Diy","June 3, 2017","Taken for 2 to 5 years","Was prescribed for knee injury. I tried all sorts of SSRI,  SDRI , tricyclics,  etc. for unexplained depression. All of them had side affects so detrimental that it made me more depressed. Of course the so called doctors want to give you more drugs to counter the side affects all the while claiming your a border line heroin addict all the while having no idea what is causing the depression all the while suggesting it's all just maligned thought processes.Thank goodness I have arthritic knees. After taking tramadol by depression is gone . Fact. Every patient is different. Don't be pigeon holed.  I have been taking one 50mg per day for years. Works somehow. If it is placebo then why didn't all the other Meds work the same. For once I'd like to hear a Doctor just say  i dont know.",10,73,3
"Tramadol","LifeIsAmazingAfterTramadol","May 25, 2017","Taken for 6 months to 1 year","I lived most of my life feeling terrible and out of place. I was an anxious, low-self esteem, depressed guy. Everything took effort to accomplish, I had few friends because I was afraid of expressing myself and had almost no confidence in myself. I have been taking tramadol daily for about 6 months (100mg in the morning and 100mg after 5-6h), and I feel like a different person. I'm confident, have energy and feel like a normal guy. Keep in mind that at first you may feel some euphoria and you must not chase it by taking more. The anti-depressant and anti-anxiety effects will remain, while the euphoria will disappear.",10,63,3
"Tramadol","TheCattlerWrangler","May 19, 2017","Taken for 1 to 6 months","I see a recurring theme in a lot of these entries....(person x) was prescribed Tramadol for pain, and it did wonders for depression and mood.  However, when discontinuing use, one's symptoms quickly return, often worse than before.... Tramodol is an OPIATE.  Think Opium, Heroin, Oxycodone, Hydrocodone, Codeine, etc. What you're describing is the pattern of Opiate usage and it's dangers.  This is why it is a poor choice for depression treatment - it's like giving a Mercedes to a guy who's lost his job and his house is being foreclosed on....feels good for a couple days, but.....",3,27,3
"Tramadol","Anonymous","May 15, 2017","Taken for 1 to 2 years","Antidepressants have had no effect on my depression in the past. I was unable to find the motivation to support my family or even go to work which caused me to lose my job. I started tramadol for a back injury as it is a non-habit forming pain reliever. It changed my life. immediately, it wiped out the depression. 100% gone. It is not much of a pain reliever, it is not very strong and I still am in pain. I can deal with it though and the lack of depression is worth it. The only downside is that when it wears off the depression comes right back, fast. So I have to take it throughout the day. I am back to work and enjoying life, i just take 3 or 4 pills per day. I don't know why this drug is not marketed as an antidepressant, it should be.",10,74,3
"Tramadol","Misosoup84","May 10, 2017","-","Well besides depression I battled with eating disorders my whole life. I never knew of this Med until 2 years ago. It really has helped me with my ED , anxiety, mood and energy! Sadly it's hard to get a prescription because is more of a narcotic",10,32,3
"Tramadol","Makpaz","May 9, 2017","Taken for 2 to 5 years","Weight loss: I lost 21lbs in 4 months: Better mood=Less appetite=More exercise Lost craving to carbs. Instead, crave protein. Hike and swim every other day. Sex drive went down,  not to zero though. Maybe from 8 to 3. (Male) but feeling so much better overall. Wellbeing without sex. Weird but possible. Once daily 50mg. Welcome to the new me. This is the first antidepressant I ever took. In summary, feel happier and lost 21lbs (from 221 to 200).  More productive at work. Self employed, lost money to depression. Now much better, back to the rat race and loving it. Btw Tramadol metabolises better in some people based on ancestry, so I read. It works for me (Sicilian descent). *Note: most doctors are reluctant to prescribe tram for depression",10,100,3
"Tramadol","Anon867392","April 29, 2017","Taken for 6 months to 1 year","I was prescribed the drug after Knee surgery, worked well with the pain but like most people this lifted my mood and productivity to new levels. Had suffered mild untreated depression for many years as I thought 'I was just feeling sorry for myself'. Just before my surgery I lost my best friend which hit me hard, dropped me to new lows. Along with relationship and work problems I was rock bottom. Had surgery and the tramadol came, picked me up, my business and my mood. 8 month later my prescription was stopped, my depression is back, my relationship ended and I'm worse than ever. I'm suicidal, restless, agitated and faitgued. Lost interest in sex life and work. Its magic for depression but will be twice as bad if/when you stop. Be careful.",8,42,3
"Tramadol","Attrit","April 28, 2017","Taken for 2 to 5 years","Like others, I have had good success with Ultracet (Tramadol with Acetaminophen) for pain, GAD and depression. A few weaknesses are 50% of the time I get a small headache. I experience tiredness/fatigue in the morning and lastly, there is the loss of well being when the drug wears off. This is part of the dependency (not addiction) that the user has to beware of. But the drug takes the edge off pain, blows away depression for a bit and reduces anxiety.  It's a balance of taking it when I need to but not all the time. It works for me.",9,38,3
"Tramadol","Joao José Fernandes","April 26, 2017","-","I have tried almost all antidepressives drugs available in the last 20 years.  Fluoxine, sertraline, paroxetina, citalopram and escitalopram did not work and destroyed my sex life. Bupropion increased my anxiety a lot. Mirtazapina caused me hallucinations and insomnia. Venlafaxine and desvenlafaxine worked a for some time, but affected my libido and erection. Niacina (off label) did not work for me. The only one that worked and is still working is Tramadol (off label). It starts to work about 1,5 to 2 hours after I take it, and lasts for 8 to 10 hours. I take 1 50mg capsule first in the morning and another 1 at around 4pm, with empty stomach. The ONLY drug that works for my depression and anxiety.",10,62,3
"Tramadol","Thaimama","April 13, 2017","Taken for 2 to 5 years","I began taking tramadol for very severe cramps during my period, and not only did it make the pain stop, it made me more productive and greatly helped my mood. I'm lucky in that it does not require a prescription where I live so I can buy it from my pharmacist. I take it along with Chinese herbs that really helped save my life ( TCM views depression as being a lack of life force or 'jing') and the combo of he shu wu, schizandra, and tramadol have done wonders for improving my quality of life. Tramadol is however habit inducing and the withdrawal can suck. I get essentially really bad restless leg syndrome when I've gone off of it, to the point where I can't sleep.",10,44,4
"Tramadol","ACEeeeeeeee","March 30, 2017","-","Totally obliterated my feeling of depression and my days have become productive.",10,46,4
"Tramadol","AJDG","March 21, 2017","-","I have suffered from Major Depression since I was 17, or at least that is when I was diagnosed.  I believe it started when I was 13.  I have been on medication every since and I am now 44.  I came across Tramadol because I have Fibromyalgia and I use it to lessen my pain.  I take 50 mg in the morning and if my pain is unbearable I will take another 50 mg in the late afternoon.   It doesn't take all my pain away but I can function since I work full time and go to school too.  The most miraculous part of all of this is that my depression while on this is completely gone.  I have to be careful since I am already on anti-depressants that are a serotonin uptake that I don't ever over do it, because of Serotonin  Syndrome.  Feel like myself :)",10,57,4
"Tramadol","HikeMoreBtchLess","March 16, 2017","Taken for 6 months to 1 year","Hello everyone. I, as many of you, have struggled with major depression for a long time. For me, it comes and goes - with a terrible onset towards the end of the winter month's. I've tried 4 different antidepressants with no success. Actually, Wellbutrin did help - but I ended up being allergic to it. Go figure. I was prescribed Tramadol for pain last year during a hip problem I was having and wow did it help my mood. I didn't feel so broken. This year I am suffering from depression again but haven't started on Tramadol yet. I am nervous because of it's addictive qualities, but I cannot keep calling out of work and risk losing my job. It is a terrible feeling. All your posts have been very encouraging so thank you for sharing!",8,45,4
