"Drug","User","Date","Period","Review","Score","Likes","Page"
"BuSpar","KellyBondGirl","June 4, 2016","-","I've been taking Buspar for a year. I feel like I can mange my life better when I'm on it. I can cope so much better with my life's stressors, especially the ones related to taking care of my daughter, who has autism. I used to get overwhelmed easily. With the busar I am more patient, not explosive or impulsive. Also, I used to have so many negative or catastrophic as automatic thoughts all the time. On Buspar I rarely have them. Buspar has worked great for me.",0,123,8
"BuSpar","valj","May 26, 2016","Taken for 5 to 10 years","Buspar lifted the anxiety ever so gently. I take 3 10 mg tablets per day and it's only $6 per month when prescribed that way. 2 15mg pills a day was $45. As if the relief from anxiety wasn't wonderful enough, after the first 3 years I went from getting plastered with viruses, to just 1 or 2  a year.  Think about it...anxiety causes the brain to send out massive amounts of cortisol and adrenaline, which seriously compromises your immune system. Less cortisol &amp; adrenaline equals a stronger immune system.  Then there's the enhanced sexual experience for a percentage of us...and that's a little personal, but very appreciated!",0,144,8
"BuSpar","8901l","April 25, 2016","Taken for less than 1 month","I initially was prescribed this a few months ago at 10 mg 3xd, but it made me headachy and almost made my anxiety worse, so I quit taking it. I cannot take benzos, and recently am having more problems with anxiety, so I'm trying it at 5 mg 3xd. Now I see what others have been talking positively about. It's very subtle, but apparently I was just taking too much for my system before. So far, so good.",7,101,8
"BuSpar","Guyver91","April 23, 2016","Taken for less than 1 month","I was taking ativan from a friend for my slight anxiety issue. It was 1mg I stopped it for two weeks started getting weird feelings in my head. Then had panic attack for the first time. Turns out I'm addicted to the ativan. My doctor gave me .5 ativan didn't stop the attacks and couldn't function right. I had to take a full 1 mg to function. When ever I don't take it I get a panic attack. Well my PcP gave me buspar and been doing better. I been on it two days he wants me to take 15 mg four times a day but that's too much I take 7.5 and feel normal. Taking a full 15 mg is a no no. But at the right dosage it works. Hopefully soon to kick the ativan out. Of missed worked because of this ativan problem. I don't suggest taking any benzodiazepines.",7,62,8
"BuSpar","Callico4215","April 20, 2016","-","I began taking buspar about six weeks ago. I am not a fan of benzos because they are addictive, I prefer to function with a clear head rather than popping a pill that sedates me so badly that maybe I'm not feeling my anxiety, but I'm also not living my life or doing much else either. Buspar has changed my life, I had completely forgotten what it was like to have a quiet mind until now. My obsessive thoughts subsided, I can leave my house without fear, I can speak to my friends and to strangers without profusely sweating and trembling, and I can drive again now that I'm not so easily stimulated. It takes a few weeks to feel the full effect, so hang in there if you just began.",9,236,8
"BuSpar","AprilCreations","April 10, 2016","Taken for 1 to 6 months","Helps so much.",7,37,8
"BuSpar","cardigon1","April 5, 2016","Taken for less than 1 month","I was suffering from such bad anxiety that I felt desperate. I wanted it gone so I waited the six weeks it took to get into a psychiatrist. She prescribed me Buspar and within the first day the meds started to kick in. I took the first dose and then the second as she prescribed me 5mg twice a day to start. I could feel the chemicals in my brain changing and suppressing the anxiety and it was a relief! Let me warn you though, anyone with true anxiety also suffers from depression too so once the anxiety is taken care of with Buspar the depression comes on so much stronger! I'm on Zoloft and Buspar. Used to just be on Paxil until it stopped working.",10,93,8
"BuSpar","Jessika N","March 18, 2016","-","I suffer from anxiety,depression and PTSD.  This medicine has proven to be a great alternative over a benzo.  Being non habit forming is the best par .  I do get headaches and fatigue but it is better then the side effects associated with benzo.  I recommend this to anyone looking for a non addictive alternative to zanex",7,88,9
"BuSpar","MerricMaker","March 12, 2016","Taken for less than 1 month","I'm returning to Buspar after seven years off. Started having chronic anxiety attacks again after my wife's hysterectomy. Wish I could remember my old dosage. I tend to be drug sensitive and the 30 mg. dosage made me fuzzy. The PA that did this script was a little overzealous. Doing well on just the 15 mg. even if it is a self-adjusted dosage. After a few weeks I can have a talk with our MD and he'll probably leave it at 15 or 20.",9,65,9
"BuSpar","Worked and then stopped...","March 3, 2016","Taken for 6 months to 1 year","My Dr. Prescribed due to it low dosage. And that I didn't want to take meds. I became so helpless after years of trying to cope with anxiety on my own, I finally reached a point where medicine was my only hope.  It kicked in quickly, my obssesive thoughts stopped, then dosage would wear off so I started taking a higher dosage, then it made me become upset, super emo crying, not myself and finally realized it was  buspar. Cut back dosage again. It made me tired all the time, couldn't concentrate, weird dreams, and loss of interest in things. Was not a good fit, I finally had to ask Dr for something else after a year it didn't work all together except for stopping obssesive thoughts. It also gave me brain zaps, memory loss, and space cadet syndr",2,64,9
"BuSpar","Snhende","March 3, 2016","Taken for less than 1 month","I've been on Busiprone (10 mg twice a day) for about 2 weeks now and I have seen no improvement. My sleep is jacked up from it from either interupted sleep or vivid dreams. I dont think I'm going to continue to use it. Xanax seemed to be the only thing that has helped me so far..",2,50,9
"BuSpar","Motorcityirish","February 26, 2016","Taken for less than 1 month","I started taking Buspar 5mg twice a day due to anxiety of my Mom being in the hospital. Let me tell you how it affects me...positively. I take it along with Prozac 20mg once a day and the combination works WONDERS for me. I take both in the morning and the Buspar in the afternoon around 4pm. What a difference!!",10,84,9
"BuSpar","Sierra921","February 25, 2016","Taken for 6 months to 1 year","Diagnosed with general anxiety disorder.  Would have obsessive thoughts non stop, losing sleep sometimes.  Started taking buspar 5mg twice a day.  Hands felt tingling and head a little cloudy but no other real side affect.  Increased up to 10mg.  Immediately saw improvement, no more obsessive thoughts that would normally slow me at my work.  Been on it for almost a year now and have no side affects.",10,131,9
"BuSpar","Edsterytt","February 22, 2016","-","I have had anxiety for 10 years and had given up all hope for a normal life.  Last year i was prescribed Buspar 15mg a day and it did nothing for me.  On one of my many visits to the mental hospital I was told to try bumping it up to 40mg.  A week later I had my first anxiety free day.  It's now been 7 months and I haven't had a single anxiety day.  I have finally started to love again, I feel normal.  My doctor said that because it's not addictive and doesn't lose its effects over time like Benzos I can continue to take it indefinitely so I will.  If you're on it and it's not working perhaps you may need more For me it's finally given me my life back",10,176,9
"BuSpar","185303pharmacydude","February 22, 2016","Taken for less than 1 month","Well this medication improved my mood related to possible social anxiety but on the 3 day of taking I had some psychosis related side effects in aggravation then started to get very hyper but depressed bad experience",3,36,9
"BuSpar","murphy's law","February 18, 2016","Taken for less than 1 month","I connect so much with Frustrated Fenway Fan's post..I have almost disabling anxiety. I started having panic attacks at eleven years old.....I am now 33. The entire time I was treated with Xanax which I NEVER once abused...my former doctor abruptly stopped prescribing it to me because he caught wind that I had spent a year and a half fighting an opiate addiction, Suboxone saved my life...but although that is all in the past and I don't even take that medication anymore....it is on my medical history! Now.NO ONE will prescribe me any sort of benzodiazepine. I have just been prescribed Buspar. I pray it works. I just want my life back.",5,41,9
"BuSpar","Anonymous","February 18, 2016","Taken for 1 to 2 years","BEST medication I've ever taken for anxiety. I was skeptical to take it because of some negative reviews, but I figured, what the heck, what have I got to lose??   I plan on staying on buspar for a long long time. It's allowed me to be more outgoing and get involved more in social situations. Have a positive attitude, try it, and I think you'll love it too!",10,151,9
"BuSpar","Myself again","February 16, 2016","-","I have tried many other anxiety medications. This took about 4 weeks to work but is great. I'm 34 years old and have had anxiety since I was a teenager. This is the best I have felt in my adult life. Also taking Prozac once daily. Great combination.",10,53,9
"BuSpar","Frustrated Fenway Fan","February 15, 2016","Taken for 6 months to 1 year","So, Buspar does nothing for me at all. I may as well have been taking a sugar pill all this time. My doctor felt that since I was only 30 years old, the Benzo that I had been on for the last 4 years that greatly helped me, was out of the question because SOME folks abuse it. REALLY?! If your anxiety is intense and life ruling like mine is, please look into a Benzo. Hopefully you'll have a doctor that is actually out to HELP you.",1,44,9
"BuSpar","Dobelady","February 13, 2016","Taken for less than 1 month","Buspar 5 mg twice daily for possible anxiety induced difficulty failing asleep. First week good, second week less helpful for sleep, then onset of extreme hip, bilateral leg weakness with feeling of extreme leg muscle fatigue, start mid afternoon, worse by bedtime every night, required pain med to allow sleep. Discontinued.",2,25,9
"BuSpar","idkwhattoputhere","February 6, 2016","Taken for 2 to 5 years","My doctor first started me on buspar over two years ago, probably at 16. Slowly throughout the years we've had to increase it until about a year ago, when I reached the maximum 60mg and I had to finally ask my doctor for something else. But I mean that's what you get with medication, it's all pretty much trial and error",2,23,9
"BuSpar","Serene Celine","February 5, 2016","Taken for 2 to 5 years","I've had severe anxiety and depression for many years and have tried many meds. For me, BuSpar wasn't very effective, even at the maximum dose of 60mg/day. It also caused me very restless legs at night, which was extremely troublesome. I couldn't lie still for even ten seconds. I also got brain zaps. My doctor thinks I should remain on BuSpar, so these days I take only 10mg/day as a backup to my other meds. I don't have the side effects at the lower dose.",5,29,9
"BuSpar","AnxiousButNotAsAnxious","January 31, 2016","Taken for 6 months to 1 year","I started this medication on a low, as needed, 5mg dose back in August after I started a new job with a high level of stress. Taking it twice a day as needed worked for awhile with no major side effects. Working this stressful job full time, classes, and being a newly wed young adult was taking it's toll and I finally had a nervous breakdown at work, uncontrollable sobbing, hyperventilating, the works. I went to the doctor and we've upped it from 5mg BID PRN to 15mg twice daily. I'm currently taking 7.5mg twice daily to get used to the increased dose. The only side effects I'm dealing with is nausea, but it goes away eventually.",7,36,9
"BuSpar","InScienceWeTrust","January 21, 2016","Taken for 6 months to 1 year","Takes 6-8 weeks to work but it works better than anything I've tried. I've had anxiety for years and have tried a long list of meds.",10,62,9
"BuSpar","quintenwatertown","December 30, 2015","-","I was on this back in the 80's while hospitalized for depression. It was a  horrible drug it made my mouth dry and talking difficult. Also, it must have made me say things I don't recall saying because during one appointment with the psychiatrist in the hospital, he wrote a comments he thought I said which I hadn't (I later saw the reports)!",1,14,9
"BuSpar","Wwert","December 30, 2015","-","Wait 6 weeks but it helps before then too. I have been on it at 25 mg a day for a year.  Just recently I have been in a traumatic situation and I ramped up the dosage to 40/50 mg to help. It has been a huge help and I only have taken 2 Ativan during this three week ordeal. I think Buspar for me makes me tired when I am not anxious and is a huge help when I am. It seems to cut the adrenaline levels and that is what works for me without the sexual side effects that SSRIs have.",10,53,9
"BuSpar","WInative","December 19, 2015","-","After extreme weight gain on SSRIs, I thought buspar would be my miracle drug. I was totally wrong. After day two I had such bad twitches/tremors and my jaw seemed to locked for short periods of time. Went to emergency due to the side effects causing panic attacks.",1,38,9
"BuSpar","Chaoz1313","December 18, 2015","-","I've been on this medication for 8 months now &amp; really like it.  I take a combination of Buspirone &amp; Mirtazapine which keeps me level with no anxiety.  My racing thoughts are gone.  I was waking up all night every hour with racing thoughts.  Now I'm able to sleep &amp; have a calm mind both while waking &amp; sleeping.  One thing I do notice is that it gives me the munchies for sweets.  I'm working to curb that with healthy snacks instead.  Sometimes it does make me slightly light headed, but to me that's a relaxing feeling that helps me stay calm.  I'm able to stay focused and am doing better on my job &amp; in my personal life than ever before.  I really love this medication &amp; give it a thumbs up for anxiety!",10,100,9
"BuSpar","ThankYouFather","December 18, 2015","Taken for 6 months to 1 year","I started taking Busbar earlier this year. I'm unable to work due to severe depression, severe anxiety, and PTSD.  Initially, it eased my muscles and eased my anxiety better than xanax. Since I have been on it, my face is fat and I've gained weight in places where I have never had a problem.  My formerly long thick hair is thin.  My skin became thin and dry.  At one point, I had patches of hair missing; through prayer, it's coming back. Today I was so disgusted with the changes and prayed for a reason as to why these things were happening.It came to me to look up the side effects of busbar and BAM, they were all there.   Warning this stuff can cause alopecia.  I'm going to stop taking it.",2,53,9
"BuSpar","Bipolar Guy with GAD","December 10, 2015","Taken for 6 months to 1 year","Noticed a change immediately.  Started out on 5mg twice a day for two weeks, then upped to 10mg twice a day.  Work in surgery so pretty stressful work.  I couldnt sleep the night before cases thinking about all the bad things that could happen.  Once I started taking buspar those thoughts went away and I could get a full nights rest.  I am clear headed and focused at work, whenever negative thoughts creep in my head I am able to dispel them with relative ease.",10,83,9
"BuSpar","Kimberly959","December 4, 2015","-","I was put om buspar due to getting custody of my niece and nephew from dhr and getting a promotion to a new much more stressful job. The buspar helped keep me calm enough to focus at the tasks before me and help me get through my day to day life. I was super stressed and scared bc of all of the changes in my life and buspar helped me calm down and cope",10,71,9
"BuSpar","jam6786876","November 30, 2015","-","I started taking this medication during a particularly stressful period in my life and continued it for about a year.  It got me through a divorce and kept me within my stress threshold.  I stopped taking it when I started feeling like I was on stable ground and had little if any withdrawal symptoms.  After about a year, another stressful situation came up with my little sister tried to kill herself and I was in my first semester back to college with a full course load, trying to be a single mom to the best of my ability at the same time.  It definitely doesn't work as strongly as it did the first round, but it makes the stress level manageable.  It feels like he rock sitting on my chest has been removed, and then I can think through things",8,67,9
"BuSpar","train wrecked","November 30, 2015","-","This is the first anxiety medicine I have ever been on, and it is by far the worst experience ever. My moods are anxious, depressed, and irritable. At first, I thought I was just overwhelmed with school and work, after reading some other reviews, I realized it's the Buspar doing it to me. If I take one due to an anxiety attack, about an hour later I am crying and talking about how much I hate myself, then about 30 minutes after that stops, I get extremely irritable and everything makes me mad. I've quit taking it until my follow up appointment and I can get it changed. I will never try this again.",1,30,10
"BuSpar","Anonymous","November 25, 2015","-","If I could rate a 0 I would. While I was on it for only 4 weeks I became extremely irritable and was constantly hating myself. Worst meds I've ever been on and I've tried a lot.",1,24,10
"BuSpar","MrCage","November 18, 2015","-","Started taking Buspar to cope with the increased anxiety that Welbutrin gave me. I eventually got off Welbutrin because of the awful side effects, but stayed on the Buspar. It definitely helps to relax me mentally. I feel physically relaxed too, and my anxious habits such as bouncing my leg and drumming my fingers have been reduced, plus some of the racing thoughts and constant worrying have been dulled (although not completely cured.) The only side effect so far has been slight dizziness at times  and I feel slightly less coordinated at times. This hasn't been a deal breaker at all, however, and I'm sure these symptoms will go away with time. I'd recommend this for mild anxiety.",9,44,10
"BuSpar","AnxietyIssues","November 18, 2015","Taken for 1 to 6 months","Hello all! I took this medication for around two months, and it helped with my anxiety, but caused me to become apathetic. I simply couldn't be bothered to do anything! It was horrible!",5,17,10
"BuSpar","Anonymous","November 11, 2015","Taken for less than 1 month","My dr added buspar twice a day while on lexapro already. Took for about a week. Every time I took it about an hour later all I wanted to do was kill myself. It would go away for a while and then once I took it again, the same feelings came back. Took it for about a week and stopped after I couldn't take the feelings anymore. Feelings stopped immediately. Would never try this again.",1,28,10
"BuSpar","Sargem","November 9, 2015","-","I love this med no side effects no problems at all just stopped my massive anxiety problems I was having almost weekly and I mean want to run to get out of my skin anxiety.. Panic attacks to the max",10,100,10
"BuSpar","charger1994","November 9, 2015","Taken for less than 1 month","I took BuSpar for a few days for Generalized Anxiety Disorder, but it cause a tic in my eye. My eyelid would flicker uncontrollably every once in a while. Apparently this is pretty serious, and can actually be permanent even after ending the medication, which was very scary. Luckily for me, the tic went away when I stopped taking it.",1,26,10
"BuSpar","JTChase","November 1, 2015","Taken for 1 to 6 months","I have GAD, and after three years of taking care of  my younger brother who has severe GAD  as well as going through an episode of pyschosis, I was told by my pdoc that I have caregiver's burnout. I was prescribed 20 mgs of Paxil every day and 15mg of Buspirone (Buspar) twice a day. It has been nearly a month now on these meds and I do see an improvement. I'm not sure which one is helping me more but my anxiety level has gone from an 8 or 9 every day to about a 5. I hope to see continued improvement.",9,45,10
"BuSpar","Smt579","October 29, 2015","Taken for less than 1 month","After my first dose on Sunday, I had a terrible migraine. I decided to take it once a day at night until I get used to it. I took it at night instead of taking it at the beginning of my 12 hour shifts (I'm a nurse). Yesterday was my first day of taking it twice a day as prescribed. I took the second dose at 10 PM. I woke up at 2 AM this morning with extreme dizziness and a profusely bleeding nose. I thought I was dizzy because of my allergy meds and being sleepy and I explained the bloody nose as being related to allergies. I went to work again today after taking my morning dose at 6 AM. At 10 AM I once again had a bleeding nose. I checked my blood pressure, and it was in the 150s when it normal runs less than 100. Will never take again",1,32,10
"BuSpar","Intellbrat","October 21, 2015","Taken for 1 to 6 months","I have been taking Buspar and Celexa and as far as the anxiety it has helped me a lot..I was having bad heart palpitations and it's gone..no more headaches either..what I did was I started talking Celexa at night and I take Buspar 2-3 times a day.  I can't say I'm completely ok because the Celexa needs to be in your system at least 6-8 weeks before you start feeling better....I'm feeling a little better. And not having Anxiety truly helps. I'm still haven't been able to go to work because of how scared I am to get an anxiety attack but I'm already starting to consider it. Believe me when I tell you I was on the verge of being committed...give it a chance not all our systems are the same. Good luck",10,62,10
"BuSpar","Busparworks","October 11, 2015","Taken for less than 1 month","So I have read several posts and here is my response. This is my second time on Buspar and I was prescribed 7.5. I didn't like the dizzy feeling and I had trouble focusing so I cut my dose in half. Broke the pills. After very light dizziness with the 3.1 dose I am feeling good. I know the doctor prescribed one dosage but if you continue to feel sick after a few days just lower your dose and start from there. You're going to feel weird for the first few days anyways as your body adjusts. The Meds work great. In the beginning when I was getting upset I could feel the medicine trigger something to keep me calm. The more I tried to get upset or was experiencing anxiety, the more weird I felt it's been 2 weeks now..",8,63,10
"BuSpar","sanchez_squared","October 7, 2015","Taken for less than 1 month","I take Buspar 5mg twice a day for anxiety. After a week, I will then take Buspar 10mg twice a day. I have only been taking it 4 days now. I also take Paxil 50 mg daily and Adderall 10 mg twice daily. So far I have had no side effects from the Buspar except slight dizziness and lack of appetite. So far those are tolerable.",6,30,10
"BuSpar","Anonymous","September 29, 2015","-","I have really bad anxiety and I've pretty much tried everything. I take kaldopins for panic attacks and they work but I needed something for daily issues. This medicine really worked but omg I can't handle the side effects. Everyday I have a migraine or I'm nauseous or puking.",5,22,10
"BuSpar","Tank-jules","September 23, 2015","Taken for 10 years or more","Take only as necessary. 2.5 mg- 5mg. only when necessary. Been taking for years when I feel nervous and have a tension headache. Works great to relax me. 30-10 mg pills can last a year for me",10,65,10
"BuSpar","krs1993","September 23, 2015","Taken for 1 to 6 months","Took this medication for a few months after being diagnosed with generalized anxiety disorder. It did work fairly well in decreasing my symptoms of anxiety, but the side effects were just too much to handle. The first time I took it (my doc prescribed me a low dose, I think it was 5mg if I remember right) I was knocked out in about 30 minutes and slept for 5 hours straight, not to mention this was in the middle of the day. Also caused extreme dizziness that I had a hard time functioning with. I thought the drowsiness, dizziness, and weakness that it caused might subside after taking it for awhile, but I took it for about three months and these side effects still persisted.",5,45,10
"BuSpar","OB1Dazed31","September 14, 2015","-","I am new to the anxiety realm, and have already tried a few different meds (xanax, ativan, buspar) and so far buspar has shown the most promise. However, even on buspar I still experience sporadic chest pressure, sharp pains in the chest, brain buzz, and muscle twitches. Today the chest issues were so bad that I had to take a xanax. I am typically against prescribed meds, and this is really the first time in my life taking them. The side effects and other dangers scare the crap out of me, but I need to figure out how to subdue my anxiety. Does anyone have any suggestions?",5,45,10
"BuSpar","Agent 700","September 13, 2015","Taken for less than 1 month","I did not like this medication. For anxiety, I have also tried Hydroxyzine (Atarax). I guess this is just my personal body chemistry but I actually prefer Atarax to this unlike most people. This made me VERY lightheaded and dizzy. I can't exactly remember the effect it had on anxiety, I think it may have helped a little.",4,19,10
