"Drug","User","Date","Period","Review","Score","Likes","Page"
"BuSpar","calabsv","May 7, 2014","-","About 3 months ago out of no where I had a severe panic attack and was rushed to hospital thinking it was a heart attack which it was not but the next day I woke up with severe anxiety, it was horrible. I tried natural remedies but nothing worked and was afraid of SSRIs because of the side effects, after some research I asked to try Buspar,  it took over 2 months and playing with the dosage, I take 10 mg morning, 7.5mg afternoon and night time. I finally feel like the constant dialogue in my head is settled down to a point where I can function,  hoping it just gets better from here on in. I have had no side effects at all,  it may take a while for this medicine to work but stick with it. I think it's worth it.",8,169,12
"BuSpar","sleepyseattle","March 29, 2014","Taken for 1 to 6 months","I was told that it may take a while to build in the system to work. I took it for over 2 months. As far as treating anxiety it didn't work.",1,55,12
"BuSpar","Punkcowboy","March 11, 2014","-","This panic attacks all hit me in August, it was December before they figured out it was anxiety because I had other medical stuff, wrong sickness. They started me out on Zoloft I was allergic then some other meds that had bad side effects finally my doctors try me out on Buspar. Finally after weeks getting the right dosage I have been awesome and healthy for over a month. This pill has given my life back, I was so bad I couldn't go in stores. Now I go every day and shop. This pill is awesome, it takes over a month to get build up or did for me. It was worth the wait, I feel so good I stopped it for 4 days I had panic attack then went back on and I plan on taking this.",10,201,12
"BuSpar","Jimmij48","February 26, 2014","-","I've only been taking Buspar for 3 weeks and my anxiety is gone but I'm still depressed and irritable.",6,103,12
"BuSpar","Smokey01","February 22, 2014","Taken for 5 to 10 years","Buspar changed my life, no kidding. I have been on Prozac so long, but once Buspar was added my personality came to life. Not that I don't sometimes worry, but it is sooo much better to manage with the Buspar. I am not any kind of spokesperson. I have a friend who it didn't work for, but for me, it has changed my life.",10,206,12
"BuSpar","Anti-Anxiety","February 8, 2014","-","I don't like SSRIs. The fact that Buspar can deal with serotonin receptors without causing the loss of libido, weight gain, and tiredness makes it perfect to treat generalized anxiety. Plus it's non-addictive like many benzodiazepine for panic attacks. I wish they made it in extended release form, though my doctor said it's okay to just take my full dose in the morning - and that seems to be working fine for me. It's the only medication that focuses mainly on the brain's serotonin levels that I like.",8,211,12
"BuSpar","Corey064875","January 9, 2014","-","Did experience slight positive changes, but came at a cost of constant dizziness and fainting",1,50,12
"BuSpar","sag34mom","December 30, 2013","Taken for 6 months to 1 year","CHANGED me life for the BETTER! Took a little while to kick in. Better to be on this then a habit-forming or dependent medicine..you have to want to change and then this medicine will work. Life-saver! 10mg once a day for 6 months now.",10,191,12
"BuSpar","Lina~Hyatt","December 14, 2013","-","This medicine has worked wonders for me... took a month to work but well worth the wait.",9,140,12
"BuSpar","boomboom77","December 13, 2013","-","I have generalized anxiety and panic disorder, I have since I was a teenager. In the past, I took Xanax as needed but it sometimes made me depressed and I worried about developing a tolerance or addiction. After less than a month on Buspar, I have already seen a major improvement. I ruminate less, my body is less tense, I am considerably less fearful (which is saying a lot because I was becoming fearful of leaving the house), I am able to tolerate stressors in a rational way, I am no longer depressed. What remains of my anxiety is manageable and it no longer interferes with my life. I began on 10mg and after a couple weeks bumped up to 15mg. I experienced insomnia the first couple days but that went away. Take with food for nausea.",9,216,12
"BuSpar","worked for me","December 8, 2013","-","I found that it worked better for me than anything else. After taking it for about 8 weeks, I was able to ween myself off of every other medication. This was the miracle for me.",10,179,13
"BuSpar","jah123","December 7, 2013","-","Buspar has completely and utterly changed my life. I have struggled with generalized anxiety ever since I was a child, and I've never been able to find a permanent solution. I have taken Xanax and Klonopin, but those are short-acting, and you build resistance to them quickly, and they're habit-forming. Now that I'm on Buspar, I have no anxiety. None. Nada. Zip. No more butterflies in my stomach, no more hyperventilating, no more irrational thoughts. I can fall asleep at night no problem, and wake up in the morning and be excited about my day. It takes a while to start noticing (3 weeks for me), but it's completely worth the wait. I'm finally excited about my future, and I finally feel in control of my life.",10,381,13
"BuSpar","WhiteKnightToo","November 26, 2013","-","This replaced Benzosiazepines and Sleeping pills, gives better rest, improved sex drive, decidedly improved social life. I'm 46m, prescribed 15mg x2 daily. Others noted the improvements first. I had no untoward side effects other than dry mouth and a few lingering panic attacks per month easily handed by low dose Xanax 0.5 mg. Various SSRI's along the way didn't help with depression this much. 5 years running. It works good.",9,146,13
"BuSpar","Anonymous","November 25, 2013","Taken for 1 to 2 years","I am 29 years old and have been on Buspar for about a year and a half and since I started taking it my sex drive is completely gone. Yes it helps my anxiety but I am too young to have a horrible sex drive!",6,48,13
"BuSpar","crane guy","October 24, 2013","-","I have suffered from severe anxiety for about 3 years now. I've tried buspar for a little bit and it helped some but I didn't keep taking it. I just had to post what has taken 90% of my anxiety away and that's cardio exercise daily. I started going to the gym and riding the bike with the heart beat monitor on it.  I got my heart beat to 120 beats per minute and held it there til I got tired, then slowed down to rest a couple minutes then speed up again.. I'm a crane operator and mostly sit all day in my crane. The very first day I sustained a higher heart rate by exercising for 15 minutes my anxiety levels plummeted. Every day after that it has gotten better. Before taking drugs for anxiety try fast walking for 15 minutes. It will help!",6,145,13
"BuSpar","anna flock","October 23, 2013","-","My psychiatrist put me on buspar after i had tried lexapro &amp; many natural remedies in regards to my anxiety disorder, depressive disorder, &amp; PTSD. Personally, i think that the medication fools with my depression. My depression has been inactive for almost 6 months now &amp; so i requested ( after taking the lexapro ) that i could be put on strictly anxiety medication. I also have adhd, which i have been taking concerta for. When taking buspar i realized that, it increases my concerta side effects, makes me have depressive symptoms. I feel like it makes me have the physical effects of everything but not the actual feelings, which is frusturating because when presented it looks like more anxiety, depression, adhd, ptsd.. etc. symptoms.",5,36,13
"BuSpar","eclectic lady","October 19, 2013","Taken for 2 to 5 years","My son timed it several times without me knowing and discovered in 10 mins I was doing so much better, in 20 I was completely back!",10,95,13
"BuSpar","Anonymous","October 2, 2013","Taken for 1 to 2 years","I have Schizoaffective disorder with bipolar features as well as uncontrollable anxiety. This medicine has helped me tremendously! I take 5mg in the morning and 15mg at night so I can fall asleep. I would recommend this medicine for sure!",10,102,13
"BuSpar","acrowell27","August 22, 2013","Taken for 1 to 6 months","I have Cluster Migraines so the doctor put me on Topamax, after about 2 months I developed anxiety symptoms and a rather hateful personality so they added Buspar to take  the edge off. It has worked well for me but I can tell when it wears off. I'm on a low dose so it just may be time to adjust( 5mg twice a day ). All in all very satisfied with this medicine. It does make you dream vividly but that doesn't bother me.",9,88,13
"BuSpar","CMR000","August 22, 2013","-","Took 5mg. Dizziness after I initially started taking, that vanished but occasionally cropped up once in a while. Felt pretty good. Happier. Thoughts that I would normally worry about still came to me, but I was able to think about them and dismiss them, not obsess over them ALL day. Some months later though I began becoming extremely emotional. I cried all the time, became so depressed getting dressed and brushing my teeth was a huge struggle; was paranoid, wanted to hurt myself, had crazy thoughts. I would sob at the drop of a hat, which ISN'T like me at all. Took months of confusion, emptiness, anger, and loneliness to figure out it was the Buspar. Loved it in the beginning, but unfortunately it was not for me!",3,88,13
"BuSpar","StevenMme","August 9, 2013","Taken for less than 1 month","I recently started having panic attacks and was diagnosed with generalized anxiety disorder. My doctor put my on Prozac but after 5 days I was having such horrible side effects she switched me over to BuSpar 5mg in the morning and 5mg in the evening. I am to up my dosage after 5 days to 7.5mg in the morning and then again in the evening. However, I feel dizzy, upset stomach and just exhausted. My doctor told me to give it time because I'm coming off a medicine and starting a new one at the same time. It is worse in the morning. I just want to feel better. I've had to take half of my 0.5mg Xanax just to take the edge off everyday and have zero appetite. I'm feeling hopeless and need some encouragement and help.",0,80,13
"BuSpar","Alliera","June 16, 2013","-","I have recurring bouts with severe anxiety.  Six weeks ago, I was put on 30 mg's of Buspar to be taken in the morning and at night.  I got brain zaps (similar to Paxil withdrawal) and nausea lasting about an hour after I took the medication.  True to most other medicines for anxiety, I felt as though overall, my level of anxiety increased over the first 2 weeks although I would have periods where I was not anxious.  After 2 weeks the Dr raised my dose to 60 mg's. I found it best to take 4 times a day because I definitely feel it wear off. While this has taken my overall anxiety from a 9 to a 7, it is still not enough.",6,62,13
"BuSpar","Just a nobody","June 11, 2013","-","Made me better",10,70,13
"BuSpar","Anonymous","June 7, 2013","-","I have been off and on BuSpar for a little over a year now for severe uncontrollable anxiety but I have to take a high dose for it to work. I just take it as needed. I take 40mg at night. That's when my anxiety seems to bother me the most. If my anxiety is bothering me really bad and I don't take it then I am always up all night long and sometimes 2 days straight. Overall I would recommend this medicine!",10,117,13
"BuSpar","anxious sleeper","May 23, 2013","-","Been taking buspirone on and off for 15 years, for insomnia, anxiety, and symptoms of post traumatic stress disorder.  Sleep is my #1 issue (or lack thereof).  Very effective for insomnia almost immediately upon starting it (after a period of not taking it). I sleep easier within the first day or two.  Within a week I get to sleep easier and more soundly.  Ironically I've always had the side-effect of vivid memorable dreams.  Doesn't seem to increase bad dreams though, just makes them more memorable.  No other side effects.  I have, depending on the stress in my life or other medicines being taken, generally been on 5mg/day to 20mg/day, with good results.  At 30mg/day I feel dopey. Prefer to take doses later in the day, not first thing in the morning.",10,135,13
"BuSpar","Aubie171","May 21, 2013","-","Started taking Buspar 15mg 2 times a day about a month ago and I will be honest, at first I hated it! I almost quit taking it! The first week it seemed as if it was making my anxiety worse. My chest was pounding and could not sleep at all! I decided to stick with it and I'm glad I did because all of that is gone now. I mainly had issues with social phobia, and I have noticed I am getting better in social situations. The only thing is every now and then I feel a little dizzy for about 20 minutes after taking it but that's it! It doesn't take anxiety away, but helps you deal with it and better rationalize things.",8,143,13
"BuSpar","Anonymous","May 20, 2013","Taken for 1 to 2 years","Buspar allows me to rationally look at my intrusive thoughts without getting trapped in obsessive thinking.  I have taken Xanax in the past, and feel that this medication is superior, though it takes some time to build up in your system.  I was against being on medication for a few years, but plan on staying on Buspar indefinitely, as it improves my quality of life and decreases many of the physical symptoms of anxiety I have experienced in the past, such as muscle tension and teeth grinding.  I have also tried Celexa in the past, and unlike an SSRI, I do not feel zombied out in the least, just clearer and more at ease.  I highly recommend this medication!",9,239,13
"BuSpar","WorryNoMore","April 24, 2013","-","Been on this medication for over 12 years.  Works well for me. Calms me down without the brain zapping I got from Paxil and Lexapro. Dosage has been adjusted throughout the years. I am told 60mgs a day is the maximum dose. I am currently on 15mgs 3 times per day.  It took a good two weeks to get into my system, and I remember thinking it wasn't working at first.  It's no Xanax, but it has helped me much more then Paxil and Lexapro did.  This works well for me, and I have no issues taking it for the rest of my life.  I do get some increased hunger and minor dizziness after each dose for about 15 minutes, but that beats being anxious and worrying all the time.  It is also pretty cheap.",9,198,13
"BuSpar","Dino78","March 1, 2013","Taken for less than 1 month","I have been on many anti depressants and anxiety meds in the past but this one is the right one for me. It is the only medication that I have taken that does not cause erection problems. While it is no miracle pill, it does take the edge off and allows me to deal with things without anger. I am actually able to see the world in a positive light and not be so negative all of the time. I believe I am taking half of the 5mg pill three times a day. I was supposed to be up to a pill and a half three times a day by now, but stronger doses make me feel medicated and I do not like that. I am perfectly happy with the results and my ability to control my anxiety problems. My anxiety is still there, but controlling it is key to long term health.",10,206,13
"BuSpar","Anonymous","February 13, 2013","Taken for 1 to 6 months","I'm 31yr old fem, and have been taking Buspar for anxiety/panic for three months, and have decided to discontinue. It took roughly 3 weeks before I noticed a difference. I am slower to irritate, less agitated, and can better manage the constant nagging sensation of anxiety. I've been sleeping better, but really require a full night's sleep or else I'm drowsy all day. And I've been more at ease with new people. These changes have been certainly been positive but minimal. Lately, every day, 2x's a day about 20 mins after my dose (10mg @ 2/day) I would get a ringing headache, body shocks, and dizziness or nausea. I thought this would go away, but it hasn't, and it is getting to the point that my anxiety level is increasing.",5,109,13
"BuSpar","knitchick","February 12, 2013","Taken for 1 to 6 months","Buspar was okay at first. I felt more relaxed and less tense. But I've had high blood pressure and headaches almost every day on this. Dr is taking me off and going to try something else.",5,66,13
"BuSpar","Centurian","February 12, 2013","-","I thought I was finally going to find the medication for me. At first it was O.K., I was on a low dose, a few days later when I was on a 5mg twice a day for only 4 days, I had been experiencing trouble concentrating, and woke up to my arm muscle twitching uncontrollably, which continued all night and onto the next day. So I quit the medication and called my MD.",4,63,13
"BuSpar","ChristyMC","February 11, 2013","-","I have been on Buspar for about 3 months. I take 30 mg a day. I feel it is effective but I still get anxious thoughts and worry about having panic attacks. Does this happen to anyone else maybe I just up my dose but I get dizzy for about 30 minutes and can't lay down while I'm working. I was on Paxil but the side effects were awful so my Dr switched me to this.",7,61,13
"BuSpar","SelfBtrue","January 24, 2013","Taken for 1 to 6 months","So far so good, helps me walk away from unreasonable people instead of sharing my unwanted opinion. I have same side effects as mentioned, wondering if anyone has uncomfortable leg pains painful tingling (like a constant funny bone just got hit but towards the high painful part. Could be a pinched nerve and unrelated to Buspar.",9,69,13
"BuSpar","JMT31","January 14, 2013","-","I suffer from anxiety and have tried several medications in the past. I just started using Buspar 5mg twice daily. I notice in the morning, I am dizzy and have vision problems, it goes away after about 30 mins and I find it is helpful to eat when I take it, as side effects are not as bad. I do like it as I am not as high strung throughout the day, my kids have noticed a big difference in my mood. I'm going to give it a bit longer.",5,115,13
"BuSpar","waybusylife","December 17, 2012","Taken for less than 1 month","I have had three deaths in my family in the last few months, quite my good paying but stressful job, opened my own salon, started school, and having a hard time with my 19 yr old who has moved back home! All of this in the last 6 months! I finally went to my Dr. today and she described Buspar for me! I've only taken one dose and already feeling better so I know I should be really better after a few days! I don't like taking medicines but I was at my wits end! Now hopefully when I go back to school tomorrow I won't get kicked out for being so agitated at people that I walked out on Saturday!",0,90,14
"BuSpar","chuckfinley","December 9, 2012","Taken for less than 1 month","When taking the medicine, the first few hours my entire body would have random tingles, I would experience vertigo / become dizzy, and be nauseous. I took BusPar  / buspirone for about 3 weeks and quit after these effects + decreased sex drive.",1,77,14
"BuSpar","strokey","December 3, 2012","Taken for 1 to 6 months","I suffered a stroke 4/15/2012 I started having a gradual increase of anxiety to the point I could not stand it. My doc put me on Buspar 15mg starting out then up to 30mg all was great until the random suicide thoughts started I also take Celexa 40mg before the Buspar with no issues. So I contacted my doctor who has taken me off of it.",6,45,14
"BuSpar","Anonymous","November 28, 2012","Taken for less than 1 month","Female 21yrs old. I have had severe anxiety attacks for the past 2 years, OCD since I can remember, and feel like I can't breath when I think about the what-ifs. I was on Prozac for a few months and absolutely loved it until I started grinding my teeth in my sleep. I tried the Buspar. I've been on it for 2 1/2 weeks. It took most of my anxiety away. But I got so dizzy I couldn't stand it (15mg). Started halving the pills, still makes me dizzy. Gives me headaches and doesn't help with the stress or obsessive compulsive disorder. My doc is adding Paxil to the Buspar and hopefully it'll help more.",9,67,14
"BuSpar","Anonymous","November 24, 2012","-","I developed generalized anxiety disorder seemingly out of nowhere after taking prednisone for an infection, and for three months felt like I could barely function, the physical and mental symptoms were so all-encompassing. My docs suggested Lexapro but I wasn't depressed, just anxious; I did some internet research on my own and asked that they try me on Buspar instead. SO GLAD I did. I've been on it for six years now and I feel totally normal, like I used to before the anxiety set in. I've never noticed any side effects to speak of, besides the weird flushed dizziness when I first started taking it, which went away after a couple of weeks. On 22.5 mg per day but I miss doses all the time, to very little effect. Amazing med.",10,187,14
"BuSpar","ohio miscreant","November 3, 2012","Taken for 6 months to 1 year","After having tried Ativan and Vistaril I asked my family Dr for Buspar for acute anxiety. I also take Zoloft. I love Buspar. It's not habit forming and I feel like I have my life back! It's my miracle.",10,153,14
"BuSpar","BlondeMama","October 29, 2012","Taken for 1 to 6 months","I'm not exaggerating when I tell you all: This medicine has truly CHANGED my life! After suffering with clinical depression and anxiety for over 12 years, this is the only medicine that has completely taken the anxiety away. I take it along with Prozac 30mg and WOW what a difference it has made for me. (I've been on Prozac for 8-10 years). The Prozac helps with depression, but since my main problem was anxiety, it didn't help very much with that. Xanax wouldn't work for me like it used to, and after this last debilitating episode of anxiety, I had lost hope that anything would work for me. I'm only on 10mg on Buspar and it's literally made me the way I was before I started suffering all those years ago.  I feel like the REAL ME again! Amazing!",10,271,14
"BuSpar","Loopyloo","October 20, 2012","Taken for 2 to 5 years","I have been taking Buspar for about two years for anxiety and panic attacks.   I take 10mg three times a day.   I never experienced any side effects.  I find them not to be a quick fix drug at first I thought they were rubbish but after being on them for about a month noticed my days of anxiety were getting less.  Recently I had a really bad day and took some Melatonin to help me sleep.   Next day I felt fine.  So been taking Melatonin each night and seem to be getting better by the day.   I have read that Buspar and Melatonin can treat Bipolar Disorder.    I am not Bipolar but these two combined have really helped me.   My husband has noticed that I'm so much more relaxed.",0,108,14
"BuSpar","vtchick","October 9, 2012","Taken for less than 1 month","At first I didn't think Buspar would help me since I have always relied on antidepressants for my mostly manageable anxiety with a very occasional Klonopin. But this past year I was diagnosed with bipolar and have been advised that SSRIs could trigger manic symptoms so I am on mood stabilizers but they do not help my ever increasing anxiety. It has gotten so bad I rarely leave the house and can't work. When I started Buspar at 7.5 Mg 2x/day it made me more anxious and all I did was cry for a week but I was encouraged to keep taking it and it would get better and it has! My quality of life is soo much better, I feel normal again. I do get dizzy after my morning dose and need to sit or lay down though for maybe a half hour to an hour.",9,94,14
"BuSpar","Chinese from Burma","October 5, 2012","-","It was really good medicine for people with anxiety and panics disorders. I been taking sertraline (Zoloft) 100 mg and Buspar 20 mg total morning and evening and it was really helping me out with general anxiety and reduce panics from my daily life. I had this thing when I go in to any store myself I feel like everyone is watching me like I am going to steal something. That triggers my anxiety and my stomach aches and breathing pattern switch to worst situation ever. Facial all red and it was really painful life. Buspar took care 70 percent of that problem for others was 9 out of 10. I say Yes to Buspar. I suggest talk with your psychiatrist about acute anxiety and consult about having Buspar.",8,81,14
"BuSpar","Anonymous","September 27, 2012","-","F-Age 60. I have taken Buspar for 20 years, starting in 1992, age 40. I would go off for 3 yrs after being on for 3 yrs. I had horrible relapse of anxiety, would have to go back on. Now I have been on for 6 years without stopping at 5mg 3-times a day. I love Buspar and plan to stay on for life without stopping. I have done things that I could never do without the Buspar, like hiking the grand canyon at age 58, just driving there would have given me panic, and even day to day stress. I will take my chances with long term, better than feeling sick daily, not being able to eat, sleep or leave the house, no way to live. Side effects for me slight dizziness.",10,156,14
"BuSpar","kewlj","September 10, 2012","Taken for 1 to 6 months","I took this medicine starting on a fairly low dose, then gradually adding higher doses.  I decided to take it for my generalized anxiety disorder. It had little to no effect on my anxiety despite being on it for months.  I know it works for some people, it just wasn't for me.",3,37,14
