"Drug","User","Date","Period","Review","Score","Likes","Page"
"Mirtazapine","Jasmine","June 2, 2020","Taken for 1 to 6 months","I switched from being on Sertraline (Zoloft) for 4 years to Mirtazapine because sertraline caused a stomach ulcer. It was hard to get used to Mirtazapine as I felt dizzy and very tired for almost 2 weeks. I slept 12-14 hours a day, and even more over the weekend.  I've always struggled with sleeping too little, this only got a little bit better over time and therefore I decided to stop as there was little left of the day. Also, I was constantly hungry, particularly for chocolate, and gained probably about 2 kilos over 6 weeks' time.",3,5,1
"Mirtazapine","Laurenjade08","May 24, 2020","Taken for 1 to 6 months","I was given this drug for stomach pain that was attributed to anxiety. This drug is awful, easy to take but hard to get off. I took it for 3 months, gained 24lbs, and was so angry I couldn’t cope and peppermint oil sorted the stomach issue out. I’ve now been tapering a year and only at 10.8mg, avoid at all costs. Find Facebook group remeron should be illegal if you need help.",1,4,1
"Mirtazapine","debdob","May 22, 2020","Taken for 6 months to 1 year","This is a very good antidepressant. it worked for severe anxiety within 3 days initially. Sertraline took a few weeks, Mirtazapine was instant. No side effects except a bit more hunger but only in the few hours after you take it, so take it at night.",9,10,1
"Mirtazapine","Mat","May 2, 2020","Taken for less than 1 month","I took 15mg mirtazapine after dinner 7.50pm...fell asleep by 9pm and tried getting up at 5am as I had an early start. I couldn’t even sit upright I was so drowsy with it, so collapsed on the sofa and checked my watch which showed a heart rate in the early 30’s ! It’s like a sedative .  It’s now 24hrs later and I have more or less slept all day and still feel zoned out but recovering.  Maybe my body needed the rest, but I won’t be taking the rest of the 10 day course the doc gave me.",1,8,1
"Mirtazapine","Yeet66","April 30, 2020","Taken for 1 to 6 months","I’ve been on this for about 3 months and I honestly don’t feel any better or any improvements..",2,8,1
"Mirtazapine","Cassidy98","April 1, 2020","Taken for 1 to 6 months","I have been on this medication mertazapine 30mg dose for 3 months now and it is not helping in any way my depression and anxiety. I struggle with an eating disorder and this is primarily why I was given this medication from outpatient. It is only worsening my ED . I am putting on a lot of weight and it is really effecting me because it is encouraging me to not want to eat . And even when I don’t eat a lot I still put on a lot of weight because of this medication. My depression and ED has worsened since taking Mirtizapine",1,10,1
"Mirtazapine","Julia","March 9, 2020","-","Started taking Mirtazapine December 31st because of my eating disorder that makes me picky with food and lack of appetite.  My main goal was to get rid of my major anxiety.  First month: nothing major happened with my anxiety. More headaches than usually. I wasn't depressed in the first place, but Mirtazapine made me feel like my life actually got more manageable and that I had more energy to do things, like study.  They increased my dose every 3 weeks because I was still having anxiety. I am now on 40mg and my anxiety is better. I do however think it's because I have a better outlook on life.  My appetite is a lot better, during these 3 months I have gained around 4kg. I never have bad eating days now so I eat regularly. About my sleeping habits: I've always been a night owl. Nowadays, if I take it around 8 PM, then I am asleep by 11:30. On the weekends I wake up around 8-10 AM on my own. I don't feel tired throughout the day.",9,40,1
"Mirtazapine","Dana","March 9, 2020","Taken for less than 1 month","I have been on this med mirtazapine for 11 days I have anxiety and panic attack and PTSD I have had very little anxiety and no panic attacks I am on 7.5mg  I also suffer from health anxiety it has also taken the edge off that the only thing I don’t like is I am tired almost all day but I will take that over panic attacks any day",9,43,1
"Mirtazapine","Anonymous","March 2, 2020","-","I'm a 35 year old male with a history of panic and anxiety. Have tried a number of meds, including SSRI's and Benzos. Today is day 14 on this medication the dose is a half a tablet (15mg) mirtazapine.  I have been taking it around 8pm every night, and it certainly reduces then amount of time it has taken to get to sleep every night. I am also sleeping throughout the night. Some sleepiness and flu like symptoms during the day.  On day 11, I woke up with a desire to clean my house. I haven't had a desire to carry out any activities to completion for a while. On day 12, I went and had a coffee with a friend, and proceeded to spend the entire day away from the house, seeing a movie, doing some grocery shopping, then having dinner with another friend. This kind of desire to get out and do things, or complete tasks is a fairly new thing for me. I am also finding that this is having an impact on reducing pain. I have a separate chronic pain issue and have had zero desire to take my opiate medication for pain.",8,59,1
"Mirtazapine","Paulalass","February 25, 2020","Taken for 1 to 2 years","Hi after reading the comments I thought I would share my experience of mirtazapine. After suffering from anxiety and panic attacks I finally went to doctors and was prescribed antidepressants - I think they were citalopram not sure of name but they made me worse. I was then prescribed mirtazapine they took a good few weeks to kick in. I've been taking 15mg for nearly 2 years now and feel miles better in myself. I am now able to go to the shops on my own, get a bus alone and even got a full time job.   Here comes the down side, I've put a stone and a half on gone from 9 and half to 11.  The actual drug doesn't make you gain weight it's the food you crave.  So I'm determined to try and combat that with a healthier diet. She says haha...also the dreams are horrendous and it does take me a good hour to ^come round^ when I get up. Saying this  but it is all worth while as I now feel I have my life back . I hope this helps.  Keep at it as it will be worthwhile in the end. Wishing you all well Paula x",10,56,1
"Mirtazapine","ScrewyLouey","February 23, 2020","Taken for 1 to 6 months","This drug really worked for me but I has to discontinue it.  I did experience grogginess in the morning. It took me awhile to get going, but once I was up and around, I was fine.  I’d take that over not sleeping any day.  It was also very effective for my anxiety at 15mg.  It also has no sexual side effects for me (male), which was huge.  In fact I think it may have helped my libido a bit.  Now, the bad.  I could not stop eating on it.  It was crazy. It was like something took over my body. I could eat a large pizza and a box of cupcakes, almost cry because I didn’t want to eat anymore and knew I was out of control, and then 10 minutes later be in the kitchen tearing through the kids’ cereal and whatever else I could get my hands on.  I put on 25 lbs in less than 2 months with no signs of slowing down. It really sucks because it was great in all other aspects for me.",5,21,1
"Mirtazapine","Yorkshirelady","February 20, 2020","Taken for less than 1 month","Would not recommend. First night taking 15mg within a very short time felt really dizzy and wobbly and unsteady and staggered as I walked. Had to go straight to bed felt really awful and then had terrible restless and throbbing legs that lasted hours and hours. Felt over whelming tiredness and the the next day slept all day and legs felt heavy and achy.",1,19,1
"Mirtazapine","Queenie","February 18, 2020","Taken for 2 to 5 years","Hi, I on 200mg of sertraline, I’ve been on them for 5 years and tbh I don’t think there working, doctors have told me to drop to 150mg and take  10mgs of mirtazapine, I’ve heard so many bad things about tapering off sertraline, has anybody done this?? Advice welcome Queenie xxx",0,11,1
"Mirtazapine","BBGL","February 14, 2020","Taken for 5 to 10 years","Mirtazapine is the only antidepressant I can tolerate (tried all of the others). I need it for GAD, PTSD and insomnia. My usual effective dose is 30mg, but I can either go up to 45mg or down to 15mg depending on where I’m at. It ‘can’ make you put on weight but it doesn’t have to if you watch your diet and exercise. Also, be aware when the carb cravings hit, try to be mindful and have some protein instead. The fog should wear off after a few weeks. I find going to bed an hour earlier most nights helps waking up a bit easier.",10,40,1
"Mirtazapine","Mike","February 12, 2020","Taken for 1 to 6 months","Take all these other reviews with a grain of salt. I think you really need to remember every body is different and so will your reaction to any medicine. As for the weight gain - if you have an increase in your appetite you have to really watch what you eat. I've been on 30mg / day for the last month and haven't had any side effects. In fact, I've been losing weight and this weight loss has continued while taking mirtzapine. I'm sleeping better than ever at night and have felt more awake and energetic during the day than ever.",10,69,1
"Mirtazapine","Kayla","February 12, 2020","Taken for less than 1 month","This was given to me to stop my seizures, I’ve been taking it for a little over 2 weeks and it’s not working. I’ve gained 10 pounds and I sleep for 12 hours a day. I have no energy. I hate this drug",1,10,1
"Mirtazapine","Tb","February 10, 2020","Taken for 1 to 6 months","Been on mirtazapine for about 2 months, I suffer with depression and insomnia too. Worked wonders for the depression and insomnia, but has not been effective for anxiety.. at all. I have terrible anxiety, it quite literally has taken over my life. On 45mg but will be going back to the doctors to see what the next step is.",6,12,1
"Mirtazapine","justphua","February 9, 2020","-","Prescribed mirtazapine for anxiety, sleep, weight loss, and acid reflux pain. 2 months, 3/4 of a 30MG  tablet and still sleeping 9 to 10 hrs per night. Brain fog is still present, but I don't feel completely impaired. Anxiety is returning and I feel emotionless.  I also feel like I'm at 90% mental clarity, and I get random moments of fatigue and the desire to nap. My weight is slowly coming back after dropping 20lbs in two months. Med leaves you trapped in your own body for two months dazed, blurred vision, and exhausted. It helped me, but at the cost of freedom, work, relationships.",5,18,1
"Mirtazapine","Timmy","February 6, 2020","Taken for 1 to 6 months","I have been on 15mg of Mirtazapine for 8 weeks now with no major side effects. The amount of panic attacks and anxiety I experience has been reduced significantly and I also now have the energy during the day to be active. When I do begin to spiral into anxious thoughts I am now much more able to pull myself out of these thoughts and distract myself. Before this was not possible. However I should note, I also made significant lifestyle changes (such as better diet, more exercise and reading), which I believe have also had a large effect on my mood and mental health. The medicine enabled me to make and maintain these changes.",10,42,1
"Mirtazapine","BC","February 5, 2020","Taken for less than 1 month","I have pretty much every type of anxiety, some more severe than others. I was on sertraline for 4 weeks before I had a bad reaction to them. I have now been on mirtazapine for 2 weeks and I'm unsure if any noticeable changes have happened. I did feel so tired for a few days but that quickly went. I'm happy that I'm slowly putting on weight but I haven't really felt much for my anxiety. I'm starting a double dose tomorrow so hopefully that all goes smooth...",5,9,1
"Mirtazapine","Snake","February 2, 2020","-","I've been taking this medication for about 4 weeks now helps with sleep but have to add Ativan to it. I only felt super drowsy the very first morning and then after the first morning started to feel a bit more alert, and had good mornings to follow. Can't really tell if it's helping much with my anxiety because I typically take Ativan with it. Going to give it 4 more weeks and see if I can get more Improvement and mood and less anxiety",6,6,1
"Mirtazapine","Nic","February 2, 2020","-","I was previously on 30mg citalopram for anxiety and depression but had suffered with insomnia for years and the last year and a half with breathing problems (which can be a rare side effect of citalopram). I still take 10mg citalopram every 3 days as I'm weening slowly off and have been taking 15mg Mirtazapine nightly for nearly two weeks. It's really helped my sleep but I struggle to get up the next morning and feel lethargic and groggy throughout the day which makes it kinda pointless to me. I know I've not been on it a long time but I will be telling my doctor I don't wish to continue when I see her this week.",5,7,1
"Mirtazapine","Sher","February 1, 2020","Taken for less than 1 month","Prescribed this medication yesterday.. took one pill at 8pm and 20 minutes later I felt so dizzy I could barely see and had to get into bed quickly. I passed out almost immediately and slept for 14 hours.. YES 14 HOURS!! I normally sleep 8. The next day I struggled getting out of bed. By 6pm I was still feeling like a zombie and even though I was not hungry I ate way more than usual. I have only taken this pill once and I am scared to take it again as there is no way I can work, drive or let alone walk properly on this! I do feel very rested but no way I can handle staying on these! I'm sure for other people it is great but not for me.",1,18,1
"Mirtazapine","Anonymous","January 24, 2020","Taken for less than 1 month","worst medication that I have been on. Mood swings of the chart agitation as well ,will never go back on this every again thought I was going insane.",1,19,1
"Mirtazapine","Momtoadarye","January 14, 2020","Taken for less than 1 month","I just took  mirtazapine 7.5 mg last night with a .5 clonzapam, and I usually research things before I go to bed on Google.  It's become a really bad habit, and I don't go to sleep till late.  Last night I was so tired I went right to sleep, and didn't wake up till morning.  I usually wake up after 4 hours of sleep, and then have to try and go back to sleep again.  I woke up a little jittery, but the sleep was great.",8,18,1
"Mirtazapine","MrMike","January 14, 2020","Taken for less than 1 month","I probably had GAD for most of my life and a previous severely depressed episode was treated with Lexapro which seemed to work OK. This time Dr said I had GAD so I just started on mirtazapine. First nite, took 7.5 mg. I was still felt stoned till 3pm the next day but slept well. Next nite did about 3mg and it worked OK. 3rd nite 3mg only lasted a few hours so back to 7.5. For sure dreams are wild but it really improved my sleep. No appetite back yet but it is still early.",8,13,2
"Mirtazapine","Ishbol","January 13, 2020","Taken for 1 to 6 months","mirtazapine helps with anxiety and panic  but the side effects are so strong heavy sedation after taking (30 mins and I'm knocked out) and extremely tired the whole next day strong cravings for the first week and then they wore off (everyone is different) no sexual side effects please, please do not rely on this or any other medication to cure your anxiety. it will help for sure, but you really need to see a therpist and read some helpful books to get to the root issues and mindsets that keep your anxiety at play. seriously, seriously awesome books: complete self help for your nerves by claire weekes at last a life by paul david  dare by barry mcdonagh no worries by sarah edalman rewire your anxious brain by catherine pittman",6,36,2
"Mirtazapine","GaGirl","January 13, 2020","Taken for 1 to 6 months","Hello, I was diagnosed with GAD about 10yrs ago along with depression and panic attacks. I was prescribed zoloft and it does help with depression but not my anxiety. I have a real hard time sleeping too. So I decided to see a new psychiatrist and she prescribed mirtazapine 7.5 right before sleep.  I started taking it and immediately noticed a quiet difference in my sleep. It doesn't knock me out like other medications did..it's like a relaxing feeling. After about a month I started noticing the want to talk more at work and to do more around the house.  I was feeling more like myself. So it helps with my anxiety too, a bonus. I urge you to try it and see if it helps. I thought I had tried everything out there.",10,44,2
"Mirtazapine","Anonymous","January 13, 2020","-","I'm a 19 years old male, anxiety disorder, and PTSD. Prescribed by GP who told me mirtazapine would help me sleep. Yeah, they make you sleepy in the first minutes. But I have terrible vivid dreams and nightmares. I get really angry at nothing, easily annoyed. Had discussions with my partner after the 1st dose. Then I took my 2nd dose yesterday, and today I woke up with suicidal thoughts, I don't wanna die. I woke up and felt so depressed and anxious! This drug is awful. I'm supposed to keep taking these, and today I should take my 3 dose, but I won't. I don't want to harm myself.",1,15,2
"Mirtazapine","Mike87","January 10, 2020","Taken for less than 1 month","First couple of doses of mirtazapine makes you extremely sleepy to the point of not been able to get up the next day but getting past that it does relax you and my anxiety has somewhat eased after about 2 weeks I've noticed that yes I am also more hungry but that is good for me as I'm skinny so need a few pounds added So all in all I'd recommend but you have to get past the initial stage of extreme sleepiness",8,12,2
"Mirtazapine","justphua","January 6, 2020","-","I have been on Mirtazapine for about one month for GAD increasing dose from 7.5MG to 30 MG. The disorientation and tiredness are life altering.  Complex tasks are hard, ability to focus, tiredness, lethargy, and blurred vision are all side effects that last into the next day. I still feel anxiety, but less intense and no panic attacks. I have read that I should give it more time at the higher dose, but there is no way I could do that outside of managed care. I was given Ativan to bridge the gaps after a panic attack sent me to the ER at 7.5MG Mirtazapine, but don’t want to be hooked on a benzo that I can’t get later. I’ll share that .25 MG of Ativan did take the edge off if it got too bad. The Mirtazapine might be helping the reflux pain as it is almost nonexistent, but the price for losing that pain is constant disorientation. I may be premature in my assessment so I’ll come back in 30 days and share an update, but this is tough going.",6,13,2
"Mirtazapine","Ivan","January 6, 2020","Taken for 2 to 5 years","Hello everyone! I have experience with using mirtazapine over 5 years where I have gone on and off every time  relapsed into anxiety/depression! I noticed a few people blaming this drug because it did not help them on the first night with sleep! Don’t do that! In my experience this drug helps sleep but not always the first night! I find with me sometimes it takes a week or longer before I sleep better taking this medicine! Also I have more energy from this medicine , it does not always makes you drowsy! If you are depressed it will give you energy but still let you sleep at night! Lower doses are better for sleep 7.5-15mg is best for sleep! Don’t judge this drug after one day of no success",8,32,2
"Mirtazapine","Lottie","December 30, 2019","Taken for 1 to 6 months","Got prescribed 15mg mirtazapine for anxiety and low moods. Did wonders for anxiety I felt like it almost went instantly I was able to concentrate again and actually had an appetite. I put on 3kg in a month but that is not a bad thing as I’m underweight anyway. Also helped so much with sleep which I struggled with due to anxiety but did feel pretty hungover in the mornings for the first few days. However I came off it after two months as my mood was not getting better and was possibly getting worse. I was also hugely irritable and found myself shouting at my family quite a bit. Coming off it I’ve found my anxiety has rocketed again.",5,9,2
"Mirtazapine","Sarah","December 29, 2019","Taken for less than 1 month","I just started this medication Monday. Before I started taking this, my anxiety was terrible. Didn't want to leave the house or interact with anyone, wasn't eating for days, shaky, hands sweaty, mind was racing 24/7 leaving me with no sleep and constantly trying to occupy my mind. Insomnia runs in my family and I was crying randomly. My therapist believes I may have manic depression and I've had GAD for most of my life. I take half of 7.5 in the morning and before bed as well as Gabapentin 100mg morning and night. I would say the first 2-3 days I was really tired and slept through the night, did not have anxiety, but mood is still the same. I'm now on day 7. I have energy through the day, I sleep well but not as well as the first couple days, and my anxiety is back but just a tiny bit where I can notice it enough to not want to lave the house. I will update in a couple weeks if it's changed or a couple weeks if dosage increase has changed anything",6,16,2
"Mirtazapine","Rick76","December 29, 2019","-","I was on 15 mg of Mirtazipine for 6 weeks, then started getting horrible thoughts, so my dr immediately took me off cold turkey after 6 weeks! I’m concerned if I’ll have bad withdrawal since I was only on it for 6 weeks, can someone help?",1,11,2
"Mirtazapine","Salara","December 26, 2019","Taken for 5 to 10 years","I've been taking mirtazipine for about 5 years now. I did stop for a little over a year, until recently having been put back on. It makes me SO HUNGRY at night when I take it. Then it knocks me the heck out; leaving me feeling drowsy as all heck the next day. It does help with depression,  but the anxiety is still in full throttle if not worse. The withdraws from it are horrific, it took me a good year and I still felt like garbage so my doc put me back on it at 30mg/day.",4,5,2
"Mirtazapine","Charlotte","December 24, 2019","Taken for less than 1 month","I’ve been taking Mirtazapin 15 mg for 5 days and I feel less anxious I was previously taking amitrityline and Pregabalin but only for 3 weeks I had a very fast heartbeat with this combo and became more anxious in turn I had insomnia.The first dose of Mirtazapine slowed my heart rate and made me feel more relaxed.I take it between 8 pm and 9 pm and feel very rested after an hour. The dr has given zopiclone prn because of insomnia so far no bad side effects a little groggy in the morning but it soon wears off",8,11,2
"Mirtazapine","Creative","December 24, 2019","-","I wanted to leave a review in the hopes of helping someone similar to me. 7 years I suffered with anxiety on and off, the last year has been unbearable! I suffered with extreme anxiety attacks over the silliest of things, I would be physically sick! I went a week without eating and constantly being sick, I was really low to the point of thinking I’d be better off not being here, I went to the doctors and was given sertraline which made me worse, I then tried citalopram which did help with my mood but didn’t help with the extreme anxiety, I was about to give up but my doctor suggested mirtazapine 15mg, I can’t explain the relief I feel! Side effects were drowsy in a morning, sleep like a baby, constipation, which lactulose solves and weight gain, but they soon wore off, for me this drug has given me my life back, I can now cope with any situation, for anyone suffering, please don’t give up, the right medication for you is out there.",10,84,2
"Mirtazapine","Kt","December 22, 2019","-","Rubbish. I don’t know what is the purpose of this drug ? First night on 15mg I slept but had the worst restless leg syndrome ever ! Felt hungover for weeks ! And the anger and rage I felt on these were awful I had massive argument with my next door neighbours I was that angry ! I ate everything in sight especially sugar cravings and I’m only 8st  and I put 10lbs on in three weeks ! The constipation was awful and all I did was cry ! They done absolutely nothing for my anxiety! The final straw was when I took myself to A&amp;E for an ECG my chest was burning with pins and needles down both arms ! I weaned off them after four months and withdrawals off that was hard too but I’ve been off a week altogether now ! I wouldn’t touch again ! Definitely recommend sertraline if your struggling from anxiety and depression! Good luck x",1,16,2
"Mirtazapine","Banjo","December 20, 2019","Taken for 1 to 6 months","My experience has been good in regards to getting to sleep since I have insomnia, but I also take this med for nightmares. I have C-PTSD, chronic depression/anxiety. Each time that I take a nap (or just anytime where I haven’t taken the med before going to sleep) I have gotten nightmares. I’m unsure if this med is causing me to have nightmares when I don’t take it but for anyone who has nightmares, maybe pay attention to this, other than that it puts me to sleep perfectly and I’m able to sleep throughout the night once I fall asleep.",0,4,2
"Mirtazapine","Ed2765677","December 17, 2019","Taken for 1 to 6 months","I took 15mg mirtazapine for 3 months when Venlafaxine XR 75mg pooped out and stopped working.  I found that it helped my depression a bit but made my physical anxiety symptoms worse. Despite being on it for a short time, the withdrawal symptoms were awful. I would recommend trying other medications before this one.",3,5,2
"Mirtazapine","Jaden","December 17, 2019","Taken for 5 to 10 years","I take this for anxiety and depression.",10,4,2
