"Drug","User","Date","Period","Review","Score","Likes","Page"
"Mirtazapine","IDH","March 14, 2018","-","Was prescribed this at the end of 2017 due to worsening depression and anxiety, along with all nighters and severe mood drops. Doc put me on 30mg and I can explain personally what it done for me. I'm currently not on them due to me being a bit of a weirdo (Hypochondriac) and thinking of going back on them. 1st few days on them: Tired, groggy feeling, but I was VERY relaxed. 1 week: Settled down with grogginess, felt very chilled, but this is why I've quit them temporarily. 2-3rd week: Sleeping fine, but was feeling very, numb. Like I just didn't feel much emotion whatsoever which made me feel a bit anxious and uneasy, (even though these tablets are supposed to stop that) I did not suffer with any weight gain issues, was hungry a lot but I have a fast metabolism, and no sexual drive decreases I think the only thing I really suffered with was loss of affection, love etc, which kinda bums me out.",10,11,7
"Mirtazapine","Sue22a","March 13, 2018","Taken for less than 1 month","Hi been on mitazapine,week four 27mg , still wake up with anxiety and needing loo all the time.  I can still feel myself shaking still.  I may need to up the dose tonight ,",8,3,7
"Mirtazapine","Jxx01","February 24, 2018","Taken for less than 1 month","After a horrendous experience on sertraline (manic and self harm), my GP has switched me to Mirtazapine 2 weeks in on 15mg. No huge change in anxiety / mood etc. I fall asleep within 5-10mins of taking it. Unfortunately I have started getting dizziness and vomiting. I hope this passes as I have been in bed all weekend with it. No appetite increase or weight gain, thank goodness. Increase in libido which is interesting (my bf is not complaining!). Got a Dr appointment this week...will be interesting to see if she wants to up my dose and, if so, how that goes for me.",6,1,7
"Mirtazapine","Neil","February 24, 2018","Taken for 1 to 6 months","Been on this drug for about two months. Every other drug made me worse.. Mirtazapine has helped heaps. Put on a couple of pounds but I'm relaxed and happy. My friends noticed the difference. Works fast also.",9,10,7
"Mirtazapine","G28","February 8, 2018","-","First week: drowsiness and hunger, ate loads craving food. The drowsiness made the days difficult to go through, I started my course of meds 2 days before the weekend and those two days of work were difficult. Everything did settled down,  I only got drowsy before bed and small increase in appetite than usual. 2-3 weeks: slight increased suicidal thoughts and more depressive mood, although my doctor had discussed this with me it wasn't fun. After a few months everything did get better with my overthinking and my anxiety. Worrying all reduced, I feel safer going outside, it's made life better. I've been on meds for almost a year now, my dosage has gone all the way up to and I'm on my way back down currently, I've personally coupled this with CBT therapy. Withdrawal affects for me have been as bad as not sleeping due to accidentally missing doses. Overall I'd say being persistent with meds for months or years will be good, I'd like to think I'm not ashamed of being on meds and I know I will get better now.",8,14,7
"Mirtazapine","Mannajon","February 2, 2018","-","I’m on week 2 of mirtazapine and have gone from 15mg in the first week to 30mg in the second. I was prescribed it for anxiety and low mood. I’ve found that it had definitely started to help as I don’t feel utter terror on waking in the morning. My sleep is very disturbed and I wake up a lot but I do feel refreshed in the morning. I know it’s early days but I hope that the glimmer of light that I can see at the end of the tunnel gets bigger as the days go on. How long have other people found it takes to feel ok and function again properly? Thanks",8,14,7
"Mirtazapine","Mochalover","January 20, 2018","-","After suffering what could only be classed as a  mental breakdown  from anxiety and depression. I was put on citalapram (horrendous) and then Sertraline (which left me suicidal) and finally a doctor prescribed me mirtazapine. For the first 5-7days I felt sedated but that could have been because of the comedown from the worst bout of anxiety I’d ever experienced. I immediately felt better, I slept properly for the first time in months and my anxiety immediately reduced. I was on 15mg for over a year, now reduced to 7.5mg (no withdrawal). This medication literally saved my life and I’ll continue to take it long term. Only side affect (aside from the initial sedation) I had was slight weight gain. I went from 52kg to 55kg.",10,26,7
"Mirtazapine","MrsRissole","January 16, 2018","-","I have been on this for 2 weeks now. Prescribed by my Dr after being given Lorazepam but having no luck. I am still having panic attacks daily, but I am finding I am able to calm myself down a little easier most of the time. I also suffer from Depression and Insomnia so these help with those.  I have been feeling very foggy and sluggish the next day though and this has been making it hard for me to function at work. After reading these reviews though I am wondering why my Dr has given me 30mg straight away. I will definitely update this the longer I am on it",8,8,7
"Mirtazapine","MDunkown","January 13, 2018","-","I have been taking 30mg of mirtazapine for just over 2 years now I used to have chronic panic attacks everyday I couldn’t sleep at night, I was losing  weight due to anxiety I started this and I have never felt more calm and relaxed I take it at night time get the munchies and go into a food comer sleep all night. I still suffer for them from time to time but not as bad as I used to. Everybody is different I guess, but definitely worked for me ;)",10,16,7
"Mirtazapine","suz49","January 7, 2018","-","I started taking this medication 3 weeks ago and after a week of taken them I have been suffering from aches pains. In shoulder, arm  wrist and knees. Could this be a side effect  Thanks",0,14,7
"Mirtazapine","Erick A","January 7, 2018","-","Had anxiety for many years, 4-5 attacks a day some lasting for hours at a time, even waking in the morning under attack. Doctor put me on Mirtazapine about 6 1/2 weeks ago after having bad reactions to other anxiety meds. First few weeks I was a little sleepy but my body adjusted just fine, very little weight gain. Bottom line I have not had an all out attack in over 5 weeks. I feel some attacks but they are so very weak I just carry on. Feels like a miracle",0,22,7
"Mirtazapine","SlightlySyncopated","January 2, 2018","-","Very early days and never usually write reviews but thought I'd share my experience for anyone who is scared of taking their first dose.  I took my first dose last night and was asleep within in an hour. I've woken up this morning after 10 hours sleep and whilst I feel slightly groggy my usual morning anxiety has completely vanished.   I'm hoping the grogginess will subside as I continue to take them.   (I've previously tried Setraline and Fluoexetine and both made my anxiety unbearable)",10,17,7
"Mirtazapine","HKA","December 31, 2017","Taken for 1 to 6 months","I use Remeron to reduce my Anxiety at night and get proper sleeping. I started with high dose at 30 mg 1 hour before bed time; it was heavy for me and I struggle to wake up next morning, then as per my schedule I reduce it to 15 mg then 7.5 mg. Dry mouth and feeling hungry at night was a problem, but it worth sacrificing the side effect. Remeron is great for me at certain level of 10-15 mg. Weight is not a problem for me as I train properly and watch my diet. I’m fighting Depression and Anxiety for the past 7 years, I have to stay on medication, Remeron at night and Zoloft in the morning, this is the best combination for me.",8,6,7
"Mirtazapine","Panic disorder","December 18, 2017","-","I've been on this medicine for a few years now 45mg and I don't think they work for anxiety at all. I still have panic attacks every day and during the night I can wake up in panic.  The doctor sent me to see a councillor but found that did not help either think I need to go back. I can't carry on like this its driving me insane",3,8,7
"Mirtazapine","Shiv shiv","December 9, 2017","-","Do not take this bad medication. It's highly addictive. Hard to come off like Xanax. This is good sleeping pill. Yes it's calm down at night if it takes on night but after waking up it's giving hang over like you drunk 15 shots of vodka the night before",6,13,7
"Mirtazapine","Markus86","December 3, 2017","-","This drug is good for depression but not for anxiety.",6,8,7
"Mirtazapine","freddyg4","November 10, 2017","-","I've been on it for about 3 years now, side effects like drowsiness are a given, it goes away with time and adjustment. Once you're good on it you'll know, it takes time (as the doctor will tell you). Kind of worried of long term use side effects after reading online but for now it helps. be back with any updates",7,10,8
"Mirtazapine","AnaChristina12","November 9, 2017","Taken for 10 years or more","Loved this medication.  Particularly loved the sedative side effect, because I had been unable to sleep more than an hour or two at a time, prior to taking mirtazapine.  The only drawback was that my appetite, and consequently my weight increased dramatically over time.  After taking it for 10 years I had to find a medication that would not make it so difficult to lose and maintain weight, but I have never found a medication that made me feel so good, relaxed, and able to sleep.",9,23,8
"Mirtazapine","Jim Dee","November 7, 2017","Taken for 1 to 2 years","I have been on  mirtazapine for a while now and my anxiety was mostly kept in check until I had a pulmonary embolism which can cause anxiety, then the anxiety kicked into high gear. The Dr increased the dosage from 15mg to 30mg. Hopefully that will provide some relief, so I can rate the drug as a 10",6,9,8
"Mirtazapine","Knsk","November 4, 2017","Taken for 1 to 6 months","Don't listen to any of the negative comments in regards to this medicine.  I currently take 30mg at night.  It helps with anxiety during the day and does keep u asleep at night.  No real side effects with this medication.  Of course it is a sedative so u r bound to be a bit sleepy at times but honestly it's not bad.  More like calm then groggy.  Only changes I found in myself since taking this medication is I find I don't have a deep sleep.  Seems to be more like a light sleep with dreams but it's still restful and I don't regret this medication at all it's been fantastic.  People say u gain weight on it but thats not true for everyone.  I didn't find it made me hungry.  No different then usual.",9,34,8
"Mirtazapine","Poe1974","October 16, 2017","Taken for 1 to 2 years","Make you drowsy",0,4,8
"Mirtazapine","Anonymous","October 9, 2017","Taken for 1 to 6 months","I have been on this medication for about 4 months now. When I first started taking it, it knocked me out hard and when I woke up I could barely walk straight. I was so dizzy and off balance it scared me. My doctor told me that it is normal and to just stick through it. I felt better the 2nd and 3rd month, while it didn’t take away my panic/anxiety disorder it did help a little bit. Now I’m on month 4, I have been having panic attacks in the middle of the night. I get weird panic Attacks which shows in uncomfortable physical symptoms. I am now going back to the doctor to see if there is anything else I can do to improve or change my medication. This did help me get off Xanax 0.25-0.5 mg for 3 months but now I need it again occasionally.",6,5,8
"Mirtazapine","beansdad","October 6, 2017","-","This med works great but these 7.5mg and 15mg doses I see on here seem low.  At those levels it will make you so hungry (at least in my case).  Just try 45mg and see if it works for you.  I have also found that a little effexor mixed with it causes the hunger from each to cancel out.",8,4,8
"Mirtazapine","KMH90","September 8, 2017","-","I've been on this med for 5 days now. I feel the hunger! I am constantly craving food. Sleep wise it knocks me out and keeps me asleep which is great as my anxiety usually wakes me up through out the night. I do feel a little better mood wise but not enough. I am on 15mg, one before bed. The groggy sleepy feeling has started to wear off today and I am able to function. I feel like this could work if it wasn't for the weight gain, I struggle with my weight as a size 14. I don't want to now feel depressed because I've put on weight. I've given it a 5 as I am still unsure, I don't know if I will renew this prescription.",5,17,8
"Mirtazapine","Jimmyjn121","September 1, 2017","-","I have had Generalized Anxiety since a child along with panic issues. I'm now 28 and continue a life of anxiety. I had my share of drug abuse as well to self treat my anxiety but in the end all that stuff made my anxiety worse. Not my fault my docs could not treat me. I've been on a variety of anti depressants and anti anxiety meds but I don't get access to benzos anymore, even if I have a panic attack because my doctor refuses to ever trust me with anything addictive so I'm stuck with meds like mirtazapine. It is great for sleep that's for sure. Also great for nightmares. Oh man the nightmares I've had! Great stuff I say. The nightmares.. Not the drug. I've been on it over a month now at 7.5mg and I still have a lot of anxiety.",5,7,8
"Mirtazapine","Greggles","August 28, 2017","-","I've  been taking the drug for about 5 years for an anxiety. It was an absolute godsend for me. It takes a few days for the body to settle in but it's worth it.   It allows me to function normally. Yes it does have a sedative effect but l take it at night which only helps me get to sleep. Yes l still suffer from mild anxiety occasionally but it is manageable. This allows me to focus on the cause which is usually procrastination of life issues such as money/health.",9,36,8
"Mirtazapine","JH Alaric","August 22, 2017","-","I have started the mirtaz 7.5mg from last night. Unfortunately, I strongly feel the dizziness.",4,5,8
"Mirtazapine","Sarah199","August 18, 2017","Taken for 6 months to 1 year","I was prescribed 15MG for anxiety, nervousness and troubles sleeping.  I struggled to fall asleep and only slept for 3-5 hours I'm now getting a full nights sleep 8 hrs+.   I recommend taking them a good 1-2 hrs  before bed, (I usually take them at 20:00 and my alarm is set for 7:00 - 7:30). I find it a struggle to get up and out of bed but that is normal for me.  I get a really good night sleep and some pretty funky dreams. If I do wake up for any reason it isn't long before I fall back to sleep.  They melt on your tongue and have a slight orangey taste, and leave your mouth numb but not for long.  My anxiety has calmed down a lot and was sleeping a bit better after week 3.  My appetite increased for the 1st month but returned to normal.",9,33,8
"Mirtazapine","Babe21","August 16, 2017","-","I have been taking low dose mirtazapine (3.75 mgs) for about 10 wks now for anxiety, insomnia and mild depression. I was prescribed this after being unable to tolerate SSRI anti depressants and having a very bad reaction to Lexapro. Mirtazapine has worked well for insomnia and I started noticing improvements in anxiety levels and mood within 3-4 wks of starting.  I initially had a mild increase in appetite but no weight gain, and my appetite is now normal. The drawback to this med is daytime fatigue/groggy sensation that does not lift until late afternoon. I was told this would improve with time, but it has not. For this reason I will likely taper off the med soon - not something I can put up with long term despite being effective for insomnia/anxiety.",7,28,8
"Mirtazapine","Anonymous","August 9, 2017","-","I have been on this mirtazapine for over a mo. Started out 30mg but went to 45mg, Then my dr. said stop taking it and started me on a different med. Could not take what he gave me so he said I could start back on 45mg. mirtazpine but it has been over a week and I really would try to to not take it, Would it be ok not to take it . I'm a little anxious  today.",0,6,8
"Mirtazapine","Reddhead","August 7, 2017","-","Not only was this medicine not helpful, it made me a zombie.  I took a quarter of a pill in the lowest dose available. Within 15 minutes I literally could not function and had to stop what I was in the middle of and go to bed. I woke up after a full nights rest and was still in a fog. As I drove to work, I was so out of it. I would snap back to reality for a second and be scared that I passed my exit, which was still miles away, because I just wasn't with it.  I also nearly missed an appointment because (despite reminding myself more than once during the day that I needed to get to this appointment) I completely forgot.  I stayed in a zombie like state all day.",1,14,8
"Mirtazapine","Samjoy","August 6, 2017","-","I have had acute anxiety since I was a kid, I am now 26. I have been put on a range of medications to help with panic attacks over the years and have been on Mirtazapine for 4 months now and it has worked better than anything else. I still have panic attacks but they are mild and infrequent, in comparison to the 6-10 I was having per week beforehand. excellent medication!",10,27,8
"Mirtazapine","M moody","July 30, 2017","-","I have been on this drug for over a year now and it's safe to say mirtazapine saved my life I was having really bad anxiety for 3 to 4 month and that brought on the depression it got that bad I was running into the wall to try stop the feeling. After the doctors seen me they put me on Mirtazapine on 15mg for 6 week. I dramatically seen a difference in the anxiety but still was feeling really down so the doctors put in up to 30mg and have been on since. I can go to my job with no problems. But every now and then the anxiety still comes back but I'm learning to deal with the issue that bring the anxiety on",10,25,8
"Mirtazapine","L Hegarty","July 26, 2017","Taken for 2 to 5 years","My son was prescribed Mirtazapine for severe anxiety. It helped a little bit and also his medicine for his bi polar disorder helped (Depakote).  However,  once the anxiety decreased he should have had the Mirtazapine stopped by the psychiatrist.  This did not happen and he eventually had a severe psychotic breakdown where he tried to smash up his home, attacked his partner and believed aliens were after him . He was in hospital for over 2 months after the police had him sectioned.",3,11,8
"Mirtazapine","Btcctb","July 15, 2017","Taken for 1 to 6 months","Was prescribed for anxiet. I don't get anxiety daily but certain situations cause horrible anxiety and panic so doctor thought this might keep me calmer overall to avoid moments of panic. Started on 7.5mg for 6 days. First few days on that felt like I was on a low dose of diazepam. Then felt nothing. Increased to 15mg for three weeks. Noticed I still felt anxious in same situations. Upped to 22.5. Anxiety felt worse. Went back down to 15mg and tapering off it. No withdrawal symptoms lowering dose. Currently on 7.5mg at 5 weeks of being on this. I sleep deeply on it but have very vivid dreams. I've experienced sleep paralysis one night which was scary. Some other horrible dreams too occasionally. Have had increased appetite.",2,15,8
"Mirtazapine","Anonymous","July 10, 2017","-","god sent for anxiety",10,23,8
"Mirtazapine","Texaschic98","July 7, 2017","Taken for less than 1 month","I think it's gonna help me just got on it yesterday with 1mg xanax",10,10,8
"Mirtazapine","Allisgood123","July 7, 2017","-","I was on this medication for approximately 8 weeks.   I felt it did a great job with helping to sleep @ night but I felt more and more anxious and not able to sit still for long.   It did help a bit with anxiety attacks but overall I would say this drug was mostly beneficial for sleeping at night.",5,14,8
"Mirtazapine","RknR","July 7, 2017","-","I found this drug increases appetite rapidly and is very sedating, I do not feel it has worked for depression or anxiety, I am on the maximum dose and take it alongside another anti depressant. I have taken for approx 12 months, I am now reducing with the aim of stopping due to the weight gain and lack of real benefit.",3,15,8
"Mirtazapine","Ron1234","June 24, 2017","-","I see a lot of negative reviews on here of people who have only just started the medication.. all I can say is that you need to actually be on it for more than 2 weeks to even begin to be able to judge it. I've been on mirtazapine 45mg for about 8 months and I find it to be great an enhancing energy, motivation, creativity and social behaviour. There is no depression anymore whatsoever. The only negative thing is perhaps I am a bit emotionally blunted, but that is a fair trade off.",9,65,8
"Mirtazapine","klee979","June 8, 2017","Taken for 1 to 6 months","This drug helped with insomnia almost immediately. But antidepressant effects seem to be lacking as I feel it really only increases my mood swings. I am usually groggy the next morning which wears off, but it's still a significant factor in the morning.  My anxiety is helped a little bit but I still have random panic attacks that seem to be brought on by my moodiness so it's give and take. So far the sleep benefits started to really decrease after the first month but I started taking two a night and I'm sleeping better again but we'll see for how long.  I don't feel that my anxiety has been helped very much by this drug but I am mostly calmer due to the sedating nature of the drug.  I am scheduled to follow up with my psych about this drug.",7,17,8
"Mirtazapine","CAL_STUDENT","May 18, 2017","-","This drug did help me sleep, but it did not put a dent in my anxiety one bit. In fact, I had a major panic attack while I was on the drug earlier this year, which I rarely have.",1,22,9
"Mirtazapine","Friarhemhappy","May 10, 2017","-","This medication has been a miracle for me.  My anxiety has improved tenfold and it's not near as bad as it was. Most meds have side effects but the improvement in my life outweighs any of them. Although I don't feel any side real effects, I do know my appetite has increased which is good for me and I just try to eat healthy &amp; keep  away from junky food. Overall I feel so much better and sleep better too. I felt a little sleepy in the evenings when I first began taking it but this has gone away now and I don't notice anything. I'm feeling so much better.",10,63,9
"Mirtazapine","Mohc","April 29, 2017","Taken for 6 months to 1 year","Mirtazapine is initially sedating, this gradually reduces over about a month.  The sedation rapidly reduces anxiety and improves sleep.  After the first month the sedative effect wears off and you may feel the drug has stopped working, it has not!  The longer term antidepressant/anxiety benefits take several months to reach maximum benefit.   After 3 months most side effects disappear.   My biggest side effect is increased appetite, I compensate by exercising more as I love to eat!  I started on 15mg dose and increased this to 30mg after a month.  Overall 6 months on my anxiety is 80% better than before.",9,69,9
"Mirtazapine","Speed292","April 19, 2017","Taken for 1 to 6 months","Was prescribed this for depressive and anxiety symptoms relating to BPD (borderline personality disorder) And for SAD (social anxiety disorder). Started on 15mg for one month then 45mg. Few months in and so far no effect at all on any symptoms.",1,15,9
"Mirtazapine","Anonymous 12345","March 30, 2017","-","I stopped zoloft 2 month ago . Now my anxiety returned with severe insomnia and bouts of depression . Was prescribed remeron. Am scared about trying it .will it help me sleep from day 1 ?",0,11,9
"Mirtazapine","Mirtel","March 20, 2017","Taken for 6 months to 1 year","Taking Mirtazipine 45mgs for anxiety at night get a good nights sleep and no hung over feelings on waking do get a dry mouth but its worth it for the help this drug gives me",10,35,9
"Mirtazapine","Sarahap","March 13, 2017","Taken for less than 1 month","These are absolutely horrible! I Literally took one tablet and they've knocked me out for 3 days. I feel like an absolute zombie, can't drive, can barely string a sentence together, and sleeping horribly. They're making me have very weird vivid dreams and I wake up exhausted. I will never ever take these pills again.",1,29,9
"Mirtazapine","Joeyrose","March 13, 2017","Taken for less than 1 month","I'm rating this drug bang in the middle because I do believe it will help some people I took 15mg twice a day only lasted 10 days because of the side effects Pros: Slept instantly every night just after taking So much energy....this did become too much will explain in cons  Lift in mood almost straight away No groggy feeling in the morning  Cons: The munchies were INSANE I couldn't stop eating sugary foods  Increase appetite too extreme  I became too 'high' experienced shaking hands and severe twitching  Feeling manic and hyperactive became too much  So although at first it was a wonder drug for me it quickly became problematic with the side effects. I was prescribed mirtazapine for severe anxiety and depression",5,33,9
