"Drug","User","Date","Period","Review","Score","Likes","Page"
"Mirtazapine","Liz Incarnate","June 8, 2016","Taken for less than 1 month","I had been experiencing post partum anxiety and severe insomnia for a few weeks. After having tried almost every natural alternative out there, I was becoming increasingly desperate. Reading of the experiences of other mums in my situation and what worked for them, I decided to mention this medication to my new doctor and thankfully, he agreed to give it a try (SSRIs had never worked for me in the past and had made my anxiety 10X worse). The 15mgs I take nightly have been a godsend. Despite the slight wooziness after the initial dose, I now sleep so well &amp; can throughly enjoy my waking life with my baby again! Highly recommended to other mums with these same symptoms.",9,30,11
"Mirtazapine","PSeel","May 19, 2016","Taken for less than 1 month","I was on Sertraline but was struggling with sleep, the doctor prescribed 15mg Mirtazapine and it was great, helped me sleep and also great for anxiety and intrusive thoughts. Like many other users, I did feel groggy in the mornings and I also noticed some minor restlessness but the positives are far more numerous than the negatives.",9,41,11
"Mirtazapine","JohnnyD2003","May 17, 2016","Taken for 5 to 10 years","Well this medication worked well for me for the first few years but as time went on the side effects got gradually worse. I'm am now totally paranoid and suffering from severe anxiety disorder. I am trying to come off this medication to deal with these side effects. To anyone taking this medication get off it now before you end up like I did. And despite what your doctor tells you it is a addictive!! Worst mistake of my life..",1,35,11
"Mirtazapine","No longer anxious","May 12, 2016","-","Having taken citalopram for 6 weeks my anxiety was awful - every morning from 3 or 4am onwards.  First mirtazapine tablet was like a miracle - I slept well and for far longer and had zero early morning anxiety. Taking 15 mg which makes me a little drowsy (just 6 days in) but nothing too bad and well worth it to feel normal again.",10,41,11
"Mirtazapine","Hopeful life","May 11, 2016","-","Panic attacks, anger attacks, obsessive thoughts and checking money, suicidal thoughts only thankfully, i was hitting my legs with my fists, anxiety and depression, under eating lack, of sleep not able to focus on work.  I started off with 7.5mg mirt. The first night knocked me out! The next morning I was groggy as heck, felt drugged.Finally though I was able to eat. This went on for about 4 days. I continued 7.5 mg for another week and then increased to 15mg. I have never been this calm in my life, it is weird i actually can eat and sleep, my acne is subsiding. I feel myself slowly coming back back. I still suffer from depression and anxiety but everything else including my sleep is finally a pattern. I am able to fall asleep",9,39,11
"Mirtazapine","Joshrw6","April 25, 2016","Taken for less than 1 month","Id write more except I cant focus for long. Citalopram made me suicidal, hate that drug with a passion.  Doctor gave me this, its yet to help with my anxiety or panic attacks (2 weeks in 30mg).  Side effects are not great: The most horrific and graphic nightmares I've ever had in my life which make me wake up in tears. The problem here is that this drug makes me sleep for 10  hours so theres no escaping these dreams, then when I wake up i just have these disturbing images in my head all day which makes my anxiety worse.   my anger is unreal and not an aggressive person in general.  Another thing is I cannot sit still, i have to be moving all the time from the second I wake up. Concentration is non existent...",4,24,11
"Mirtazapine","Bryant73","April 21, 2016","-","Bad. Way to many Side effects and effects on too many neurotransmitters. Awful. Interacted with my clonidine and tagamet. Put me in hospital. Rather be depressed",1,17,11
"Mirtazapine","Floss1234","April 15, 2016","-","I suffered from postnatal Anxiety that I had just about every symptom that comes with anxiety! Mirtazapine 15mg changed my life that I can now enjoys my babies and lead a normal life that I did before! No more anxiety or insomnia and am now back at work!",10,40,11
"Mirtazapine","Australia 2","April 14, 2016","-","I suffer from obsessive thoughts, anxiety, depression and poor sleep. Mirta has a very powerful effect on me. I break a 15mg tablet in half and half again  to about 4 mg and it still knocks me out all night with a solid sleep. The next day I'm only about 60% alert until the evening when I become fully alert. It takes away sexual drive and sometimes causes restlessness before sleep. However it does reduce anxiety well enough to sleep. I have been using it when I need it.",7,24,11
"Mirtazapine","Somebodyhereandthere","April 11, 2016","Taken for 1 to 6 months","Mirtazapine 30 mg, taken it for several months... I still have anxiety and depression... but not much and not all the time. I still have the dreaded restless leg syndrome but, after falling asleep, I sleep like a baby. No side effects whatsoever, none, never. It may not perform miracles but it is, as per my experience, definitely worth a try. Other antidepressants I tried were horrible, so...",9,32,11
"Mirtazapine","chloejaderx","April 7, 2016","-","So, I started taking 15mg of Mirtazapine but only half 7.5 as at the time (6 months ago) I was under 18 years of age and my doctor was extremely cautious about me taking this pill. Anyway! I started taking them maybe just over 6 months actually, and my behaviour and attitude &amp; anxiety has gotten much much worse. I wouldn't recommend anyone take this pill, as I have stopped sleeping as much, I have felt like I can't go out, just all together I feel like a zombie. Having to deal with the insomnia aswell as the anxiety aswell is not a good combination. I've had to start taking sleep aid as well as this drug because I feel constantly tired, I'm very pale all the time and I don't feel the benefits of this drug.",4,16,11
"Mirtazapine","Amber ann","April 6, 2016","-","Total nightmare I couldn't sleep had awful nightmares of something that happened to me nearly 20 years,dry mouth,chapped lips,the tirdness was unreal I only took it for two night and this happened imagine if I stick it out any long,keep away from this DRUG it's dug up my past and now i have to deal with this all over again,I'm distraught from it",0,20,11
"Mirtazapine","Whatabuzz","March 17, 2016","Taken for 1 to 6 months","Well, for such a tiny pill, this sure packs a punch! After complaining of an irregular sleep pattern that I simply could not break no matter what I did during the course of my day, my doctor prescribed 15mg Mirtazapine to be taken half-an-hour before bed. Most nights now I sleep right through and it is quality sleep I am getting. Since overcoming the mild grogginess I experienced during the initial uptake, I have found this medication works very well in combination with 112.5mg Venlafaxine which I take in the morning for depression. The main side-effects for me are massive carbohydrate cravings (I piled on weight before I knew it) and regular bizarre dreams, which at first I found quite disturbing but now kind of look forward to having.",9,24,11
"Mirtazapine","Motivated10000","February 19, 2016","Taken for 1 to 6 months","I started taking this over a month ago for anxiety. I had terrible physical symptoms of anxiety including numbness, pins and needles and burning in my limbs. I was having panic attacks on a daily basis for about 6 months and was feeling incredibly disconnected from my life and surroundings. I was put on 15mg once a day and I can not express how much this drug has changed my life. The first day after taking it I was incredibly drowsy, however, that subsided within two weeks - I still get drowsy after taking it but I've never slept better and I wake up fine. I did have increased hunger for about three weeks but I just continued my normal diet/exercise so I had absolutely no weight gain and my appetite has returned to normal.",10,89,11
"Mirtazapine","c15690","February 17, 2016","Taken for 6 months to 1 year","I took mirtazapine for 10 months with a slow taper to get off it, this drug caused horrible side effects whilst on it and off it. Increase anxiety, poor sleep pattern, several physical and mental problems and even gained a irregular heart beat, I took my last dose 6 months ago and would warn of its heavy sedation properties masking your current problem.ie count the months not the days, the longer you take it and increase the dose, the bigger your problems maybe in the future ten fold unless it works for you and you signed up for life to it.",1,27,11
"Mirtazapine","fl2016","February 13, 2016","-","Mirtazapine has been a life saver for me. I had severe anxiety to the point I was feeling suicidal. I couldn't function and my obsessive thoughts were constant. I couldn't sleep more than one hour without waking up from a panic attack. I started taking 50mg of Pristiq and 5 days later was put on 15mg of Mirtazapine to speed up the process and help with sleep and appetite. I took the tablet an hour before bed and was knocked out almost instantly and slept the whole night. It's been 4 days since I started Mirtazapine and I am able to go to work etc. Still feeling a bit anxious but it's bearable. Definitely increased my hunger but I don't give into the cravings! I eat normal, if not less. Will see how it progresses but only good things so far!",10,54,11
"Mirtazapine","Cortisol Kid","February 11, 2016","Taken for less than 1 month","I have been taking antidepressants for around 30 years. Zoloft, prozac, bupropion just to name a few.  Last night was my first foray into mirtazapine 15mg soltabs. It took very little time to begin to work. I felt altered right away. Quickly I got sleepy and began hearing faint voices. Turned out I could hear my partners laptop on very low volume from across the room. My hearing is not very good so I would count that as a good thing if in fact it was her laptop.  I was soon totally wrecked, could hardy walk. I went to bed.  Had to use the toilet 5 times throughout the night. Lack of balance made this interesting.  I feel hung over and I can no longer concentrate to finish my story.",10,21,11
"Mirtazapine","Stephanie83x","January 27, 2016","Taken for less than 1 month","I was on 40mg of citalopram which was working a treat but wasn't sleeping so I was given mirtazapine 15mg. I've been on them less than 2 weeks now and the change in myself is simply terrible. The first couple of nights I got an amazing sleep but found it hard to get up in the morning but things have just gone from bad to worse, I have bad anxiety, can't sleep, feel like a walking zombie, dizziness is terrible, crazy dreams/mares, compulsive sweating, itching/burning sensations and the worst for me is my anger it's unexplainable I can fly of the handle for someone looking at me. This drug might work for some people but I'd say avoid at all costs I've never felt so unhappy and down right miserable.",1,21,11
"Mirtazapine","rotundrob","January 14, 2016","Taken for less than 1 month","Am on a cross-over from Venlafaxine to Mirtazipine due to the libido-destroying qualities I experienced with the former. If ever there was a passion killer list then Venlafaxine would rate up there with halitosis.  It is  great anti-depressant but top of the flops in the pants department. Started on 30mgs Mirtazipine the other day and two things hit me straight away..... food and serenity. Will keep it going as am sure the initial 'hit' will subside and I'll rejoin my body sometime but certainly if the libido matches the serenity then 'hello baby!'",9,39,11
"Mirtazapine","caringinco.","January 11, 2016","Taken for 1 to 6 months","I am pleased to say, that I have been taking Remeron for about 4 months after recovering from severe acute pancreatitis, including surgery and a 5 1/2  month hospital stay. I take it at bedtime,  sleep 8-10 hours , wake without drowsiness and it seems to have helped curb my anxiety due to significant family problems.",8,35,11
"Mirtazapine","Huddy","December 23, 2015","-","I feel like I've taken amphetamines and Valium in one hit! I'm in my 3rd day... A different kind of anxiety!!!! Like one minute I'm rushing!! The next I'm knackered!! Does anyone get what I mean? I think I'm going to persevere and see how it settles",5,32,11
"Mirtazapine","Henry horse","December 18, 2015","Taken for 6 months to 1 year","I took citalapram for nine weeks unsuccessfully and mirtazapine for 8months, too many side effects, numb emotional feelings and made anxiety worse , feeling aggressive, aching joints,big changes in weight and bodily functions , not easy to withdraw from either, worsening thoughts, (don't think relapse, think it's the drug) or you'll end up back on it. My opinion is never again, beware!",1,31,11
"Mirtazapine","No nickname","December 15, 2015","-","I was prescribed mirtazapine after a 10 week treatment of citalapram, side effect out way any gains in taking it, it will make u sleep and create more anxiety,weight gain and change in personality are to name a few, when your depressed and down that black hole the withdrawal effects of the drug are far worse, I slow tapered off this drug and haven't taken any for 4months, partial side effects are still with me, I know this as I didn't have them in the first place, I' d research the myth of the chemical imbalance theory before you take this drug.",1,21,11
"Mirtazapine","heyyyyyyyyyyyyyyyyyyyyyyyyy784","December 8, 2015","-","I took my first dose last night and I have slept 9+ hours and my anxiety is reduced today but I WANT FOOD.",10,39,12
"Mirtazapine","mackieb","December 7, 2015","-","I have had mild depression on and off for 3 years and have been taking 10mg Vivactil. A recent change in my circumstances means I have been experiencing anxiety attacks, not sleeping and very tearful. I took a 15mg tablet for the first time last night as directed and slept 9 hours solid. However I felt 'drunk' all day. Didn't feel safe to drive, unable to concentrate in work and eventually had to come home. I slept another 7 hours and only just feel 'normal' again. This drug is not for me! I wasn't able to function. Although I slept well and didn't have any panic attacks I couldn't remember where I had parked my car and I also forgot to eat. It's back to the GP for me",1,20,12
"Mirtazapine","Justliloleme","December 2, 2015","-","Have tried this now for four weeks and I am coming off it. Gave me dry mouth, dry eyes and done nothing for anxiety, helped with eating, did not help me sleep. I am not condemning the drug, it works for some and that's great, so happy for them.",1,24,12
"Mirtazapine","J1993","November 29, 2015","-","At 19 I went on Sertraline as I'd struggled with varying levels of anxiety throughout my teens. About a year later I tapered and came off for about 6 months. Then, completely out of the blue, I felt almost an electric shock in bed one night and spiralled into the most awful depression and panic imaginable. After the Sertraline failed to work I was on the verge of admitting myself to a psych ward. It was truly the most painful experience imaginable. My GP prescribed Mirtazapine as an attempt to pull me back into balance, and I can honestly say that in about 2 weeks I had recovered. I cannot speak of the difference it made. Utterly unbelievable. The best benefit was its sleep inducing effects, as I'd always stay up all night in panic.",9,66,12
"Mirtazapine","a_mother_is","October 28, 2015","Taken for less than 1 month","I have just started on Remeron while tapering Zoloft for my axsiety and sleep issues.  This may change, but I wanted to post this to possibly give someone hope. I am not a big eater,  I never have been. When I started Remeron,  I was expecting this ravenous appetite to start. Not only did that not happen, I have less of an appetite then I normally do. I am not super thin, average for my height and have never had any food issues. So the weight gain thing does not happen to everyone.",0,67,12
"Mirtazapine","CatsForever","October 20, 2015","Taken for less than 1 month","I was prescribed this for anxiety, depression and sleep problems (with my fibromyalgia)  after several trial and errors with other medication. I've been on it for three weeks now and it has no effect whatsoever on me. The doctor took me off sertraline and replaced it with mirtazapine.  I sleep about 3/4 hours every other night so I've doubled my dosage from 15mg to 30 mg after reading people's comments. I took the dose 3 hours ago and nothing :( hope it works better for others! (Uk)",1,24,12
"Mirtazapine","Jane07","October 13, 2015","-","I was previously on Citalopram, which I didn't think was doing me any good, so doctor changed me to Mirtazapine which I am very glad about.  It's helped my sleep and appetite, which were both very up &amp; down.  It has also helped my anxiety and racing, negative thoughts.  In turn, I feel more upbeat and positive. Only slight downside is feeling groggy during the day, which I hope is just a small side effect while I get used to it.  Overall, I'm very happy with this so far.",9,74,12
"Mirtazapine","Kansaschick2015","September 30, 2015","-","I have bad anxiety for years and I tired a few meds but they weren't working for me . Now I am on Mirtazapine 15 mg I only take one pill a note. The first nite I felt great little tired but the anxiety stopped. The sec nite was little different I had a few anxiety attacks but I managed to control them . I feel really tired and have a few attacks during the day but not as bad as before . I'm going to give this medicine a try and I'm going to have to go to therapy as the doc told me it will help, since I have been diagnosed with anxiety for years . I pray this will help me and get my life back. Good luck to all of you that are having bad times with anxiety and depression.",4,71,12
"Mirtazapine","Brett84","September 18, 2015","Taken for less than 1 month","Might try this one again someday.  Was on it 3 weeks.  Sleep started off OK but got worse with time along with feeling more anxious and exhausted each day.  3rd week, I'm lying in bed and start to panic.  Try to get up and collapse on the floor.  My brain felt like it was being lightly electrocuted.  Broken sleep and nightmares the rest of the night.  Next day around 3pm, I started to feel better.  Great even and slept great that night but the night before freaked me out so much I swore to never take it again.  Withdrawals were horrific.  Worst thing I ever experienced.  Still, that one day and night was amazing and think it might have been the one if I stuck it out another day or 2.  Weird reactions, I know.  It works great for my dad.",6,38,12
"Mirtazapine","BlaZeQ","September 5, 2015","-","I began taking this medicine about 1 year ago. I started on 15 mg, then upped to 30 then upped to 45. At first I felt better, kind of a happy optimistic feeling and then it kinda quit working so we went up to 30 mg which Is almost too much for me it would knock me out for 10 hours (I always take it right before bed) and I went back to the doctor and he said to just take more so I was put on the 45 mg tabs. I absolutely can not take a whole 45 mg tab I always wake up 11-12 hours later. If I have to get up early I am so fatigued in the morning so what I do is break a 45 mg one in half and I'm actually taking 22.5 mg now, any more is too sedating. It works very well for my insomnia but as far as my anxiety and depression it doesnt seem to work",5,23,12
"Mirtazapine","ofra","July 26, 2015","Taken for less than 1 month","Was prescribed mirtazipine after citalopram failed to lift my depression and anxiety. I must say I was in a deep depression, you know, the place where everything is gloomy and hopeless and you just want to crawl into some cave and die. 15mg for the first couple of weeks nearly made me give up hope on this drug. The lethargy, hopelessness and anxiety deepened.  I am into my third week and I have upped the dose to 30mg as prescribed and I feel completely different. The anxiety is reducing by the day, I feel hopeful, upbeat and for once in eight months, I wake up in the morning with a spring in my steps. The zombie days seem to be disappearing. Mirtazipine is working for me and I hope it works for anyone who has started taking it.",9,120,12
"Mirtazapine","DylPill90","June 11, 2015","-","I must say, Mirtazipine was extremely helpful for my anxiety/depression along with taking Fluvoxamine for anxiety, depression, and ocd. A lot of the physical symptoms of anxiety as well as mental symptoms have diminished. Concentration has also improved. Although, the weight gain from increased appetite and the sluggish feeling in the morning has become problematic. I have my mind set on discontinuing.",8,64,12
"Mirtazapine","hein","May 26, 2015","Taken for 1 to 2 years","Excellent for anxiety and sleep. No more sweaty palms and inner tension. 15mg at bedtime and sleep like a baby. No side effects - increased appetite though.",10,95,12
"Mirtazapine","justlottie","April 16, 2015","-","Have had depression with anxiety and insomnia 4 times in the last 10 years. Tried Prozac, went nuts,citalopram up to 60mg, did not work, sertraline, fabulous but took 6 weeks plus to get better at a relatively high dose and with horrid side effects. This time mirtazapine as had heard so many good things, I am a health care professional. Day 3 like a light bulb moment. Better. Sleeping like a baby, anxiety gone and of mood back to normal. Amazing",10,192,12
"Mirtazapine","Pazster","March 27, 2015","Taken for less than 1 month","Hi, I have given the medicine 5 out of 10 although I am yet to take it. I was originally taking 150 mg of venlafaxine a day which really helped with my anxiety, the only problem was the side effects. Every night I would wake in a pool of sweat which no matter how much I showered or bathed would have a strong smell to it. We had to constantly wash and replace duvet covers, sheets etc... I had no problem with sexual desire but maintaining an erection and staying interested was a problem. I ended buying kamagra online and found just an 8th of the tablet (dissolvable) would work wonders. I spoke to the doctor and he changed the medication to citalopram which I found the transition period fine but no way as effective as the venlafaxine",5,12,12
"Mirtazapine","anxiety joe","March 17, 2015","-","I used it at bed time along with Paxil. I have anxiety and at times insomnia. The lower the dose(@ 7.5 mg), the more it becomes a sleep aid. It worked well for both anxiety and insomnia.",8,73,12
"Mirtazapine","MR ATKINSON","March 10, 2015","Taken for 5 to 10 years","I have been taking mirtazapine for 5 years now and at first they were very, very helpful. The doctors told me that it was dangerous to stop taking them but my depression and anxiety was getting worse and the medication wasn't helping  anymore I must have got used to them. My personal experience with this medicine is ok for short time use.",7,61,12
"Mirtazapine","serenitynowman","February 10, 2015","-","I was having massive problems with anxiety caused by constant heart palpitations or PVCs. Was having a lot of trouble going to bed at night. This honestly fixed me overnight. I couldn't believe it just worked so fast. Was very groggy the first morning waking up, but this has really given me my life back.",10,105,12
"Mirtazapine","DrugExpert101","February 6, 2015","-","I use this for serious post traumatic stress disorder, Major Depressive disorder, Anxiety, Flashbacks Night Sweats, Night Terrors, Anger, Mood Swings, and waking up at night not knowing where I am. I have taken this for more than 5 years. I take up to 70 mg of Citalopram during the day to compliment this medication along with Valuim for Anxiety and for major Surgery that gives me muscle cramps and pain. I give it a ten. I have no side effects from this. I do Citalopram, and Valuim but not Mirtazapine. Rate it at 10.",10,46,12
"Mirtazapine","Anonymous","February 2, 2015","Taken for 2 to 5 years","I was on every SSRI/SNRI possible. They all exacerbated my sleep problems. Remeron has given me my sleep back and virtually no anxiety! I highly recommend for people with anxiety and insomnia. Therapy also helped, it's not always just about taking a pill. I highly recommend  this and plan on never coming off!",10,67,12
"Mirtazapine","coxysmelons93","January 24, 2015","Taken for less than 1 month","Works far better than any SSRI but I do still have symptoms of anxiety. I also take Diazepam when I feel an episode of severe anxiety coming on. Haven't been on it for that long though. Physiological symptoms like heart racing etc. Have already decreased so looking good.",8,87,12
"Mirtazapine","CampbellW","December 3, 2014","-","I suffered from awful anxiety for years. I tried a wide range of antidepressants and nothing ever worked. This medicine saved my life. Within days of trying it I was off of Ambien and Ativan which I had needed to sleep and function. It did make me super hungry and I did gain weight. But whats a few pounds to trade in for happiness. If I ever suffered severe anxiety problems again, I would try it in a second. It was actually one of the very first medicines my doctor recommended, but I did not try it due to possible liver side effects. That was a big mistake. I wasted years on the anti-depressant roller coaster. If it wasn't for the increased appetite, I would gladly pop one of those little miracle pills every night for the rest of my life.",10,126,12
