"Drug","User","Date","Period","Review","Score","Likes","Page"
"Invega Sustenna","Charles120","April 21, 2016","Taken for 1 to 6 months","Clears the mind of weird thoughts, delusions and hallucinations. Weight gain has been noted as well as a general feeling of restlessness and drowsiness. I'm always on slow-motion and need to think things twice or 3 times. Still better than having conversations with dead people or thinking my brain can see in the future... by the way, DON'T try quitting this drug cold turkey. It's a recipe for disaster.",8,22,2
"Invega Sustenna","Anonymous","March 28, 2016","Taken for 2 to 5 years","Gained weight. Too much. Fear of cholesterol and diabetes. Less work. Lost a girlfriend.",1,17,2
"Invega Sustenna","Invega","March 21, 2016","Taken for 1 to 2 years","My wife has suffered from late onset schizophrenia with severe positive symptoms for over 10 years. She started Invega Sustena treatment (monthly injection) a year ago and has made dramatic improvements. All of her positive symptoms have gone away. Residual negative symptoms remain but is now manageable with talk therapy. The injection method helps with compliance as daily pills are difficult to maintain and easy to discontinue. This is a wonder drug...",10,27,2
"Invega Sustenna","pazmataz","April 12, 2015","Taken for less than 1 month","My daughter had the injection this month.It stopped her psychosis, still a little paranoia. The first ten days severe pain in neck. Also some dizziness still and balance problems she says. She took cogentin for neck. Some relief from the neck now. Another issue from blood test is high prolactin level. We will be seeing her Dr this week .Dont know if side effects worth it",7,17,2
"Invega Sustenna","Doterdot","August 4, 2014","-","Very high smoking sensation, weight gain, tiredness, and insomnia. But its the best antipsychotic med for me.",10,21,3
"Invega Sustenna","Anonymous","June 18, 2014","Taken for 1 to 6 months","I have been on Invega for 5 months now and it has significantly improved my quality of living. Prior to the shot I was on numerous antipsychotics and would begin to stop taking the pills and go into relapse with symptoms. I'm not on the shot and auditory and visual hallucinations and paranoia have decreased dramatically. I like that it is a monthly shot and it cuts down remembering (or wanting) to take a pill once or twice a day.",9,29,3
"Invega Sustenna","delucz89","January 13, 2014","-","I found this medication to cause side effects of swaying while standing up &amp; sometimes rocking back and forth whilst sitting down. Because this is taken monthly I am on 150mg, towards the end of the month I became unwell and psychotic symptoms reoccurred. Delusional thoughts mainly. I am now going to try Abilify and hope I don't have bad side effects but I know that without my medication I would relapse.",5,23,3
"Invega Sustenna","Anonymous","May 13, 2012","Taken for 1 to 6 months","Invega is working great on auditory symptoms and no lethargy noted.  I have noted some of the adverse side effects after the first dose: sudden weight gain, indigestion, pain at injection site and sore throat. In addition to these there has been increasing facial and abdominal bloating, I am concerned but there is no other medicine I am aware of at this time and the doctor feels the benefit outweighs the side effects.",9,31,3
"Invega Sustenna","OnOnOnOn","November 3, 2010","-","This medication is Great.",9,31,3
