"Drug","User","Date","Period","Review","Score","Likes","Page"
"Olanzapine","Naboo Bear","December 20, 2016","-","<b>Zyprexa (olanzapine):</b>			 Worked great for me. Not only did it control my perception of reality, it also takes away the strange emotional attachments that I was having. It made me go from sitting on the couch hidding, to working full time as an electrician, sometimes up to 10 hours a day, something I thought I would never be able to do again. There were only two problems. I was unmotivated, I didn't have any passion for life. I was  just going through the motions. However this is much better that being  psychotic and suicidal. In the 9 months I was on the medication, I gained almost 100 pounds. This happened even when I was eating the same amount as before I was medicated. Again, this is far better than being angry and paranoid.",0,20,3
"Olanzapine","Hamerman","November 25, 2016","Taken for 2 to 5 years","My experience with this neuroleptic is actually a combination of olanzapine 25mg with quetiapine 50mg. My thoughts are definitely not as agitated,am not as angry as i used to be,sometimes though,i feel false,looking at the world,but not really a part of,i know strange..I do not hear voices from my condition.I also take dexedrine for adult ADHD. This drug combination forces you to bed within an hour or so,do to extreme fatigue. I've been taking these antipsychotics for over 2 years..",7,8,3
"Olanzapine","MarianVB","October 18, 2016","-","I wasn't prescribed Zyprexa for OCD, but for psychosis. But since I developed OCD on this med, I wanted to warn people.  Before Zyprexa I was slightly perfectionist and obsessive, but because of Zyprexa I developed full blown OCD (upon withdrawal). Ever since using Zyprexa I can't function because of obsessions and many other problems that started with Zyprexa. I changed into a completely different person: angry, sad, obsessive, controlling, unkind.  Zyprexa is said to cause OCD in some 20% or so of it's users. Please stay away from it if you already have OCD...it may worsen it.",1,7,3
"Olanzapine","Wills45","July 30, 2016","Taken for 2 to 5 years","This drug calmed me down within an hour. Thoughts became more moderate in most respects over a longer period of time. Having been taking it for four years, my cognitive skills have improved due to improved social functioning. My advice is to give it a chance. Be prepared to tolerate some physical drawbacks for the sake of improved mental functioning and cognitive gains based on stability of mind. It is true that some forcefulness will be lost from your thoughts, but you may want this. Depending on your state of mind, this drug could be a life saver.",8,24,3
"Olanzapine","Medical turnaround","April 7, 2016","Taken for 6 months to 1 year","Less agression, no weight gain, no increased appetite,  taken 5mg for 8 months.  Happy, normal,active life now.",9,27,3
"Olanzapine","Nutty Rich","January 13, 2016","Taken for 1 to 2 years","<b>Zyprexa (olanzapine):</b>			 An amazing medication considering the earlier antiphsycotics available, I think its more expensive that could effect availability.  I do suffer from shaky hands but its the only side effect noticed.I take 20mg at night, it doesn't make me sleepy, no weight gain or hangover effect. Don't increase the dose it doesn't help it just gives restless legs and I was informed a dangerous to increase",0,32,3
"Olanzapine","Cactustomato","December 8, 2015","Taken for 1 to 6 months","This med caused so much weight gain I gained 20 lbs a month.",1,4,3
"Olanzapine","nylorac9633","September 30, 2015","-","In a few months I exactly doubled my weight -- constant ravenous appetite.  Started on 40mg a day.  But after 15  years of taking it &amp; fighting confusion &amp; appetite &amp; somnolence, even when I got it to 2.5mg and lower, I still had the same objectionable side effects.  Would have been better to take it short term (maybe 3 months) instead of years.  VERY VERY hard to taper off of it no matter how slowly you do it.  I don't think I would ever take it again unless it was a life-or-death situation.",5,9,3
"Olanzapine","Goodfella90","September 15, 2015","Taken for 1 to 6 months","<b>Zyprexa (olanzapine):</b>			 Was hospitalized after psychotic break proscribed Zyprexa 20mg at first the medicine was ok my paranoia and schizophenic thoughts went away. But after about two weeks i started to notice the side affects weight gain was the most obvious gained 40 pounds in two months and sleep i was sleeping 9-12 hours a night it was difficult to wake up in the morning. During the day i felt unmotivated and at work i had no energy even after drinking an energy drink.lowerd my dose to 5mg it didnt make difference. after about 6 months i had enough decided to try an other medication now i fell much better. bottom line Zyprexa was the worst med ive ever tried.If you want to try this med beware you will gain weight.",0,27,3
"Olanzapine","LiamGamerr","August 23, 2015","-","I have been on this medicine for about 2-3 weeks now and although I missed a dose a couple of times it has helped me greatly. Before going onto this medicine I was awake for 3 days straight with racing thoughts/extreme anxiety and agitation. I still have anxiety but I feel more calm and collected. In terms of treating psychosis I have given this medicine a 7/10 (so far) because although I am getting some paranoid thoughts still, it has enabled me to think more clearly and rationalize them better. They are no where near as intense as they were before starting this medicine. I was talking to objects and saying strange things to myself in the mirror... this no longer happens and I feel more 'normal'. This medicine is great in a number of ways.",7,20,3
"Olanzapine","schizoeffective","July 20, 2015","Taken for less than 1 month","<b>Zyprexa (olanzapine):</b>			 This drug has turned down the volume on a lot of my voices. Which is great. I sleep better and take more naps during the day. Also notice my appetite increased which is where I think people mean they gain weight on this med. I just exercise an hour a day. My mood is kinda flat lined.",0,29,3
"Olanzapine","Sick within well it's mine","June 5, 2015","Taken for 1 to 6 months","<b>Zyprexa (olanzapine):</b>			 Everything is worse so much worse this medicine has intensified everything and I have a ton of side effects",0,16,3
"Olanzapine","justin4939","May 27, 2015","Taken for 1 to 6 months","<b>Zyprexa Zydis (olanzapine):</b>			 Made me dizzy.",0,7,3
"Olanzapine","jl4190","April 30, 2015","Taken for 1 to 6 months","Works great for schizophrenia like symptoms, still have some traces of voices however but the symptoms are VERY suppressed and not noticeable. The medication changed my aggression symptoms into neutral/muted emotions. Sex drive is completely gone. Cannot have orgasms and I gained 30 pounds in a month. I have a problem controlling my eating on this medication. I barely feel the sedation from whence I had first started. I highly recommend this medication for psychotic symptoms. I am currently on 20 mg per day before bed.",9,10,3
"Olanzapine","Rivvi98","October 14, 2014","Taken for 1 to 6 months","<b>Zyprexa (olanzapine):</b>			 Kept my schizophrenia in check but way too sedating. Gained 20 pounds in 6 months, hard to wake up in morning, going to try something else.",0,27,3
"Olanzapine","Nicholasfromnc","November 23, 2013","-","<b>Zyprexa Zydis (olanzapine):</b>			 Good for emergency situations. Versatile, quick acting, wish it came in 10mg tabs.",0,12,3
"Olanzapine","kim from sydney","February 10, 2013","Taken for 2 to 5 years","<b>Zyprexa (olanzapine):</b>			 I take Zoloft, Zyprexa and dothiepin. All very effective.",0,15,3
"Olanzapine","Steven12345","December 1, 2012","Taken for 1 to 2 years","<b>Zyprexa (olanzapine):</b>			 I have tried many meds Seroquel, Risperidone, Abilify. Seroquel have me peeing all night long, burning sensation like urinary tract infection. Abilfy sex was good but give me anxiety, fast heart rate, light headed feeling, fainting and insomnia. So far Zyprexa is the best for me. Sex is ok, having problem with sensual sensation, dizzy sometime. Now I am on 2.5 mg I still feel dizzy even without it you feel better if you take the pill. Weight gain 30lb. Triglyceride high.",0,31,3
"Olanzapine","Unio","December 1, 2012","Taken for 1 to 2 years","Great results.",8,4,3
"Olanzapine","Laserjik","August 23, 2012","Taken for 2 to 5 years","<b>Zyprexa (olanzapine):</b>			 Got this medicine and was amazed at how I recovered.  I wasn't paranoid, was relaxed and loved life.  Until I kept taking it for a couple years and all the symptoms returned I now am withdrawing, which is a nightmare.",0,43,3
"Olanzapine","Anonymous","July 19, 2012","Taken for 1 to 6 months","<b>Zyprexa (olanzapine):</b>			 Controlled my thought process, moods and hallucinations, helped my insomnia.",0,39,3
"Olanzapine","27yearoldmale","June 19, 2012","-","<b>Zyprexa (olanzapine):</b>			 I take 7.5mg a day for schizophrenia, I have only been on this medicine for 5 weeks but it has helped me immensely with both negative and positive symptoms. I have gained weight but its a small price to pay for some peace of mind, honestly couldn't be more grateful for this medicine.",0,52,3
"Olanzapine","DatMexicanLalo","April 4, 2012","-","<b>Zyprexa (olanzapine):</b>			 Before I took Zyprexa I was hallucinating due to lack of sleep and exhaustion. While I was hospitalized I denied my medication and wouldn't take it but as soon as I took Zyprexa and Remeron my sleep got better. I stopped hallucinating &amp; hearing things. Thanks to my medication I haven't been hospitalized for psychosis since I've been given Zyprexa.",0,49,3
"Olanzapine","bww7","March 4, 2012","-","<b>Zyprexa (olanzapine):</b>			 The medicine brought my wife's symptoms under control finally.  Was very sedating to the tune of her sleeping 14 hours per day.  We are trying Invega instead but Zyprexa is always the fallback plan because it works.",0,31,3
"Olanzapine","Anonymous","August 7, 2011","-","<b>Zyprexa (olanzapine):</b>			 I am currently on Zyprexa and I have been using it for a year. My life completely changed. I have less fear and I am more relaxed. The only thing though is I experienced fatigue whenever I woke up. But so far, the results were great! My doctor did a good job!",0,52,3
"Olanzapine","yhmya","October 22, 2009","-","<b>Zyprexa (olanzapine):</b>			 This drug may be that comes from Heaven, but you must have insight in order to you may have no barrier to take this nearly perfect drug.",0,34,4
"Olanzapine","Anonymous","August 7, 2009","-","<b>Zyprexa Zydis (olanzapine):</b>			 I like it that it dissolves in your mouth just like M&amp;M's, but I don't like the tranquilization of this medication.",0,14,4
"Olanzapine","Rol","July 24, 2009","-","<b>Zyprexa (olanzapine):</b>			 I found the disintegrating velotab very easy to swallow, but the medication was too sedating.",0,29,4
"Olanzapine","Standingfirm","February 23, 2009","-","<b>Zyprexa Zydis (olanzapine):</b>			 So far after 3 weeks this medication is assisting my son to gain clarity, stop hearing voices and it has helped to ensure that he gets the medicines into his system.",0,31,4
"Olanzapine","Anonymous","January 18, 2009","-","<b>Zyprexa (olanzapine):</b>			 I've been taking Zyprexa for just over a year now and have seen dramatic improvements in my life. I used to be incredibly paranoid of people, was hearing voices and was delusional about my physical health. I'm on 20mgs of Zyprexa and most of my symptoms have cleared. Some of them remain, but they're much more tolerable than they used to be.  The only drawbacks I have noticed are weight gain and slowed reactions but I'd rather live through those side effects than experience what I did before treatment.",0,97,4
"Olanzapine","Anonymous","January 1, 2009","-","<b>Zyprexa (olanzapine):</b>			 This medication killed my schizophrenia in two months. But I gained 20 pounds which is okay considering I was a little underweight. The worst side effect was that my eyes would not move. Finally a doctor told me to cut down my dosage from 10 mg to 5 mg and this lowered the occurence. When I lowered it to 2.5 mg the side effect completely went away. Now I feel great and the schizophrenia is still gone. I recommend Zyprexa but the doctor has to be really careful with the dosage.",0,112,4
"Olanzapine","Anonymous","October 3, 2008","-","<b>Zyprexa (olanzapine):</b>			 I don't hear voices any more.",0,89,4
"Olanzapine","Kessler","February 25, 2008","-","Pros: Olanzapine controls conversations in my head to clear thoughts, working exstremely well. I have taken Olanzapine for the majority of ten years, nothing else works as good for me. Cons: I gained weight at the begining of treatment (eating too much) because of hunger sensation, but this subsides. I have neck stiffness - this may not be connected to treatment, also irregular heart beat (not serious), I think this is probably unconnected to treatment.",8,22,4
