"Drug","User","Date","Period","Review","Score","Likes","Page"
"Zyprexa Zydis","Default User","January 26, 2018","Taken for 1 to 6 months","Been on 25mg of zyprexa zydis for about 4 months, it cause weight gain and akathisia for me. Hallucinations decreases but still delusional",5,17,1
"Zyprexa Zydis","justin4939","May 27, 2015","Taken for 1 to 6 months","Made me dizzy.",1,7,1
"Zyprexa Zydis","Nicholasfromnc","November 23, 2013","-","Good for emergency situations. Versatile, quick acting, wish it came in 10mg tabs.",8,12,1
"Zyprexa Zydis","Anonymous","August 7, 2009","-","I like it that it dissolves in your mouth just like M&amp;M's, but I don't like the tranquilization of this medication.",7,14,1
"Zyprexa Zydis","Standingfirm","February 23, 2009","-","So far after 3 weeks this medication is assisting my son to gain clarity, stop hearing voices and it has helped to ensure that he gets the medicines into his system.",0,31,1
